skill,level,question_text,option_a,option_b,option_c,option_d,correct_answer,explanation,topic,mdn_link,youtube_english,youtube_hindi,youtube_kannada,youtube_tamil,youtube_telugu
GLSL,Intermediate,How do you implement screen-space paint/wetness effects in GLSL?,Surface wetness,Paint effects,Material blending,Weather effects,A,"Blend between dry/wet material properties based on wetness map, add specular highlights, darkening.",Surface Effects,https://developer.nvidia.com/gpugems/gpugems3/part-iii-rendering/chapter-19-generating-complex-procedural-terrains-using-gpu,https://youtube.com/results?search_query=glsl+wetness+effects,https://youtube.com/results?search_query=glsl+wetness+effects+hindi,https://youtube.com/results?search_query=glsl+wetness+effects+kannada,https://youtube.com/results?search_query=glsl+wetness+effects+tamil,https://youtube.com/results?search_query=glsl+wetness+effects+telugu
GLSL,Intermediate,What's the difference between any() and all() functions?,Boolean reduction,Vector testing,Condition checking,Logical operations,A,any() returns true if any component true; all() returns true if all components true - different tests.,Vector Functions,https://www.khronos.org/registry/OpenGL-Refpages/gl4/html/any.xhtml,https://youtube.com/results?search_query=glsl+any+all,https://youtube.com/results?search_query=glsl+any+all+hindi,https://youtube.com/results?search_query=glsl+any+all+kannada,https://youtube.com/results?search_query=glsl+any+all+tamil,https://youtube.com/results?search_query=glsl+any+all+telugu
GLSL,Intermediate,How do you implement screen-space fire/smoke effects in GLSL?,Fire simulation,Volumetric effects,Particle systems,Real-time effects,A,"Use noise-based texture animation, additive blending, color gradient based on temperature/density.",Fire Effects,https://developer.nvidia.com/gpugems/gpugems3/part-i-natural-effects/chapter-2-fire-and-smoke,https://youtube.com/results?search_query=glsl+fire+effects,https://youtube.com/results?search_query=glsl+fire+effects+hindi,https://youtube.com/results?search_query=glsl+fire+effects+kannada,https://youtube.com/results?search_query=glsl+fire+effects+tamil,https://youtube.com/results?search_query=glsl+fire+effects+telugu
GLSL,Intermediate,What's the purpose of the gl_PrimitiveIDIn variable in geometry shaders?,Input primitive ID,Geometry shader input,Primitive identification,Shader stages,A,gl_PrimitiveIDIn provides primitive ID from previous shader stage to geometry shader.,Geometry Shaders,https://www.khronos.org/opengl/wiki/Geometry_Shader#Inputs,https://youtube.com/results?search_query=glsl+primitiveidin,https://youtube.com/results?search_query=glsl+primitiveidin+hindi,https://youtube.com/results?search_query=glsl+primitiveidin+kannada,https://youtube.com/results?search_query=glsl+primitiveidin+tamil,https://youtube.com/results?search_query=glsl+primitiveidin+telugu
GLSL,Intermediate,How do you implement screen-space magic/spell effects in GLSL?,Visual effects,Game effects,Procedural patterns,Animated effects,A,"Combine noise patterns, color gradients, particle trails with time-based animation for magical looks.",Special Effects,https://thebookofshaders.com/,https://youtube.com/results?search_query=glsl+magic+effects,https://youtube.com/results?search_query=glsl+magic+effects+hindi,https://youtube.com/results?search_query=glsl+magic+effects+kannada,https://youtube.com/results?search_query=glsl+magic+effects+tamil,https://youtube.com/results?search_query=glsl+magic+effects+telugu