skill,level,question_text,option_a,option_b,option_c,option_d,correct_answer,explanation,topic,mdn_link,youtube_english,youtube_hindi,youtube_kannada,youtube_tamil,youtube_telugu
GLSL,Intermediate,How do you implement water simulation in GLSL?,Water rendering,Wave simulation,Gerstner waves,Fluid dynamics,A,"Use Gerstner wave equation for vertices, apply normal calculation, add reflection/refraction, foam.",Water Simulation,https://developer.nvidia.com/gpugems/gpugems/part-i-natural-effects/chapter-1-effective-water-simulation-physical-models,https://youtube.com/results?search_query=glsl+water+simulation,https://youtube.com/results?search_query=glsl+water+simulation+hindi,https://youtube.com/results?search_query=glsl+water+simulation+kannada,https://youtube.com/results?search_query=glsl+water+simulation+tamil,https://youtube.com/results?search_query=glsl+water+simulation+telugu
GLSL,Intermediate,What's the difference between pow() and exp2() functions?,Exponential functions,Power calculation,Base-2 exponent,Mathematical operations,A,"pow(x, y) = x^y; exp2(x) = 2^x - different exponential bases and parameterization.",Math Functions,https://www.khronos.org/registry/OpenGL-Refpages/gl4/html/pow.xhtml,https://youtube.com/results?search_query=glsl+pow+exp2,https://youtube.com/results?search_query=glsl+pow+exp2+hindi,https://youtube.com/results?search_query=glsl+pow+exp2+kannada,https://youtube.com/results?search_query=glsl+pow+exp2+tamil,https://youtube.com/results?search_query=glsl+pow+exp2+telugu
GLSL,Intermediate,How do you implement subsurface scattering in GLSL?,Skin rendering,Wax materials,Translucency,Light diffusion,A,"Approximate with blur of backlit areas, use texture space diffusion, or screen-space blur for thin objects.",Subsurface Scattering,https://developer.nvidia.com/gpugems/gpugems3/part-iii-rendering/chapter-14-advanced-techniques-realistic-real-time-skin-rendering,https://youtube.com/results?search_query=glsl+subsurface+scattering,https://youtube.com/results?search_query=glsl+subsurface+scattering+hindi,https://youtube.com/results?search_query=glsl+subsurface+scattering+kannada,https://youtube.com/results?search_query=glsl+subsurface+scattering+tamil,https://youtube.com/results?search_query=glsl+subsurface+scattering+telugu
GLSL,Intermediate,What's the purpose of the gl_NumWorkGroups variable in compute shaders?,Dispatch dimensions,Global work size,Total groups,Compute organization,A,gl_NumWorkGroups contains total number of work groups dispatched for current compute invocation.,Compute Shaders,https://www.khronos.org/opengl/wiki/Compute_Shader#Inputs,https://youtube.com/results?search_query=glsl+numworkgroups,https://youtube.com/results?search_query=glsl+numworkgroups+hindi,https://youtube.com/results?search_query=glsl+numworkgroups+kannada,https://youtube.com/results?search_query=glsl+numworkgroups+tamil,https://youtube.com/results?search_query=glsl+numworkgroups+telugu
GLSL,Intermediate,How do you implement procedural noise in GLSL?,Procedural generation,Noise functions,Random patterns,Texture synthesis,A,"Use value, gradient, simplex, or Worley noise functions implemented in shader for dynamic textures.",Procedural Textures,https://thebookofshaders.com/11/,https://youtube.com/results?search_query=glsl+procedural+noise,https://youtube.com/results?search_query=glsl+procedural+noise+hindi,https://youtube.com/results?search_query=glsl+procedural+noise+kannada,https://youtube.com/results?search_query=glsl+procedural+noise+tamil,https://youtube.com/results?search_query=glsl+procedural+noise+telugu
GLSL,Intermediate,What's the difference between dot() and cross() vector operations?,Vector algebra,Dot product,Cross product,Geometric calculations,A,dot() = scalar projection; cross() = vector perpendicular to plane - different geometric operations.,Vector Functions,https://www.khronos.org/registry/OpenGL-Refpages/gl4/html/dot.xhtml,https://youtube.com/results?search_query=glsl+dot+cross,https://youtube.com/results?search_query=glsl+dot+cross+hindi,https://youtube.com/results?search_query=glsl+dot+cross+kannada,https://youtube.com/results?search_query=glsl+dot+cross+tamil,https://youtube.com/results?search_query=glsl+dot+cross+telugu
GLSL,Intermediate,How do you implement deferred shading in GLSL?,Deferred rendering,GBuffer,Light accumulation,Multi-pass lighting,A,"First pass: store geometry data (position, normal, albedo) in GBuffer; second pass: apply lighting.",Deferred Rendering,https://learnopengl.com/Advanced-Lighting/Deferred-Shading,https://youtube.com/results?search_query=glsl+deferred+shading,https://youtube.com/results?search_query=glsl+deferred+shading+hindi,https://youtube.com/results?search_query=glsl+deferred+shading+kannada,https://youtube.com/results?search_query=glsl+deferred+shading+tamil,https://youtube.com/results?search_query=glsl+deferred+shading+telugu
GLSL,Intermediate,What's the purpose of the gl_InvocationID variable in tessellation shaders?,Tessellation invocation,Patch processing,Control point index,Parallel execution,A,gl_InvocationID identifies which control point invocation is being processed in tessellation control shader.,Tessellation,https://www.khronos.org/opengl/wiki/Tessellation_Control_Shader,https://youtube.com/results?search_query=glsl+invocationid,https://youtube.com/results?search_query=glsl+invocationid+hindi,https://youtube.com/results?search_query=glsl+invocationid+kannada,https://youtube.com/results?search_query=glsl+invocationid+tamil,https://youtube.com/results?search_query=glsl+invocationid+telugu
GLSL,Intermediate,How do you implement screen-space decals in GLSL?,Decal projection,Surface marking,Projected textures,Detail overlay,A,"Project decal volume, reconstruct world position from depth, clip to volume, blend decal texture.",Decals,https://martindevans.me/game-development/2015/02/27/Drawing-Stuff-On-Other-Stuff-With-Deferred-Screenspace-Decals/,https://youtube.com/results?search_query=glsl+screen+space+decals,https://youtube.com/results?search_query=glsl+screen+space+decals+hindi,https://youtube.com/results?search_query=glsl+screen+space+decals+kannada,https://youtube.com/results?search_query=glsl+screen+space+decals+tamil,https://youtube.com/results?search_query=glsl+screen+space+decals+telugu
GLSL,Intermediate,What's the difference between length() and distance() functions?,Vector magnitude,Measurement functions,Spatial calculation,Metric functions,A,"length(v) = ||v||; distance(a,b) = length(a-b) - single vector vs two-point measurement.",Vector Functions,https://www.khronos.org/registry/OpenGL-Refpages/gl4/html/length.xhtml,https://youtube.com/results?search_query=glsl+length+distance,https://youtube.com/results?search_query=glsl+length+distance+hindi,https://youtube.com/results?search_query=glsl+length+distance+kannada,https://youtube.com/results?search_query=glsl+length+distance+tamil,https://youtube.com/results?search_query=glsl+length+distance+telugu
GLSL,Intermediate,How do you implement order-independent transparency in GLSL?,Transparency sorting,Depth peeling,Alpha blending,Compositing,A,"Use depth peeling (multi-pass), weighted blended OIT, or per-pixel linked lists for correct transparency.",Transparency,http://casual-effects.blogspot.com/2014/03/weighted-blended-order-independent.html,https://youtube.com/results?search_query=glsl+order+independent+transparency,https://youtube.com/results?search_query=glsl+order+independent+transparency+hindi,https://youtube.com/results?search_query=glsl+order+independent+transparency+kannada,https://youtube.com/results?search_query=glsl+order+independent+transparency+tamil,https://youtube.com/results?search_query=glsl+order+independent+transparency+telugu
GLSL,Intermediate,What's the purpose of the gl_PrimitiveID variable in geometry shaders?,Primitive identification,Draw element index,Geometry indexing,Shader input,A,gl_PrimitiveID provides index of current primitive being processed in geometry shader.,Geometry Shaders,https://www.khronos.org/registry/OpenGL-Refpages/gl4/html/gl_PrimitiveID.xhtml,https://youtube.com/results?search_query=glsl+primitiveid,https://youtube.com/results?search_query=glsl+primitiveid+hindi,https://youtube.com/results?search_query=glsl+primitiveid+kannada,https://youtube.com/results?search_query=glsl+primitiveid+tamil,https://youtube.com/results?search_query=glsl+primitiveid+telugu
GLSL,Intermediate,How do you implement physically-based rendering (PBR) in GLSL?,PBR,Metallic workflow,Energy conservation,Microfacet theory,A,"Use Cook-Torrance BRDF with GGX distribution, Fresnel term, geometry term; store material as metallic/roughness.",PBR,https://learnopengl.com/PBR/Theory,https://youtube.com/results?search_query=glsl+pbr+rendering,https://youtube.com/results?search_query=glsl+pbr+rendering+hindi,https://youtube.com/results?search_query=glsl+pbr+rendering+kannada,https://youtube.com/results?search_query=glsl+pbr+rendering+tamil,https://youtube.com/results?search_query=glsl+pbr+rendering+telugu
GLSL,Intermediate,What's the difference between reflect() and refract() functions?,Light direction,Reflection vector,Refraction calculation,Optical functions,A,reflect() calculates reflection vector; refract() calculates refraction vector using Snell's law.,Vector Functions,https://www.khronos.org/registry/OpenGL-Refpages/gl4/html/reflect.xhtml,https://youtube.com/results?search_query=glsl+reflect+refract,https://youtube.com/results?search_query=glsl+reflect+refract+hindi,https://youtube.com/results?search_query=glsl+reflect+refract+kannada,https://youtube.com/results?search_query=glsl+reflect+refract+tamil,https://youtube.com/results?search_query=glsl+reflect+refract+telugu
GLSL,Intermediate,How do you implement temporal anti-aliasing (TAA) in GLSL?,Anti-aliasing,Temporal filtering,Jitter sampling,Motion vectors,A,"Use jittered projection, accumulate samples over frames with motion vectors, apply history rejection.",Anti-aliasing,https://www.elopezr.com/temporal-aa-and-the-quest-for-the-holy-trail/,https://youtube.com/results?search_query=glsl+temporal+anti+aliasing,https://youtube.com/results?search_query=glsl+temporal+anti+aliasing+hindi,https://youtube.com/results?search_query=glsl+temporal+anti+aliasing+kannada,https://youtube.com/results?search_query=glsl+temporal+anti+aliasing+tamil,https://youtube.com/results?search_query=glsl+temporal+anti+aliasing+telugu
GLSL,Intermediate,What's the purpose of the gl_ClipDistance variable in vertex shaders?,User clipping,Custom clip planes,Volume culling,Clip distance,A,gl_ClipDistance enables custom clipping planes by setting distance from vertex to each clip plane.,Clipping,https://www.khronos.org/registry/OpenGL-Refpages/gl4/html/gl_ClipDistance.xhtml,https://youtube.com/results?search_query=glsl+clipdistance,https://youtube.com/results?search_query=glsl+clipdistance+hindi,https://youtube.com/results?search_query=glsl+clipdistance+kannada,https://youtube.com/results?search_query=glsl+clipdistance+tamil,https://youtube.com/results?search_query=glsl+clipdistance+telugu
GLSL,Intermediate,How do you implement displacement mapping in GLSL?,Vertex displacement,Height displacement,Tessellation combination,Surface deformation,A,Use height map in tessellation evaluation or vertex shader to offset vertex along normal direction.,Displacement Mapping,https://learnopengl.com/Advanced-Lighting/Parallax-Mapping,https://youtube.com/results?search_query=glsl+displacement+mapping,https://youtube.com/results?search_query=glsl+displacement+mapping+hindi,https://youtube.com/results?search_query=glsl+displacement+mapping+kannada,https://youtube.com/results?search_query=glsl+displacement+mapping+tamil,https://youtube.com/results?search_query=glsl+displacement+mapping+telugu
GLSL,Intermediate,What's the difference between step() and smoothstep() functions?,Threshold functions,Edge detection,Transition functions,Step comparison,A,"step(edge, x) returns 0/1 threshold; smoothstep(edge0, edge1, x) smooth hermite interpolation.",Built-in Functions,https://www.khronos.org/registry/OpenGL-Refpages/gl4/html/step.xhtml,https://youtube.com/results?search_query=glsl+step+smoothstep,https://youtube.com/results?search_query=glsl+step+smoothstep+hindi,https://youtube.com/results?search_query=glsl+step+smoothstep+kannada,https://youtube.com/results?search_query=glsl+step+smoothstep+tamil,https://youtube.com/results?search_query=glsl+step+smoothstep+telugu
GLSL,Intermediate,How do you implement contact hardening shadows (PCSS) in GLSL?,Soft shadows,Penumbra estimation,Percentage closer filtering,Shadow quality,A,"Estimate blocker distance, calculate penumbra size based on blocker distance, variable kernel PCF.",Shadows,http://developer.download.nvidia.com/shaderlibrary/docs/shadow_PCSS.pdf,https://youtube.com/results?search_query=glsl+pcss+shadows,https://youtube.com/results?search_query=glsl+pcss+shadows+hindi,https://youtube.com/results?search_query=glsl+pcss+shadows+kannada,https://youtube.com/results?search_query=glsl+pcss+shadows+tamil,https://youtube.com/results?search_query=glsl+pcss+shadows+telugu
GLSL,Intermediate,What's the purpose of the gl_CullDistance variable in vertex shaders?,Culling distance,User culling planes,Custom culling,Geometry elimination,A,gl_CullDistance enables custom culling planes; similar to gl_ClipDistance but for primitive culling.,Culling,https://www.khronos.org/registry/OpenGL-Refpages/gl4/html/gl_CullDistance.xhtml,https://youtube.com/results?search_query=glsl+culldistance,https://youtube.com/results?search_query=glsl+culldistance+hindi,https://youtube.com/results?search_query=glsl+culldistance+kannada,https://youtube.com/results?search_query=glsl+culldistance+tamil,https://youtube.com/results?search_query=glsl+culldistance+telugu
GLSL,Intermediate,How do you implement impostors/billboards in GLSL?,Billboarding,Sprite rendering,Always-facing quads,Particle orientation,A,"Use geometry shader or vertex shader to align quad with camera, calculate texture coordinates.",Billboarding,https://learnopengl.com/In-Practice/2D-Game/Rendering-Sprites,https://youtube.com/results?search_query=glsl+billboarding,https://youtube.com/results?search_query=glsl+billboarding+hindi,https://youtube.com/results?search_query=glsl+billboarding+kannada,https://youtube.com/results?search_query=glsl+billboarding+tamil,https://youtube.com/results?search_query=glsl+billboarding+telugu
GLSL,Intermediate,What's the difference between mod() and fract() functions?,Modulo operations,Fractional part,Value decomposition,Periodic functions,A,"mod(x, y) = x - y*floor(x/y); fract(x) = x - floor(x) (fractional part only).",Math Functions,https://www.khronos.org/registry/OpenGL-Refpages/gl4/html/mod.xhtml,https://youtube.com/results?search_query=glsl+mod+fract,https://youtube.com/results?search_query=glsl+mod+fract+hindi,https://youtube.com/results?search_query=glsl+mod+fract+kannada,https://youtube.com/results?search_query=glsl+mod+fract+tamil,https://youtube.com/results?search_query=glsl+mod+fract+telugu
GLSL,Intermediate,How do you implement vignetting in GLSL?,Lens effects,Edge darkening,Post-processing,Photographic effects,A,"Calculate distance from screen center, apply darkening curve (cosine, Gaussian) to edges of image.",Post-processing,https://learnopengl.com/Advanced-OpenGL/Framebuffers,https://youtube.com/results?search_query=glsl+vignetting,https://youtube.com/results?search_query=glsl+vignetting+hindi,https://youtube.com/results?search_query=glsl+vignetting+kannada,https://youtube.com/results?search_query=glsl+vignetting+tamil,https://youtube.com/results?search_query=glsl+vignetting+telugu
GLSL,Intermediate,What's the purpose of the gl_ViewportIndex variable in geometry shaders?,Viewport selection,Multi-viewport rendering,Stereoscopic rendering,Viewport array,A,gl_ViewportIndex selects which viewport to use for layered rendering to viewport array.,Viewport Management,https://www.khronos.org/opengl/wiki/Geometry_Shader#Viewport_array,https://youtube.com/results?search_query=glsl+viewportindex,https://youtube.com/results?search_query=glsl+viewportindex+hindi,https://youtube.com/results?search_query=glsl+viewportindex+kannada,https://youtube.com/results?search_query=glsl+viewportindex+tamil,https://youtube.com/results?search_query=glsl+viewportindex+telugu
GLSL,Intermediate,How do you implement chromatic aberration in GLSL?,Lens distortion,Color separation,Optical defects,Post-processing,A,Shift RGB channels by different amounts radially from center based on wavelength dispersion.,Chromatic Aberration,https://learnopengl.com/Advanced-OpenGL/Framebuffers,https://youtube.com/results?search_query=glsl+chromatic+aberration,https://youtube.com/results?search_query=glsl+chromatic+aberration+hindi,https://youtube.com/results?search_query=glsl+chromatic+aberration+kannada,https://youtube.com/results?search_query=glsl+chromatic+aberration+tamil,https://youtube.com/results?search_query=glsl+chromatic+aberration+telugu
GLSL,Intermediate,What's the difference between normalize() and faceforward() functions?,Vector normalization,Orientation correction,Normal calculation,Surface direction,A,"normalize(v) = v/||v||; faceforward(N, I, Nref) flips N to face away from I relative to Nref.",Vector Functions,https://www.khronos.org/registry/OpenGL-Refpages/gl4/html/normalize.xhtml,https://youtube.com/results?search_query=glsl+normalize+faceforward,https://youtube.com/results?search_query=glsl+normalize+faceforward+hindi,https://youtube.com/results?search_query=glsl+normalize+faceforward+kannada,https://youtube.com/results?search_query=glsl+normalize+faceforward+tamil,https://youtube.com/results?search_query=glsl+normalize+faceforward+telugu
GLSL,Intermediate,How do you implement film grain in GLSL?,Noise overlay,Analog simulation,Post-processing,Aesthetic effects,A,"Add procedural noise (Perlin, value) scaled by intensity, optionally correlated with luminance.",Film Grain,https://thebookofshaders.com/11/,https://youtube.com/results?search_query=glsl+film+grain,https://youtube.com/results?search_query=glsl+film+grain+hindi,https://youtube.com/results?search_query=glsl+film+grain+kannada,https://youtube.com/results?search_query=glsl+film+grain+tamil,https://youtube.com/results?search_query=glsl+film+grain+telugu
GLSL,Intermediate,What's the purpose of the gl_PatchVerticesIn variable in tessellation shaders?,Patch size,Input vertices,Patch topology,Tessellation input,A,gl_PatchVerticesIn contains number of vertices in input patch for tessellation control shader.,Tessellation,https://www.khronos.org/opengl/wiki/Tessellation_Control_Shader,https://youtube.com/results?search_query=glsl+patchverticesin,https://youtube.com/results?search_query=glsl+patchverticesin+hindi,https://youtube.com/results?search_query=glsl+patchverticesin+kannada,https://youtube.com/results?search_query=glsl+patchverticesin+tamil,https://youtube.com/results?search_query=glsl+patchverticesin+telugu
GLSL,Intermediate,How do you implement screen-space directional occlusion (SSDO)?,Directional occlusion,Indirect lighting,Global illumination approximation,Ambient improvement,A,"Cast rays in hemisphere, check depth for occlusion, accumulate indirect lighting from unoccluded samples.",Screen-space Effects,https://www.activision.com/cdn/research/Practical_Real_Time_Strategies_for_Accurate_Indirect_Occlusion.pdf,https://youtube.com/results?search_query=glsl+ssdo,https://youtube.com/results?search_query=glsl+ssdo+hindi,https://youtube.com/results?search_query=glsl+ssdo+kannada,https://youtube.com/results?search_query=glsl+ssdo+tamil,https://youtube.com/results?search_query=glsl+ssdo+telugu
GLSL,Intermediate,What's the difference between outerProduct() and matrixCompMult()?,Matrix construction,Component multiplication,Matrix operations,Element-wise,A,"outerProduct(c, r) creates matrix from column×row; matrixCompMult() multiplies matrices component-wise.",Matrix Functions,https://www.khronos.org/registry/OpenGL-Refpages/gl4/html/outerProduct.xhtml,https://youtube.com/results?search_query=glsl+outerproduct+matrixcompmult,https://youtube.com/results?search_query=glsl+outerproduct+matrixcompmult+hindi,https://youtube.com/results?search_query=glsl+outerproduct+matrixcompmult+kannada,https://youtube.com/results?search_query=glsl+outerproduct+matrixcompmult+tamil,https://youtube.com/results?search_query=glsl+outerproduct+matrixcompmult+telugu
GLSL,Intermediate,How do you implement heat haze/distortion in GLSL?,Atmospheric effects,Refraction distortion,Heat waves,Visual distortion,A,Use noise texture to distort UV coordinates based on heat source distance and time for waving effect.,Distortion Effects,https://learnopengl.com/Advanced-OpenGL/Framebuffers,https://youtube.com/results?search_query=glsl+heat+haze,https://youtube.com/results?search_query=glsl+heat+haze+hindi,https://youtube.com/results?search_query=glsl+heat+haze+kannada,https://youtube.com/results?search_query=glsl+heat+haze+tamil,https://youtube.com/results?search_query=glsl+heat+haze+telugu
GLSL,Intermediate,What's the purpose of the gl_TessCoord variable in tessellation evaluation shaders?,Tessellation coordinates,Barycentric position,Parametric location,Patch interpolation,A,gl_TessCoord contains barycentric/parametric coordinates within tessellated primitive for interpolation.,Tessellation,https://www.khronos.org/opengl/wiki/Tessellation_Evaluation_Shader,https://youtube.com/results?search_query=glsl+tesscoord,https://youtube.com/results?search_query=glsl+tesscoord+hindi,https://youtube.com/results?search_query=glsl+tesscoord+kannada,https://youtube.com/results?search_query=glsl+tesscoord+tamil,https://youtube.com/results?search_query=glsl+tesscoord+telugu
GLSL,Intermediate,How do you implement lens flare in GLSL?,Lens effects,Light scattering,Glare,Optical artifacts,A,"Detect bright light sources, generate streak/spike patterns, apply ghosting and anamorphic streaks.",Lens Flare,https://learnopengl.com/Advanced-OpenGL/Framebuffers,https://youtube.com/results?search_query=glsl+lens+flare,https://youtube.com/results?search_query=glsl+lens+flare+hindi,https://youtube.com/results?search_query=glsl+lens+flare+kannada,https://youtube.com/results?search_query=glsl+lens+flare+tamil,https://youtube.com/results?search_query=glsl+lens+flare+telugu
GLSL,Intermediate,What's the difference between radians() and degrees() functions?,Angle conversion,Unit transformation,Trigonometry preparation,Mathematical conversion,A,radians(x) converts degrees to radians; degrees(x) converts radians to degrees - opposite conversions.,Math Functions,https://www.khronos.org/registry/OpenGL-Refpages/gl4/html/radians.xhtml,https://youtube.com/results?search_query=glsl+radians+degrees,https://youtube.com/results?search_query=glsl+radians+degrees+hindi,https://youtube.com/results?search_query=glsl+radians+degrees+kannada,https://youtube.com/results?search_query=glsl+radians+degrees+tamil,https://youtube.com/results?search_query=glsl+radians+degrees+telugu
GLSL,Intermediate,How do you implement velocity buffer for motion blur?,Motion vectors,Object velocity,Per-pixel motion,Frame coherence,A,"Store per-pixel velocity (currentPos - previousPos) in RG buffer, use for motion blur direction.",Motion Vectors,https://developer.nvidia.com/gpugems/gpugems3/part-iv-image-effects/chapter-27-motion-blur-post-processing-effect,https://youtube.com/results?search_query=glsl+velocity+buffer,https://youtube.com/results?search_query=glsl+velocity+buffer+hindi,https://youtube.com/results?search_query=glsl+velocity+buffer+kannada,https://youtube.com/results?search_query=glsl+velocity+buffer+tamil,https://youtube.com/results?search_query=glsl+velocity+buffer+telugu
GLSL,Intermediate,What's the purpose of the gl_SampleID variable in fragment shaders?,Multisample identification,Sample index,MSAA access,Anti-aliasing,A,gl_SampleID provides index of current sample within pixel for multisample anti-aliasing (MSAA).,Multisampling,https://www.khronos.org/registry/OpenGL-Refpages/gl4/html/gl_SampleID.xhtml,https://youtube.com/results?search_query=glsl+sampleid,https://youtube.com/results?search_query=glsl+sampleid+hindi,https://youtube.com/results?search_query=glsl+sampleid+kannada,https://youtube.com/results?search_query=glsl+sampleid+tamil,https://youtube.com/results?search_query=glsl+sampleid+telugu
GLSL,Intermediate,How do you implement tri-planar texturing in GLSL?,Seamless texturing,Projection blending,Object-space mapping,Procedural texturing,A,"Sample texture three times (XY, XZ, YZ planes), blend based on surface normal to avoid seams.",Texturing,https://www.gamedev.net/tutorials/programming/graphics/tri-planar-texture-mapping-r747/,https://youtube.com/results?search_query=glsl+triplanar+texturing,https://youtube.com/results?search_query=glsl+triplanar+texturing+hindi,https://youtube.com/results?search_query=glsl+triplanar+texturing+kannada,https://youtube.com/results?search_query=glsl+triplanar+texturing+tamil,https://youtube.com/results?search_query=glsl+triplanar+texturing+telugu
GLSL,Intermediate,What's the difference between textureLod() and textureGrad()?,Mipmap control,Explicit LOD,Gradient specification,Texture filtering,A,textureLod() uses explicit LOD; textureGrad() uses explicit derivatives for implicit LOD calculation.,Texture Functions,https://www.khronos.org/registry/OpenGL-Refpages/gl4/html/textureLod.xhtml,https://youtube.com/results?search_query=glsl+texturelod+texturegrad,https://youtube.com/results?search_query=glsl+texturelod+texturegrad+hindi,https://youtube.com/results?search_query=glsl+texturelod+texturegrad+kannada,https://youtube.com/results?search_query=glsl+texturelod+texturegrad+tamil,https://youtube.com/results?search_query=glsl+texturelod+texturegrad+telugu
