skill,level,question_text,option_a,option_b,option_c,option_d,correct_answer,explanation,topic,mdn_link,youtube_english,youtube_hindi,youtube_kannada,youtube_tamil,youtube_telugu
GLSL,Intermediate,How do you implement fur shell rendering in GLSL?,Fur techniques,Layered rendering,Volume approximation,Alpha blended layers,A,"Render multiple shell layers offset along normal, alpha blend with noise pattern for fur appearance.",Fur Rendering,https://developer.nvidia.com/gpugems/gpugems3/part-iii-rendering/chapter-16-virtual-fur-rendering,https://youtube.com/results?search_query=glsl+fur+shell+rendering,https://youtube.com/results?search_query=glsl+fur+shell+rendering+hindi,https://youtube.com/results?search_query=glsl+fur+shell+rendering+kannada,https://youtube.com/results?search_query=glsl+fur+shell+rendering+tamil,https://youtube.com/results?search_query=glsl+fur+shell+rendering+telugu
GLSL,Intermediate,What's the purpose of the gl_SamplePosition variable in fragment shaders?,Sample location,Multisample offset,Sub-pixel position,AA pattern,A,gl_SamplePosition provides sub-pixel position of current sample for custom multisample resolve.,Multisampling,https://www.khronos.org/registry/OpenGL-Refpages/gl4/html/gl_SamplePosition.xhtml,https://youtube.com/results?search_query=glsl+sampleposition,https://youtube.com/results?search_query=glsl+sampleposition+hindi,https://youtube.com/results?search_query=glsl+sampleposition+kannada,https://youtube.com/results?search_query=glsl+sampleposition+tamil,https://youtube.com/results?search_query=glsl+sampleposition+telugu
GLSL,Intermediate,How do you implement screen-space fluid rendering in GLSL?,Fluid simulation,Ray marching,Volume rendering,Particle visualization,A,"Use metaballs/SPH particles, ray march through density field, apply lighting with gradient normals.",Fluid Rendering,https://developer.nvidia.com/gpugems/gpugems3/part-i-natural-effects/chapter-1-gpu-gems-3-ch-01,https://youtube.com/results?search_query=glsl+fluid+rendering,https://youtube.com/results?search_query=glsl+fluid+rendering+hindi,https://youtube.com/results?search_query=glsl+fluid+rendering+kannada,https://youtube.com/results?search_query=glsl+fluid+rendering+tamil,https://youtube.com/results?search_query=glsl+fluid+rendering+telugu
GLSL,Intermediate,What's the difference between asin() and atan() functions?,Inverse trigonometric,Arc functions,Angle calculation,Trigonometry,A,asin() returns angle whose sine is x; atan() returns angle whose tangent is x - different inverse trig.,Math Functions,https://www.khronos.org/registry/OpenGL-Refpages/gl4/html/asin.xhtml,https://youtube.com/results?search_query=glsl+asin+atan,https://youtube.com/results?search_query=glsl+asin+atan+hindi,https://youtube.com/results?search_query=glsl+asin+atan+kannada,https://youtube.com/results?search_query=glsl+asin+atan+tamil,https://youtube.com/results?search_query=glsl+asin+atan+telugu
GLSL,Intermediate,How do you implement terrain rendering with heightmaps in GLSL?,Terrain,Heightfield rendering,Landscape,LOD systems,A,"Sample heightmap in vertex/tessellation shader, displace vertices, calculate normals from height differences.",Terrain Rendering,https://learnopengl.com/Guest-Articles/2021/Tessellation/Tessellation,https://youtube.com/results?search_query=glsl+terrain+rendering,https://youtube.com/results?search_query=glsl+terrain+rendering+hindi,https://youtube.com/results?search_query=glsl+terrain+rendering+kannada,https://youtube.com/results?search_query=glsl+terrain+rendering+tamil,https://youtube.com/results?search_query=glsl+terrain+rendering+telugu
GLSL,Intermediate,What's the purpose of the gl_HelperInvocation variable in fragment shaders?,Helper thread detection,Derivative groups,Shader optimization,Execution mask,A,gl_HelperInvocation indicates if fragment is helper invocation (for derivatives) not writing output.,Shader Optimization,https://www.khronos.org/registry/OpenGL-Refpages/gl4/html/gl_HelperInvocation.xhtml,https://youtube.com/results?search_query=glsl+helperinvocation,https://youtube.com/results?search_query=glsl+helperinvocation+hindi,https://youtube.com/results?search_query=glsl+helperinvocation+kannada,https://youtube.com/results?search_query=glsl+helperinvocation+tamil,https://youtube.com/results?search_query=glsl+helperinvocation+telugu
GLSL,Intermediate,How do you implement screen-space outlines in GLSL?,Edge detection,Outline effects,Silhouette rendering,Post-processing,A,"Use Sobel/Canny edge detection on depth/normal buffer, combine with color-based edges for outlines.",Edge Detection,https://learnopengl.com/Advanced-OpenGL/Framebuffers,https://youtube.com/results?search_query=glsl+screen+space+outlines,https://youtube.com/results?search_query=glsl+screen+space+outlines+hindi,https://youtube.com/results?search_query=glsl+screen+space+outlines+kannada,https://youtube.com/results?search_query=glsl+screen+space+outlines+tamil,https://youtube.com/results?search_query=glsl+screen+space+outlines+telugu
GLSL,Intermediate,What's the difference between textureSize() and imageSize()?,Texture dimensions,Image load/store,Size query,Buffer sizes,A,textureSize() gets dimensions of texture sampler; imageSize() gets dimensions of image load/store.,Texture/Image Functions,https://www.khronos.org/registry/OpenGL-Refpages/gl4/html/textureSize.xhtml,https://youtube.com/results?search_query=glsl+texturesize+imagesize,https://youtube.com/results?search_query=glsl+texturesize+imagesize+hindi,https://youtube.com/results?search_query=glsl+texturesize+imagesize+kannada,https://youtube.com/results?search_query=glsl+texturesize+imagesize+tamil,https://youtube.com/results?search_query=glsl+texturesize+imagesize+telugu
GLSL,Intermediate,How do you implement signed distance fields (SDF) in GLSL?,Distance fields,Font rendering,Shape definition,Procedural geometry,A,"Store/calculate distance to shape boundary, use for smooth blending, font rendering, or ray marching.",Distance Fields,https://www.iquilezles.org/www/articles/distfunctions/distfunctions.htm,https://youtube.com/results?search_query=glsl+signed+distance+fields,https://youtube.com/results?search_query=glsl+signed+distance+fields+hindi,https://youtube.com/results?search_query=glsl+signed+distance+fields+kannada,https://youtube.com/results?search_query=glsl+signed+distance+fields+tamil,https://youtube.com/results?search_query=glsl+signed+distance+fields+telugu
GLSL,Intermediate,What's the purpose of the gl_SecondaryFragColorEXT variable in fragment shaders?,Dual source blending,Advanced blending,Multiple outputs,Blend equation,A,gl_SecondaryFragColorEXT provides second output color for dual-source blending operations.,Blending,https://www.khronos.org/registry/OpenGL/extensions/EXT/EXT_blend_func_extended.txt,https://youtube.com/results?search_query=glsl+secondaryfragcolor,https://youtube.com/results?search_query=glsl+secondaryfragcolor+hindi,https://youtube.com/results?search_query=glsl+secondaryfragcolor+kannada,https://youtube.com/results?search_query=glsl+secondaryfragcolor+tamil,https://youtube.com/results?search_query=glsl+secondaryfragcolor+telugu
GLSL,Intermediate,How do you implement procedural skyboxes in GLSL?,Sky rendering,Atmospheric scattering,Procedural sky,Time of day,A,"Use Rayleigh/Mie scattering equations, sun position, apply depth-based fog for horizon blending.",Sky Rendering,https://www.scratchapixel.com/lessons/procedural-generation-virtual-worlds/simulating-sky,https://youtube.com/results?search_query=glsl+procedural+skybox,https://youtube.com/results?search_query=glsl+procedural+skybox+hindi,https://youtube.com/results?search_query=glsl+procedural+skybox+kannada,https://youtube.com/results?search_query=glsl+procedural+skybox+tamil,https://youtube.com/results?search_query=glsl+procedural+skybox+telugu
GLSL,Intermediate,What's the difference between noise1(), noise2(), noise3(), noise4()?,Noise dimensions,Procedural noise,"Random functions,Texture synthesis,A,Number indicates dimensions: noise1() 1D, noise2() 2D, noise3() 3D, noise4() 4D (3D + time).",Noise Functions,https://thebookofshaders.com/11/,https://youtube.com/results?search_query=glsl+noise+functions,https://youtube.com/results?search_query=glsl+noise+functions+hindi,https://youtube.com/results?search_query=glsl+noise+functions+kannada,https://youtube.com/results?search_query=glsl+noise+functions+tamil,https://youtube.com/results?search_query=glsl+noise+functions+telugu
GLSL,Intermediate,How do you implement voronoi patterns in GLSL?,Voronoi diagrams,Cell noise,Procedural patterns,Distance fields,A,"Calculate distance to nearest feature points, optionally second-nearest for cell boundaries.",Voronoi Patterns,https://thebookofshaders.com/12/,https://youtube.com/results?search_query=glsl+voronoi+patterns,https://youtube.com/results?search_query=glsl+voronoi+patterns+hindi,https://youtube.com/results?search_query=glsl+voronoi+patterns+kannada,https://youtube.com/results?search_query=glsl+voronoi+patterns+tamil,https://youtube.com/results?search_query=glsl+voronoi+patterns+telugu
GLSL,Intermediate,What's the purpose of the gl_FragStencilRefEXT variable in fragment shaders?,Stencil reference,Stencil testing,Custom stencil values,Mask operations,A,gl_FragStencilRefEXT allows writing custom stencil reference value for advanced stencil operations.,Stencil Buffer,https://www.khronos.org/registry/OpenGL/extensions/EXT/EXT_shader_stencil_export.txt,https://youtube.com/results?search_query=glsl+fragstencilref,https://youtube.com/results?search_query=glsl+fragstencilref+hindi,https://youtube.com/results?search_query=glsl+fragstencilref+kannada,https://youtube.com/results?search_query=glsl+fragstencilref+tamil,https://youtube.com/results?search_query=glsl+fragstencilref+telugu
GLSL,Intermediate,How do you implement screen-space refraction with depth?,Refractive materials,Depth-aware refraction,Underwater effects,Distortion,A,"March ray through depth buffer using refraction vector, find intersection, sample color with distortion.",Refraction,https://learnopengl.com/Advanced-OpenGL/Cubemaps,https://youtube.com/results?search_query=glsl+depth+refraction,https://youtube.com/results?search_query=glsl+depth+refraction+hindi,https://youtube.com/results?search_query=glsl+depth+refraction+kannada,https://youtube.com/results?search_query=glsl+depth+refraction+tamil,https://youtube.com/results?search_query=glsl+depth+refraction+telugu
GLSL,Intermediate,What's the difference between findLSB() and findMSB() functions?,Bit scanning,Integer analysis,Bit position,Binary operations,A,findLSB() finds least significant set bit; findMSB() finds most significant set bit - opposite ends.,Integer Functions,https://www.khronos.org/registry/OpenGL-Refpages/gl4/html/findLSB.xhtml,https://youtube.com/results?search_query=glsl+findlsb+findmsb,https://youtube.com/results?search_query=glsl+findlsb+findmsb+hindi,https://youtube.com/results?search_query=glsl+findlsb+findmsb+kannada,https://youtube.com/results?search_query=glsl+findlsb+findmsb+tamil,https://youtube.com/results?search_query=glsl+findlsb+findmsb+telugu
GLSL,Intermediate,How do you implement GPU-based picking in GLSL?,Object selection,ID rendering,Picking system,Interactive rendering,A,"Render object IDs to separate buffer, read back pixel under mouse for object identification.",Picking,https://learnopengl.com/In-Practice/2D-Game/Picking,https://youtube.com/results?search_query=glsl+gpu+picking,https://youtube.com/results?search_query=glsl+gpu+picking+hindi,https://youtube.com/results?search_query=glsl+gpu+picking+kannada,https://youtube.com/results?search_query=glsl+gpu+picking+tamil,https://youtube.com/results?search_query=glsl+gpu+picking+telugu
GLSL,Intermediate,What's the purpose of the gl_LastFragData variable in fragment shaders?,Previous fragment data,Feedback loops,Multi-pass accumulation,Frame history,A,gl_LastFragData provides access to previous frame's fragment data for feedback/accumulation effects.,Feedback,https://www.khronos.org/registry/OpenGL/extensions/NV/NV_shader_buffer_load.txt,https://youtube.com/results?search_query=glsl+lastfragdata,https://youtube.com/results?search_query=glsl+lastfragdata+hindi,https://youtube.com/results?search_query=glsl+lastfragdata+kannada,https://youtube.com/results?search_query=glsl+lastfragdata+tamil,https://youtube.com/results?search_query=glsl+lastfragdata+telugu
GLSL,Intermediate,How do you implement screen-space global illumination (SSGI)?,Global illumination,Screen-space lighting,Indirect lighting,Real-time GI,A,"Trace rays in screen space, gather indirect lighting from hit points, apply spatial filtering.",Global Illumination,https://sites.google.com/site/patrickdavidgourdet/home/ssgi,https://youtube.com/results?search_query=glsl+ssgi,https://youtube.com/results?search_query=glsl+ssgi+hindi,https://youtube.com/results?search_query=glsl+ssgi+kannada,https://youtube.com/results?search_query=glsl+ssgi+tamil,https://youtube.com/results?search_query=glsl+ssgi+telugu
GLSL,Intermediate,What's the difference between uaddCarry() and umulExtended()?,Integer operations,Carry bits,Extended precision,Arithmetic functions,A,uaddCarry() adds with carry output; umulExtended() multiplies with high/low output - different integer ops.,Integer Functions,https://www.khronos.org/registry/OpenGL-Refpages/gl4/html/uaddCarry.xhtml,https://youtube.com/results?search_query=glsl+uaddcarry+umulextended,https://youtube.com/results?search_query=glsl+uaddcarry+umulextended+hindi,https://youtube.com/results?search_query=glsl+uaddcarry+umulextended+kannada,https://youtube.com/results?search_query=glsl+uaddcarry+umulextended+tamil,https://youtube.com/results?search_query=glsl+uaddcarry+umulextended+telugu
GLSL,Intermediate,How do you implement screen-space subsurface scattering for skin?,Skin rendering,Subsurface blur,Separable convolution,Multi-pass blur,A,Apply separable Gaussian blur in screen space for red channel more than green/blue for skin diffusion.,Skin Rendering,https://developer.nvidia.com/gpugems/gpugems3/part-iii-rendering/chapter-14-advanced-techniques-realistic-real-time-skin-rendering,https://youtube.com/results?search_query=glsl+skin+subsurface,https://youtube.com/results?search_query=glsl+skin+subsurface+hindi,https://youtube.com/results?search_query=glsl+skin+subsurface+kannada,https://youtube.com/results?search_query=glsl+skin+subsurface+tamil,https://youtube.com/results?search_query=glsl+skin+subsurface+telugu
GLSL,Intermediate,What's the purpose of the gl_FragColor variable in fragment shaders?,Color output,Fragment result,Render target,Buffer writing,A,gl_FragColor is deprecated output variable for fragment color; use out variables in modern GLSL.,Fragment Output,https://www.khronos.org/opengl/wiki/Fragment_Shader#Outputs,https://youtube.com/results?search_query=glsl+fragcolor,https://youtube.com/results?search_query=glsl+fragcolor+hindi,https://youtube.com/results?search_query=glsl+fragcolor+kannada,https://youtube.com/results?search_query=glsl+fragcolor+tamil,https://youtube.com/results?search_query=glsl+fragcolor+telugu
GLSL,Intermediate,How do you implement screen-space ray tracing in GLSL?,Ray tracing,Screen-space rays,Intersection testing,Real-time RT,A,"March rays through depth buffer using步进, find intersections, apply lighting at hit points.",Ray Tracing,https://www.scratchapixel.com/lessons/3d-basic-rendering/introduction-to-ray-tracing,https://youtube.com/results?search_query=glsl+screen+space+ray+tracing,https://youtube.com/results?search_query=glsl+screen+space+ray+tracing+hindi,https://youtube.com/results?search_query=glsl+screen+space+ray+tracing+kannada,https://youtube.com/results?search_query=glsl+screen+space+ray+tracing+tamil,https://youtube.com/results?search_query=glsl+screen+space+ray+tracing+telugu
GLSL,Intermediate,What's the difference between textureProj() and textureOffset()?,Projective texturing,Coordinate offset,Sampling variations,Texture access,A,textureProj() divides coordinates by w; textureOffset() samples with constant offset - different transforms.,Texture Functions,https://www.khronos.org/registry/OpenGL-Refpages/gl4/html/textureProj.xhtml,https://youtube.com/results?search_query=glsl+textureproj+textureoffset,https://youtube.com/results?search_query=glsl+textureproj+textureoffset+hindi,https://youtube.com/results?search_query=glsl+textureproj+textureoffset+kannada,https://youtube.com/results?search_query=glsl+textureproj+textureoffset+tamil,https://youtube.com/results?search_query=glsl+textureproj+textureoffset+telugu
GLSL,Intermediate,How do you implement screen-space caustics in GLSL?,Caustics,Light focusing,Water effects,Optical patterns,A,"Project light through refractive/reflective surfaces, accumulate intensity on receiver surfaces.",Caustics,https://www.activision.com/cdn/research/RealTimeRenderingProjectedCaustics.pdf,https://youtube.com/results?search_query=glsl+caustics,https://youtube.com/results?search_query=glsl+caustics+hindi,https://youtube.com/results?search_query=glsl+caustics+kannada,https://youtube.com/results?search_query=glsl+caustics+tamil,https://youtube.com/results?search_query=glsl+caustics+telugu
GLSL,Intermediate,What's the purpose of the gl_FragData[] array in fragment shaders?,Multiple render targets,MRT output,Multiple buffers,Deferred rendering,A,gl_FragData[] is deprecated array for multiple render targets; use out variables in modern GLSL.,Multiple Targets,https://www.khronos.org/opengl/wiki/Fragment_Shader#Outputs,https://youtube.com/results?search_query=glsl+fragdata,https://youtube.com/results?search_query=glsl+fragdata+hindi,https://youtube.com/results?search_query=glsl+fragdata+kannada,https://youtube.com/results?search_query=glsl+fragdata+tamil,https://youtube.com/results?search_query=glsl+fragdata+telugu
GLSL,Intermediate,How do you implement screen-space fog in GLSL?,Atmospheric fog,Depth-based fog,Exponential fog,Environment effects,A,"Calculate fog factor based on depth (linear/exponential), blend fragment color with fog color.",Fog,https://learnopengl.com/Advanced-OpenGL/Depth-testing,https://youtube.com/results?search_query=glsl+screen+space+fog,https://youtube.com/results?search_query=glsl+screen+space+fog+hindi,https://youtube.com/results?search_query=glsl+screen+space+fog+kannada,https://youtube.com/results?search_query=glsl+screen+space+fog+tamil,https://youtube.com/results?search_query=glsl+screen+space+fog+telugu
GLSL,Intermediate,What's the difference between bitfieldExtract() and bitfieldInsert()?,Bit manipulation,Bit field operations,Integer packing,Data extraction,A,bitfieldExtract() extracts bits; bitfieldInsert() inserts bits - complementary bit field operations.,Integer Functions,https://www.khronos.org/registry/OpenGL-Refpages/gl4/html/bitfieldExtract.xhtml,https://youtube.com/results?search_query=glsl+bitfieldextract+insert,https://youtube.com/results?search_query=glsl+bitfieldextract+insert+hindi,https://youtube.com/results?search_query=glsl+bitfieldextract+insert+kannada,https://youtube.com/results?search_query=glsl+bitfieldextract+insert+tamil,https://youtube.com/results?search_query=glsl+bitfieldextract+insert+telugu
GLSL,Intermediate,How do you implement screen-space dithering in GLSL?,Dithering,Banding reduction,Noise addition,Quantization,A,Add Bayer matrix or blue noise pattern scaled by quantization step to reduce color banding.,Dithering,https://loopit.dk/rendering_post.html,https://youtube.com/results?search_query=glsl+dithering,https://youtube.com/results?search_query=glsl+dithering+hindi,https://youtube.com/results?search_query=glsl+dithering+kannada,https://youtube.com/results?search_query=glsl+dithering+tamil,https://youtube.com/results?search_query=glsl+dithering+telugu
GLSL,Intermediate,What's the purpose of the gl_NumSamples variable in fragment shaders?,Multisample count,Sample information,AA quality,Hardware info,A,gl_NumSamples contains number of samples per pixel for current framebuffer (multisample count).,Multisampling,https://www.khronos.org/registry/OpenGL-Refpages/gl4/html/gl_NumSamples.xhtml,https://youtube.com/results?search_query=glsl+numsamples,https://youtube.com/results?search_query=glsl+numsamples+hindi,https://youtube.com/results?search_query=glsl+numsamples+kannada,https://youtube.com/results?search_query=glsl+numsamples+tamil,https://youtube.com/results?search_query=glsl+numsamples+telugu
GLSL,Intermediate,How do you implement screen-space fluid simulation in GLSL?,Fluid dynamics,GPU simulation,Navier-Stokes,Real-time fluids,A,"Solve Navier-Stokes equations on grid, advect velocity/density, apply pressure projection, visualize.",Fluid Simulation,https://developer.nvidia.com/gpugems/gpugems/part-vi-beyond-triangles/chapter-38-fast-fluid-dynamics-simulation-gpu,https://youtube.com/results?search_query=glsl+fluid+simulation,https://youtube.com/results?search_query=glsl+fluid+simulation+hindi,https://youtube.com/results?search_query=glsl+fluid+simulation+kannada,https://youtube.com/results?search_query=glsl+fluid+simulation+tamil,https://youtube.com/results?search_query=glsl+fluid+simulation+telugu
GLSL,Intermediate,What's the difference between packUnorm2x16() and unpackUnorm2x16()?,Data packing,Normalized packing,Float compression,Memory optimization,A,packUnorm2x16() packs two floats to uint; unpackUnorm2x16() unpacks - complementary packing functions.,Data Packing,https://www.khronos.org/registry/OpenGL-Refpages/gl4/html/packUnorm2x16.xhtml,https://youtube.com/results?search_query=glsl+packunorm+unpackunorm,https://youtube.com/results?search_query=glsl+packunorm+unpackunorm+hindi,https://youtube.com/results?search_query=glsl+packunorm+unpackunorm+kannada,https://youtube.com/results?search_query=glsl+packunorm+unpackunorm+tamil,https://youtube.com/results?search_query=glsl+packunorm+unpackunorm+telugu
GLSL,Intermediate,How do you implement screen-space hair rendering in GLSL?,Hair rendering,Kajiya-Kay model,Anisotropic highlights,Strand rendering,A,"Use Kajiya-Kay lighting model with tangent direction, apply noise for strand variation, alpha test.",Hair Rendering,https://developer.nvidia.com/gpugems/gpugems2/part-iii-high-quality-rendering/chapter-23-hair-animation-and-rendering,https://youtube.com/results?search_query=glsl+hair+rendering,https://youtube.com/results?search_query=glsl+hair+rendering+hindi,https://youtube.com/results?search_query=glsl+hair+rendering+kannada,https://youtube.com/results?search_query=glsl+hair+rendering+tamil,https://youtube.com/results?search_query=glsl+hair+rendering+telugu
GLSL,Intermediate,What's the purpose of the gl_DepthRange variable in vertex shaders?,Depth range,Clip space conversion,Near/far planes,Viewport depth,A,"gl_DepthRange contains near, far, and diff values for converting clip Z to window depth range.",Depth Range,https://www.khronos.org/registry/OpenGL-Refpages/gl4/html/gl_DepthRange.xhtml,https://youtube.com/results?search_query=glsl+depthrange,https://youtube.com/results?search_query=glsl+depthrange+hindi,https://youtube.com/results?search_query=glsl+depthrange+kannada,https://youtube.com/results?search_query=glsl+depthrange+tamil,https://youtube.com/results?search_query=glsl+depthrange+telugu
GLSL,Intermediate,How do you implement screen-space grass/wind effects in GLSL?,Vegetation rendering,Wind animation,Vertex animation,Procedural movement,A,"Apply sine wave based on position/time to vertices, use noise for variation, calculate normals.",Vegetation,https://developer.nvidia.com/gpugems/gpugems3/part-i-natural-effects/chapter-1-generating-complex-procedural-terrains-using-gpu,https://youtube.com/results?search_query=glsl+grass+wind,https://youtube.com/results?search_query=glsl+grass+wind+hindi,https://youtube.com/results?search_query=glsl+grass+wind+kannada,https://youtube.com/results?search_query=glsl+grass+wind+tamil,https://youtube.com/results?search_query=glsl+grass+wind+telugu
GLSL,Intermediate,What's the difference between ldexp() and frexp() functions?,Floating point decomposition,Exponent manipulation,Scientific notation,Float analysis,A,ldexp() = x * 2^exp; frexp() extracts mantissa and exponent - complementary float operations.,Math Functions,https://www.khronos.org/registry/OpenGL-Refpages/gl4/html/ldexp.xhtml,https://youtube.com/results?search_query=glsl+ldexp+frexp,https://youtube.com/results?search_query=glsl+ldexp+frexp+hindi,https://youtube.com/results?search_query=glsl+ldexp+frexp+kannada,https://youtube.com/results?search_query=glsl+ldexp+frexp+tamil,https://youtube.com/results?search_query=glsl+ldexp+frexp+telugu
GLSL,Intermediate,How do you implement screen-space snow accumulation in GLSL?,Snow rendering,Accumulation effects,Weather simulation,Seasonal effects,A,"Use height map for accumulation, blend based on surface angle/temperature, add sparkling with noise.",Weather Effects,https://developer.nvidia.com/gpugems/gpugems3/part-i-natural-effects/chapter-1-generating-complex-procedural-terrains-using-gpu,https://youtube.com/results?search_query=glsl+snow+accumulation,https://youtube.com/results?search_query=glsl+snow+accumulation+hindi,https://youtube.com/results?search_query=glsl+snow+accumulation+kannada,https://youtube.com/results?search_query=glsl+snow+accumulation+tamil,https://youtube.com/results?search_query=glsl+snow+accumulation+telugu
GLSL,Intermediate,What's the purpose of the gl_Max* constants in GLSL?,Implementation limits,Hardware capabilities,Shader constraints,Resource limits,A,"gl_Max* constants define implementation limits (vertices, uniforms, texture units) for portability.",Limits,https://www.khronos.org/opengl/wiki/GLSL_Implicit_Size_Limitations,https://youtube.com/results?search_query=glsl+max+constants,https://youtube.com/results?search_query=glsl+max+constants+hindi,https://youtube.com/results?search_query=glsl+max+constants+kannada,https://youtube.com/results?search_query=glsl+max+constants+tamil,https://youtube.com/results?search_query=glsl+max+constants+telugu
