skill,level,question_text,option_a,option_b,option_c,option_d,correct_answer,explanation,topic,mdn_link,youtube_english,youtube_hindi,youtube_kannada,youtube_tamil,youtube_telugu
GLSL,Intermediate,How do you implement Phong lighting model in GLSL?,Lighting models,Phong shading,Surface illumination,Realistic lighting,A,"Calculate ambient + diffuse + specular components using light position, surface normal, and viewer direction.",Lighting,https://learnopengl.com/Lighting/Basic-Lighting,https://youtube.com/results?search_query=glsl+phong+lighting,https://youtube.com/results?search_query=glsl+phong+lighting+hindi,https://youtube.com/results?search_query=glsl+phong+lighting+kannada,https://youtube.com/results?search_query=glsl+phong+lighting+tamil,https://youtube.com/results?search_query=glsl+phong+lighting+telugu
GLSL,Intermediate,What's the purpose of the gl_FragCoord variable in fragment shaders?,Fragment position,Screen coordinates,Pixel location,Rendering context,A,"gl_FragCoord contains window-relative coordinates (x,y) and depth of current fragment for screen-space effects.",Built-in Variables,https://www.khronos.org/registry/OpenGL-Refpages/gl4/html/gl_FragCoord.xhtml,https://youtube.com/results?search_query=glsl+gl_FragCoord,https://youtube.com/results?search_query=glsl+gl_FragCoord+hindi,https://youtube.com/results?search_query=glsl+gl_FragCoord+kannada,https://youtube.com/results?search_query=glsl+gl_FragCoord+tamil,https://youtube.com/results?search_query=glsl+gl_FragCoord+telugu
GLSL,Intermediate,How do you implement normal mapping in GLSL?,Surface detail,Normal perturbation,Texture-based normals,Bump mapping,A,"Sample normal from texture, transform from tangent to world space, use for lighting calculations.",Texturing,https://learnopengl.com/Advanced-Lighting/Normal-Mapping,https://youtube.com/results?search_query=glsl+normal+mapping,https://youtube.com/results?search_query=glsl+normal+mapping+hindi,https://youtube.com/results?search_query=glsl+normal+mapping+kannada,https://youtube.com/results?search_query=glsl+normal+mapping+tamil,https://youtube.com/results?search_query=glsl+normal+mapping+telugu
GLSL,Intermediate,What's the difference between discard and return in fragment shaders?,Fragment rejection,Early termination,Pixel elimination,Shader flow,A,discard completely discards fragment (no writing); return exits function but fragment may still be written.,Fragment Control,https://www.khronos.org/opengl/wiki/Fragment_Shader#Special_operations,https://youtube.com/results?search_query=glsl+discard+return,https://youtube.com/results?search_query=glsl+discard+return+hindi,https://youtube.com/results?search_query=glsl+discard+return+kannada,https://youtube.com/results?search_query=glsl+discard+return+tamil,https://youtube.com/results?search_query=glsl+discard+return+telugu
GLSL,Intermediate,How do you implement environment mapping/cubemap reflection?,Reflections,Cubemap sampling,Environment capture,Realistic materials,A,Sample cubemap texture using reflection vector calculated from surface normal and view direction.,Cubemaps,https://learnopengl.com/Advanced-OpenGL/Cubemaps,https://youtube.com/results?search_query=glsl+environment+mapping,https://youtube.com/results?search_query=glsl+environment+mapping+hindi,https://youtube.com/results?search_query=glsl+environment+mapping+kannada,https://youtube.com/results?search_query=glsl+environment+mapping+tamil,https://youtube.com/results?search_query=glsl+environment+mapping+telugu
GLSL,Intermediate,What's the purpose of the gl_Position variable in vertex shaders?,Vertex transformation,Clip space output,Projection result,GPU output,A,gl_Position must be written with clip-space position for vertex; used by fixed-function rasterization.,Vertex Output,https://www.khronos.org/registry/OpenGL-Refpages/gl4/html/gl_Position.xhtml,https://youtube.com/results?search_query=glsl+gl_Position,https://youtube.com/results?search_query=glsl+gl_Position+hindi,https://youtube.com/results?search_query=glsl+gl_Position+kannada,https://youtube.com/results?search_query=glsl+gl_Position+tamil,https://youtube.com/results?search_query=glsl+gl_Position+telugu
GLSL,Intermediate,How do you implement shadow mapping in GLSL?,Shadows,Depth testing,Light perspective,Shadow calculation,A,"Render depth from light's view, compare fragment depth to shadow map depth with bias to avoid shadow acne.",Shadows,https://learnopengl.com/Advanced-Lighting/Shadows/Shadow-Mapping,https://youtube.com/results?search_query=glsl+shadow+mapping,https://youtube.com/results?search_query=glsl+shadow+mapping+hindi,https://youtube.com/results?search_query=glsl+shadow+mapping+kannada,https://youtube.com/results?search_query=glsl+shadow+mapping+tamil,https://youtube.com/results?search_query=glsl+shadow+mapping+telugu
GLSL,Intermediate,What's the difference between smooth, flat, and noperspective interpolation qualifiers?,Varying interpolation,Rasterization behavior,Perspective correction,"Fragment input,A,smooth: perspective-correct, flat: no interpolation, noperspective: linear without perspective correction.",Interpolation,https://www.khronos.org/opengl/wiki/Type_Qualifier_(GLSL)#Interpolation_qualifiers,https://youtube.com/results?search_query=glsl+interpolation+qualifiers,https://youtube.com/results?search_query=glsl+interpolation+qualifiers+hindi,https://youtube.com/results?search_query=glsl+interpolation+qualifiers+kannada,https://youtube.com/results?search_query=glsl+interpolation+qualifiers+tamil,https://youtube.com/results?search_query=glsl+interpolation+qualifiers+telugu
GLSL,Intermediate,How do you implement Gaussian blur in GLSL?,Image processing,Blur effects,Convolution filters,Post-processing,A,Apply two-pass separable Gaussian blur using weight samples from normal distribution in both directions.,Post-processing,https://learnopengl.com/Advanced-OpenGL/Framebuffers,https://youtube.com/results?search_query=glsl+gaussian+blur,https://youtube.com/results?search_query=glsl+gaussian+blur+hindi,https://youtube.com/results?search_query=glsl+gaussian+blur+kannada,https://youtube.com/results?search_query=glsl+gaussian+blur+tamil,https://youtube.com/results?search_query=glsl+gaussian+blur+telugu
GLSL,Intermediate,What's the purpose of the gl_FragDepth variable in fragment shaders?,Depth override,Custom depth,Depth manipulation,Z-buffer control,A,gl_FragDepth allows writing custom depth value instead of interpolated depth; enables advanced depth effects.,Depth Buffer,https://www.khronos.org/registry/OpenGL-Refpages/gl4/html/gl_FragDepth.xhtml,https://youtube.com/results?search_query=glsl+gl_FragDepth,https://youtube.com/results?search_query=glsl+gl_FragDepth+hindi,https://youtube.com/results?search_query=glsl+gl_FragDepth+kannada,https://youtube.com/results?search_query=glsl+gl_FragDepth+tamil,https://youtube.com/results?search_query=glsl+gl_FragDepth+telugu
GLSL,Intermediate,How do you implement screen-space ambient occlusion (SSAO)?,Ambient occlusion,Screen-space effects,Contact shadows,Global illumination,A,"Sample depth buffer around fragment, compare depths to estimate occlusion, blur results for smooth occlusion.",Screen-space Effects,https://learnopengl.com/Advanced-Lighting/SSAO,https://youtube.com/results?search_query=glsl+ssao,https://youtube.com/results?search_query=glsl+ssao+hindi,https://youtube.com/results?search_query=glsl+ssao+kannada,https://youtube.com/results?search_query=glsl+ssao+tamil,https://youtube.com/results?search_query=glsl+ssao+telugu
GLSL,Intermediate,What's the difference between texture() and texelFetch() functions?,Texture sampling,Coordinate types,Direct access,Filtered sampling,A,texture() uses normalized coordinates with filtering; texelFetch() uses integer coordinates without filtering.,Texture Functions,https://www.khronos.org/registry/OpenGL-Refpages/gl4/html/texture.xhtml,https://youtube.com/results?search_query=glsl+texture+texelfetch,https://youtube.com/results?search_query=glsl+texture+texelfetch+hindi,https://youtube.com/results?search_query=glsl+texture+texelfetch+kannada,https://youtube.com/results?search_query=glsl+texture+texelfetch+tamil,https://youtube.com/results?search_query=glsl+texture+texelfetch+telugu
GLSL,Intermediate,How do you implement parallax occlusion mapping?,Height mapping,Parallax effects,Surface displacement,Depth illusion,A,Ray march through height field using view direction to find intersection point for texture coordinate offset.,Parallax Mapping,https://learnopengl.com/Advanced-Lighting/Parallax-Mapping,https://youtube.com/results?search_query=glsl+parallax+occlusion,https://youtube.com/results?search_query=glsl+parallax+occlusion+hindi,https://youtube.com/results?search_query=glsl+parallax+occlusion+kannada,https://youtube.com/results?search_query=glsl+parallax+occlusion+tamil,https://youtube.com/results?search_query=glsl+parallax+occlusion+telugu
GLSL,Intermediate,What's the purpose of the gl_VertexID variable in vertex shaders?,Vertex identification,Index access,Draw call context,Array indexing,A,"gl_VertexID provides integer index of current vertex being processed, useful for procedural geometry.",Built-in Variables,https://www.khronos.org/registry/OpenGL-Refpages/gl4/html/gl_VertexID.xhtml,https://youtube.com/results?search_query=glsl+gl_VertexID,https://youtube.com/results?search_query=glsl+gl_VertexID+hindi,https://youtube.com/results?search_query=glsl+gl_VertexID+kannada,https://youtube.com/results?search_query=glsl+gl_VertexID+tamil,https://youtube.com/results?search_query=glsl+gl_VertexID+telugu
GLSL,Intermediate,How do you implement bloom effect in GLSL?,Glow effects,HDR rendering,Brightness extraction,Post-processing,A,"Extract bright areas, blur with Gaussian filter, combine with original image using additive blending.",Bloom,https://learnopengl.com/Advanced-Lighting/Bloom,https://youtube.com/results?search_query=glsl+bloom+effect,https://youtube.com/results?search_query=glsl+bloom+effect+hindi,https://youtube.com/results?search_query=glsl+bloom+effect+kannada,https://youtube.com/results?search_query=glsl+bloom+effect+tamil,https://youtube.com/results?search_query=glsl+bloom+effect+telugu
GLSL,Intermediate,What's the difference between mat2, mat2x2, and mat2x3 matrix types?,Matrix dimensions,Data layout,Memory organization,"Type specification,A,mat2 = mat2x2 (2x2), mat2x3 is 2-column, 3-row matrix - different dimensions for different transformations.",Data Types,https://www.khronos.org/opengl/wiki/Data_Type_(GLSL)#Matrices,https://youtube.com/results?search_query=glsl+matrix+types,https://youtube.com/results?search_query=glsl+matrix+types+hindi,https://youtube.com/results?search_query=glsl+matrix+types+kannada,https://youtube.com/results?search_query=glsl+matrix+types+tamil,https://youtube.com/results?search_query=glsl+matrix+types+telugu
GLSL,Intermediate,How do you implement cel/toon shading in GLSL?,Non-photorealistic,Toon rendering,Posterization,Stylized lighting,A,"Quantize lighting intensity into bands, add dark outlines using edge detection or normal-based techniques.",Stylized Rendering,https://learnopengl.com/Advanced-OpenGL/Cel-Shading,https://youtube.com/results?search_query=glsl+cel+shading,https://youtube.com/results?search_query=glsl+cel+shading+hindi,https://youtube.com/results?search_query=glsl+cel+shading+kannada,https://youtube.com/results?search_query=glsl+cel+shading+tamil,https://youtube.com/results?search_query=glsl+cel+shading+telugu
GLSL,Intermediate,What's the purpose of the gl_InstanceID variable in vertex shaders?,Instancing identification,Draw instance index,Batch rendering,GPU instancing,A,gl_InstanceID provides index of current instance in instanced draw calls for per-instance data.,Instancing,https://www.khronos.org/registry/OpenGL-Refpages/gl4/html/gl_InstanceID.xhtml,https://youtube.com/results?search_query=glsl+gl_InstanceID,https://youtube.com/results?search_query=glsl+gl_InstanceID+hindi,https://youtube.com/results?search_query=glsl+gl_InstanceID+kannada,https://youtube.com/results?search_query=glsl+gl_InstanceID+tamil,https://youtube.com/results?search_query=glsl+gl_InstanceID+telugu
GLSL,Intermediate,How do you implement motion blur in GLSL?,Temporal effects,Motion vectors,Blur direction,Animation smoothing,A,"Use velocity buffer to determine blur direction/speed, accumulate samples along motion vector.",Motion Blur,https://developer.nvidia.com/gpugems/gpugems3/part-iv-image-effects/chapter-27-motion-blur-post-processing-effect,https://youtube.com/results?search_query=glsl+motion+blur,https://youtube.com/results?search_query=glsl+motion+blur+hindi,https://youtube.com/results?search_query=glsl+motion+blur+kannada,https://youtube.com/results?search_query=glsl+motion+blur+tamil,https://youtube.com/results?search_query=glsl+motion+blur+telugu
GLSL,Intermediate,What's the difference between sampler2D and sampler2DShadow?,Texture sampler types,Depth comparison,Shadow sampling,Specialized sampling,A,sampler2D for regular textures; sampler2DShadow for depth textures with comparison (shadow maps).,Sampler Types,https://www.khronos.org/opengl/wiki/Sampler_(GLSL),https://youtube.com/results?search_query=glsl+sampler2d+shadow,https://youtube.com/results?search_query=glsl+sampler2d+shadow+hindi,https://youtube.com/results?search_query=glsl+sampler2d+shadow+kannada,https://youtube.com/results?search_query=glsl+sampler2d+shadow+tamil,https://youtube.com/results?search_query=glsl+sampler2d+shadow+telugu
GLSL,Intermediate,How do you implement depth of field in GLSL?,Focus effects,Lens simulation,Depth-based blur,Photographic effects,A,"Calculate circle of confusion based on depth, apply blur proportional to CoC size using Gaussian kernel.",Depth of Field,https://learnopengl.com/Advanced-OpenGL/Depth-testing,https://youtube.com/results?search_query=glsl+depth+of+field,https://youtube.com/results?search_query=glsl+depth+of+field+hindi,https://youtube.com/results?search_query=glsl+depth+of+field+kannada,https://youtube.com/results?search_query=glsl+depth+of+field+tamil,https://youtube.com/results?search_query=glsl+depth+of+field+telugu
GLSL,Intermediate,What's the purpose of the gl_PointSize variable in vertex shaders?,Point sprite sizing,Point rendering,Particle size,Primitive size,A,gl_PointSize sets size of point primitive in pixels for point sprites or particle systems.,Point Rendering,https://www.khronos.org/registry/OpenGL-Refpages/gl4/html/gl_PointSize.xhtml,https://youtube.com/results?search_query=glsl+gl_PointSize,https://youtube.com/results?search_query=glsl+gl_PointSize+hindi,https://youtube.com/results?search_query=glsl+gl_PointSize+kannada,https://youtube.com/results?search_query=glsl+gl_PointSize+tamil,https://youtube.com/results?search_query=glsl+gl_PointSize+telugu
GLSL,Intermediate,How do you implement refraction in GLSL?,Transparency effects,Light bending,Refractive materials,Glass simulation,A,"Calculate refraction vector using Snell's law, sample environment/cubemap with refracted direction.",Refraction,https://learnopengl.com/Advanced-OpenGL/Cubemaps,https://youtube.com/results?search_query=glsl+refraction,https://youtube.com/results?search_query=glsl+refraction+hindi,https://youtube.com/results?search_query=glsl+refraction+kannada,https://youtube.com/results?search_query=glsl+refraction+tamil,https://youtube.com/results?search_query=glsl+refraction+telugu
GLSL,Intermediate,What's the difference between mix() and smoothstep() functions?,Interpolation functions,Blending,Easing curves,Value smoothing,A,mix() linear interpolation; smoothstep() hermite interpolation with smooth edges - different easing functions.,Built-in Functions,https://www.khronos.org/registry/OpenGL-Refpages/gl4/html/mix.xhtml,https://youtube.com/results?search_query=glsl+mix+smoothstep,https://youtube.com/results?search_query=glsl+mix+smoothstep+hindi,https://youtube.com/results?search_query=glsl+mix+smoothstep+kannada,https://youtube.com/results?search_query=glsl+mix+smoothstep+tamil,https://youtube.com/results?search_query=glsl+mix+smoothstep+telugu
GLSL,Intermediate,How do you implement volumetric lighting/light shafts?,God rays,Volumetric effects,Atmospheric scattering,Light volume,A,"Ray march through light volume, accumulate scattering based on density and shadowing from light source.",Volumetric Effects,https://developer.nvidia.com/gpugems/gpugems3/part-ii-light-and-shadows/chapter-13-volumetric-light-scattering-post-process,https://youtube.com/results?search_query=glsl+volumetric+lighting,https://youtube.com/results?search_query=glsl+volumetric+lighting+hindi,https://youtube.com/results?search_query=glsl+volumetric+lighting+kannada,https://youtube.com/results?search_query=glsl+volumetric+lighting+tamil,https://youtube.com/results?search_query=glsl+volumetric+lighting+telugu
GLSL,Intermediate,What's the purpose of the gl_FrontFacing variable in fragment shaders?,Face orientation,Backface detection,Culling information,Geometry direction,A,"gl_FrontFacing indicates whether fragment is from front-facing primitive, useful for two-sided materials.",Face Culling,https://www.khronos.org/registry/OpenGL-Refpages/gl4/html/gl_FrontFacing.xhtml,https://youtube.com/results?search_query=glsl+gl_FrontFacing,https://youtube.com/results?search_query=glsl+gl_FrontFacing+hindi,https://youtube.com/results?search_query=glsl+gl_FrontFacing+kannada,https://youtube.com/results?search_query=glsl+gl_FrontFacing+tamil,https://youtube.com/results?search_query=glsl+gl_FrontFacing+telugu
GLSL,Intermediate,How do you implement screen-space reflections?,Reflections,Screen-space ray tracing,Real-time mirrors,Planar reflections,A,"Ray march in screen space using depth buffer, find intersection point, sample color at hit position.",Screen-space Effects,https://learnopengl.com/Advanced-Lighting/SSAO,https://youtube.com/results?search_query=glsl+screen+space+reflections,https://youtube.com/results?search_query=glsl+screen+space+reflections+hindi,https://youtube.com/results?search_query=glsl+screen+space+reflections+kannada,https://youtube.com/results?search_query=glsl+screen+space+reflections+tamil,https://youtube.com/results?search_query=glsl+screen+space+reflections+telugu
GLSL,Intermediate,What's the difference between dFdx() and fwidth() functions?,Derivative functions,Gradient estimation,Texture LOD,Mipmap calculation,A,dFdx() gives derivative in x; fwidth() = abs(dFdx()) + abs(dFdy()) for mipmap level selection.,Derivatives,https://www.khronos.org/registry/OpenGL-Refpages/gl4/html/dFdx.xhtml,https://youtube.com/results?search_query=glsl+dfdx+fwidth,https://youtube.com/results?search_query=glsl+dfdx+fwidth+hindi,https://youtube.com/results?search_query=glsl+dfdx+fwidth+kannada,https://youtube.com/results?search_query=glsl+dfdx+fwidth+tamil,https://youtube.com/results?search_query=glsl+dfdx+fwidth+telugu
GLSL,Intermediate,How do you implement tessellation shaders in GLSL?,Tessellation,Dynamic LOD,Geometry subdivision,Adaptive meshing,A,Use tessellation control (patch) and evaluation shaders to subdivide primitives based on distance/criteria.,Tessellation,https://learnopengl.com/Advanced-OpenGL/Tessellation,https://youtube.com/results?search_query=glsl+tessellation+shaders,https://youtube.com/results?search_query=glsl+tessellation+shaders+hindi,https://youtube.com/results?search_query=glsl+tessellation+shaders+kannada,https://youtube.com/results?search_query=glsl+tessellation+shaders+tamil,https://youtube.com/results?search_query=glsl+tessellation+shaders+telugu
GLSL,Intermediate,What's the purpose of the gl_TessLevelInner/Outer variables?,Tessellation levels,Patch subdivision,Edge tessellation,Primitive density,A,Set inner/outer tessellation levels in tessellation control shader to control subdivision factors.,Tessellation,https://www.khronos.org/opengl/wiki/Tessellation,https://youtube.com/results?search_query=glsl+tessellation+levels,https://youtube.com/results?search_query=glsl+tessellation+levels+hindi,https://youtube.com/results?search_query=glsl+tessellation+levels+kannada,https://youtube.com/results?search_query=glsl+tessellation+levels+tamil,https://youtube.com/results?search_query=glsl+tessellation+levels+telugu
GLSL,Intermediate,How do you implement geometry shaders in GLSL?,Geometry processing,Primitive generation,Mesh manipulation,Shader stages,A,"Geometry shader takes primitives, can emit new vertices/primitives for effects like fur, explosions.",Geometry Shaders,https://learnopengl.com/Advanced-OpenGL/Geometry-Shader,https://youtube.com/results?search_query=glsl+geometry+shader,https://youtube.com/results?search_query=glsl+geometry+shader+hindi,https://youtube.com/results?search_query=glsl+geometry+shader+kannada,https://youtube.com/results?search_query=glsl+geometry+shader+tamil,https://youtube.com/results?search_query=glsl+geometry+shader+telugu
GLSL,Intermediate,What's the difference between inverse() and transpose() matrix operations?,Matrix manipulation,Linear algebra,Inverse calculation,Transposition,A,inverse() computes matrix inverse; transpose() swaps rows and columns - different matrix operations.,Matrix Functions,https://www.khronos.org/registry/OpenGL-Refpages/gl4/html/inverse.xhtml,https://youtube.com/results?search_query=glsl+inverse+transpose,https://youtube.com/results?search_query=glsl+inverse+transpose+hindi,https://youtube.com/results?search_query=glsl+inverse+transpose+kannada,https://youtube.com/results?search_query=glsl+inverse+transpose+tamil,https://youtube.com/results?search_query=glsl+inverse+transpose+telugu
GLSL,Intermediate,How do you implement particle systems in GLSL?,Particles,GPU simulation,Point sprites,Animation,A,"Use vertex shader with point size, update positions in compute shader or transform feedback, apply billboarding.",Particle Systems,https://learnopengl.com/In-Practice/2D-Game/Rendering-Particles,https://youtube.com/results?search_query=glsl+particle+system,https://youtube.com/results?search_query=glsl+particle+system+hindi,https://youtube.com/results?search_query=glsl+particle+system+kannada,https://youtube.com/results?search_query=glsl+particle+system+tamil,https://youtube.com/results?search_query=glsl+particle+system+telugu
GLSL,Intermediate,What's the purpose of the gl_Layer variable in geometry shaders?,Layer selection,Layered rendering,Cubemap faces,Array textures,A,"gl_Layer selects which layer of layered framebuffer (array texture, cubemap face) to render to.",Layered Rendering,https://www.khronos.org/opengl/wiki/Geometry_Shader#Layered_rendering,https://youtube.com/results?search_query=glsl+gl_Layer,https://youtube.com/results?search_query=glsl+gl_Layer+hindi,https://youtube.com/results?search_query=glsl+gl_Layer+kannada,https://youtube.com/results?search_query=glsl+gl_Layer+tamil,https://youtube.com/results?search_query=glsl+gl_Layer+telugu
GLSL,Intermediate,How do you implement compute shaders in GLSL?,General purpose,GPU computing,Parallel processing,Data manipulation,A,"Define work groups, use shared memory, synchronize with barrier(), process large data sets in parallel.",Compute Shaders,https://learnopengl.com/Guest-Articles/2022/Compute-Shaders/Introduction,https://youtube.com/results?search_query=glsl+compute+shaders,https://youtube.com/results?search_query=glsl+compute+shaders+hindi,https://youtube.com/results?search_query=glsl+compute+shaders+kannada,https://youtube.com/results?search_query=glsl+compute+shaders+tamil,https://youtube.com/results?search_query=glsl+compute+shaders+telugu
GLSL,Intermediate,What's the difference between clamp() and saturate() functions?,Value limiting,Range restriction,Color clamping,Saturation,A,"clamp() limits to min/max range; saturate() = clamp(x, 0.0, 1.0) specifically for 0-1 range.",Built-in Functions,https://www.khronos.org/registry/OpenGL-Refpages/gl4/html/clamp.xhtml,https://youtube.com/results?search_query=glsl+clamp+saturate,https://youtube.com/results?search_query=glsl+clamp+saturate+hindi,https://youtube.com/results?search_query=glsl+clamp+saturate+kannada,https://youtube.com/results?search_query=glsl+clamp+saturate+tamil,https://youtube.com/results?search_query=glsl+clamp+saturate+telugu
GLSL,Intermediate,How do you implement fur rendering in GLSL?,Fur simulation,Shell rendering,Layer rendering,Volumetric fur,A,"Use geometry shader or multiple passes with shell textures, apply noise for randomness, alpha test.",Fur Rendering,https://developer.nvidia.com/gpugems/gpugems3/part-iii-rendering/chapter-16-virtual-fur-rendering,https://youtube.com/results?search_query=glsl+fur+rendering,https://youtube.com/results?search_query=glsl+fur+rendering+hindi,https://youtube.com/results?search_query=glsl+fur+rendering+kannada,https://youtube.com/results?search_query=glsl+fur+rendering+tamil,https://youtube.com/results?search_query=glsl+fur+rendering+telugu
GLSL,Intermediate,What's the purpose of the gl_WorkGroupSize variable in compute shaders?,Work group dimensions,Compute dispatch,Thread organization,Parallel layout,A,gl_WorkGroupSize defines dimensions of work group for compute shader execution (layout local_size).,Compute Shaders,https://www.khronos.org/opengl/wiki/Compute_Shader#Local_size,https://youtube.com/results?search_query=glsl+workgroup+size,https://youtube.com/results?search_query=glsl+workgroup+size+hindi,https://youtube.com/results?search_query=glsl+workgroup+size+kannada,https://youtube.com/results?search_query=glsl+workgroup+size+tamil,https://youtube.com/results?search_query=glsl+workgroup+size+telugu
