skill,level,question_text,option_a,option_b,option_c,option_d,correct_answer,explanation,topic,mdn_link,youtube_english,youtube_hindi,youtube_kannada,youtube_tamil,youtube_telugu
React.js,Advanced,How to implement React with CSS-in-JS libraries (styled-components, Emotion)?,Styling,CSS-in-JS,Dynamic,styled-components and Emotion allow writing CSS in JavaScript with dynamic props, theming, and component-scoped styles. Use ThemeProvider for global themes.,https://styled-components.com/,https://youtube.com/results?search_query=react+styled+components+advanced,https://youtube.com/results?search_query=react+styled+components+advanced+hindi,https://youtube.com/results?search_query=react+styled+components+advanced+kannada,https://youtube.com/results?search_query=react+styled+components+advanced+tamil,https://youtube.com/results?search_query=react+styled+components+advanced+telugu
React.js,Advanced,What are React's patterns for handling permissions and roles?,Security,Permissions,RBAC,Patterns: higher-order components (withPermissions), custom hooks (usePermission)," context providers, route guards", and component-level permission checks with conditional rendering.,https://react.dev/learn/conditional-rendering,https://youtube.com/results?search_query=react+permissions+roles+patterns,https://youtube.com/results?search_query=react+permissions+roles+patterns+hindi,https://youtube.com/results?search_query=react+permissions+roles+patterns+kannada,https://youtube.com/results?search_query=react+permissions+roles+patterns+tamil,https://youtube.com/results?search_query=react+permissions+roles+patterns+telugu
React.js,Advanced,How to implement React with WebSockets for real-time updates?,Real-time,WebSockets,Bi-directional,Use native WebSocket or socket.io-client. Manage connection in custom hook, handle reconnection, broadcast updates via context, and clean up on unmount.,https://react.dev/reference/react/useEffect,https://youtube.com/results?search_query=react+websockets+real+time,https://youtube.com/results?search_query=react+websockets+real+time+hindi,https://youtube.com/results?search_query=react+websockets+real+time+kannada,https://youtube.com/results?search_query=react+websockets+real+time+tamil,https://youtube.com/results?search_query=react+websockets+real+time+telugu
React.js,Advanced,How to implement React with Zustand middleware?,State Management,Zustand,Middleware,Zustand supports middleware: devtools for Redux DevTools, persist for localStorage, immer for mutable updates, subscribe for state changes. Chain middleware in create().,https://docs.pmnd.rs/zustand/guides/middleware,https://youtube.com/results?search_query=zustand+middleware+react,https://youtube.com/results?search_query=zustand+middleware+react+hindi,https://youtube.com/results?search_query=zustand+middleware+react+kannada,https://youtube.com/results?search_query=zustand+middleware+react+tamil,https://youtube.com/results?search_query=zustand+middleware+react+telugu
React.js,Advanced,What are React's patterns for handling API errors globally?,Error Handling,API Errors,Global,Patterns: axios interceptors, error boundary for rendering errors," context for error state, custom hook with retry logic", and notification system for user feedback.,https://react.dev/reference/react/Component#catching-rendering-errors-with-an-error-boundary,https://youtube.com/results?search_query=react+api+error+handling,https://youtube.com/results?search_query=react+api+error+handling+hindi,https://youtube.com/results?search_query=react+api+error+handling+kannada,https://youtube.com/results?search_query=react+api+error+handling+tamil,https://youtube.com/results?search_query=react+api+error+handling+telugu
React.js,Advanced,What are React's patterns for handling side effects in custom hooks?,Custom Hooks,Side Effects,Cleanup,Patterns: useEffect inside hook with cleanup, dependency array management," abort controller for fetch, event listener cleanup", and returning cleanup function from hook.,https://react.dev/reference/react/useEffect,https://youtube.com/results?search_query=react+custom+hooks+side+effects,https://youtube.com/results?search_query=react+custom+hooks+side+effects+hindi,https://youtube.com/results?search_query=react+custom+hooks+side+effects+kannada,https://youtube.com/results?search_query=react+custom+hooks+side+effects+tamil,https://youtube.com/results?search_query=react+custom+hooks+side+effects+telugu
React.js,Advanced,How to implement React with Next.js App Router?,Next.js,App Router,Layouts,App Router uses file-system routing with layouts, loading states," error handling, and server components. Use page.tsx, layout.tsx, loading.tsx", error.tsx files.,https://nextjs.org/docs/app,https://youtube.com/results?search_query=nextjs+app+router+react,https://youtube.com/results?search_query=nextjs+app+router+react+hindi,https://youtube.com/results?search_query=nextjs+app+router+react+kannada,https://youtube.com/results?search_query=nextjs+app+router+react+tamil,https://youtube.com/results?search_query=nextjs+app+router+react+telugu
React.js,Advanced,How to implement React with React Table for complex tables?,Tables,React Table,Headless,React Table is headless UI hook for building tables. Provides sorting, filtering," pagination, virtualization. You control rendering", it provides state and callbacks.,https://tanstack.com/table/latest,https://youtube.com/results?search_query=react+table+advanced,https://youtube.com/results?search_query=react+table+advanced+hindi,https://youtube.com/results?search_query=react+table+advanced+kannada,https://youtube.com/results?search_query=react+table+advanced+tamil,https://youtube.com/results?search_query=react+table+advanced+telugu
React.js,Advanced,What are React's patterns for handling theme switching?,Styling,Themes,Dark Mode,Patterns: Context API with theme provider, CSS variables with useEffect to update, styled-components ThemeProvider, or use localStorage with system preference detection.,https://react.dev/reference/react/useContext,https://youtube.com/results?search_query=react+theme+switching+patterns,https://youtube.com/results?search_query=react+theme+switching+patterns+hindi,https://youtube.com/results?search_query=react+theme+switching+patterns+kannada,https://youtube.com/results?search_query=react+theme+switching+patterns+tamil,https://youtube.com/results?search_query=react+theme+switching+patterns+telugu
React.js,Advanced,How to implement React with React Virtualized for windowing?,Performance,Virtualization,Windowing,React Virtualized provides List, Grid, Table components that render only visible items. Use for large datasets, with estimated row heights and dynamic sizing.,https://github.com/bvaughn/react-virtualized,https://youtube.com/results?search_query=react+virtualized+windowing,https://youtube.com/results?search_query=react+virtualized+windowing+hindi,https://youtube.com/results?search_query=react+virtualized+windowing+kannada,https://youtube.com/results?search_query=react+virtualized+windowing+tamil,https://youtube.com/results?search_query=react+virtualized+windowing+telugu
React.js,Advanced,What are React's patterns for handling loading states?,UX,Loading States,Skeletons,Patterns: conditional rendering with boolean flags, Suspense with fallback," skeletons (placeholder content), optimistic UI", and loading states per component section.,https://react.dev/reference/react/Suspense,https://youtube.com/results?search_query=react+loading+states+patterns,https://youtube.com/results?search_query=react+loading+states+patterns+hindi,https://youtube.com/results?search_query=react+loading+states+patterns+kannada,https://youtube.com/results?search_query=react+loading+states+patterns+tamil,https://youtube.com/results?search_query=react+loading+states+patterns+telugu
React.js,Advanced,How to implement React with React Beautiful DnD for lists?,Drag and Drop,Beautiful DnD,Lists,React Beautiful DnD provides <DragDropContext>, <Droppable>," <Draggable> for beautiful list reordering. Handles animations, accessibility", and touch devices.,https://github.com/atlassian/react-beautiful-dnd,https://youtube.com/results?search_query=react+beautiful+dnd,https://youtube.com/results?search_query=react+beautiful+dnd+hindi,https://youtube.com/results?search_query=react+beautiful+dnd+kannada,https://youtube.com/results?search_query=react+beautiful+dnd+tamil,https://youtube.com/results?search_query=react+beautiful+dnd+telugu
React.js,Advanced,How to implement React with React Select for advanced selects?,Forms,React Select,Advanced,React Select provides customizable select component with async loading, multi-select," creatable options, theming", and accessibility. Use with Formik or React Hook Form.,https://react-select.com/,https://youtube.com/results?search_query=react+select+advanced,https://youtube.com/results?search_query=react+select+advanced+hindi,https://youtube.com/results?search_query=react+select+advanced+kannada,https://youtube.com/results?search_query=react+select+advanced+tamil,https://youtube.com/results?search_query=react+select+advanced+telugu
React.js,Advanced,What are React's patterns for handling file uploads?,Forms,File Uploads,Progress,Patterns: input type="file" with FormData, drag and drop interface," chunked uploads for large files, progress indicators", and preview generation with FileReader.,https://react.dev/reference/react-dom/components/input#file-inputs,https://youtube.com/results?search_query=react+file+upload+patterns,https://youtube.com/results?search_query=react+file+upload+patterns+hindi,https://youtube.com/results?search_query=react+file+upload+patterns+kannada,https://youtube.com/results?search_query=react+file+upload+patterns+tamil,https://youtube.com/results?search_query=react+file+upload+patterns+telugu
React.js,Advanced,How to implement React with React ChartJS for data visualization?,Data Visualization,ChartJS,Graphs,React ChartJS 2 provides React components for Chart.js. Configure options, data," plugins. Use for line, bar", pie charts with interactivity and animations.,https://react-chartjs-2.js.org/,https://youtube.com/results?search_query=react+chartjs+data+visualization,https://youtube.com/results?search_query=react+chartjs+data+visualization+hindi,https://youtube.com/results?search_query=react+chartjs+data+visualization+kannada,https://youtube.com/results?search_query=react+chartjs+data+visualization+tamil,https://youtube.com/results?search_query=react+chartjs+data+visualization+telugu
React.js,Advanced,How to implement React with React PDF for PDF generation?,Advanced Features,PDF Generation,Reports,React PDF renders PDF documents in React. Use <Document>, <Page>, <Text>, <View> components. Can generate PDFs on server or client.,https://react-pdf.org/,https://youtube.com/results?search_query=react+pdf+generation,https://youtube.com/results?search_query=react+pdf+generation+hindi,https://youtube.com/results?search_query=react+pdf+generation+kannada,https://youtube.com/results?search_query=react+pdf+generation+tamil,https://youtube.com/results?search_query=react+pdf+generation+telugu
React.js,Advanced,What are React's patterns for handling real-time collaboration?,Real-time,Collaboration,Conflict Resolution,Patterns: WebSocket connections, Operational Transformation (OT)," Conflict-free Replicated Data Types (CRDTs), presence indicators", and undo/redo with command pattern.,https://react.dev/reference/react/useEffect,https://youtube.com/results?search_query=react+real+time+collaboration,https://youtube.com/results?search_query=react+real+time+collaboration+hindi,https://youtube.com/results?search_query=react+real+time+collaboration+kannada,https://youtube.com/results?search_query=react+real+time+collaboration+tamil,https://youtube.com/results?search_query=react+real+time+collaboration+telugu
React.js,Advanced,How to implement React with React Map GL for maps?,Maps,React Map GL,Interactive,React Map GL provides React components for Mapbox GL JS. Use for interactive maps with markers, popups, layers, and geospatial visualizations.,https://visgl.github.io/react-map-gl/,https://youtube.com/results?search_query=react+mapbox+gl,https://youtube.com/results?search_query=react+mapbox+gl+hindi,https://youtube.com/results?search_query=react+mapbox+gl+kannada,https://youtube.com/results?search_query=react+mapbox+gl+tamil,https://youtube.com/results?search_query=react+mapbox+gl+telugu
React.js,Advanced,What are React's patterns for handling multi-step forms?,Forms,Multi-step,Wizard,Patterns: component per step with shared state via context, URL routing for steps," progress indicators, validation per step", and summary before submission.,https://react.dev/reference/react/useContext,https://youtube.com/results?search_query=react+multi+step+forms,https://youtube.com/results?search_query=react+multi+step+forms+hindi,https://youtube.com/results?search_query=react+multi+step+forms+kannada,https://youtube.com/results?search_query=react+multi+step+forms+tamil,https://youtube.com/results?search_query=react+multi+step+forms+telugu
React.js,Advanced,How to implement React with React Datepicker for date selection?,Forms,Datepicker,Calendar,React Datepicker provides customizable date picker component. Supports range selection, time selection, localization, and disabled dates.,https://reactdatepicker.com/,https://youtube.com/results?search_query=react+datepicker+advanced,https://youtube.com/results?search_query=react+datepicker+advanced+hindi,https://youtube.com/results?search_query=react+datepicker+advanced+kannada,https://youtube.com/results?search_query=react+datepicker+advanced+tamil,https://youtube.com/results?search_query=react+datepicker+advanced+telugu
React.js,Advanced,What are React's patterns for handling currency and number formatting?,Internationalization,Formatting,Numbers,Patterns: Intl.NumberFormat API, libraries like react-intl," custom hooks for formatting, context for locale", and handling currency conversion.,https://developer.mozilla.org/en-US/docs/Web/JavaScript/Reference/Global_Objects/Intl/NumberFormat,https://youtube.com/results?search_query=react+currency+formatting,https://youtube.com/results?search_query=react+currency+formatting+hindi,https://youtube.com/results?search_query=react+currency+formatting+kannada,https://youtube.com/results?search_query=react+currency+formatting+tamil,https://youtube.com/results?search_query=react+currency+formatting+telugu
React.js,Advanced,How to implement React with React Popper for tooltips and popovers?,UI Components,Popper,Positioning,React Popper provides positioning engine for tooltips, popovers," dropdowns. Handles overflow, flipping", and positioning relative to reference element.,https://popper.js.org/react-popper/,https://youtube.com/results?search_query=react+popper+tooltips,https://youtube.com/results?search_query=react+popper+tooltips+hindi,https://youtube.com/results?search_query=react+popper+tooltips+kannada,https://youtube.com/results?search_query=react+popper+tooltips+tamil,https://youtube.com/results?search_query=react+popper+tooltips+telugu
React.js,Advanced,What are React's patterns for handling offline-first applications?,PWA,Offline First,Caching,Patterns: Service Worker with Workbox, IndexedDB for local data," background sync, optimistic UI, conflict resolution strategies", and offline detection.,https://create-react-app.dev/docs/making-a-progressive-web-app/,https://youtube.com/results?search_query=react+offline+first+patterns,https://youtube.com/results?search_query=react+offline+first+patterns+hindi,https://youtube.com/results?search_query=react+offline+first+patterns+kannada,https://youtube.com/results?search_query=react+offline+first+patterns+tamil,https://youtube.com/results?search_query=react+offline+first+patterns+telugu