skill,level,question_text,option_a,option_b,option_c,option_d,correct_answer,explanation,topic,mdn_link,youtube_english,youtube_hindi,youtube_kannada,youtube_tamil,youtube_telugu
React.js,Advanced,What is the Context API and when should it replace Redux?,State Management,Context API,Redux,Context API provides a way to pass data through component tree without prop drilling. Replace Redux for simple global state needs, but Redux is better for complex state logic, middleware, and dev tools.,https://react.dev/reference/react/useContext,https://youtube.com/results?search_query=react+context+api+vs+redux,https://youtube.com/results?search_query=react+context+api+vs+redux+hindi,https://youtube.com/results?search_query=react+context+api+vs+redux+kannada,https://youtube.com/results?search_query=react+context+api+vs+redux+tamil,https://youtube.com/results?search_query=react+context+api+vs+redux+telugu
React.js,Advanced,What are React Portals and their use cases?,Advanced Features,Portals,DOM Manipulation,Portals render children into a DOM node outside parent hierarchy. Use cases: modals, tooltips, dropdowns, global notification systems that need to break out of container CSS.,https://react.dev/reference/react-dom/createPortal,https://youtube.com/results?search_query=react+portals+advanced,https://youtube.com/results?search_query=react+portals+advanced+hindi,https://youtube.com/results?search_query=react+portals+advanced+kannada,https://youtube.com/results?search_query=react+portals+advanced+tamil,https://youtube.com/results?search_query=react+portals+advanced+telugu
React.js,Advanced,What are Higher-Order Components (HOCs) and their limitations?,Patterns,HOCs,Composition,HOCs are functions that take a component and return enhanced component. Limitations: prop collisions, static composition (hard to debug), wrapper hell, and they don't work well with hooks.,https://legacy.reactjs.org/docs/higher-order-components.html,https://youtube.com/results?search_query=react+higher+order+components,https://youtube.com/results?search_query=react+higher+order+components+hindi,https://youtube.com/results?search_query=react+higher+order+components+kannada,https://youtube.com/results?search_query=react+higher+order+components+tamil,https://youtube.com/results?search_query=react+higher+order+components+telugu
React.js,Advanced,How to implement drag and drop in React?,Advanced Features,Drag and Drop,Interactivity,Use HTML5 Drag and Drop API with React events (onDragStart, onDragOver, onDrop), or libraries like react-dnd or react-beautiful-dnd for complex scenarios.,https://react.dev/reference/react-dom/components/common#dragevent-handler,https://youtube.com/results?search_query=react+drag+and+drop,https://youtube.com/results?search_query=react+drag+and+drop+hindi,https://youtube.com/results?search_query=react+drag+and+drop+kannada,https://youtube.com/results?search_query=react+drag+and+drop+tamil,https://youtube.com/results?search_query=react+drag+and+drop+telugu
React.js,Advanced,What is React Server Components and how do they differ?,Advanced Features,Server Components,Rendering,React Server Components render on server, send minimal JavaScript to client. They can directly access server-side data, reduce bundle size, and improve performance compared to traditional SSR.,https://react.dev/blog/2020/12/21/data-fetching-with-react-server-components,https://youtube.com/results?search_query=react+server+components,https://youtube.com/results?search_query=react+server+components+hindi,https://youtube.com/results?search_query=react+server+components+kannada,https://youtube.com/results?search_query=react+server+components+tamil,https://youtube.com/results?search_query=react+server+components+telugu
React.js,Advanced,How to implement authentication flow in React?,Security,Authentication,JWT,Use context/provider for auth state, intercept API calls with axios interceptors," store tokens securely (httpOnly cookies preferred), handle token refresh", and protect routes.,https://react.dev/learn/passing-data-deeply-with-context,https://youtube.com/results?search_query=react+authentication+flow,https://youtube.com/results?search_query=react+authentication+flow+hindi,https://youtube.com/results?search_query=react+authentication+flow+kannada,https://youtube.com/results?search_query=react+authentication+flow+tamil,https://youtube.com/results?search_query=react+authentication+flow+telugu
React.js,Advanced,How to implement React application with TypeScript?,Type Safety,TypeScript,Integration,Use create-react-app with TypeScript template, define props/interfaces, use generics for hooks (useState<Type>), and configure tsconfig.json for strict type checking.,https://create-react-app.dev/docs/adding-typescript/,https://youtube.com/results?search_query=react+typescript+advanced,https://youtube.com/results?search_query=react+typescript+advanced+hindi,https://youtube.com/results?search_query=react+typescript+advanced+kannada,https://youtube.com/results?search_query=react+typescript+advanced+tamil,https://youtube.com/results?search_query=react+typescript+advanced+telugu
React.js,Advanced,What are React's new features in version 18?,Advanced Features,React 18,Updates,React 18 features: Concurrent Mode (createRoot), Automatic Batching," Transitions (startTransition), Suspense for SSR, new hooks (useId, useTransition", useDeferredValue).,https://react.dev/blog/2022/03/29/react-v18,https://youtube.com/results?search_query=react+18+new+features,https://youtube.com/results?search_query=react+18+new+features+hindi,https://youtube.com/results?search_query=react+18+new+features+kannada,https://youtube.com/results?search_query=react+18+new+features+tamil,https://youtube.com/results?search_query=react+18+new+features+telugu
React.js,Advanced,How to implement React with GraphQL?,Data Fetching,GraphQL,Apollo,Use Apollo Client or Relay. Apollo provides useQuery, useMutation hooks, cache management, and optimistic UI. Relay is Facebook's official GraphQL client with compile-time optimizations.,https://www.apollographql.com/docs/react/,https://youtube.com/results?search_query=react+graphql+apollo,https://youtube.com/results?search_query=react+graphql+apollo+hindi,https://youtube.com/results?search_query=react+graphql+apollo+kannada,https://youtube.com/results?search_query=react+graphql+apollo+tamil,https://youtube.com/results?search_query=react+graphql+apollo+telugu
React.js,Advanced,How to implement custom hooks for API calls?,Custom Hooks,API,Data Fetching,Create custom hook using useState for data/loading/error, useEffect for fetching," with cleanup. Add parameters for URL, options", and dependency array for refetching.,https://react.dev/learn/reusing-logic-with-custom-hooks,https://youtube.com/results?search_query=react+custom+hooks+api,https://youtube.com/results?search_query=react+custom+hooks+api+hindi,https://youtube.com/results?search_query=react+custom+hooks+api+kannada,https://youtube.com/results?search_query=react+custom+hooks+api+tamil,https://youtube.com/results?search_query=react+custom+hooks+api+telugu
React.js,Advanced,What is the Children API in React and how to use it?,Advanced Features,Children API,Manipulation,React.Children provides utilities (map, forEach," count, toArray", only) for working with opaque this.props.children data structure. Useful for cloning children with additional props.,https://react.dev/reference/react/Children,https://youtube.com/results?search_query=react+children+api,https://youtube.com/results?search_query=react+children+api+hindi,https://youtube.com/results?search_query=react+children+api+kannada,https://youtube.com/results?search_query=react+children+api+tamil,https://youtube.com/results?search_query=react+children+api+telugu
React.js,Advanced,How to implement React with Redux Toolkit?,State Management,Redux Toolkit,Modern Redux,Redux Toolkit simplifies Redux with configureStore, createSlice," createAsyncThunk. It includes Redux Thunk middleware, Immer for immutable updates", and dev tools integration.,https://redux-toolkit.js.org/,https://youtube.com/results?search_query=react+redux+toolkit,https://youtube.com/results?search_query=react+redux+toolkit+hindi,https://youtube.com/results?search_query=react+redux+toolkit+kannada,https://youtube.com/results?search_query=react+redux+toolkit+tamil,https://youtube.com/results?search_query=react+redux+toolkit+telugu
React.js,Advanced,How to implement React application testing with Jest and React Testing Library?,Testing,Jest,React Testing Library,Jest for test runner, React Testing Library for component testing. Focus on testing behavior not implementation. Use fireEvent, waitFor, and mock API calls with MSW.,https://testing-library.com/docs/react-testing-library/intro/,https://youtube.com/results?search_query=react+testing+library+advanced,https://youtube.com/results?search_query=react+testing+library+advanced+hindi,https://youtube.com/results?search_query=react+testing+library+advanced+kannada,https://youtube.com/results?search_query=react+testing+library+advanced+tamil,https://youtube.com/results?search_query=react+testing+library+advanced+telugu
React.js,Advanced,How to implement React with Next.js for SSR?,Frameworks,Next.js,SSR,Next.js provides file-based routing, API routes," built-in SSR with getServerSideProps, SSG with getStaticProps", and Image optimization. Use for production React apps with SEO needs.,https://nextjs.org/docs,https://youtube.com/results?search_query=react+nextjs+ssr,https://youtube.com/results?search_query=react+nextjs+ssr+hindi,https://youtube.com/results?search_query=react+nextjs+ssr+kannada,https://youtube.com/results?search_query=react+nextjs+ssr+tamil,https://youtube.com/results?search_query=react+nextjs+ssr+telugu
React.js,Advanced,How to implement React application with PWA features?,Advanced Features,PWA,Offline,Use Workbox with Create React App, configure manifest.json, implement service worker for offline caching, and use Lighthouse for PWA audits. Add install prompts and push notifications.,https://create-react-app.dev/docs/making-a-progressive-web-app/,https://youtube.com/results?search_query=react+pwa+implementation,https://youtube.com/results?search_query=react+pwa+implementation+hindi,https://youtube.com/results?search_query=react+pwa+implementation+kannada,https://youtube.com/results?search_query=react+pwa+implementation+tamil,https://youtube.com/results?search_query=react+pwa+implementation+telugu
React.js,Advanced,How to implement React Context with performance optimizations?,Performance,Context,Optimization,Split contexts (theme, auth," user), use memoized values with useMemo, create separate providers for independent state", and avoid putting frequently changing values in main context.,https://react.dev/reference/react/useContext,https://youtube.com/results?search_query=react+context+performance,https://youtube.com/results?search_query=react+context+performance+hindi,https://youtube.com/results?search_query=react+context+performance+kannada,https://youtube.com/results?search_query=react+context+performance+tamil,https://youtube.com/results?search_query=react+context+performance+telugu
React.js,Advanced,What is React's Strict Mode and what does it check?,Development,Strict Mode,Debugging,Strict Mode enables additional checks: identifying unsafe lifecycles, warning about legacy string ref API, detecting unexpected side effects, and ensuring reusable state.,https://react.dev/reference/react/StrictMode,https://youtube.com/results?search_query=react+strict+mode,https://youtube.com/results?search_query=react+strict+mode+hindi,https://youtube.com/results?search_query=react+strict+mode+kannada,https://youtube.com/results?search_query=react+strict+mode+tamil,https://youtube.com/results?search_query=react+strict+mode+telugu
React.js,Advanced,How to implement React with Tailwind CSS?,Styling,Tailwind CSS,Utility-First,Install Tailwind, configure postcss," use utility classes directly in JSX. Benefits: rapid development, consistent design system", purging unused CSS in production.,https://tailwindcss.com/docs/guides/create-react-app,https://youtube.com/results?search_query=react+tailwind+css,https://youtube.com/results?search_query=react+tailwind+css+hindi,https://youtube.com/results?search_query=react+tailwind+css+kannada,https://youtube.com/results?search_query=react+tailwind+css+tamil,https://youtube.com/results?search_query=react+tailwind+css+telugu
React.js,Advanced,What are React hooks for state management beyond useState?,State Management,Hooks,Advanced,useReducer for complex state logic, useContext for global state, useSyncExternalStore for external stores, and third-party hooks from libraries like Zustand or Jotai.,https://react.dev/reference/react,https://youtube.com/results?search_query=react+state+management+hooks,https://youtube.com/results?search_query=react+state+management+hooks+hindi,https://youtube.com/results?search_query=react+state+management+hooks+kannada,https://youtube.com/results?search_query=react+state+management+hooks+tamil,https://youtube.com/results?search_query=react+state+management+hooks+telugu
React.js,Advanced,How to implement React application with microfrontends?,Architecture,Microfrontends,Scaling,Use Module Federation with Webpack 5, single-spa framework, or iframe-based approach. Each microfrontend is independent React app, composed at runtime.,https://module-federation.github.io/,https://youtube.com/results?search_query=react+microfrontends,https://youtube.com/results?search_query=react+microfrontends+hindi,https://youtube.com/results?search_query=react+microfrontends+kannada,https://youtube.com/results?search_query=react+microfrontends+tamil,https://youtube.com/results?search_query=react+microfrontends+telugu
React.js,Advanced,What are React's best practices for folder structure?,Best Practices,Project Structure,Scalability,Feature-based or domain-driven structure: group by feature (auth, dashboard, products) with co-located files. Avoid grouping by type (components, hooks). Use index.ts for clean imports.,https://react.dev/learn/importing-and-exporting-components,https://youtube.com/results?search_query=react+folder+structure+best+practices,https://youtube.com/results?search_query=react+folder+structure+best+practices+hindi,https://youtube.com/results?search_query=react+folder+structure+best+practices+kannada,https://youtube.com/results?search_query=react+folder+structure+best+practices+tamil,https://youtube.com/results?search_query=react+folder+structure+best+practices+telugu
React.js,Advanced,How to implement React application monitoring and error tracking?,DevOps,Monitoring,Error Tracking,Use Sentry, LogRocket," or New Relic. Integrate Error Boundaries with monitoring services, track performance metrics with React Profiler", and log user sessions.,https://docs.sentry.io/platforms/javascript/guides/react/,https://youtube.com/results?search_query=react+error+tracking+sentry,https://youtube.com/results?search_query=react+error+tracking+sentry+hindi,https://youtube.com/results?search_query=react+error+tracking+sentry+kannada,https://youtube.com/results?search_query=react+error+tracking+sentry+tamil,https://youtube.com/results?search_query=react+error+tracking+sentry+telugu
React.js,Advanced,How to implement React with Zustand for state management?,State Management,Zustand,Minimalist,Zustand provides simple, scalable state management with hooks API. Create store with create(), use hooks directly in components. No providers needed, supports middleware.,https://docs.pmnd.rs/zustand/getting-started/introduction,https://youtube.com/results?search_query=react+zustand+state+management,https://youtube.com/results?search_query=react+zustand+state+management+hindi,https://youtube.com/results?search_query=react+zustand+state+management+kannada,https://youtube.com/results?search_query=react+zustand+state+management+tamil,https://youtube.com/results?search_query=react+zustand+state+management+telugu
React.js,Advanced,How to implement React with Storybook for component documentation?,Development,Storybook,Documentation,Install Storybook, create *.stories.js files for each component, document props, add controls and actions. Use for visual testing and design system documentation.,https://storybook.js.org/docs/react/get-started/introduction,https://youtube.com/results?search_query=react+storybook+documentation,https://youtube.com/results?search_query=react+storybook+documentation+hindi,https://youtube.com/results?search_query=react+storybook+documentation+kannada,https://youtube.com/results?search_query=react+storybook+documentation+tamil,https://youtube.com/results?search_query=react+storybook+documentation+telugu
React.js,Advanced,What are React's guidelines for accessibility (a11y)?,Accessibility,WCAG,Best Practices,Use semantic HTML, manage focus with useRef," provide keyboard navigation, add ARIA attributes, ensure color contrast, and test with screen readers (NVDA", VoiceOver).,https://react.dev/reference/react-dom/components/common#accessibility,https://youtube.com/results?search_query=react+accessibility+guidelines,https://youtube.com/results?search_query=react+accessibility+guidelines+hindi,https://youtube.com/results?search_query=react+accessibility+guidelines+kannada,https://youtube.com/results?search_query=react+accessibility+guidelines+tamil,https://youtube.com/results?search_query=react+accessibility+guidelines+telugu
React.js,Advanced,How to implement React with Vite instead of Create React App?,Tooling,Vite,Bundling,Vite provides faster dev server, HMR, and optimized builds. Use npm create vite@latest, choose React template. Better performance with ES modules.,https://vitejs.dev/guide/,https://youtube.com/results?search_query=react+vite+setup,https://youtube.com/results?search_query=react+vite+setup+hindi,https://youtube.com/results?search_query=react+vite+setup+kannada,https://youtube.com/results?search_query=react+vite+setup+tamil,https://youtube.com/results?search_query=react+vite+setup+telugu
React.js,Advanced,How to implement React with SWR for data fetching?,Data Fetching,SWR,Stale-While-Revalidate,SWR provides hooks for data fetching with caching, revalidation," and pagination. Use useSWR() with key, fetcher. Handles loading, error", and data states automatically.,https://swr.vercel.app/,https://youtube.com/results?search_query=react+swr+data+fetching,https://youtube.com/results?search_query=react+swr+data+fetching+hindi,https://youtube.com/results?search_query=react+swr+data+fetching+kannada,https://youtube.com/results?search_query=react+swr+data+fetching+tamil,https://youtube.com/results?search_query=react+swr+data+fetching+telugu
React.js,Advanced,What are React's patterns for conditional rendering?,Patterns,Conditional Rendering,Logic,Patterns: if/else, ternary operator," && operator, element variables, IIFE, switch statement, HOCs", render props. Choose based on complexity and readability.,https://react.dev/learn/conditional-rendering,https://youtube.com/results?search_query=react+conditional+rendering+patterns,https://youtube.com/results?search_query=react+conditional+rendering+patterns+hindi,https://youtube.com/results?search_query=react+conditional+rendering+patterns+kannada,https://youtube.com/results?search_query=react+conditional+rendering+patterns+tamil,https://youtube.com/results?search_query=react+conditional+rendering+patterns+telugu
React.js,Advanced,How to implement React with React Query (TanStack Query)?,Data Fetching,React Query,Caching,React Query manages server state with useQuery, useMutation," and useInfiniteQuery. Provides caching, background updates, pagination", and optimistic updates.,https://tanstack.com/query/latest,https://youtube.com/results?search_query=react+query+tanstack,https://youtube.com/results?search_query=react+query+tanstack+hindi,https://youtube.com/results?search_query=react+query+tanstack+kannada,https://youtube.com/results?search_query=react+query+tanstack+tamil,https://youtube.com/results?search_query=react+query+tanstack+telugu
React.js,Advanced,What are React's patterns for handling forms with complex validation?,Forms,Validation,Patterns,Patterns: controlled components with useState, form libraries (Formik," React Hook Form), custom validation hooks, Yup/Joi schema validation", and field-level vs form-level validation.,https://react.dev/reference/react-dom/components/input,https://youtube.com/results?search_query=react+form+validation+patterns,https://youtube.com/results?search_query=react+form+validation+patterns+hindi,https://youtube.com/results?search_query=react+form+validation+patterns+kannada,https://youtube.com/results?search_query=react+form+validation+patterns+tamil,https://youtube.com/results?search_query=react+form+validation+patterns+telugu
React.js,Advanced,How to implement React with Docker for containerization?,DevOps,Docker,Containerization,Create Dockerfile with multi-stage builds: build stage with Node, production stage with nginx. Use .dockerignore, environment variables, and Docker Compose for services.,https://docs.docker.com/language/nodejs/,https://youtube.com/results?search_query=react+docker+containerization,https://youtube.com/results?search_query=react+docker+containerization+hindi,https://youtube.com/results?search_query=react+docker+containerization+kannada,https://youtube.com/results?search_query=react+docker+containerization+tamil,https://youtube.com/results?search_query=react+docker+containerization+telugu
React.js,Advanced,What are React's patterns for component composition vs inheritance?,Patterns,Composition,Inheritance,React favors composition over inheritance. Use props, children," HOCs, render props", and custom hooks to reuse code. Inheritance creates tight coupling and hierarchy issues.,https://react.dev/learn/passing-props-to-a-component,https://youtube.com/results?search_query=react+composition+vs+inheritance,https://youtube.com/results?search_query=react+composition+vs+inheritance+hindi,https://youtube.com/results?search_query=react+composition+vs+inheritance+kannada,https://youtube.com/results?search_query=react+composition+vs+inheritance+tamil,https://youtube.com/results?search_query=react+composition+vs+inheritance+telugu
React.js,Advanced,How to implement React with Redux Saga for side effects?,State Management,Redux Saga,Side Effects,Redux Saga uses ES6 generators to manage async flows. Create sagas with takeEvery, takeLatest," call, put", fork. Good for complex async logic with cancellation.,https://redux-saga.js.org/,https://youtube.com/results?search_query=react+redux+saga,https://youtube.com/results?search_query=react+redux+saga+hindi,https://youtube.com/results?search_query=react+redux+saga+kannada,https://youtube.com/results?search_query=react+redux+saga+tamil,https://youtube.com/results?search_query=react+redux+saga+telugu
React.js,Advanced,What are React's patterns for code organization in large applications?,Architecture,Code Organization,Scaling,Patterns: feature-based folders, domain-driven design," clean architecture, dependency injection, barrel exports, monorepo with workspaces", and microfrontends for very large apps.,https://react.dev/learn/importing-and-exporting-components,https://youtube.com/results?search_query=react+large+application+architecture,https://youtube.com/results?search_query=react+large+application+architecture+hindi,https://youtube.com/results?search_query=react+large+application+architecture+kannada,https://youtube.com/results?search_query=react+large+application+architecture+tamil,https://youtube.com/results?search_query=react+large+application+architecture+telugu
React.js,Advanced,How to implement React with React Router v6 advanced features?,Routing,React Router v6,Nested Routes,React Router v6 features: nested routes with <Outlet>, relative links," loaders and actions for data fetching, useNavigation for pending states", and route protection.,https://reactrouter.com/en/main,https://youtube.com/results?search_query=react+router+v6+advanced,https://youtube.com/results?search_query=react+router+v6+advanced+hindi,https://youtube.com/results?search_query=react+router+v6+advanced+kannada,https://youtube.com/results?search_query=react+router+v6+advanced+tamil,https://youtube.com/results?search_query=react+router+v6+advanced+telugu
React.js,Advanced,What are React's patterns for handling global state without libraries?,State Management,Patterns,Global State,Patterns: Context API with useReducer, prop drilling (simple apps)," lifting state up, component composition", and custom hooks with singleton pattern.,https://react.dev/learn/sharing-state-between-components,https://youtube.com/results?search_query=react+global+state+patterns,https://youtube.com/results?search_query=react+global+state+patterns+hindi,https://youtube.com/results?search_query=react+global+state+patterns+kannada,https://youtube.com/results?search_query=react+global+state+patterns+tamil,https://youtube.com/results?search_query=react+global+state+patterns+telugu
React.js,Advanced,How to implement React with React Hook Form for performance?,Forms,React Hook Form,Performance,React Hook Form uses uncontrolled components with refs, reducing re-renders. Use register()," handleSubmit(), watch()", and formState for validation and performance.,https://react-hook-form.com/,https://youtube.com/results?search_query=react+hook+form+performance,https://youtube.com/results?search_query=react+hook+form+performance+hindi,https://youtube.com/results?search_query=react+hook+form+performance+kannada,https://youtube.com/results?search_query=react+hook+form+performance+tamil,https://youtube.com/results?search_query=react+hook+form+performance+telugu
