skill,level,question_text,option_a,option_b,option_c,option_d,correct_answer,explanation,topic,mdn_link,youtube_english,youtube_hindi,youtube_kannada,youtube_tamil,youtube_telugu
SQL,Basic,What are the ACID properties?,Transactions,ACID,Atomic,Consistent,Isolated,"Durable,ACID stands for Atomicity (all or nothing), Consistency (data remains valid), Isolation (transactions don't interfere)", Durability (committed changes persist). These ensure reliable transaction processing.,https://www.w3schools.com/sql/sql_transaction.asp,https://youtube.com/results?search_query=acid+properties+sql,https://youtube.com/results?search_query=acid+properties+sql+hindi,https://youtube.com/results?search_query=acid+properties+sql+kannada,https://youtube.com/results?search_query=acid+properties+sql+tamil,https://youtube.com/results?search_query=acid+properties+sql+telugu
SQL,Basic,What is a surrogate key?,Constraints,Surrogate Key,Artificial,Serial,A surrogate key is an artificial key (usually auto-increment integer) added to a table as the primary key," when natural keys are not suitable (e.g., too long", composite). It has no business meaning.,https://www.w3schools.com/sql/sql_autoincrement.asp,https://youtube.com/results?search_query=surrogate+key+sql,https://youtube.com/results?search_query=surrogate+key+sql+hindi,https://youtube.com/results?search_query=surrogate+key+sql+kannada,https://youtube.com/results?search_query=surrogate+key+sql+tamil,https://youtube.com/results?search_query=surrogate+key+sql+telugu
SQL,Basic,What is a natural key?,Constraints,Natural Key,Business,Real-world,A natural key is a candidate key that exists in the real world and has business meaning (e.g., Social Security Number, email). It's derived from the data itself.,https://www.w3schools.com/sql/sql_primarykey.asp,https://youtube.com/results?search_query=natural+key+sql,https://youtube.com/results?search_query=natural+key+sql+hindi,https://youtube.com/results?search_query=natural+key+sql+kannada,https://youtube.com/results?search_query=natural+key+sql+tamil,https://youtube.com/results?search_query=natural+key+sql+telugu
SQL,Basic,What is the difference between surrogate key and natural key?,Constraints,Surrogate Key,Natural Key,Artificial,Business,"A surrogate key is an artificial identifier with no business meaning (e.g., auto-increment ID). A natural key is a real-world identifier with business meaning (e.g.", passport number). Surrogate keys are preferred for stability.,https://www.w3schools.com/sql/sql_primarykey.asp,https://youtube.com/results?search_query=surrogate+key+vs+natural+key,https://youtube.com/results?search_query=surrogate+key+vs+natural+key+hindi,https://youtube.com/results?search_query=surrogate+key+vs+natural+key+kannada,https://youtube.com/results?search_query=surrogate+key+vs+natural+key+tamil,https://youtube.com/results?search_query=surrogate+key+vs+natural+key+telugu
SQL,Basic,What is the difference between a database and a table?,Database Objects,Database,Table,Container,Data,"A database is a collection of related data and objects (tables, views, indexes", etc.). A table is a specific object within a database that stores data in rows and columns.,https://www.w3schools.com/sql/sql_create_db.asp,https://youtube.com/results?search_query=database+vs+table,https://youtube.com/results?search_query=database+vs+table+hindi,https://youtube.com/results?search_query=database+vs+table+kannada,https://youtube.com/results?search_query=database+vs+table+tamil,https://youtube.com/results?search_query=database+vs+table+telugu
SQL,Basic,What is a database management system (DBMS)?,Introduction,DBMS,Software,Manage,A DBMS is software that interacts with users," applications, and the database itself to capture and analyze data. It manages data storage, retrieval, security, and integrity. Examples: MySQL, PostgreSQL", Oracle.,https://www.w3schools.com/sql/sql_intro.asp,https://youtube.com/results?search_query=dbms+sql,https://youtube.com/results?search_query=dbms+sql+hindi,https://youtube.com/results?search_query=dbms+sql+kannada,https://youtube.com/results?search_query=dbms+sql+tamil,https://youtube.com/results?search_query=dbms+sql+telugu
SQL,Basic,What is the purpose of the INFORMATION_SCHEMA?,Metadata,INFORMATION_SCHEMA,System Tables,Metadata,INFORMATION_SCHEMA is a set of read-only views that provide information about all the tables," views, columns", and procedures in a database. It's the SQL standard way to query metadata.,https://www.w3schools.com/sql/sql_quickref.asp,https://youtube.com/results?search_query=information_schema+sql,https://youtube.com/results?search_query=information_schema+sql+hindi,https://youtube.com/results?search_query=information_schema+sql+kannada,https://youtube.com/results?search_query=information_schema+sql+tamil,https://youtube.com/results?search_query=information_schema+sql+telugu
SQL,Basic,What is the purpose of the SET operators (UNION, INTERSECT, EXCEPT)?,Set Operators,UNION,INTERSECT,"EXCEPT,SET operators combine results from multiple SELECT statements. UNION combines, INTERSECT returns common rows", EXCEPT returns rows from first query not in second.,https://www.w3schools.com/sql/sql_union.asp,https://youtube.com/results?search_query=set+operators+sql,https://youtube.com/results?search_query=set+operators+sql+hindi,https://youtube.com/results?search_query=set+operators+sql+kannada,https://youtube.com/results?search_query=set+operators+sql+tamil,https://youtube.com/results?search_query=set+operators+sql+telugu
SQL,Basic,What is the difference between DATETIME and TIMESTAMP?,Data Types,DATETIME,TIMESTAMP,Time,MySQL,"In MySQL, both store date and time. Differences: TIMESTAMP has a smaller range (1970-2038) and converts stored values from current time zone to UTC for storage", and back for retrieval. DATETIME stores as-is.,https://www.w3schools.com/sql/sql_datatypes.asp,https://youtube.com/results?search_query=datetime+vs+timestamp+mysql,https://youtube.com/results?search_query=datetime+vs+timestamp+mysql+hindi,https://youtube.com/results?search_query=datetime+vs+timestamp+mysql+kannada,https://youtube.com/results?search_query=datetime+vs+timestamp+mysql+tamil,https://youtube.com/results?search_query=datetime+vs+timestamp+mysql+telugu
SQL,Basic,What is the purpose of the SQL statement "DESCRIBE table_name"?,DDL Commands,DESCRIBE,Structure,Columns,DESCRIBE (or DESC) displays the structure of a table: column names," data types, constraints", etc. It's a quick way to see table metadata.,https://www.w3schools.com/sql/sql_quickref.asp,https://youtube.com/results?search_query=describe+table+sql,https://youtube.com/results?search_query=describe+table+sql+hindi,https://youtube.com/results?search_query=describe+table+sql+kannada,https://youtube.com/results?search_query=describe+table+sql+tamil,https://youtube.com/results?search_query=describe+table+sql+telugu
SQL,Basic,What is the difference between a database and a spreadsheet?,Introduction,Database,Spreadsheet,Structured,Relational,"A database is designed for storing and retrieving large amounts of structured data efficiently, supports multi-user access with concurrency control, and enforces data integrity. A spreadsheet is for individual use, calculations", and small datasets.,https://www.w3schools.com/sql/sql_intro.asp,https://youtube.com/results?search_query=database+vs+spreadsheet,https://youtube.com/results?search_query=database+vs+spreadsheet+hindi,https://youtube.com/results?search_query=database+vs+spreadsheet+kannada,https://youtube.com/results?search_query=database+vs+spreadsheet+tamil,https://youtube.com/results?search_query=database+vs+spreadsheet+telugu
SQL,Basic,What is the difference between SQL and PL/SQL?,Introduction,SQL,PL/SQL,Procedural,SQL is a declarative language for querying databases. PL/SQL is Oracle's procedural extension to SQL," allowing for loops, conditions", and error handling within database programs.,https://www.w3schools.com/sql/sql_intro.asp,https://youtube.com/results?search_query=sql+vs+plsql,https://youtube.com/results?search_query=sql+vs+plsql+hindi,https://youtube.com/results?search_query=sql+vs+plsql+kannada,https://youtube.com/results?search_query=sql+vs+plsql+tamil,https://youtube.com/results?search_query=sql+vs+plsql+telugu
SQL,Basic,What is the difference between SQL and T-SQL?,Introduction,SQL,T-SQL,Microsoft,Procedural,"SQL is the standard language. T-SQL (Transact-SQL) is Microsoft's and Sybase's extension to SQL, used in SQL Server. It includes procedural programming, local variables", and special functions.,https://www.w3schools.com/sql/sql_intro.asp,https://youtube.com/results?search_query=sql+vs+tsql,https://youtube.com/results?search_query=sql+vs+tsql+hindi,https://youtube.com/results?search_query=sql+vs+tsql+kannada,https://youtube.com/results?search_query=sql+vs+tsql+tamil,https://youtube.com/results?search_query=sql+vs+tsql+telugu