skill,level,question_text,option_a,option_b,option_c,option_d,correct_answer,explanation,topic,mdn_link,youtube_english,youtube_hindi,youtube_kannada,youtube_tamil,youtube_telugu
Terraform,Advanced,What is Terraform state and why is it critical? Explain the different backends for storing state files.,State Management,Infrastructure,The state file maps real-world resources to configuration, tracks metadata, and improves performance. Backends: local (default)," remote (Terraform Cloud, S3 + DynamoDB, Azure Blob, GCS)", enhanced backends support locking and collaboration.,https://developer.hashicorp.com/terraform/language/state,https://youtube.com/results?search_query=terraform+state+explained,https://youtube.com/results?search_query=terraform+state+hindi,https://youtube.com/results?search_query=terraform+state+kannada,https://youtube.com/results?search_query=terraform+state+tamil,https://youtube.com/results?search_query=terraform+state+telugu
Terraform,Advanced,What are Terraform Modules and how do they improve code reuse and maintainability?,Modules,DRY,Modules are containers for multiple resources used together. They encapsulate complexity, promote reuse, and enable composition. Use modules for reusable patterns (VPCs, security groups, Kubernetes clusters).,https://developer.hashicorp.com/terraform/language/modules,https://youtube.com/results?search_query=terraform+modules,https://youtube.com/results?search_query=terraform+modules+hindi,https://youtube.com/results?search_query=terraform+modules+kannada,https://youtube.com/results?search_query=terraform+modules+tamil,https://youtube.com/results?search_query=terraform+modules+telugu
Terraform,Advanced,Explain the difference between root modules, child modules, and published modules.,Modules,Hierarchy,Root module: directory with terraform apply. Child modules: called from root via module block. Published modules: in Terraform Registry (public/private). Root orchestrates, children encapsulate, published share.,https://developer.hashicorp.com/terraform/language/modules,https://youtube.com/results?search_query=terraform+module+types,https://youtube.com/results?search_query=terraform+modules+hindi,https://youtube.com/results?search_query=terraform+modules+kannada,https://youtube.com/results?search_query=terraform+modules+tamil,https://youtube.com/results?search_query=terraform+modules+telugu
Terraform,Advanced,What are Terraform Providers and how do they interact with APIs? Explain provider version constraints.,Providers,Plugins,Providers are plugins that interact with APIs (AWS, Azure, GCP," Kubernetes). They translate Terraform config to API calls. Version constraints: "~> 3.0" (3.x), ">= 2.0", < 3.0". Lock file ensures consistency.,https://developer.hashicorp.com/terraform/language/providers,https://youtube.com/results?search_query=terraform+providers,https://youtube.com/results?search_query=terraform+providers+hindi,https://youtube.com/results?search_query=terraform+providers+kannada,https://youtube.com/results?search_query=terraform+providers+tamil,https://youtube.com/results?search_query=terraform+providers+telugu
Terraform,Advanced,What is the difference between terraform init, plan, apply, and destroy? Explain their use cases.,CLI,Workflow,init: initializes backend, providers. plan: shows changes (dry run). apply: executes changes. destroy: removes infrastructure. plan should always precede apply for review. destroy for cleanup.,https://developer.hashicorp.com/terraform/cli/commands,https://youtube.com/results?search_query=terraform+cli+commands,https://youtube.com/results?search_query=terraform+commands+hindi,https://youtube.com/results?search_query=terraform+commands+kannada,https://youtube.com/results?search_query=terraform+commands+tamil,https://youtube.com/results?search_query=terraform+commands+telugu
Terraform,Advanced,Explain the concept of Terraform Remote State and its benefits for team collaboration.,State Management,Collaboration,Remote state stores state file in shared backend (S3, Terraform Cloud). Benefits: team access, state locking (prevent conflicts), secret management, output sharing between configurations.,https://developer.hashicorp.com/terraform/language/state/remote,https://youtube.com/results?search_query=terraform+remote+state,https://youtube.com/results?search_query=terraform+remote+state+hindi,https://youtube.com/results?search_query=terraform+remote+state+kannada,https://youtube.com/results?search_query=terraform+remote+state+tamil,https://youtube.com/results?search_query=terraform+remote+state+telugu
Terraform,Advanced,Explain Terraform's provisioners (local-exec, remote-exec) and their alternatives.,Provisioners,Configuration,Provisioners run scripts on resources (local-exec locally, remote-exec on resource). Considered last resort; prefer cloud-init," user data, configuration management (Ansible, Chef). Limitations: error handling", lifecycle.,https://developer.hashicorp.com/terraform/language/resources/provisioners/syntax,https://youtube.com/results?search_query=terraform+provisioners,https://youtube.com/results?search_query=terraform+provisioners+hindi,https://youtube.com/results?search_query=terraform+provisioners+kannada,https://youtube.com/results?search_query=terraform+provisioners+tamil,https://youtube.com/results?search_query=terraform+provisioners+telugu
Terraform,Advanced,Explain Terraform's Input Variables: types, validation, and sensitivity.,Variables,Input,Variables parameterize configurations. Types: string," number, bool, list, map, set, object", tuple. Validation: validation blocks. Sensitive: hides values in UI/outputs (but still in state).,https://developer.hashicorp.com/terraform/language/values/variables,https://youtube.com/results?search_query=terraform+variables,https://youtube.com/results?search_query=terraform+variables+hindi,https://youtube.com/results?search_query=terraform+variables+kannada,https://youtube.com/results?search_query=terraform+variables+tamil,https://youtube.com/results?search_query=terraform+variables+telugu
Terraform,Advanced,What are Terraform Locals and when should they be used instead of variables or outputs?,Locals,Computation,Locals assign names to expressions within module. Use for: complex expressions, transforming data, avoiding repetition. Unlike variables, not set by users. Unlike outputs, not exposed externally.,https://developer.hashicorp.com/terraform/language/values/locals,https://youtube.com/results?search_query=terraform+locals,https://youtube.com/results?search_query=terraform+locals+hindi,https://youtube.com/results?search_query=terraform+locals+kannada,https://youtube.com/results?search_query=terraform+locals+tamil,https://youtube.com/results?search_query=terraform+locals+telugu
Terraform,Advanced,Explain Terraform's interpolation syntax and functions for string manipulation.,Interpolation,Functions,Interpolation: ${var.name} or just var.name. String functions: join, split, substr," replace, lower, upper, format. Use for constructing values", transforming data.,https://developer.hashicorp.com/terraform/language/functions,https://youtube.com/results?search_query=terraform+functions+string,https://youtube.com/results?search_query=terraform+functions+hindi,https://youtube.com/results?search_query=terraform+functions+kannada,https://youtube.com/results?search_query=terraform+functions+tamil,https://youtube.com/results?search_query=terraform+functions+telugu
Terraform,Advanced,What are Terraform's collection functions (map, filter, reduce) and their use cases?,Functions,Collections,map: transform each element. filter: select elements meeting condition. reduce: combine elements to single value. Use for: transforming lists/maps, conditional inclusion, aggregation.,https://developer.hashicorp.com/terraform/language/functions,https://youtube.com/results?search_query=terraform+collection+functions,https://youtube.com/results?search_query=terraform+collections+hindi,https://youtube.com/results?search_query=terraform+collections+kannada,https://youtube.com/results?search_query=terraform+collections+tamil,https://youtube.com/results?search_query=terraform+collections+telugu
Terraform,Advanced,What is Terraform Cloud/Enterprise and how does it differ from OSS Terraform?,Terraform Cloud,CI/CD,Terraform Cloud: managed service with UI, VCS integration, policy enforcement," run triggers, cost estimation. Enterprise adds SAML", audit logging. OSS is CLI only; TFC/TFE add collaboration features.,https://developer.hashicorp.com/terraform/cloud-docs,https://youtube.com/results?search_query=terraform+cloud+vs+oss,https://youtube.com/results?search_query=terraform+cloud+hindi,https://youtube.com/results?search_query=terraform+cloud+kannada,https://youtube.com/results?search_query=terraform+cloud+tamil,https://youtube.com/results?search_query=terraform+cloud+telugu
Terraform,Advanced,What is terraform state list, show, mv, rm, pull, push? Explain use cases.,"State,CLI,list: resources in state. show: detailed view. mv: rename/move resources. rm: remove from state. pull/push: manual state transfer. Use for: state inspection, refactoring", recovery.,https://developer.hashicorp.com/terraform/cli/commands/state,https://youtube.com/results?search_query=terraform+state+commands,https://youtube.com/results?search_query=terraform+state+cli+hindi,https://youtube.com/results?search_query=terraform+state+cli+kannada,https://youtube.com/results?search_query=terraform+state+cli+tamil,https://youtube.com/results?search_query=terraform+state+cli+telugu
Terraform,Advanced,What are Terraform's built-in functions for working with maps and objects?,Functions,Maps,Functions: keys(values), values(map), lookup(map," key, default), merge(maps...), zipmap(keys, values). Use for: dynamic configurations", transforming data structures.,https://developer.hashicorp.com/terraform/language/functions,https://youtube.com/results?search_query=terraform+map+functions,https://youtube.com/results?search_query=terraform+maps+hindi,https://youtube.com/results?search_query=terraform+maps+kannada,https://youtube.com/results?search_query=terraform+maps+tamil,https://youtube.com/results?search_query=terraform+maps+telugu
Terraform,Advanced,Explain Terraform's "connection" block for provisioners (SSH, WinRM).,Provisioners,Connection,connection block defines how to connect for remote-exec: type (ssh, winrm)," host, user", password/private_key. Use for: configuring resources after creation.,https://developer.hashicorp.com/terraform/language/resources/provisioners/connection,https://youtube.com/results?search_query=terraform+connection+block,https://youtube.com/results?search_query=terraform+connection+hindi,https://youtube.com/results?search_query=terraform+connection+kannada,https://youtube.com/results?search_query=terraform+connection+tamil,https://youtube.com/results?search_query=terraform+connection+telugu
Terraform,Advanced,What is Terraform's "validation" block for input variables and its use cases?,Validation,Variables,validation block in variable definition enforces rules: condition (bool), error_message. Use for: validating format (CIDR, email), ranges, allowed values beyond type constraints.,https://developer.hashicorp.com/terraform/language/values/variables#custom-validation-rules,https://youtube.com/results?search_query=terraform+variable+validation,https://youtube.com/results?search_query=terraform+validation+hindi,https://youtube.com/results?search_query=terraform+validation+kannada,https://youtube.com/results?search_query=terraform+validation+tamil,https://youtube.com/results?search_query=terraform+validation+telugu
Terraform,Advanced,What are Terraform's "element", "slice", "concat" functions for list manipulation?,Functions,Lists,element gets item at index (wraps). slice extracts sublist. concat combines lists. Use for: iterating with count, processing lists, building complex data structures.,https://developer.hashicorp.com/terraform/language/functions/element,https://youtube.com/results?search_query=terraform+list+functions,https://youtube.com/results?search_query=terraform+lists+hindi,https://youtube.com/results?search_query=terraform+lists+kannada,https://youtube.com/results?search_query=terraform+lists+tamil,https://youtube.com/results?search_query=terraform+lists+telugu
Terraform,Advanced,Explain Terraform's "random" provider for generating random values (strings, passwords).,Providers,Random,random provider generates random values: string, password," integer, shuffle. Use for: generating passwords, unique names", random selection. Values saved in state; use keepers for regeneration triggers.,https://registry.terraform.io/providers/hashicorp/random/latest/docs,https://youtube.com/results?search_query=terraform+random+provider,https://youtube.com/results?search_query=terraform+random+hindi,https://youtube.com/results?search_query=terraform+random+kannada,https://youtube.com/results?search_query=terraform+random+tamil,https://youtube.com/results?search_query=terraform+random+telugu
Terraform,Advanced,What is Terraform's "backend" block configuration for S3 with DynamoDB locking?,Backend,S3,Backend config: bucket (S3), key (path), region, dynamodb_table (locking), encrypt. Use for: team collaboration with state locking and versioning (S3).,https://developer.hashicorp.com/terraform/language/settings/backends/s3,https://youtube.com/results?search_query=terraform+s3+backend,https://youtube.com/results?search_query=terraform+s3+hindi,https://youtube.com/results?search_query=terraform+s3+kannada,https://youtube.com/results?search_query=terraform+s3+tamil,https://youtube.com/results?search_query=terraform+s3+telugu
Terraform,Advanced,Explain the concept of Terraform's "module" sources: local, Git, Registry, S3, etc.,Modules,"Sources,Module sources: local path, Git (URL, ref), Terraform Registry (public/private), S3, GCS", HTTP. Determines where module code is fetched from.,https://developer.hashicorp.com/terraform/language/modules/sources,https://youtube.com/results?search_query=terraform+module+sources,https://youtube.com/results?search_query=terraform+module+sources+hindi,https://youtube.com/results?search_query=terraform+module+sources+kannada,https://youtube.com/results?search_query=terraform+module+sources+tamil,https://youtube.com/results?search_query=terraform+module+sources+telugu
Terraform,Advanced,What are Terraform's "module" version constraints when using Git or Registry sources?,Modules,Versioning,For Git: ref parameter (branch, tag, commit). For Registry: version parameter. Use for: pinning module versions, avoiding breaking changes, reproducible deployments.,https://developer.hashicorp.com/terraform/language/modules/sources#selecting-a-revision,https://youtube.com/results?search_query=terraform+module+versions,https://youtube.com/results?search_query=terraform+module+versions+hindi,https://youtube.com/results?search_query=terraform+module+versions+kannada,https://youtube.com/results?search_query=terraform+module+versions+tamil,https://youtube.com/results?search_query=terraform+module+versions+telugu
Terraform,Advanced,Explain the concept of Terraform's "data-only" modules for data transformation.,Modules,Data,Data-only modules contain only data sources, locals, outputs. Use for: complex data transformation, shared queries, abstraction over data lookups.,https://developer.hashicorp.com/terraform/language/modules/develop,https://youtube.com/results?search_query=terraform+data+modules,https://youtube.com/results?search_query=terraform+data+modules+hindi,https://youtube.com/results?search_query=terraform+data+modules+kannada,https://youtube.com/results?search_query=terraform+data+modules+tamil,https://youtube.com/results?search_query=terraform+data+modules+telugu
Terraform,Advanced,What are Terraform's "environment" variables: TF_VAR_name, TF_CLI_ARGS, TF_IN_AUTOMATION?,Environment,Variables,TF_VAR_name sets variable values. TF_CLI_ARGS passes CLI arguments. TF_IN_AUTOMATION adjusts output for scripts. Use for: automation, CI/CD, avoiding hardcoded values.,https://developer.hashicorp.com/terraform/cli/config/environment-variables,https://youtube.com/results?search_query=terraform+environment+variables,https://youtube.com/results?search_query=terraform+env+vars+hindi,https://youtube.com/results?search_query=terraform+env+vars+kannada,https://youtube.com/results?search_query=terraform+env+vars+tamil,https://youtube.com/results?search_query=terraform+env+vars+telugu
Terraform,Advanced,Explain Terraform's "cost estimation" in Terraform Cloud/Enterprise.,Cost,Estimation,Cost estimation analyzes plan, estimates monthly cost changes. Supports AWS, Azure," GCP. Use for: budgeting, cost control", approval workflows.,https://developer.hashicorp.com/terraform/cloud-docs/cost-estimation,https://youtube.com/results?search_query=terraform+cost+estimation,https://youtube.com/results?search_query=terraform+cost+hindi,https://youtube.com/results?search_query=terraform+cost+kannada,https://youtube.com/results?search_query=terraform+cost+tamil,https://youtube.com/results?search_query=terraform+cost+telugu
Terraform,Advanced,What are Terraform's "policy sets" and "sentinel" policies for governance?,Policy,Governance,Policy sets group Sentinel policies, apply to workspaces. Policies enforce rules: allowed instance types, required tags," spending limits. Use for: compliance, security", cost control.,https://developer.hashicorp.com/terraform/cloud-docs/policy-enforcement/sentinel,https://youtube.com/results?search_query=terraform+sentinel+policies,https://youtube.com/results?search_query=terraform+policies+hindi,https://youtube.com/results?search_query=terraform+policies+kannada,https://youtube.com/results?search_query=terraform+policies+tamil,https://youtube.com/results?search_query=terraform+policies+telugu
Terraform,Advanced,What are Terraform's "CDK for Terraform" (CDKTF) and when to use it vs HCL?,CDKTF,Programming,CDKTF allows defining infrastructure in programming languages (TypeScript, Python, Go," Java, C#). Use for: developers familiar with code, complex logic", existing code reuse.,https://developer.hashicorp.com/terraform/cdktf,https://youtube.com/results?search_query=cdktf+terraform,https://youtube.com/results?search_query=terraform+cdktf+hindi,https://youtube.com/results?search_query=terraform+cdktf+kannada,https://youtube.com/results?search_query=terraform+cdktf+tamil,https://youtube.com/results?search_query=terraform+cdktf+telugu
Terraform,Advanced,Explain Terraform's "multi-cloud" and "hybrid-cloud" deployment patterns.,Multi-cloud,Architecture,Multi-cloud: deploy across AWS, Azure, GCP. Hybrid-cloud: combine cloud with on-premises. Terraform manages all via providers. Use for: vendor diversity, compliance, disaster recovery.,https://developer.hashicorp.com/terraform/tutorials/multi-cloud,https://youtube.com/results?search_query=terraform+multi+cloud,https://youtube.com/results?search_query=terraform+multi+cloud+hindi,https://youtube.com/results?search_query=terraform+multi+cloud+kannada,https://youtube.com/results?search_query=terraform+multi+cloud+tamil,https://youtube.com/results?search_query=terraform+multi+cloud+telugu
Terraform,Advanced,What are Terraform's "compliance as code" patterns with policy enforcement?,Compliance,Policy,Compliance as code: define policies in code (Sentinel, OPA), enforce in pipelines. Examples: encryption requirements, tagging standards, network security. Integrate with Terraform Cloud/Enterprise.,https://developer.hashicorp.com/terraform/tutorials/configuration-language/policy,https://youtube.com/results?search_query=terraform+compliance+as+code,https://youtube.com/results?search_query=terraform+compliance+hindi,https://youtube.com/results?search_query=terraform+compliance+kannada,https://youtube.com/results?search_query=terraform+compliance+tamil,https://youtube.com/results?search_query=terraform+compliance+telugu
Terraform,Advanced,Explain the concept of "Terraform Day 2 Operations" and lifecycle management.,Operations,Lifecycle,Day 2 Operations: monitoring, scaling, updates," backups after initial deployment. Terraform manages via: regular updates, state management, module versioning", drift correction.,https://developer.hashicorp.com/terraform/best-practices,https://youtube.com/results?search_query=terraform+day+2+operations,https://youtube.com/results?search_query=terraform+operations+hindi,https://youtube.com/results?search_query=terraform+operations+kannada,https://youtube.com/results?search_query=terraform+operations+tamil,https://youtube.com/results?search_query=terraform+operations+telugu
Terraform,Advanced,Explain Terraform's "GitOps" workflow for infrastructure management.,GitOps,Workflow,GitOps: infrastructure defined in Git, changes via PRs, automated apply. Tools: Terraform Cloud," Atlantis, custom CI/CD. Benefits: audit trail, collaboration", rollback capability.,https://developer.hashicorp.com/terraform/cloud-docs/run/ui,https://youtube.com/results?search_query=terraform+gitops,https://youtube.com/results?search_query=terraform+gitops+hindi,https://youtube.com/results?search_query=terraform+gitops+kannada,https://youtube.com/results?search_query=terraform+gitops+tamil,https://youtube.com/results?search_query=terraform+gitops+telugu
Terraform,Advanced,What are Terraform's "best practices" for large enterprise deployments?,Best Practices,Enterprise,Best practices: modular design, remote state with locking, policy enforcement," CI/CD integration, environment separation, version pinning, documentation", testing.,https://developer.hashicorp.com/terraform/best-practices,https://youtube.com/results?search_query=terraform+best+practices+enterprise,https://youtube.com/results?search_query=terraform+best+practices+hindi,https://youtube.com/results?search_query=terraform+best+practices+kannada,https://youtube.com/results?search_query=terraform+best+practices+tamil,https://youtube.com/results?search_query=terraform+best+practices+telugu