skill,level,question_text,option_a,option_b,option_c,option_d,correct_answer,explanation,topic,mdn_link,youtube_english,youtube_hindi,youtube_kannada,youtube_tamil,youtube_telugu
Cpp,Advanced,What are the thread safety guarantees of static local variable initialization?,Singleton pattern,Thread-safe initialization,Magic statics,Concurrency,A,"Since C++11, static local variable initialization is thread-safe, ensuring only one thread performs initialization.",Concurrency,https://en.cppreference.com/w/cpp/language/storage_duration,https://youtube.com/results?search_query=cpp+static+local+thread+safety,https://youtube.com/results?search_query=cpp+static+local+thread+safety+hindi,https://youtube.com/results?search_query=cpp+static+local+thread+safety+kannada,https://youtube.com/results?search_query=cpp+static+local+thread+safety+tamil,https://youtube.com/results?search_query=cpp+static+local+thread+safety+telugu
Cpp,Advanced,How does std::to_array convert C-style arrays to std::array safely?,Array conversion,Type deduction,Bounds preservation,Modern C++,A,"std::to_array deduces the size and type of C-arrays, creating a std::array with the same elements and preventing decay.",STL,https://en.cppreference.com/w/cpp/container/array/to_array,https://youtube.com/results?search_query=cpp+to_array,https://youtube.com/results?search_query=cpp+to_array+hindi,https://youtube.com/results?search_query=cpp+to_array+kannada,https://youtube.com/results?search_query=cpp+to_array+tamil,https://youtube.com/results?search_query=cpp+to_array+telugu
Cpp,Advanced,What are the differences between std::async with launch::async and launch::deferred?,Asynchronous execution,Lazy evaluation,Thread creation,Task scheduling,A,"launch::async immediately starts execution in a new thread, while launch::deferred delays execution until the future is accessed.",Concurrency,https://en.cppreference.com/w/cpp/thread/async,https://youtube.com/results?search_query=cpp+async+launch+policies,https://youtube.com/results?search_query=cpp+async+launch+policies+hindi,https://youtube.com/results?search_query=cpp+async+launch+policies+kannada,https://youtube.com/results?search_query=cpp+async+launch+policies+tamil,https://youtube.com/results?search_query=cpp+async+launch+policies+telugu
Cpp,Advanced,How does std::filesystem provide platform-independent file system operations?,File system API,Cross-platform,Path manipulation,Directory iteration,A,std::filesystem abstracts platform-specific file system details behind a unified C++ interface.,STL,https://en.cppreference.com/w/cpp/filesystem,https://youtube.com/results?search_query=cpp+filesystem+cross+platform,https://youtube.com/results?search_query=cpp+filesystem+cross+platform+hindi,https://youtube.com/results?search_query=cpp+filesystem+cross+platform+kannada,https://youtube.com/results?search_query=cpp+filesystem+cross+platform+tamil,https://youtube.com/results?search_query=cpp+filesystem+cross+platform+telugu
Cpp,Advanced,What is the empty base optimization and how does it reduce memory overhead?,Inheritance,Memory layout,Zero-size base classes,Compile-time optimization,A,"EBO allows compilers to allocate zero-size base classes within the derived class's padding, eliminating memory overhead.",Memory Management,https://en.cppreference.com/w/cpp/language/ebo,https://youtube.com/results?search_query=cpp+empty+base+optimization,https://youtube.com/results?search_query=cpp+empty+base+optimization+hindi,https://youtube.com/results?search_query=cpp+empty+base+optimization+kannada,https://youtube.com/results?search_query=cpp+empty+base+optimization+tamil,https://youtube.com/results?search_query=cpp+empty+base+optimization+telugu
Cpp,Advanced,How do user-defined literals enable compile-time unit conversions and validation?,Literal operators,Compile-time computation,Type safety,Unit systems,A,User-defined literals allow creating objects from literal values with compile-time type checking and conversions.,Core Concepts,https://en.cppreference.com/w/cpp/language/user_literal,https://youtube.com/results?search_query=cpp+user+defined+literals,https://youtube.com/results?search_query=cpp+user+defined+literals+hindi,https://youtube.com/results?search_query=cpp+user+defined+literals+kannada,https://youtube.com/results?search_query=cpp+user+defined+literals+tamil,https://youtube.com/results?search_query=cpp+user+defined+literals+telugu
Cpp,Advanced,What are the memory model implications of lock-free programming with atomics?,Memory ordering,Atomic operations,Lock-free algorithms,Concurrency,A,Lock-free programming requires careful use of memory orderings to ensure correct visibility and synchronization between threads.,Concurrency,https://en.cppreference.com/w/cpp/atomic/memory_order,https://youtube.com/results?search_query=cpp+lock+free+memory+model,https://youtube.com/results?search_query=cpp+lock+free+memory+model+hindi,https://youtube.com/results?search_query=cpp+lock+free+memory+model+kannada,https://youtube.com/results?search_query=cpp+lock+free+memory+model+tamil,https://youtube.com/results?search_query=cpp+lock+free+memory+model+telugu
Cpp,Advanced,How does std::format improve type safety over printf-style formatting?,Type-safe formatting,Compile-time format strings,Modern formatting,Error detection,A,std::format validates format strings at compile time and uses type-safe argument passing through variadic templates.,STL,https://en.cppreference.com/w/cpp/utility/format,https://youtube.com/results?search_query=cpp+format+type+safety,https://youtube.com/results?search_query=cpp+format+type+safety+hindi,https://youtube.com/results?search_query=cpp+format+type+safety+kannada,https://youtube.com/results?search_query=cpp+format+type+safety+tamil,https://youtube.com/results?search_query=cpp+format+type+safety+telugu
Cpp,Advanced,What are the performance characteristics of std::deque compared to std::vector?,Sequence containers,Random access,Insertion performance,Memory fragmentation,A,"std::deque provides O(1) insertion at both ends but slower random access due to segmented storage, unlike std::vector's contiguous storage.",STL,https://en.cppreference.com/w/cpp/container/deque,https://youtube.com/results?search_query=cpp+deque+vs+vector+performance,https://youtube.com/results?search_query=cpp+deque+vs+vector+performance+hindi,https://youtube.com/results?search_query=cpp+deque+vs+vector+performance+kannada,https://youtube.com/results?search_query=cpp+deque+vs+vector+performance+tamil,https://youtube.com/results?search_query=cpp+deque+vs+vector+performance+telugu
Cpp,Advanced,How does the rule of zero simplify resource management in modern C++?,Default operations,RAII,Smart pointers,Simplified design,A,"The rule of zero advocates using compiler-generated special members and RAII types, avoiding manual resource management.",Core Concepts,https://en.cppreference.com/w/cpp/language/rule_of_three,https://youtube.com/results?search_query=cpp+rule+of+zero,https://youtube.com/results?search_query=cpp+rule+of+zero+hindi,https://youtube.com/results?search_query=cpp+rule+of+zero+kannada,https://youtube.com/results?search_query=cpp+rule+of+zero+tamil,https://youtube.com/results?search_query=cpp+rule+of+zero+telugu
Cpp,Advanced,What are the iterator invalidation rules for std::vector during insertion and deletion?,Container modifications,Iterator safety,Reallocation,Performance implications,A,std::vector iterators are invalidated by reallocation (when capacity changes) and by insertions/deletions before or at the iterator position.,STL,https://en.cppreference.com/w/cpp/container/vector,https://youtube.com/results?search_query=cpp+vector+iterator+invalidation,https://youtube.com/results?search_query=cpp+vector+iterator+invalidation+hindi,https://youtube.com/results?search_query=cpp+vector+iterator+invalidation+kannada,https://youtube.com/results?search_query=cpp+vector+iterator+invalidation+tamil,https://youtube.com/results?search_query=cpp+vector+iterator+invalidation+telugu
Cpp,Advanced,How does std::chrono provide type-safe time calculations and conversions?,Time library,Type safety,Units,Compile-time checking,A,"std::chrono uses strong types for different time units and durations, preventing incorrect conversions at compile time.",STL,https://en.cppreference.com/w/cpp/chrono,https://youtube.com/results?search_query=cpp+chrono+type+safety,https://youtube.com/results?search_query=cpp+chrono+type+safety+hindi,https://youtube.com/results?search_query=cpp+chrono+type+safety+kannada,https://youtube.com/results?search_query=cpp+chrono+type+safety+tamil,https://youtube.com/results?search_query=cpp+chrono+type+safety+telugu
Cpp,Advanced,What are the differences between std::map and std::multimap in terms of key uniqueness?,Associative containers,Duplicate keys,Binary search trees,Lookup semantics,A,"std::map requires unique keys, while std::multimap allows multiple elements with the same key.",STL,https://en.cppreference.com/w/cpp/container/multimap,https://youtube.com/results?search_query=cpp+map+vs+multimap,https://youtube.com/results?search_query=cpp+map+vs+multimap+hindi,https://youtube.com/results?search_query=cpp+map+vs+multimap+kannada,https://youtube.com/results?search_query=cpp+map+vs+multimap+tamil,https://youtube.com/results?search_query=cpp+map+vs+multimap+telugu
Cpp,Advanced,How does move-only types affect container operations and algorithm usage?,Unique ownership,Non-copyable types,Container requirements,Algorithm constraints,A,Move-only types can be stored in containers but limit algorithm usage since many algorithms require copyable types.,STL,https://en.cppreference.com/w/cpp/concepts/copyable,https://youtube.com/results?search_query=cpp+move+only+types+containers,https://youtube.com/results?search_query=cpp+move+only+types+containers+hindi,https://youtube.com/results?search_query=cpp+move+only+types+containers+kannada,https://youtube.com/results?search_query=cpp+move+only+types+containers+tamil,https://youtube.com/results?search_query=cpp+move+only+types+containers+telugu
Cpp,Advanced,What are the guarantees and limitations of std::string_view's lifetime management?,Non-owning views,String references,Lifetime dependencies,Performance optimization,A,std::string_view doesn't manage memory lifetime; it's the programmer's responsibility to ensure the referenced data outlives the view.,STL,https://en.cppreference.com/w/cpp/string/basic_string_view,https://youtube.com/results?search_query=cpp+string_view+lifetime,https://youtube.com/results?search_query=cpp+string_view+lifetime+hindi,https://youtube.com/results?search_query=cpp+string_view+lifetime+kannada,https://youtube.com/results?search_query=cpp+string_view+lifetime+tamil,https://youtube.com/results?search_query=cpp+string_view+lifetime+telugu
Cpp,Advanced,How does the allocator-aware interface enable custom memory management in STL containers?,Allocators,Memory management,Container customization,Policy-based design,A,"STL containers accept allocator template parameters, allowing custom memory allocation strategies while maintaining container interfaces.",Memory Management,https://en.cppreference.com/w/cpp/named_req/Allocator,https://youtube.com/results?search_query=cpp+allocator+aware+containers,https://youtube.com/results?search_query=cpp+allocator+aware+containers+hindi,https://youtube.com/results?search_query=cpp+allocator+aware+containers+kannada,https://youtube.com/results?search_query=cpp+allocator+aware+containers+tamil,https://youtube.com/results?search_query=cpp+allocator+aware+containers+telugu
Cpp,Advanced,What are the thread safety implications of using static initialization within templates?,Template instantiation,Static variables,Thread safety,Singleton patterns,A,"Static variables within function templates have separate instances for each instantiation, with thread-safe initialization per C++11.",Templates,https://en.cppreference.com/w/cpp/language/storage_duration,https://youtube.com/results?search_query=cpp+template+static+thread+safety,https://youtube.com/results?search_query=cpp+template+static+thread+safety+hindi,https://youtube.com/results?search_query=cpp+template+static+thread+safety+kannada,https://youtube.com/results?search_query=cpp+template+static+thread+safety+tamil,https://youtube.com/results?search_query=cpp+template+static+thread+safety+telugu
Cpp,Advanced,How does std::optional's value_or method provide safe fallback values?,Optional values,Fallback semantics,Default values,Error handling,A,"value_or returns the contained value or a provided default if the optional is empty, ensuring a valid value is always returned.",STL,https://en.cppreference.com/w/cpp/utility/optional/value_or,https://youtube.com/results?search_query=cpp+optional+value_or,https://youtube.com/results?search_query=cpp+optional+value_or+hindi,https://youtube.com/results?search_query=cpp+optional+value_or+kannada,https://youtube.com/results?search_query=cpp+optional+value_or+tamil,https://youtube.com/results?search_query=cpp+optional+value_or+telugu
Cpp,Advanced,What are the differences between intrusive and non-intrusive smart pointer implementations?,Memory management,Reference counting,Container integration,Performance tradeoffs,A,"Intrusive smart pointers store reference count within the object, while non-intrusive ones store it separately, affecting memory layout and performance.",Memory Management,https://en.cppreference.com/w/cpp/memory/shared_ptr,https://youtube.com/results?search_query=cpp+intrusive+smart+pointers,https://youtube.com/results?search_query=cpp+intrusive+smart+pointers+hindi,https://youtube.com/results?search_query=cpp+intrusive+smart+pointers+kannada,https://youtube.com/results?search_query=cpp+intrusive+smart+pointers+tamil,https://youtube.com/results?search_query=cpp+intrusive+smart+pointers+telugu
Cpp,Advanced,How does std::generate_n differ from std::generate in terms of iterator requirements?,Algorithm requirements,Output iterators,Iterator categories,Range generation,A,"std::generate_n takes a count and doesn't need an end iterator, making it suitable for output iterators without a defined range end.",STL,https://en.cppreference.com/w/cpp/algorithm/generate_n,https://youtube.com/results?search_query=cpp+generate_n+vs+generate,https://youtube.com/results?search_query=cpp+generate_n+vs+generate+hindi,https://youtube.com/results?search_query=cpp+generate_n+vs+generate+kannada,https://youtube.com/results?search_query=cpp+generate_n+vs+generate+tamil,https://youtube.com/results?search_query=cpp+generate_n+vs+generate+telugu
Cpp,Advanced,What are the memory allocation strategies used by different STL allocator implementations?,Memory pools,Allocation strategies,Fragmentation,Performance optimization,A,"STL allocators can use strategies like pooling, slab allocation, or arena allocation to optimize for specific use cases.",Memory Management,https://en.cppreference.com/w/cpp/named_req/Allocator,https://youtube.com/results?search_query=cpp+allocator+strategies,https://youtube.com/results?search_query=cpp+allocator+strategies+hindi,https://youtube.com/results?search_query=cpp+allocator+strategies+kannada,https://youtube.com/results?search_query=cpp+allocator+strategies+tamil,https://youtube.com/results?search_query=cpp+allocator+strategies+telugu
Cpp,Advanced,How does the Pimpl idiom reduce compilation dependencies and improve compile times?,Compilation firewall,Binary compatibility,Header dependencies,Design patterns,A,"Pimpl separates implementation details into a forward-declared class, reducing header dependencies and recompilation.",Design Patterns,https://en.cppreference.com/w/cpp/language/pimpl,https://youtube.com/results?search_query=cpp+pimpl+compilation,https://youtube.com/results?search_query=cpp+pimpl+compilation+hindi,https://youtube.com/results?search_query=cpp+pimpl+compilation+kannada,https://youtube.com/results?search_query=cpp+pimpl+compilation+tamil,https://youtube.com/results?search_query=cpp+pimpl+compilation+telugu
Cpp,Advanced,What are the type erasure techniques used by std::function to store arbitrary callables?,Callable storage,Type erasure,Function objects,Virtual dispatch,A,std::function uses type erasure through templates and virtual function calls to store and invoke different callable types.,STL,https://en.cppreference.com/w/cpp/utility/functional/function,https://youtube.com/results?search_query=cpp+std+function+type+erasure,https://youtube.com/results?search_query=cpp+std+function+type+erasure+hindi,https://youtube.com/results?search_query=cpp+std+function+type+erasure+kannada,https://youtube.com/results?search_query=cpp+std+function+type+erasure+tamil,https://youtube.com/results?search_query=cpp+std+function+type+erasure+telugu
Cpp,Advanced,How does std::accumulate differ from std::reduce in terms of parallelization safety?,Parallel algorithms,Associative operations,Ordering guarantees,Performance optimization,A,"std::reduce can be parallelized and doesn't require strict left-to-right evaluation, while std::accumulate is strictly sequential.",STL,https://en.cppreference.com/w/cpp/algorithm/reduce,https://youtube.com/results?search_query=cpp+reduce+vs+accumulate,https://youtube.com/results?search_query=cpp+reduce+vs+accumulate+hindi,https://youtube.com/results?search_query=cpp+reduce+vs+accumulate+kannada,https://youtube.com/results?search_query=cpp+reduce+vs+accumulate+tamil,https://youtube.com/results?search_query=cpp+reduce+vs+accumulate+telugu
Cpp,Advanced,What are the cache locality implications of different STL container memory layouts?,CPU cache,Memory access patterns,Performance optimization,Container design,A,Contiguous containers like std::vector have better cache locality than node-based containers like std::list or std::map.,Performance,https://en.cppreference.com/w/cpp/container,https://youtube.com/results?search_query=cpp+cache+locality+containers,https://youtube.com/results?search_query=cpp+cache+locality+containers+hindi,https://youtube.com/results?search_query=cpp+cache+locality+containers+kannada,https://youtube.com/results?search_query=cpp+cache+locality+containers+tamil,https://youtube.com/results?search_query=cpp+cache+locality+containers+telugu
Cpp,Advanced,How does std::invoke provide uniform call syntax for different callable types?,Callable invocation,Member pointers,Function objects,Uniform syntax,A,"std::invoke handles different callable types (functions, member functions, member objects) with a uniform syntax.",STL,https://en.cppreference.com/w/cpp/utility/functional/invoke,https://youtube.com/results?search_query=cpp+std+invoke,https://youtube.com/results?search_query=cpp+std+invoke+hindi,https://youtube.com/results?search_query=cpp+std+invoke+kannada,https://youtube.com/results?search_query=cpp+std+invoke+tamil,https://youtube.com/results?search_query=cpp+std+invoke+telugu
Cpp,Advanced,What are the differences between std::scoped_lock and std::lock_guard in C++17?,Mutex management,Deadlock avoidance,RAII locks,Concurrency,A,"std::scoped_lock can lock multiple mutexes atomically preventing deadlocks, while std::lock_guard handles only one mutex.",Concurrency,https://en.cppreference.com/w/cpp/thread/scoped_lock,https://youtube.com/results?search_query=cpp+scoped_lock+vs+lock_guard,https://youtube.com/results?search_query=cpp+scoped_lock+vs+lock_guard+hindi,https://youtube.com/results?search_query=cpp+scoped_lock+vs+lock_guard+kannada,https://youtube.com/results?search_query=cpp+scoped_lock+vs+lock_guard+tamil,https://youtube.com/results?search_query=cpp+scoped_lock+vs+lock_guard+telugu
Cpp,Advanced,How does std::byte provide type-safe byte manipulation compared to unsigned char?,Byte manipulation,Type safety,Bit operations,Memory access,A,std::byte is a distinct type for byte manipulation that prevents accidental integer arithmetic and provides only bitwise operations.,STL,https://en.cppreference.com/w/cpp/types/byte,https://youtube.com/results?search_query=cpp+std+byte+type+safety,https://youtube.com/results?search_query=cpp+std+byte+type+safety+hindi,https://youtube.com/results?search_query=cpp+std+byte+type+safety+kannada,https://youtube.com/results?search_query=cpp+std+byte+type+safety+tamil,https://youtube.com/results?search_query=cpp+std+byte+type+safety+telugu
Cpp,Advanced,What are the performance tradeoffs between exception handling and error codes?,Error handling,Performance costs,Zero-cost exceptions,Control flow,A,"Exceptions have zero cost when not thrown but expensive when thrown, while error codes have constant overhead but predictable performance.",Error Handling,https://en.cppreference.com/w/cpp/language/exceptions,https://youtube.com/results?search_query=cpp+exceptions+vs+error+codes+performance,https://youtube.com/results?search_query=cpp+exceptions+vs+error+codes+performance+hindi,https://youtube.com/results?search_query=cpp+exceptions+vs+error+codes+performance+kannada,https://youtube.com/results?search_query=cpp+exceptions+vs+error+codes+performance+tamil,https://youtube.com/results?search_query=cpp+exceptions+vs+error+codes+performance+telugu
Cpp,Advanced,How does std::is_constant_evaluated enable different compile-time and runtime code paths?,Compile-time detection,constexpr branching,Optimization,Code generation,A,"std::is_constant_evaluated returns true in constexpr contexts, allowing different implementations for compile-time vs runtime evaluation.",Core Concepts,https://en.cppreference.com/w/cpp/types/is_constant_evaluated,https://youtube.com/results?search_query=cpp+is_constant_evaluated,https://youtube.com/results?search_query=cpp+is_constant_evaluated+hindi,https://youtube.com/results?search_query=cpp+is_constant_evaluated+kannada,https://youtube.com/results?search_query=cpp+is_constant_evaluated+tamil,https://youtube.com/results?search_query=cpp+is_constant_evaluated+telugu
Cpp,Advanced,What are the memory ordering requirements for implementing spin locks with atomics?,Synchronization,Lock implementation,Memory barriers,Concurrency primitives,A,Spin locks require acquire semantics on lock and release semantics on unlock to ensure critical section protection.,Concurrency,https://en.cppreference.com/w/cpp/atomic/atomic_flag,https://youtube.com/results?search_query=cpp+spinlock+memory+ordering,https://youtube.com/results?search_query=cpp+spinlock+memory+ordering+hindi,https://youtube.com/results?search_query=cpp+spinlock+memory+ordering+kannada,https://youtube.com/results?search_query=cpp+spinlock+memory+ordering+tamil,https://youtube.com/results?search_query=cpp+spinlock+memory+ordering+telugu
Cpp,Advanced,How does std::variant's valueless_by_exception state occur and how to handle it?,Exception safety,Variant states,Error handling,Robust programming,A,"valueless_by_exception occurs when a variant's assignment throws, leaving it empty; it can be checked with valueless_by_exception() method.",STL,https://en.cppreference.com/w/cpp/utility/variant/valueless_by_exception,https://youtube.com/results?search_query=cpp+variant+valueless+by+exception,https://youtube.com/results?search_query=cpp+variant+valueless+by+exception+hindi,https://youtube.com/results?search_query=cpp+variant+valueless+by+exception+kannada,https://youtube.com/results?search_query=cpp+variant+valueless+by+exception+tamil,https://youtube.com/results?search_query=cpp+variant+valueless+by+exception+telugu
Cpp,Advanced,What are the alignment requirements for over-aligned types and how to allocate them?,Memory alignment,Custom alignment,Cache lines,SIMD optimization,A,Over-aligned types require alignment greater than alignof(std::max_align_t) and need specialized allocation like aligned_alloc.,Memory Management,https://en.cppreference.com/w/cpp/types/max_align_t,https://youtube.com/results?search_query=cpp+over+aligned+allocation,https://youtube.com/results?search_query=cpp+over+aligned+allocation+hindi,https://youtube.com/results?search_query=cpp+over+aligned+allocation+kannada,https://youtube.com/results?search_query=cpp+over+aligned+allocation+tamil,https://youtube.com/results?search_query=cpp+over+aligned+allocation+telugu
Cpp,Advanced,How does std::atomic's compare_exchange_weak handle spurious failures in lock-free algorithms?,Atomic operations,Lock-free programming,Compare-and-swap,Concurrency,A,"compare_exchange_weak may fail spuriously due to platform constraints, requiring loops in lock-free algorithms.",Concurrency,https://en.cppreference.com/w/cpp/atomic/atomic/compare_exchange,https://youtube.com/results?search_query=cpp+compare_exchange_weak,https://youtube.com/results?search_query=cpp+compare_exchange_weak+hindi,https://youtube.com/results?search_query=cpp+compare_exchange_weak+kannada,https://youtube.com/results?search_query=cpp+compare_exchange_weak+tamil,https://youtube.com/results?search_query=cpp+compare_exchange_weak+telugu
Cpp,Advanced,What are the differences between std::forward_list and std::list in terms of memory overhead?,Singly-linked list,Doubly-linked list,Memory efficiency,Iterator capabilities,A,"std::forward_list uses less memory per node (no back pointer) but only supports forward iteration, unlike std::list's bidirectional iteration.",STL,https://en.cppreference.com/w/cpp/container/forward_list,https://youtube.com/results?search_query=cpp+forward_list+vs+list,https://youtube.com/results?search_query=cpp+forward_list+vs+list+hindi,https://youtube.com/results?search_query=cpp+forward_list+vs+list+kannada,https://youtube.com/results?search_query=cpp+forward_list+vs+list+tamil,https://youtube.com/results?search_query=cpp+forward_list+vs+list+telugu
