skill,level,question_text,option_a,option_b,option_c,option_d,correct_answer,explanation,topic,mdn_link,youtube_english,youtube_hindi,youtube_kannada,youtube_tamil,youtube_telugu
Cpp,Advanced,When should you implement move constructors instead of copy constructors?,Performance optimization,Resource transfer,rvalue usage,Move semantics,A,Implement move constructors when objects manage expensive resources that can be transferred instead of copied.,Core Concepts,https://en.cppreference.com/w/cpp/language/move_constructor,https://youtube.com/results?search_query=cpp+move+vs+copy,https://youtube.com/results?search_query=cpp+move+vs+copy+hindi,https://youtube.com/results?search_query=cpp+move+vs+copy+kannada,https://youtube.com/results?search_query=cpp+move+vs+copy+tamil,https://youtube.com/results?search_query=cpp+move+vs+copy+telugu
Cpp,Advanced,How does perfect forwarding eliminate unnecessary copies in template functions?,Universal references,Argument forwarding,Performance,Template optimization,A,"Perfect forwarding preserves value categories, allowing rvalues to be moved instead of copied.",Templates,https://en.cppreference.com/w/cpp/utility/forward,https://youtube.com/results?search_query=cpp+perfect+forwarding+optimization,https://youtube.com/results?search_query=cpp+perfect+forwarding+optimization+hindi,https://youtube.com/results?search_query=cpp+perfect+forwarding+optimization+kannada,https://youtube.com/results?search_query=cpp+perfect+forwarding+optimization+tamil,https://youtube.com/results?search_query=cpp+perfect+forwarding+optimization+telugu
Cpp,Advanced,Can SFINAE detect if a class has a specific member function at compile time?,Template metaprogramming,Type checking,Member detection,Compile-time reflection,A,"Yes, SFINAE can be used to create traits that check for member function existence.",Templates,https://en.cppreference.com/w/cpp/language/sfinae,https://youtube.com/results?search_query=cpp+sfinae+member+detection,https://youtube.com/results?search_query=cpp+sfinae+member+detection+hindi,https://youtube.com/results?search_query=cpp+sfinae+member+detection+kannada,https://youtube.com/results?search_query=cpp+sfinae+member+detection+tamil,https://youtube.com/results?search_query=cpp+sfinae+member+detection+telugu
Cpp,Advanced,How does CRTP achieve static polymorphism without virtual function overhead?,Template inheritance,Compile-time dispatch,Performance optimization,Design patterns,A,"CRTP uses compile-time method resolution through templates, avoiding runtime vtable lookups.",Design Patterns,https://en.cppreference.com/w/cpp/language/crtp,https://youtube.com/results?search_query=cpp+crtp+performance,https://youtube.com/results?search_query=cpp+crtp+performance+hindi,https://youtube.com/results?search_query=cpp+crtp+performance+kannada,https://youtube.com/results?search_query=cpp+crtp+performance+tamil,https://youtube.com/results?search_query=cpp+crtp+performance+telugu
Cpp,Advanced,What are the performance implications of using std::any for type erasure?,Runtime polymorphism,Dynamic allocation,Type safety,Performance costs,A,"std::any involves heap allocation and type checking overhead, making it slower than template-based solutions.",Design Patterns,https://en.cppreference.com/w/cpp/utility/any,https://youtube.com/results?search_query=cpp+std+any+performance,https://youtube.com/results?search_query=cpp+std+any+performance+hindi,https://youtube.com/results?search_query=cpp+std+any+performance+kannada,https://youtube.com/results?search_query=cpp+std+any+performance+tamil,https://youtube.com/results?search_query=cpp+std+any+performance+telugu
Cpp,Advanced,How can expression templates optimize matrix operations at compile time?,Template metaprogramming,Lazy evaluation,Matrix math,Compile-time optimization,A,"Expression templates create temporary expression objects that compute results in single loops, avoiding intermediate copies.",Templates,https://en.cppreference.com/w/cpp/language/expression_templates,https://youtube.com/results?search_query=cpp+expression+templates+matrix,https://youtube.com/results?search_query=cpp+expression+templates+matrix+hindi,https://youtube.com/results?search_query=cpp+expression+templates+matrix+kannada,https://youtube.com/results?search_query=cpp+expression+templates+matrix+tamil,https://youtube.com/results?search_query=cpp+expression+templates+matrix+telugu
Cpp,Advanced,Why does std::launder exist and when must you use it?,Pointer optimization,Memory model,Object lifetime,Compiler barriers,A,std::launder informs the compiler about object reuse in memory to prevent incorrect optimizations.,Memory Management,https://en.cppreference.com/w/cpp/utility/launder,https://youtube.com/results?search_query=cpp+std+launder,https://youtube.com/results?search_query=cpp+std+launder+hindi,https://youtube.com/results?search_query=cpp+std+launder+kannada,https://youtube.com/results?search_query=cpp+std+launder+tamil,https://youtube.com/results?search_query=cpp+std+launder+telugu
Cpp,Advanced,How does std::variant achieve type-safe union with visitor pattern?,Sum types,Pattern matching,Type-safe unions,std::visit,A,std::variant stores one of multiple types and uses visitation for type-safe access with compile-time checking.,STL,https://en.cppreference.com/w/cpp/utility/variant,https://youtube.com/results?search_query=cpp+variant+visitor,https://youtube.com/results?search_query=cpp+variant+visitor+hindi,https://youtube.com/results?search_query=cpp+variant+visitor+kannada,https://youtube.com/results?search_query=cpp+variant+visitor+tamil,https://youtube.com/results?search_query=cpp+variant+visitor+telugu
Cpp,Advanced,When would you use placement new instead of regular new?,Memory pools,Custom allocation,Object construction,Performance optimization,A,"Placement new constructs objects in pre-allocated memory, useful for custom allocators and memory pools.",Memory Management,https://en.cppreference.com/w/cpp/language/new,https://youtube.com/results?search_query=cpp+placement+new,https://youtube.com/results?search_query=cpp+placement+new+hindi,https://youtube.com/results?search_query=cpp+placement+new+kannada,https://youtube.com/results?search_query=cpp+placement+new+tamil,https://youtube.com/results?search_query=cpp+placement+new+telugu
Cpp,Advanced,How does constexpr enable compile-time computation in modern C++?,Compile-time evaluation,Constant expressions,Template metaprogramming,Performance optimization,A,"constexpr allows functions and variables to be evaluated at compile time, reducing runtime overhead.",Core Concepts,https://en.cppreference.com/w/cpp/language/constexpr,https://youtube.com/results?search_query=cpp+constexpr+compile+time,https://youtube.com/results?search_query=cpp+constexpr+compile+time+hindi,https://youtube.com/results?search_query=cpp+constexpr+compile+time+kannada,https://youtube.com/results?search_query=cpp+constexpr+compile+time+tamil,https://youtube.com/results?search_query=cpp+constexpr+compile+time+telugu
Cpp,Advanced,What are the memory ordering guarantees in C++ atomics and when to use each?,Multithreading,Memory barriers,Concurrency,Atomic operations,A,"C++ provides several memory orderings (relaxed, acquire-release, seq_cst) with different synchronization guarantees.",Concurrency,https://en.cppreference.com/w/cpp/atomic/memory_order,https://youtube.com/results?search_query=cpp+atomic+memory+ordering,https://youtube.com/results?search_query=cpp+atomic+memory+ordering+hindi,https://youtube.com/results?search_query=cpp+atomic+memory+ordering+kannada,https://youtube.com/results?search_query=cpp+atomic+memory+ordering+tamil,https://youtube.com/results?search_query=cpp+atomic+memory+ordering+telugu
Cpp,Advanced,How does copy elision optimize return value handling in C++17?,Return value optimization,Mandatory copy elision,Performance,Named return value optimization,A,"C++17 mandates copy elision in certain cases, allowing objects to be constructed directly at their destination.",Core Concepts,https://en.cppreference.com/w/cpp/language/copy_elision,https://youtube.com/results?search_query=cpp+copy+elision+c++17,https://youtube.com/results?search_query=cpp+copy+elision+c++17+hindi,https://youtube.com/results?search_query=cpp+copy+elision+c++17+kannada,https://youtube.com/results?search_query=cpp+copy+elision+c++17+tamil,https://youtube.com/results?search_query=cpp+copy+elision+c++17+telugu
Cpp,Advanced,What is the Rule of Five and when does it apply to class design?,Copy control,Move semantics,Resource management,Destructor,A,"The Rule of Five states that if you define any of destructor, copy/move constructor, or copy/move assignment, you should define all five.",Core Concepts,https://en.cppreference.com/w/cpp/language/rule_of_three,https://youtube.com/results?search_query=cpp+rule+of+five,https://youtube.com/results?search_query=cpp+rule+of+five+hindi,https://youtube.com/results?search_query=cpp+rule+of+five+kannada,https://youtube.com/results?search_query=cpp+rule+of+five+tamil,https://youtube.com/results?search_query=cpp+rule+of+five+telugu
Cpp,Advanced,How does std::optional avoid the overhead of heap allocation for nullable types?,Value semantics,Stack allocation,Nullable types,No heap overhead,A,"std::optional uses value semantics with internal storage and a bool flag, avoiding dynamic allocation.",STL,https://en.cppreference.com/w/cpp/utility/optional,https://youtube.com/results?search_query=cpp+optional+performance,https://youtube.com/results?search_query=cpp+optional+performance+hindi,https://youtube.com/results?search_query=cpp+optional+performance+kannada,https://youtube.com/results?search_query=cpp+optional+performance+tamil,https://youtube.com/results?search_query=cpp+optional+performance+telugu
Cpp,Advanced,What are dangling references and how can they be prevented in modern C++?,Lifetime issues,Reference safety,Smart pointers,RAII,A,"Dangling references occur when a reference outlives its referent; prevention includes using value semantics, smart pointers, and careful lifetime management.",Memory Management,https://en.cppreference.com/w/cpp/language/reference,https://youtube.com/results?search_query=cpp+dangling+references,https://youtube.com/results?search_query=cpp+dangling+references+hindi,https://youtube.com/results?search_query=cpp+dangling+references+kannada,https://youtube.com/results?search_query=cpp+dangling+references+tamil,https://youtube.com/results?search_query=cpp+dangling+references+telugu
Cpp,Advanced,How does type punning via unions differ from std::memcpy in terms of strict aliasing?,Strict aliasing rule,Type punning,Undefined behavior,Memory access,A,"Type punning through unions has implementation-defined behavior, while std::memcpy is always well-defined under strict aliasing.",Memory Management,https://en.cppreference.com/w/cpp/language/union,https://youtube.com/results?search_query=cpp+type+punning+strict+aliasing,https://youtube.com/results?search_query=cpp+type+punning+strict+aliasing+hindi,https://youtube.com/results?search_query=cpp+type+punning+strict+aliasing+kannada,https://youtube.com/results?search_query=cpp+type+punning+strict+aliasing+tamil,https://youtube.com/results?search_query=cpp+type+punning+strict+aliasing+telugu
Cpp,Advanced,What are immediate functions (consteval) and how do they differ from constexpr?,Compile-time functions,Constant evaluation,Error checking,Template constraints,A,"consteval functions must produce compile-time constants and guarantee compile-time evaluation, unlike constexpr which can also run at runtime.",Core Concepts,https://en.cppreference.com/w/cpp/language/consteval,https://youtube.com/results?search_query=cpp+consteval+vs+constexpr,https://youtube.com/results?search_query=cpp+consteval+vs+constexpr+hindi,https://youtube.com/results?search_query=cpp+consteval+vs+constexpr+kannada,https://youtube.com/results?search_query=cpp+consteval+vs+constexpr+tamil,https://youtube.com/results?search_query=cpp+consteval+vs+constexpr+telugu
Cpp,Advanced,How does std::expected handle errors without exceptions in C++23?,Error handling,Expected monad,Non-throwing errors,Value-or-error,A,"std::expected encapsulates either a value or an error, providing type-safe error handling without exceptions.",Error Handling,https://en.cppreference.com/w/cpp/utility/expected,https://youtube.com/results?search_query=cpp+expected+error+handling,https://youtube.com/results?search_query=cpp+expected+error+handling+hindi,https://youtube.com/results?search_query=cpp+expected+error+handling+kannada,https://youtube.com/results?search_query=cpp+expected+error+handling+tamil,https://youtube.com/results?search_query=cpp+expected+error+handling+telugu
Cpp,Advanced,What are coroutines and how do they enable asynchronous programming without callbacks?,Asynchronous programming,Suspend/resume,State machines,Generators,A,"Coroutines allow functions to suspend and resume execution, enabling async code that looks synchronous.",Concurrency,https://en.cppreference.com/w/cpp/coroutine,https://youtube.com/results?search_query=cpp+coroutines+async,https://youtube.com/results?search_query=cpp+coroutines+async+hindi,https://youtube.com/results?search_query=cpp+coroutines+async+kannada,https://youtube.com/results?search_query=cpp+coroutines+async+tamil,https://youtube.com/results?search_query=cpp+coroutines+async+telugu
Cpp,Advanced,How does the spaceship operator (<=>) simplify comparison operator implementations?,Three-way comparison,Comparison categories,Synthesized operators,Operator reduction,A,"The spaceship operator generates ==, !=, <, >, <=, >= automatically based on its return type and comparison category.",Core Concepts,https://en.cppreference.com/w/cpp/language/operator_comparison,https://youtube.com/results?search_query=cpp+spaceship+operator,https://youtube.com/results?search_query=cpp+spaceship+operator+hindi,https://youtube.com/results?search_query=cpp+spaceship+operator+kannada,https://youtube.com/results?search_query=cpp+spaceship+operator+tamil,https://youtube.com/results?search_query=cpp+spaceship+operator+telugu
Cpp,Advanced,What are the differences between std::unique_ptr and std::shared_ptr regarding thread safety?,Smart pointers,Ownership semantics,Atomic operations,Thread safety,A,"std::unique_ptr has no thread-safe operations, while std::shared_ptr's reference count is thread-safe but not the managed object.",Memory Management,https://en.cppreference.com/w/cpp/memory/shared_ptr,https://youtube.com/results?search_query=cpp+smart+pointers+thread+safety,https://youtube.com/results?search_query=cpp+smart+pointers+thread+safety+hindi,https://youtube.com/results?search_query=cpp+smart+pointers+thread+safety+kannada,https://youtube.com/results?search_query=cpp+smart+pointers+thread+safety+tamil,https://youtube.com/results?search_query=cpp+smart+pointers+thread+safety+telugu
Cpp,Advanced,How does std::pmr (Polymorphic Memory Resources) enable custom memory allocation strategies?,Memory allocation,Allocators,Memory pools,Performance optimization,A,std::pmr provides a framework for custom allocators that can be composed and swapped at runtime.,Memory Management,https://en.cppreference.com/w/cpp/memory/polymorphic_allocator,https://youtube.com/results?search_query=cpp+pmr+memory+resources,https://youtube.com/results?search_query=cpp+pmr+memory+resources+hindi,https://youtube.com/results?search_query=cpp+pmr+memory+resources+kannada,https://youtube.com/results?search_query=cpp+pmr+memory+resources+tamil,https://youtube.com/results?search_query=cpp+pmr+memory+resources+telugu
Cpp,Advanced,What are constexpr virtual functions and when are they useful?,Compile-time polymorphism,Runtime interface,Abstract classes,constexpr virtual,A,constexpr virtual functions allow compile-time polymorphism through virtual function calls in constant expressions.,Core Concepts,https://en.cppreference.com/w/cpp/language/constexpr,https://youtube.com/results?search_query=cpp+constexpr+virtual,https://youtube.com/results?search_query=cpp+constexpr+virtual+hindi,https://youtube.com/results?search_query=cpp+constexpr+virtual+kannada,https://youtube.com/results?search_query=cpp+constexpr+virtual+tamil,https://youtube.com/results?search_query=cpp+constexpr+virtual+telugu
Cpp,Advanced,How does std::source_location replace __FILE__ and __LINE__ macros in modern C++?,Debugging,Source information,Compile-time information,Macro replacement,A,"std::source_location provides file, line, column, and function name as a constexpr struct without macros.",Debugging,https://en.cppreference.com/w/cpp/utility/source_location,https://youtube.com/results?search_query=cpp+source+location,https://youtube.com/results?search_query=cpp+source+location+hindi,https://youtube.com/results?search_query=cpp+source+location+kannada,https://youtube.com/results?search_query=cpp+source+location+tamil,https://youtube.com/results?search_query=cpp+source+location+telugu
Cpp,Advanced,What are forwarding references and how do they differ from rvalue references?,Template deduction,Universal references,Perfect forwarding,Type deduction,A,Forwarding references are template parameters that deduce to either lvalue or rvalue references based on the argument.,Templates,https://en.cppreference.com/w/cpp/language/template_argument_deduction,https://youtube.com/results?search_query=cpp+forwarding+references,https://youtube.com/results?search_query=cpp+forwarding+references+hindi,https://youtube.com/results?search_query=cpp+forwarding+references+kannada,https://youtube.com/results?search_query=cpp+forwarding+references+tamil,https://youtube.com/results?search_query=cpp+forwarding+references+telugu
Cpp,Advanced,How does std::bit_cast enable type punning without undefined behavior?,Type punning,Memory representation,Strict aliasing,constexpr conversion,A,"std::bit_cast performs a bitwise reinterpretation of an object's representation, guaranteed to be well-defined.",Memory Management,https://en.cppreference.com/w/cpp/numeric/bit_cast,https://youtube.com/results?search_query=cpp+bit_cast,https://youtube.com/results?search_query=cpp+bit_cast+hindi,https://youtube.com/results?search_query=cpp+bit_cast+kannada,https://youtube.com/results?search_query=cpp+bit_cast+tamil,https://youtube.com/results?search_query=cpp+bit_cast+telugu
Cpp,Advanced,What is the small string optimization and how does it work in std::string?,Memory optimization,Short string optimization,Stack allocation,String performance,A,SSO stores small strings directly in the string object's buffer instead of heap-allocating memory.,STL,https://en.cppreference.com/w/cpp/string/basic_string,https://youtube.com/results?search_query=cpp+small+string+optimization,https://youtube.com/results?search_query=cpp+small+string+optimization+hindi,https://youtube.com/results?search_query=cpp+small+string+optimization+kannada,https://youtube.com/results?search_query=cpp+small+string+optimization+tamil,https://youtube.com/results?search_query=cpp+small+string+optimization+telugu
Cpp,Advanced,How do concepts improve template error messages and constraints in C++20?,Template constraints,Type requirements,Compile-time checking,Error messages,A,"Concepts specify template parameter requirements, producing clearer error messages and enabling better overload resolution.",Templates,https://en.cppreference.com/w/cpp/language/constraints,https://youtube.com/results?search_query=cpp+concepts+error+messages,https://youtube.com/results?search_query=cpp+concepts+error+messages+hindi,https://youtube.com/results?search_query=cpp+concepts+error+messages+kannada,https://youtube.com/results?search_query=cpp+concepts+error+messages+tamil,https://youtube.com/results?search_query=cpp+concepts+error+messages+telugu
Cpp,Advanced,What are the thread safety guarantees of std::function when copied between threads?,Function objects,Callable wrappers,Thread safety,Concurrent access,A,"std::function objects are not thread-safe for concurrent invocation or modification, but independent copies can be used in different threads.",Concurrency,https://en.cppreference.com/w/cpp/utility/functional/function,https://youtube.com/results?search_query=cpp+std+function+thread+safety,https://youtube.com/results?search_query=cpp+std+function+thread+safety+hindi,https://youtube.com/results?search_query=cpp+std+function+thread+safety+kannada,https://youtube.com/results?search_query=cpp+std+function+thread+safety+tamil,https://youtube.com/results?search_query=cpp+std+function+thread+safety+telugu
Cpp,Advanced,How does std::atomic_ref enable atomic operations on non-atomic variables?,Atomic operations,Memory synchronization,Reference semantics,Concurrency,A,std::atomic_ref provides atomic access to existing objects without requiring them to be declared atomic initially.,Concurrency,https://en.cppreference.com/w/cpp/atomic/atomic_ref,https://youtube.com/results?search_query=cpp+atomic_ref,https://youtube.com/results?search_query=cpp+atomic_ref+hindi,https://youtube.com/results?search_query=cpp+atomic_ref+kannada,https://youtube.com/results?search_query=cpp+atomic_ref+tamil,https://youtube.com/results?search_query=cpp+atomic_ref+telugu
Cpp,Advanced,What are designated initializers and how do they improve struct initialization?,Struct initialization,Named members,Aggregate initialization,C++20 features,A,"Designated initializers allow specifying struct members by name during initialization, improving readability and safety.",Core Concepts,https://en.cppreference.com/w/cpp/language/aggregate_initialization,https://youtube.com/results?search_query=cpp+designated+initializers,https://youtube.com/results?search_query=cpp+designated+initializers+hindi,https://youtube.com/results?search_query=cpp+designated+initializers+kannada,https://youtube.com/results?search_query=cpp+designated+initializers+tamil,https://youtube.com/results?search_query=cpp+designated+initializers+telugu
Cpp,Advanced,How does std::jthread differ from std::thread in terms of resource management?,Thread management,RAII threads,Automatic joining,Stop tokens,A,std::jthread automatically joins on destruction and supports cooperative interruption via stop tokens.,Concurrency,https://en.cppreference.com/w/cpp/thread/jthread,https://youtube.com/results?search_query=cpp+jthread+vs+thread,https://youtube.com/results?search_query=cpp+jthread+vs+thread+hindi,https://youtube.com/results?search_query=cpp+jthread+vs+thread+kannada,https://youtube.com/results?search_query=cpp+jthread+vs+thread+tamil,https://youtube.com/results?search_query=cpp+jthread+vs+thread+telugu
Cpp,Advanced,What is the time complexity of std::unordered_map operations and when can it degrade?,Hash tables,Collision resolution,Bucket management,Performance degradation,A,std::unordered_map has average O(1) operations but can degrade to O(n) with many hash collisions or poor hash function.,STL,https://en.cppreference.com/w/cpp/container/unordered_map,https://youtube.com/results?search_query=cpp+unordered_map+performance,https://youtube.com/results?search_query=cpp+unordered_map+performance+hindi,https://youtube.com/results?search_query=cpp+unordered_map+performance+kannada,https://youtube.com/results?search_query=cpp+unordered_map+performance+tamil,https://youtube.com/results?search_query=cpp+unordered_map+performance+telugu
Cpp,Advanced,How does std::span provide bounds-safe array access without ownership?,View types,Array views,Bounds checking,Non-owning references,A,std::span is a non-owning view over a contiguous sequence that provides bounds-checked access in debug builds.,STL,https://en.cppreference.com/w/cpp/container/span,https://youtube.com/results?search_query=cpp+span+bounds+safety,https://youtube.com/results?search_query=cpp+span+bounds+safety+hindi,https://youtube.com/results?search_query=cpp+span+bounds+safety+kannada,https://youtube.com/results?search_query=cpp+span+bounds+safety+tamil,https://youtube.com/results?search_query=cpp+span+bounds+safety+telugu
Cpp,Advanced,What are the alignment requirements for SIMD operations and how to ensure them in C++?,Vectorization,SIMD instructions,Memory alignment,Performance optimization,A,"SIMD operations require specific byte alignment (e.g., 16, 32, 64 bytes) which can be ensured using alignas or aligned allocators.",Performance,https://en.cppreference.com/w/cpp/language/alignas,https://youtube.com/results?search_query=cpp+simd+alignment,https://youtube.com/results?search_query=cpp+simd+alignment+hindi,https://youtube.com/results?search_query=cpp+simd+alignment+kannada,https://youtube.com/results?search_query=cpp+simd+alignment+tamil,https://youtube.com/results?search_query=cpp+simd+alignment+telugu
Cpp,Advanced,How does the as-if rule allow compiler optimizations while maintaining program correctness?,Compiler optimizations,Program transformation,Observable behavior,Optimization guarantees,A,The as-if rule allows any optimization that doesn't change observable behavior as defined by the standard.,Compilers,https://en.cppreference.com/w/cpp/language/as_if,https://youtube.com/results?search_query=cpp+as+if+rule,https://youtube.com/results?search_query=cpp+as+if+rule+hindi,https://youtube.com/results?search_query=cpp+as+if+rule+kannada,https://youtube.com/results?search_query=cpp+as+if+rule+tamil,https://youtube.com/results?search_query=cpp+as+if+rule+telugu
