skill,level,question_text,option_a,option_b,option_c,option_d,correct_answer,explanation,topic,mdn_link,youtube_english,youtube_hindi,youtube_kannada,youtube_tamil,youtube_telugu
C++,Intermediate,Explain the concept of memory alignment.,Data structure padding for CPU access efficiency,Memory allocation,Memory fragmentation,Memory compaction,A,Alignment ensures data is stored at memory addresses that are multiples of their size for optimal CPU access.,Memory Management,https://en.cppreference.com/w/cpp/language/alignas,https://youtube.com/results?search_query=cpp+memory+alignment,https://youtube.com/results?search_query=cpp+memory+alignment+hindi,https://youtube.com/results?search_query=cpp+memory+alignment+kannada,https://youtube.com/results?search_query=cpp+memory+alignment+tamil,https://youtube.com/results?search_query=cpp+memory+alignment+telugu
C++,Intermediate,How does std::shared_ptr implement reference counting?,Uses control block with atomic counters,Manual counting,Garbage collection,Compiler assistance,A,std::shared_ptr uses a control block containing atomic reference counters for shared ownership.,Memory Management,https://en.cppreference.com/w/cpp/memory/shared_ptr,https://youtube.com/results?search_query=cpp+shared_ptr+reference+counting,https://youtube.com/results?search_query=cpp+shared_ptr+reference+counting+hindi,https://youtube.com/results?search_query=cpp+shared_ptr+reference+counting+kannada,https://youtube.com/results?search_query=cpp+shared_ptr+reference+counting+tamil,https://youtube.com/results?search_query=cpp+shared_ptr+reference+counting+telugu
C++,Intermediate,What is the purpose of std::weak_ptr?,Break circular references of shared_ptr,Weak reference counting,Primary ownership,Automatic deletion,A,std::weak_ptr holds non-owning references to break circular dependencies between shared_ptr.,Memory Management,https://en.cppreference.com/w/cpp/memory/weak_ptr,https://youtube.com/results?search_query=cpp+weak_ptr,https://youtube.com/results?search_query=cpp+weak_ptr+hindi,https://youtube.com/results?search_query=cpp+weak_ptr+kannada,https://youtube.com/results?search_query=cpp+weak_ptr+tamil,https://youtube.com/results?search_query=cpp+weak_ptr+telugu
C++,Intermediate,Describe the concept of copy-and-swap idiom.,Exception-safe assignment operator,Move assignment,Copy constructor,Destructor,A,Copy-and-swap provides strong exception safety for assignment operators using copy constructor and swap.,Classes,https://en.cppreference.com/w/cpp/language/rule_of_three,https://youtube.com/results?search_query=cpp+copy+and+swap,https://youtube.com/results?search_query=cpp+copy+and+swap+hindi,https://youtube.com/results?search_query=cpp+copy+and+swap+kannada,https://youtube.com/results?search_query=cpp+copy+and+swap+tamil,https://youtube.com/results?search_query=cpp+copy+and+swap+telugu
C++,Intermediate,How does std::array differ from C-style arrays?,STL interface and bounds checking,No difference,Faster access,Smaller size,A,"std::array provides STL container interface, bounds checking via at(), and doesn't decay to pointer.",STL,https://en.cppreference.com/w/cpp/container/array,https://youtube.com/results?search_query=cpp+array+vs+c+array,https://youtube.com/results?search_query=cpp+array+vs+c+array+hindi,https://youtube.com/results?search_query=cpp+array+vs+c+array+kannada,https://youtube.com/results?search_query=cpp+array+vs+c+array+tamil,https://youtube.com/results?search_query=cpp+array+vs+c+array+telugu
C++,Intermediate,What is the purpose of std::tuple?,Heterogeneous collection of fixed size,Homogeneous collection,Dynamic collection,Array collection,A,std::tuple can store multiple values of different types with fixed size.,STL,https://en.cppreference.com/w/cpp/utility/tuple,https://youtube.com/results?search_query=cpp+tuple,https://youtube.com/results?search_query=cpp+tuple+hindi,https://youtube.com/results?search_query=cpp+tuple+kannada,https://youtube.com/results?search_query=cpp+tuple+tamil,https://youtube.com/results?search_query=cpp+tuple+telugu
C++,Intermediate,Explain the concept of type deduction with auto.,Compiler deduces type from initializer,Manual type declaration,Type inference at runtime,Dynamic typing,A,auto instructs compiler to deduce the variable type from its initializer expression.,Keywords,https://en.cppreference.com/w/cpp/language/auto,https://youtube.com/results?search_query=cpp+auto+type+deduction,https://youtube.com/results?search_query=cpp+auto+type+deduction+hindi,https://youtube.com/results?search_query=cpp+auto+type+deduction+kannada,https://youtube.com/results?search_query=cpp+auto+type+deduction+tamil,https://youtube.com/results?search_query=cpp+auto+type+deduction+telugu
C++,Intermediate,How does decltype differ from auto?,Preserves references and const-ness,Always strips references,Same as auto,For function return types,A,decltype preserves the exact type including references and const qualifiers of an expression.,Keywords,https://en.cppreference.com/w/cpp/language/decltype,https://youtube.com/results?search_query=cpp+decltype,https://youtube.com/results?search_query=cpp+decltype+hindi,https://youtube.com/results?search_query=cpp+decltype+kannada,https://youtube.com/results?search_query=cpp+decltype+tamil,https://youtube.com/results?search_query=cpp+decltype+telugu
C++,Intermediate,What is the purpose of std::invoke?,Uniformly call any callable object,Invoke functions only,Invoke methods only,Invoke lambdas only,A,"std::invoke provides uniform syntax for calling functions, member functions, and callable objects.",STL,https://en.cppreference.com/w/cpp/utility/functional/invoke,https://youtube.com/results?search_query=cpp+std+invoke,https://youtube.com/results?search_query=cpp+std+invoke+hindi,https://youtube.com/results?search_query=cpp+std+invoke+kannada,https://youtube.com/results?search_query=cpp+std+invoke+tamil,https://youtube.com/results?search_query=cpp+std+invoke+telugu
C++,Intermediate,Describe the concept of expression templates.,Lazy evaluation for performance,Template expressions,Runtime expressions,Compile-time expressions,A,Expression templates enable lazy evaluation and optimization of expression trees at compile time.,Templates,https://en.cppreference.com/w/cpp/language/templates,https://youtube.com/results?search_query=cpp+expression+templates,https://youtube.com/results?search_query=cpp+expression+templates+hindi,https://youtube.com/results?search_query=cpp+expression+templates+kannada,https://youtube.com/results?search_query=cpp+expression+templates+tamil,https://youtube.com/results?search_query=cpp+expression+templates+telugu
C++,Intermediate,How does std::filesystem simplify file operations?,Cross-platform path handling,Platform-specific code,Manual file handling,Basic file I/O,A,"std::filesystem provides portable operations for paths, files, and directories.",STL,https://en.cppreference.com/w/cpp/filesystem,https://youtube.com/results?search_query=cpp+filesystem,https://youtube.com/results?search_query=cpp+filesystem+hindi,https://youtube.com/results?search_query=cpp+filesystem+kannada,https://youtube.com/results?search_query=cpp+filesystem+tamil,https://youtube.com/results?search_query=cpp+filesystem+telugu
C++,Intermediate,What is the purpose of std::span?,Non-owning view over contiguous sequence,Owns sequence data,Dynamic allocation,Static allocation,A,std::span provides a lightweight non-owning view over a contiguous sequence of elements.,STL,https://en.cppreference.com/w/cpp/container/span,https://youtube.com/results?search_query=cpp+span,https://youtube.com/results?search_query=cpp+span+hindi,https://youtube.com/results?search_query=cpp+span+kannada,https://youtube.com/results?search_query=cpp+span+tamil,https://youtube.com/results?search_query=cpp+span+telugu
C++,Intermediate,Explain the concept of move-only types.,Types that can be moved but not copied,Types that can be copied only,Immutable types,Reference types,A,Move-only types (like unique_ptr) support move semantics but disable copy operations.,Move Semantics,https://en.cppreference.com/w/cpp/language/move_constructor,https://youtube.com/results?search_query=cpp+move+only+types,https://youtube.com/results?search_query=cpp+move+only+types+hindi,https://youtube.com/results?search_query=cpp+move+only+types+kannada,https://youtube.com/results?search_query=cpp+move+only+types+tamil,https://youtube.com/results?search_query=cpp+move+only+types+telugu
C++,Intermediate,How does std::chrono improve time handling?,Type-safe time operations,Simpler syntax,Faster operations,Manual time handling,A,std::chrono provides type-safe time points and durations with compile-time unit checking.,STL,https://en.cppreference.com/w/cpp/chrono,https://youtube.com/results?search_query=cpp+chrono,https://youtube.com/results?search_query=cpp+chrono+hindi,https://youtube.com/results?search_query=cpp+chrono+kannada,https://youtube.com/results?search_query=cpp+chrono+tamil,https://youtube.com/results?search_query=cpp+chrono+telugu
C++,Intermediate,What is the purpose of std::expected (C++23)?,Represent value or error,Optional values only,Expected values only,Error values only,A,"std::expected represents either a value or an error, similar to Rust's Result type.",STL,https://en.cppreference.com/w/cpp/utility/expected,https://youtube.com/results?search_query=cpp+expected,https://youtube.com/results?search_query=cpp+expected+hindi,https://youtube.com/results?search_query=cpp+expected+kannada,https://youtube.com/results?search_query=cpp+expected+tamil,https://youtube.com/results?search_query=cpp+expected+telugu
C++,Intermediate,Describe the concept of coroutines.,Functions that can suspend and resume,Recursive functions,Inline functions,Virtual functions,A,Coroutines are functions that can suspend execution and later resume from where they left off.,Functions,https://en.cppreference.com/w/cpp/language/coroutines,https://youtube.com/results?search_query=cpp+coroutines,https://youtube.com/results?search_query=cpp+coroutines+hindi,https://youtube.com/results?search_query=cpp+coroutines+kannada,https://youtube.com/results?search_query=cpp+coroutines+tamil,https://youtube.com/results?search_query=cpp+coroutines+telugu
C++,Intermediate,How does std::format improve over printf?,Type-safe and extensible,Faster execution,Simpler syntax,Less memory,A,std::format provides type-safe formatting with compile-time format string checking.,STL,https://en.cppreference.com/w/cpp/utility/format/format,https://youtube.com/results?search_query=cpp+format,https://youtube.com/results?search_query=cpp+format+hindi,https://youtube.com/results?search_query=cpp+format+kannada,https://youtube.com/results?search_query=cpp+format+tamil,https://youtube.com/results?search_query=cpp+format+telugu
C++,Intermediate,What is the purpose of concepts in C++20?,Constraints on template parameters,New data types,Function constraints,Class constraints,A,"Concepts specify constraints on template arguments, improving error messages and enabling overloading.",Templates,https://en.cppreference.com/w/cpp/language/constraints,https://youtube.com/results?search_query=cpp+concepts,https://youtube.com/results?search_query=cpp+concepts+hindi,https://youtube.com/results?search_query=cpp+concepts+kannada,https://youtube.com/results?search_query=cpp+concepts+tamil,https://youtube.com/results?search_query=cpp+concepts+telugu
C++,Intermediate,Explain the concept of modules in C++20.,Replace header files with compiled interfaces,New functions,New classes,New templates,A,Modules provide faster compilation by replacing textual inclusion with compiled binary interfaces.,Compilation,https://en.cppreference.com/w/cpp/language/modules,https://youtube.com/results?search_query=cpp+modules,https://youtube.com/results?search_query=cpp+modules+hindi,https://youtube.com/results?search_query=cpp+modules+kannada,https://youtube.com/results?search_query=cpp+modules+tamil,https://youtube.com/results?search_query=cpp+modules+telugu
C++,Intermediate,How does std::jthread differ from std::thread?,Automatic joining on destruction,Manual joining required,Same functionality,Faster creation,A,std::jthread automatically joins on destruction and supports cooperative cancellation.,Concurrency,https://en.cppreference.com/w/cpp/thread/jthread,https://youtube.com/results?search_query=cpp+jthread,https://youtube.com/results?search_query=cpp+jthread+hindi,https://youtube.com/results?search_query=cpp+jthread+kannada,https://youtube.com/results?search_query=cpp+jthread+tamil,https://youtube.com/results?search_query=cpp+jthread+telugu
C++,Intermediate,What is the purpose of std::source_location?,Capture source code location,Memory location,Function location,File location,A,"std::source_location captures file name, line number, and function name at compile time.",Debugging,https://en.cppreference.com/w/cpp/utility/source_location,https://youtube.com/results?search_query=cpp+source_location,https://youtube.com/results?search_query=cpp+source_location+hindi,https://youtube.com/results?search_query=cpp+source_location+kannada,https://youtube.com/results?search_query=cpp+source_location+tamil,https://youtube.com/results?search_query=cpp+source_location+telugu
C++,Intermediate,Describe the concept of structured bindings.,Decompose objects into individual variables,Create structured data,Parse data,Format data,A,Structured bindings allow unpacking tuple-like objects into individual variables.,Syntax,https://en.cppreference.com/w/cpp/language/structured_binding,https://youtube.com/results?search_query=cpp+structured+bindings,https://youtube.com/results?search_query=cpp+structured+bindings+hindi,https://youtube.com/results?search_query=cpp+structured+bindings+kannada,https://youtube.com/results?search_query=cpp+structured+bindings+tamil,https://youtube.com/results?search_query=cpp+structured+bindings+telugu
C++,Intermediate,How does if constexpr differ from regular if?,Evaluated at compile-time,Evaluated at runtime,Same functionality,For constants only,A,"if constexpr condition is evaluated at compile time, allowing branch elimination.",Control Flow,https://en.cppreference.com/w/cpp/language/if,https://youtube.com/results?search_query=cpp+if+constexpr,https://youtube.com/results?search_query=cpp+if+constexpr+hindi,https://youtube.com/results?search_query=cpp+if+constexpr+kannada,https://youtube.com/results?search_query=cpp+if+constexpr+tamil,https://youtube.com/results?search_query=cpp+if+constexpr+telugu
C++,Intermediate,What is the purpose of std::byte?,Type-safe byte manipulation,Raw byte type,Character type,Integer type,A,std::byte represents raw memory bytes without character type semantics.,Types,https://en.cppreference.com/w/cpp/types/byte,https://youtube.com/results?search_query=cpp+byte,https://youtube.com/results?search_query=cpp+byte+hindi,https://youtube.com/results?search_query=cpp+byte+kannada,https://youtube.com/results?search_query=cpp+byte+tamil,https://youtube.com/results?search_query=cpp+byte+telugu
C++,Intermediate,Explain the concept of three-way comparison (<=>).,Simplifies comparison operators,Three-way branching,Comparison with three values,Ternary comparison,A,The spaceship operator generates all six comparison operators from a single function.,Operators,https://en.cppreference.com/w/cpp/language/operator_comparison,https://youtube.com/results?search_query=cpp+three+way+comparison,https://youtube.com/results?search_query=cpp+three+way+comparison+hindi,https://youtube.com/results?search_query=cpp+three+way+comparison+kannada,https://youtube.com/results?search_query=cpp+three+way+comparison+tamil,https://youtube.com/results?search_query=cpp+three+way+comparison+telugu
C++,Intermediate,How does std::ranges improve over traditional algorithms?,Works directly on containers and views,Requires iterators only,Same functionality,Faster execution,A,std::ranges algorithms work directly with containers and support views and pipelines.,STL,https://en.cppreference.com/w/cpp/ranges,https://youtube.com/results?search_query=cpp+ranges,https://youtube.com/results?search_query=cpp+ranges+hindi,https://youtube.com/results?search_query=cpp+ranges+kannada,https://youtube.com/results?search_query=cpp+ranges+tamil,https://youtube.com/results?search_query=cpp+ranges+telugu
C++,Intermediate,What is the purpose of std::views in ranges?,Lazy evaluated ranges,Eager evaluation,Memory allocation,Data transformation,A,std::views create lazy evaluated range adaptors that transform sequences without copying.,STL,https://en.cppreference.com/w/cpp/ranges,https://youtube.com/results?search_query=cpp+ranges+views,https://youtube.com/results?search_query=cpp+ranges+views+hindi,https://youtube.com/results?search_query=cpp+ranges+views+kannada,https://youtube.com/results?search_query=cpp+ranges+views+tamil,https://youtube.com/results?search_query=cpp+ranges+views+telugu
C++,Intermediate,Describe the concept of memory model in C++.,Defines memory ordering for concurrency,Memory allocation,Memory layout,Memory optimization,A,The memory model defines how memory accesses are ordered in multithreaded programs.,Concurrency,https://en.cppreference.com/w/cpp/atomic/memory_order,https://youtube.com/results?search_query=cpp+memory+model,https://youtube.com/results?search_query=cpp+memory+model+hindi,https://youtube.com/results?search_query=cpp+memory+model+kannada,https://youtube.com/results?search_query=cpp+memory+model+tamil,https://youtube.com/results?search_query=cpp+memory+model+telugu
C++,Intermediate,How does std::latch differ from std::barrier?,Single-use vs reusable,Same functionality,For threads only,For processes only,A,"std::latch is single-use counter, std::barrier can be reused for multiple phases.",Concurrency,https://en.cppreference.com/w/cpp/thread/latch,https://youtube.com/results?search_query=cpp+latch+vs+barrier,https://youtube.com/results?search_query=cpp+latch+vs+barrier+hindi,https://youtube.com/results?search_query=cpp+latch+vs+barrier+kannada,https://youtube.com/results?search_query=cpp+latch+vs+barrier+tamil,https://youtube.com/results?search_query=cpp+latch+vs+barrier+telugu
C++,Intermediate,What is the purpose of std::semaphore?,Coordinate thread access to resources,Memory semaphore,Process semaphore,File semaphore,A,std::semaphore controls access to a shared resource by multiple threads.,Concurrency,https://en.cppreference.com/w/cpp/thread/counting_semaphore,https://youtube.com/results?search_query=cpp+semaphore,https://youtube.com/results?search_query=cpp+semaphore+hindi,https://youtube.com/results?search_query=cpp+semaphore+kannada,https://youtube.com/results?search_query=cpp+semaphore+tamil,https://youtube.com/results?search_query=cpp+semaphore+telugu
C++,Intermediate,Explain the concept of consteval functions.,Always evaluated at compile-time,Sometimes at compile-time,At runtime only,For constants only,A,consteval functions must produce compile-time constants and cannot be called at runtime.,Functions,https://en.cppreference.com/w/cpp/language/consteval,https://youtube.com/results?search_query=cpp+consteval,https://youtube.com/results?search_query=cpp+consteval+hindi,https://youtube.com/results?search_query=cpp+consteval+kannada,https://youtube.com/results?search_query=cpp+consteval+tamil,https://youtube.com/results?search_query=cpp+consteval+telugu
C++,Intermediate,How does std::bit_cast work?,Reinterprets object representation,Changes value,Casts types,Allocates memory,A,std::bit_cast reinterprets the object representation of one type as another type.,Type Conversion,https://en.cppreference.com/w/cpp/numeric/bit_cast,https://youtube.com/results?search_query=cpp+bit_cast,https://youtube.com/results?search_query=cpp+bit_cast+hindi,https://youtube.com/results?search_query=cpp+bit_cast+kannada,https://youtube.com/results?search_query=cpp+bit_cast+tamil,https://youtube.com/results?search_query=cpp+bit_cast+telugu
C++,Intermediate,What is the purpose of std::midpoint?,Compute midpoint without overflow,Average calculation,Median calculation,Mean calculation,A,std::midpoint computes the midpoint of two values without overflow risk.,Algorithms,https://en.cppreference.com/w/cpp/numeric/midpoint,https://youtube.com/results?search_query=cpp+midpoint,https://youtube.com/results?search_query=cpp+midpoint+hindi,https://youtube.com/results?search_query=cpp+midpoint+kannada,https://youtube.com/results?search_query=cpp+midpoint+tamil,https://youtube.com/results?search_query=cpp+midpoint+telugu
C++,Intermediate,Describe the concept of NTTP (Non-Type Template Parameters).,Template parameters that are values not types,Templates without parameters,Non-template parameters,Type parameters only,A,"NTTPs allow passing values (not types) as template parameters, like std::array<int, 5>.",Templates,https://en.cppreference.com/w/cpp/language/template_parameters,https://youtube.com/results?search_query=cpp+non+type+template+parameters,https://youtube.com/results?search_query=cpp+non+type+template+parameters+hindi,https://youtube.com/results?search_query=cpp+non+type+template+parameters+kannada,https://youtube.com/results?search_query=cpp+non+type+template+parameters+tamil,https://youtube.com/results?search_query=cpp+non+type+template+parameters+telugu
C++,Intermediate,How does std::generator (C++23) simplify coroutines?,Produces sequence of values for coroutines,Generates random numbers,Creates functions,Generates types,A,std::generator makes it easier to write coroutines that produce sequences of values.,Coroutines,https://en.cppreference.com/w/cpp/coroutine/generator,https://youtube.com/results?search_query=cpp+generator,https://youtube.com/results?search_query=cpp+generator+hindi,https://youtube.com/results?search_query=cpp+generator+kannada,https://youtube.com/results?search_query=cpp+generator+tamil,https://youtube.com/results?search_query=cpp+generator+telugu
C++,Intermediate,What is the purpose of std::mdspan?,Multidimensional array view,Matrix operations,Span operations,Data span,A,std::mdspan provides a non-owning multidimensional array view with flexible layout mapping.,STL,https://en.cppreference.com/w/cpp/container/mdspan,https://youtube.com/results?search_query=cpp+mdspan,https://youtube.com/results?search_query=cpp+mdspan+hindi,https://youtube.com/results?search_query=cpp+mdspan+kannada,https://youtube.com/results?search_query=cpp+mdspan+tamil,https://youtube.com/results?search_query=cpp+mdspan+telugu
C++,Intermediate,Explain the concept of static_assert.,Compile-time assertion,Runtime assertion,Debug assertion,Type assertion,A,"static_assert performs compile-time assertion checking, causing compilation error if false.",Debugging,https://en.cppreference.com/w/cpp/language/static_assert,https://youtube.com/results?search_query=cpp+static_assert,https://youtube.com/results?search_query=cpp+static_assert+hindi,https://youtube.com/results?search_query=cpp+static_assert+kannada,https://youtube.com/results?search_query=cpp+static_assert+tamil,https://youtube.com/results?search_query=cpp+static_assert+telugu
C++,Intermediate,How does std::is_constant_evaluated work?,Detects if in constant evaluation context,Checks constant value,Evaluates constants,Compile-time check,A,std::is_constant_evaluated returns true if called during constant expression evaluation.,Compile-time,https://en.cppreference.com/w/cpp/types/is_constant_evaluated,https://youtube.com/results?search_query=cpp+is_constant_evaluated,https://youtube.com/results?search_query=cpp+is_constant_evaluated+hindi,https://youtube.com/results?search_query=cpp+is_constant_evaluated+kannada,https://youtube.com/results?search_query=cpp+is_constant_evaluated+tamil,https://youtube.com/results?search_query=cpp+is_constant_evaluated+telugu
C++,Intermediate,What is the purpose of std::to_underlying?,Convert enum to underlying type,Convert to string,Convert to integer,Convert to float,A,std::to_underlying converts an enumeration to its underlying integral type.,Type Conversion,https://en.cppreference.com/w/cpp/utility/to_underlying,https://youtube.com/results?search_query=cpp+to_underlying,https://youtube.com/results?search_query=cpp+to_underlying+hindi,https://youtube.com/results?search_query=cpp+to_underlying+kannada,https://youtube.com/results?search_query=cpp+to_underlying+tamil,https://youtube.com/results?search_query=cpp+to_underlying+telugu
C++,Intermediate,Describe the concept of dependent names in templates.,Names that depend on template parameters,Independent names,Function names,Class names,A,Dependent names are identifiers that depend on template parameters and require typename/keyword.,Templates,https://en.cppreference.com/w/cpp/language/dependent_name,https://youtube.com/results?search_query=cpp+dependent+names,https://youtube.com/results?search_query=cpp+dependent+names+hindi,https://youtube.com/results?search_query=cpp+dependent+names+kannada,https://youtube.com/results?search_query=cpp+dependent+names+tamil,https://youtube.com/results?search_query=cpp+dependent+names+telugu
C++,Intermediate,How does std::construct_at differ from placement new?,Exception safety and constexpr support,Same functionality,Less safe,More complex,A,"std::construct_at provides exception-safe, constexpr-capable object construction at given location.",Memory Management,https://en.cppreference.com/w/cpp/memory/construct_at,https://youtube.com/results?search_query=cpp+construct_at,https://youtube.com/results?search_query=cpp+construct_at+hindi,https://youtube.com/results?search_query=cpp+construct_at+kannada,https://youtube.com/results?search_query=cpp+construct_at+tamil,https://youtube.com/results?search_query=cpp+construct_at+telugu
