skill,level,question_text,option_a,option_b,option_c,option_d,correct_answer,explanation,topic,mdn_link,youtube_english,youtube_hindi,youtube_kannada,youtube_tamil,youtube_telugu
Cpp,Advanced,How does the noexcept specification affect code generation and optimization opportunities?,Exception specifications,Optimization,Code generation,Move operations,A,noexcept enables optimizations like vectorized move operations and affects std::move_if_noexcept behavior.,Core Concepts,https://en.cppreference.com/w/cpp/language/noexcept,https://youtube.com/results?search_query=cpp+noexcept+optimization,https://youtube.com/results?search_query=cpp+noexcept+optimization+hindi,https://youtube.com/results?search_query=cpp+noexcept+optimization+kannada,https://youtube.com/results?search_query=cpp+noexcept+optimization+tamil,https://youtube.com/results?search_query=cpp+noexcept+optimization+telugu
Cpp,Advanced,What are the iterator category requirements for different STL algorithms?,Algorithm requirements,Iterator concepts,Category hierarchy,Compile-time checking,A,"Algorithms require specific iterator categories (input, forward, bidirectional, random access) which affect their capabilities and performance.",STL,https://en.cppreference.com/w/cpp/iterator,https://youtube.com/results?search_query=cpp+iterator+categories+algorithms,https://youtube.com/results?search_query=cpp+iterator+categories+algorithms+hindi,https://youtube.com/results?search_query=cpp+iterator+categories+algorithms+kannada,https://youtube.com/results?search_query=cpp+iterator+categories+algorithms+tamil,https://youtube.com/results?search_query=cpp+iterator+categories+algorithms+telugu
Cpp,Advanced,How does std::visit with overloaded pattern provide type-safe variant access?,Variant visitation,Pattern matching,Overload resolution,Type-safe access,A,"std::visit with overloaded calls the appropriate visitor based on the variant's active type, ensuring type-safe access.",STL,https://en.cppreference.com/w/cpp/utility/variant/visit,https://youtube.com/results?search_query=cpp+variant+visit+overloaded,https://youtube.com/results?search_query=cpp+variant+visit+overloaded+hindi,https://youtube.com/results?search_query=cpp+variant+visit+overloaded+kannada,https://youtube.com/results?search_query=cpp+variant+visit+overloaded+tamil,https://youtube.com/results?search_query=cpp+variant+visit+overloaded+telugu
Cpp,Advanced,What are the memory layout differences between virtual and non-virtual inheritance?,Multiple inheritance,Memory overhead,Virtual base classes,Object layout,A,Virtual inheritance adds pointer overhead for virtual base class access and changes object layout to support shared base instances.,Core Concepts,https://en.cppreference.com/w/cpp/language/derived_class,https://youtube.com/results?search_query=cpp+virtual+inheritance+memory,https://youtube.com/results?search_query=cpp+virtual+inheritance+memory+hindi,https://youtube.com/results?search_query=cpp+virtual+inheritance+memory+kannada,https://youtube.com/results?search_query=cpp+virtual+inheritance+memory+tamil,https://youtube.com/results?search_query=cpp+virtual+inheritance+memory+telugu
Cpp,Advanced,How does std::unordered_map handle hash collisions and what are the performance implications?,Hash collisions,Chaining,Open addressing,Load factor,A,"std::unordered_map uses separate chaining (buckets with linked lists) to handle collisions, with performance degrading as load factor increases.",STL,https://en.cppreference.com/w/cpp/container/unordered_map,https://youtube.com/results?search_query=cpp+unordered_map+collisions,https://youtube.com/results?search_query=cpp+unordered_map+collisions+hindi,https://youtube.com/results?search_query=cpp+unordered_map+collisions+kannada,https://youtube.com/results?search_query=cpp+unordered_map+collisions+tamil,https://youtube.com/results?search_query=cpp+unordered_map+collisions+telugu
Cpp,Advanced,What are the differences between std::sort and std::stable_sort in terms of algorithm stability?,Sorting algorithms,Stability guarantees,Memory usage,Performance tradeoffs,A,"std::sort is faster but not stable (may reorder equal elements), while std::stable_sort preserves order of equal elements at higher memory cost.",STL,https://en.cppreference.com/w/cpp/algorithm/stable_sort,https://youtube.com/results?search_query=cpp+sort+vs+stable_sort,https://youtube.com/results?search_query=cpp+sort+vs+stable_sort+hindi,https://youtube.com/results?search_query=cpp+sort+vs+stable_sort+kannada,https://youtube.com/results?search_query=cpp+sort+vs+stable_sort+tamil,https://youtube.com/results?search_query=cpp+sort+vs+stable_sort+telugu
Cpp,Advanced,How does the rule of three/five/zero affect default move operations generation?,Special member functions,Move operations,Default behavior,Compiler generation,A,"Declaring any of destructor, copy constructor, or copy assignment prevents automatic generation of move operations (rule of three/five).",Core Concepts,https://en.cppreference.com/w/cpp/language/rule_of_three,https://youtube.com/results?search_query=cpp+rule+of+three+move,https://youtube.com/results?search_query=cpp+rule+of+three+move+hindi,https://youtube.com/results?search_query=cpp+rule+of+three+move+kannada,https://youtube.com/results?search_query=cpp+rule+of+three+move+tamil,https://youtube.com/results?search_query=cpp+rule+of+three+move+telugu
Cpp,Advanced,What are the memory model implications of using relaxed atomics for counters?,Memory ordering,Atomic counters,Performance optimization,Visibility guarantees,A,"Relaxed atomics provide no synchronization guarantees, suitable for independent counters but not for coordinating access to shared data.",Concurrency,https://en.cppreference.com/w/cpp/atomic/memory_order,https://youtube.com/results?search_query=cpp+relaxed+atomics+counters,https://youtube.com/results?search_query=cpp+relaxed+atomics+counters+hindi,https://youtube.com/results?search_query=cpp+relaxed+atomics+counters+kannada,https://youtube.com/results?search_query=cpp+relaxed+atomics+counters+tamil,https://youtube.com/results?search_query=cpp+relaxed+atomics+counters+telugu
Cpp,Advanced,How does std::array provide stack allocation with STL container interface?,Fixed-size arrays,Stack allocation,Container interface,Zero overhead,A,"std::array is an aggregate type wrapping a C-style array, providing STL interface without heap allocation or size overhead.",STL,https://en.cppreference.com/w/cpp/container/array,https://youtube.com/results?search_query=cpp+array+stack+allocation,https://youtube.com/results?search_query=cpp+array+stack+allocation+hindi,https://youtube.com/results?search_query=cpp+array+stack+allocation+kannada,https://youtube.com/results?search_query=cpp+array+stack+allocation+tamil,https://youtube.com/results?search_query=cpp+array+stack+allocation+telugu
Cpp,Advanced,What are the iterator invalidation rules for std::unordered_map during rehashing?,Hash table resizing,Iterator stability,Rehashing,Performance impact,A,"std::unordered_map iterators are invalidated during rehashing (when load factor exceeds max_load_factor), which occurs on insertion.",STL,https://en.cppreference.com/w/cpp/container/unordered_map/rehash,https://youtube.com/results?search_query=cpp+unordered_map+iterator+invalidation+rehash,https://youtube.com/results?search_query=cpp+unordered_map+iterator+invalidation+rehash+hindi,https://youtube.com/results?search_query=cpp+unordered_map+iterator+invalidation+rehash+kannada,https://youtube.com/results?search_query=cpp+unordered_map+iterator+invalidation+rehash+tamil,https://youtube.com/results?search_query=cpp+unordered_map+iterator+invalidation+rehash+telugu
Cpp,Advanced,How does std::async's default launch policy affect exception propagation?,Exception safety,Asynchronous execution,Launch policies,Error handling,A,"With default launch policy, exceptions may be stored in the future or thrown immediately depending on when the task executes.",Concurrency,https://en.cppreference.com/w/cpp/thread/async,https://youtube.com/results?search_query=cpp+async+exceptions,https://youtube.com/results?search_query=cpp+async+exceptions+hindi,https://youtube.com/results?search_query=cpp+async+exceptions+kannada,https://youtube.com/results?search_query=cpp+async+exceptions+tamil,https://youtube.com/results?search_query=cpp+async+exceptions+telugu
Cpp,Advanced,What are the differences between std::priority_queue and std::make_heap/pop_heap/push_heap?,Heap algorithms,Priority queues,Container adapters,Performance characteristics,A,"std::priority_queue is a container adapter with simpler interface, while heap algorithms provide more control over underlying container.",STL,https://en.cppreference.com/w/cpp/container/priority_queue,https://youtube.com/results?search_query=cpp+priority_queue+vs+heap+algorithms,https://youtube.com/results?search_query=cpp+priority_queue+vs+heap+algorithms+hindi,https://youtube.com/results?search_query=cpp+priority_queue+vs+heap+algorithms+kannada,https://youtube.com/results?search_query=cpp+priority_queue+vs+heap+algorithms+tamil,https://youtube.com/results?search_query=cpp+priority_queue+vs+heap+algorithms+telugu
Cpp,Advanced,How does std::bind differ from lambda expressions in terms of performance and flexibility?,Function objects,Binding arguments,Closures,Performance comparison,A,"Lambdas typically generate better code, are more readable, and can capture by reference, while std::bind has more overhead but handles placeholders.",STL,https://en.cppreference.com/w/cpp/utility/functional/bind,https://youtube.com/results?search_query=cpp+bind+vs+lambda+performance,https://youtube.com/results?search_query=cpp+bind+vs+lambda+performance+hindi,https://youtube.com/results?search_query=cpp+bind+vs+lambda+performance+kannada,https://youtube.com/results?search_query=cpp+bind+vs+lambda+performance+tamil,https://youtube.com/results?search_query=cpp+bind+vs+lambda+performance+telugu
Cpp,Advanced,What are the memory allocation patterns optimized by tcmalloc and jemalloc in C++ applications?,Memory allocators,Performance optimization,Fragmentation reduction,Multi-threaded allocation,A,tcmalloc and jemalloc optimize for multi-threaded applications with thread-local caches and reduced lock contention.,Performance,https://en.cppreference.com/w/cpp/memory/new/operator_new,https://youtube.com/results?search_query=cpp+tcmalloc+jemalloc,https://youtube.com/results?search_query=cpp+tcmalloc+jemalloc+hindi,https://youtube.com/results?search_query=cpp+tcmalloc+jemalloc+kannada,https://youtube.com/results?search_query=cpp+tcmalloc+jemalloc+tamil,https://youtube.com/results?search_query=cpp+tcmalloc+jemalloc+telugu
Cpp,Advanced,How does std::aligned_storage enable type-safe storage for variant-like types?,Type-punning,Storage buffers,Alignment requirements,Manual construction,A,std::aligned_storage provides properly aligned raw storage for manually constructing objects with placement new.,Memory Management,https://en.cppreference.com/w/cpp/types/aligned_storage,https://youtube.com/results?search_query=cpp+aligned_storage+variant,https://youtube.com/results?search_query=cpp+aligned_storage+variant+hindi,https://youtube.com/results?search_query=cpp+aligned_storage+variant+kannada,https://youtube.com/results?search_query=cpp+aligned_storage+variant+tamil,https://youtube.com/results?search_query=cpp+aligned_storage+variant+telugu
Cpp,Advanced,What are the differences between std::map and std::unordered_map in iterator stability?,Associative containers,Hash tables,Iterator invalidation,Insertion stability,A,"std::map iterators remain valid during insertion/deletion (except erased elements), while std::unordered_map iterators invalidate on rehash.",STL,https://en.cppreference.com/w/cpp/container/map,https://youtube.com/results?search_query=cpp+map+unordered_map+iterator+stability,https://youtube.com/results?search_query=cpp+map+unordered_map+iterator+stability+hindi,https://youtube.com/results?search_query=cpp+map+unordered_map+iterator+stability+kannada,https://youtube.com/results?search_query=cpp+map+unordered_map+iterator+stability+tamil,https://youtube.com/results?search_query=cpp+map+unordered_map+iterator+stability+telugu
Cpp,Advanced,How does the strict aliasing rule affect optimization of memory access patterns?,Compiler optimization,Aliasing assumptions,Type-based analysis,Performance impact,A,"Strict aliasing allows compilers to assume different types don't alias, enabling better optimization but requiring careful type punning.",Compilers,https://en.cppreference.com/w/cpp/language/object,https://youtube.com/results?search_query=cpp+strict+aliasing+optimization,https://youtube.com/results?search_query=cpp+strict+aliasing+optimization+hindi,https://youtube.com/results?search_query=cpp+strict+aliasing+optimization+kannada,https://youtube.com/results?search_query=cpp+strict+aliasing+optimization+tamil,https://youtube.com/results?search_query=cpp+strict+aliasing+optimization+telugu
Cpp,Advanced,What are the thread cancellation mechanisms available in C++ and their tradeoffs?,Thread interruption,Cancellation points,Cooperative cancellation,Exception safety,A,"C++ provides cooperative cancellation via atomic flags or condition variables, lacking built-in interruption like pthread_cancel.",Concurrency,https://en.cppreference.com/w/cpp/thread/jthread,https://youtube.com/results?search_query=cpp+thread+cancellation,https://youtube.com/results?search_query=cpp+thread+cancellation+hindi,https://youtube.com/results?search_query=cpp+thread+cancellation+kannada,https://youtube.com/results?search_query=cpp+thread+cancellation+tamil,https://youtube.com/results?search_query=cpp+thread+cancellation+telugu
Cpp,Advanced,How does std::initializer_list enable uniform initialization syntax for containers?,Initializer lists,Uniform initialization,Container construction,Syntax sugar,A,"std::initializer_list provides a lightweight wrapper for brace-enclosed initializers, used by container constructors for list initialization.",STL,https://en.cppreference.com/w/cpp/utility/initializer_list,https://youtube.com/results?search_query=cpp+initializer_list+containers,https://youtube.com/results?search_query=cpp+initializer_list+containers+hindi,https://youtube.com/results?search_query=cpp+initializer_list+containers+kannada,https://youtube.com/results?search_query=cpp+initializer_list+containers+tamil,https://youtube.com/results?search_query=cpp+initializer_list+containers+telugu
Cpp,Advanced,What are the differences between std::ref and std::cref in terms of reference semantics?,Reference wrappers,Pass by reference,const correctness,Function arguments,A,"std::ref creates a mutable reference wrapper, while std::cref creates a const reference wrapper for passing references to templates.",STL,https://en.cppreference.com/w/cpp/utility/functional/ref,https://youtube.com/results?search_query=cpp+ref+vs+cref,https://youtube.com/results?search_query=cpp+ref+vs+cref+hindi,https://youtube.com/results?search_query=cpp+ref+vs+cref+kannada,https://youtube.com/results?search_query=cpp+ref+vs+cref+tamil,https://youtube.com/results?search_query=cpp+ref+vs+cref+telugu
Cpp,Advanced,How does the empty member optimization work in std::optional for trivial types?,Space optimization,No-overhead optional,Trivial types,Memory layout,A,"For trivial types, std::optional can use a sentinel value (like NaN for float) to represent empty state without extra storage.",STL,https://en.cppreference.com/w/cpp/utility/optional,https://youtube.com/results?search_query=cpp+optional+empty+optimization,https://youtube.com/results?search_query=cpp+optional+empty+optimization+hindi,https://youtube.com/results?search_query=cpp+optional+empty+optimization+kannada,https://youtube.com/results?search_query=cpp+optional+empty+optimization+tamil,https://youtube.com/results?search_query=cpp+optional+empty+optimization+telugu
Cpp,Advanced,What are the differences between std::in_place and std::in_place_type for variant construction?,In-place construction,Direct initialization,Avoiding moves,Construction tags,A,"std::in_place constructs variant with given arguments, while std::in_place_type specifies which alternative to construct with given arguments.",STL,https://en.cppreference.com/w/cpp/utility/variant/variant,https://youtube.com/results?search_query=cpp+variant+in_place,https://youtube.com/results?search_query=cpp+variant+in_place+hindi,https://youtube.com/results?search_query=cpp+variant+in_place+kannada,https://youtube.com/results?search_query=cpp+variant+in_place+tamil,https://youtube.com/results?search_query=cpp+variant+in_place+telugu
Cpp,Advanced,How does std::weak_ptr break circular references in shared ownership scenarios?,Smart pointers,Circular references,Memory leaks,Weak references,A,"std::weak_ptr doesn't increase reference count, allowing objects to be deleted even if weak references exist, breaking reference cycles.",Memory Management,https://en.cppreference.com/w/cpp/memory/weak_ptr,https://youtube.com/results?search_query=cpp+weak_ptr+circular+references,https://youtube.com/results?search_query=cpp+weak_ptr+circular+references+hindi,https://youtube.com/results?search_query=cpp+weak_ptr+circular+references+kannada,https://youtube.com/results?search_query=cpp+weak_ptr+circular+references+tamil,https://youtube.com/results?search_query=cpp+weak_ptr+circular+references+telugu
Cpp,Advanced,What are the performance implications of using virtual function calls in tight loops?,Virtual dispatch,Indirect calls,Performance overhead,Inline optimization,A,"Virtual calls prevent inlining and add indirection overhead, which can be significant in performance-critical loops.",Performance,https://en.cppreference.com/w/cpp/language/virtual,https://youtube.com/results?search_query=cpp+virtual+functions+performance+loops,https://youtube.com/results?search_query=cpp+virtual+functions+performance+loops+hindi,https://youtube.com/results?search_query=cpp+virtual+functions+performance+loops+kannada,https://youtube.com/results?search_query=cpp+virtual+functions+performance+loops+tamil,https://youtube.com/results?search_query=cpp+virtual+functions+performance+loops+telugu
Cpp,Advanced,How does std::quoted handle string escaping in stream input/output?,String manipulation,Stream I/O,Quote handling,Escaping sequences,A,std::quoted adds/removes quotes and escapes embedded quotes when reading/writing strings to streams.,STL,https://en.cppreference.com/w/cpp/io/manip/quoted,https://youtube.com/results?search_query=cpp+std+quoted,https://youtube.com/results?search_query=cpp+std+quoted+hindi,https://youtube.com/results?search_query=cpp+std+quoted+kannada,https://youtube.com/results?search_query=cpp+std+quoted+tamil,https://youtube.com/results?search_query=cpp+std+quoted+telugu
Cpp,Advanced,What are the differences between std::accumulate with and without an initial value?,Numeric algorithms,Fold operations,Empty ranges,Default behavior,A,"Without initial value, std::accumulate uses the first element as initial value, requiring non-empty range and proper value type.",STL,https://en.cppreference.com/w/cpp/algorithm/accumulate,https://youtube.com/results?search_query=cpp+accumulate+initial+value,https://youtube.com/results?search_query=cpp+accumulate+initial+value+hindi,https://youtube.com/results?search_query=cpp+accumulate+initial+value+kannada,https://youtube.com/results?search_query=cpp+accumulate+initial+value+tamil,https://youtube.com/results?search_query=cpp+accumulate+initial+value+telugu
Cpp,Advanced,How does the Type Traits library enable compile-time introspection and metaprogramming?,Type properties,Compile-time checking,Template metaprogramming,Reflection,A,"Type traits provide information about types at compile time, enabling conditional compilation and template specialization.",Templates,https://en.cppreference.com/w/cpp/header/type_traits,https://youtube.com/results?search_query=cpp+type+traits+metaprogramming,https://youtube.com/results?search_query=cpp+type+traits+metaprogramming+hindi,https://youtube.com/results?search_query=cpp+type+traits+metaprogramming+kannada,https://youtube.com/results?search_query=cpp+type+traits+metaprogramming+tamil,https://youtube.com/results?search_query=cpp+type+traits+metaprogramming+telugu
Cpp,Advanced,What are the memory allocation strategies for exception handling in C++?,Exception objects,Stack unwinding,Allocation overhead,Performance costs,A,"Exception objects are typically allocated in a special exception storage, with implementation-defined allocation strategies.",Error Handling,https://en.cppreference.com/w/cpp/language/throw,https://youtube.com/results?search_query=cpp+exception+allocation,https://youtube.com/results?search_query=cpp+exception+allocation+hindi,https://youtube.com/results?search_query=cpp+exception+allocation+kannada,https://youtube.com/results?search_query=cpp+exception+allocation+tamil,https://youtube.com/results?search_query=cpp+exception+allocation+telugu
Cpp,Advanced,How does std::is_nothrow_swapable enable optimized swap implementations?,Exception safety,Swap optimization,Move operations,Performance,A,std::is_nothrow_swappable allows algorithms to use optimized swap paths when swapping is guaranteed not to throw.,STL,https://en.cppreference.com/w/cpp/types/is_swappable,https://youtube.com/results?search_query=cpp+is_nothrow_swappable,https://youtube.com/results?search_query=cpp+is_nothrow_swappable+hindi,https://youtube.com/results?search_query=cpp+is_nothrow_swappable+kannada,https://youtube.com/results?search_query=cpp+is_nothrow_swappable+tamil,https://youtube.com/results?search_query=cpp+is_nothrow_swappable+telugu
Cpp,Advanced,What are the differences between std::call_once and static local variable initialization for singletons?,Thread-safe initialization,Singleton patterns,One-time execution,Performance comparison,A,"std::call_once provides more control and can rethrow exceptions, while static locals have simpler syntax but limited exception handling.",Concurrency,https://en.cppreference.com/w/cpp/thread/call_once,https://youtube.com/results?search_query=cpp+call_once+vs+static+local,https://youtube.com/results?search_query=cpp+call_once+vs+static+local+hindi,https://youtube.com/results?search_query=cpp+call_once+vs+static+local+kannada,https://youtube.com/results?search_query=cpp+call_once+vs+static+local+tamil,https://youtube.com/results?search_query=cpp+call_once+vs+static+local+telugu
Cpp,Advanced,How does std::ranges improve algorithm composability and readability in C++20?,Range algorithms,Pipeline composition,Views,Modern C++,A,"std::ranges provides lazy evaluation, pipe syntax, and better integration with containers through range concepts.",STL,https://en.cppreference.com/w/cpp/ranges,https://youtube.com/results?search_query=cpp+ranges+composability,https://youtube.com/results?search_query=cpp+ranges+composability+hindi,https://youtube.com/results?search_query=cpp+ranges+composability+kannada,https://youtube.com/results?search_query=cpp+ranges+composability+tamil,https://youtube.com/results?search_query=cpp+ranges+composability+telugu
Cpp,Advanced,What are the alignment requirements for SIMD types like __m128 and __m256?,Vector types,SIMD instructions,Memory alignment,Performance optimization,A,"SIMD types require specific alignment (16 bytes for __m128, 32 bytes for __m256) for correct and efficient access.",Performance,https://en.cppreference.com/w/cpp/header/immintrin.h,https://youtube.com/results?search_query=cpp+simd+alignment+requirements,https://youtube.com/results?search_query=cpp+simd+alignment+requirements+hindi,https://youtube.com/results?search_query=cpp+simd+alignment+requirements+kannada,https://youtube.com/results?search_query=cpp+simd+alignment+requirements+tamil,https://youtube.com/results?search_query=cpp+simd+alignment+requirements+telugu
Cpp,Advanced,How does std::mem_fn differ from std::bind for member function pointers?,Member function pointers,Function adapters,Performance,Usability,A,std::mem_fn creates a callable wrapper for member functions with simpler syntax and often better performance than std::bind.,STL,https://en.cppreference.com/w/cpp/utility/functional/mem_fn,https://youtube.com/results?search_query=cpp+mem_fn+vs+bind,https://youtube.com/results?search_query=cpp+mem_fn+vs+bind+hindi,https://youtube.com/results?search_query=cpp+mem_fn+vs+bind+kannada,https://youtube.com/results?search_query=cpp+mem_fn+vs+bind+tamil,https://youtube.com/results?search_query=cpp+mem_fn+vs+bind+telugu
Cpp,Advanced,What are the differences between std::string and std::string_view in terms of substring operations?,String manipulation,Substring creation,Performance,Memory overhead,A,"std::string_view::substr returns a view without copying, while std::string::substr creates a new string with copied data.",STL,https://en.cppreference.com/w/cpp/string/basic_string_view/substr,https://youtube.com/results?search_query=cpp+string+vs+string_view+substr,https://youtube.com/results?search_query=cpp+string+vs+string_view+substr+hindi,https://youtube.com/results?search_query=cpp+string+vs+string_view+substr+kannada,https://youtube.com/results?search_query=cpp+string+vs+string_view+substr+tamil,https://youtube.com/results?search_query=cpp+string+vs+string_view+substr+telugu
