skill,level,question_text,option_a,option_b,option_c,option_d,correct_answer,explanation,topic,mdn_link,youtube_english,youtube_hindi,youtube_kannada,youtube_tamil,youtube_telugu
C++,Intermediate,What is the purpose of std::assume_aligned?,Hint compiler about pointer alignment,Force alignment,Check alignment,Allocate aligned memory,A,std::assume_aligned tells the compiler a pointer is aligned to specified boundary for optimization.,Optimization,https://en.cppreference.com/w/cpp/memory/assume_aligned,https://youtube.com/results?search_query=cpp+assume_aligned,https://youtube.com/results?search_query=cpp+assume_aligned+hindi,https://youtube.com/results?search_query=cpp+assume_aligned+kannada,https://youtube.com/results?search_query=cpp+assume_aligned+tamil,https://youtube.com/results?search_query=cpp+assume_aligned+telugu
C++,Intermediate,Explain the concept of transparent comparators.,Allow heterogeneous lookup in associative containers,Make comparators invisible,Same comparators,Faster comparators,A,Transparent comparators (like std::less<>) enable searching with different types than key type.,STL,https://en.cppreference.com/w/cpp/utility/functional/less_void,https://youtube.com/results?search_query=cpp+transparent+comparators,https://youtube.com/results?search_query=cpp+transparent+comparators+hindi,https://youtube.com/results?search_query=cpp+transparent+comparators+kannada,https://youtube.com/results?search_query=cpp+transparent+comparators+tamil,https://youtube.com/results?search_query=cpp+transparent+comparators+telugu
C++,Intermediate,How does std::uncaught_exceptions differ from uncaught_exception?,Counts uncaught exceptions not just existence,Same functionality,For caught exceptions,For all exceptions,A,std::uncaught_exceptions returns count of currently uncaught exceptions (not just boolean).,Exception Handling,https://en.cppreference.com/w/cpp/error/uncaught_exception,https://youtube.com/results?search_query=cpp+uncaught_exceptions,https://youtube.com/results?search_query=cpp+uncaught_exceptions+hindi,https://youtube.com/results?search_query=cpp+uncaught_exceptions+kannada,https://youtube.com/results?search_query=cpp+uncaught_exceptions+tamil,https://youtube.com/results?search_query=cpp+uncaught_exceptions+telugu
C++,Intermediate,What is the purpose of std::hardware_destructive_interference_size?,Cache line separation size,Cache size,Memory size,CPU size,A,Helps avoid false sharing by ensuring data separation by at least cache line size.,Concurrency,https://en.cppreference.com/w/cpp/thread/hardware_destructive_interference_size,https://youtube.com/results?search_query=cpp+hardware_interference_size,https://youtube.com/results?search_query=cpp+hardware_interference_size+hindi,https://youtube.com/results?search_query=cpp+hardware_interference_size+kannada,https://youtube.com/results?search_query=cpp+hardware_interference_size+tamil,https://youtube.com/results?search_query=cpp+hardware_interference_size+telugu
C++,Intermediate,Describe the concept of allocation awareness in containers.,Containers aware of memory resource,Memory allocation,Resource management,Container size,A,Allocator-aware containers can use custom memory allocators via std::pmr or custom allocators.,Memory Management,https://en.cppreference.com/w/cpp/memory/allocator,https://youtube.com/results?search_query=cpp+allocator+aware+containers,https://youtube.com/results?search_query=cpp+allocator+aware+containers+hindi,https://youtube.com/results?search_query=cpp+allocator+aware+containers+kannada,https://youtube.com/results?search_query=cpp+allocator+aware+containers+tamil,https://youtube.com/results?search_query=cpp+allocator+aware+containers+telugu
C++,Intermediate,How does std::lerp perform linear interpolation?,Computes a + t*(b-a) correctly,Simple multiplication,Floating point only,Integer only,A,std::lerp computes linear interpolation a + t*(b-a) with correct handling of edge cases.,Algorithms,https://en.cppreference.com/w/cpp/numeric/lerp,https://youtube.com/results?search_query=cpp+lerp,https://youtube.com/results?search_query=cpp+lerp+hindi,https://youtube.com/results?search_query=cpp+lerp+kannada,https://youtube.com/results?search_query=cpp+lerp+tamil,https://youtube.com/results?search_query=cpp+lerp+telugu
C++,Intermediate,What is the purpose of std::bind_front?,Partial function application,Complete binding,Front binding only,Back binding,A,std::bind_front binds arguments to the front of a callable object (replacement for std::bind).,Functions,https://en.cppreference.com/w/cpp/utility/functional/bind_front,https://youtube.com/results?search_query=cpp+bind_front,https://youtube.com/results?search_query=cpp+bind_front+hindi,https://youtube.com/results?search_query=cpp+bind_front+kannada,https://youtube.com/results?search_query=cpp+bind_front+tamil,https://youtube.com/results?search_query=cpp+bind_front+telugu
C++,Intermediate,Explain the concept of PImpl (Pointer to Implementation).,Hide implementation details in .cpp file,Pointer implementation,Public implementation,Simple implementation,A,PImpl idiom hides class implementation details by storing them in a separate class accessed via pointer.,Design Patterns,https://en.cppreference.com/w/cpp/language/pimpl,https://youtube.com/results?search_query=cpp+pimpl,https://youtube.com/results?search_query=cpp+pimpl+hindi,https://youtube.com/results?search_query=cpp+pimpl+kannada,https://youtube.com/results?search_query=cpp+pimpl+tamil,https://youtube.com/results?search_query=cpp+pimpl+telugu
C++,Intermediate,How does std::exchange work?,Sets variable to new value, returns old value,Exchanges values,Same as swap,Copies values,"A,std::exchange atomically replaces object with new value and returns the old value.",Utilities,https://en.cppreference.com/w/cpp/utility/exchange,https://youtube.com/results?search_query=cpp+exchange,https://youtube.com/results?search_query=cpp+exchange+hindi,https://youtube.com/results?search_query=cpp+exchange+kannada,https://youtube.com/results?search_query=cpp+exchange+tamil,https://youtube.com/results?search_query=cpp+exchange+telugu
C++,Intermediate,What is the purpose of std::identity?,Identity function object,Check identity,Create identity,Verify identity,A,std::identity is a function object that returns its argument unchanged (useful in ranges).,STL,https://en.cppreference.com/w/cpp/utility/functional/identity,https://youtube.com/results?search_query=cpp+identity,https://youtube.com/results?search_query=cpp+identity+hindi,https://youtube.com/results?search_query=cpp+identity+kannada,https://youtube.com/results?search_query=cpp+identity+tamil,https://youtube.com/results?search_query=cpp+identity+telugu
C++,Intermediate,Describe the concept of type erasure.,Hide concrete types behind interface,Erase type information,Delete types,Remove types,A,Type erasure allows treating objects of different types uniformly through a common interface.,Design Patterns,https://en.cppreference.com/w/cpp/utility/any,https://youtube.com/results?search_query=cpp+type+erasure,https://youtube.com/results?search_query=cpp+type+erasure+hindi,https://youtube.com/results?search_query=cpp+type+erasure+kannada,https://youtube.com/results?search_query=cpp+type+erasure+tamil,https://youtube.com/results?search_query=cpp+type+erasure+telugu
C++,Intermediate,How does std::visit work with std::variant?,Applies visitor to active alternative,Visits all alternatives,Random alternative,First alternative,A,std::visit calls the appropriate overload based on the currently active type in the variant.,STL,https://en.cppreference.com/w/cpp/utility/variant/visit,https://youtube.com/results?search_query=cpp+visit+variant,https://youtube.com/results?search_query=cpp+visit+variant+hindi,https://youtube.com/results?search_query=cpp+visit+variant+kannada,https://youtube.com/results?search_query=cpp+visit+variant+tamil,https://youtube.com/results?search_query=cpp+visit+variant+telugu
C++,Intermediate,What is the purpose of std::make_shared over shared_ptr constructor?,Single memory allocation for object and control block,Separate allocations,Same allocation,Faster allocation,A,"std::make_shared allocates object and control block together, improving performance and memory locality.",Memory Management,https://en.cppreference.com/w/cpp/memory/shared_ptr/make_shared,https://youtube.com/results?search_query=cpp+make_shared,https://youtube.com/results?search_query=cpp+make_shared+hindi,https://youtube.com/results?search_query=cpp+make_shared+kannada,https://youtube.com/results?search_query=cpp+make_shared+tamil,https://youtube.com/results?search_query=cpp+make_shared+telugu
C++,Intermediate,Explain the concept of NVI (Non-Virtual Interface).,Public non-virtual method calls private virtual method,Virtual interface only,No interface,Direct virtual calls,A,NVI pattern uses public non-virtual methods that call private virtual methods for implementation.,Design Patterns,https://en.cppreference.com/w/cpp/language/virtual,https://youtube.com/results?search_query=cpp+nvi+pattern,https://youtube.com/results?search_query=cpp+nvi+pattern+hindi,https://youtube.com/results?search_query=cpp+nvi+pattern+kannada,https://youtube.com/results?search_query=cpp+nvi+pattern+tamil,https://youtube.com/results?search_query=cpp+nvi+pattern+telugu
C++,Intermediate,How does std::partial_sort work?,Sorts first N elements partially,Sorts partially,Sorts completely,Same as sort,A,std::partial_sort rearranges elements so that first N are sorted and rest are in unspecified order.,Algorithms,https://en.cppreference.com/w/cpp/algorithm/partial_sort,https://youtube.com/results?search_query=cpp+partial_sort,https://youtube.com/results?search_query=cpp+partial_sort+hindi,https://youtube.com/results?search_query=cpp+partial_sort+kannada,https://youtube.com/results?search_query=cpp+partial_sort+tamil,https://youtube.com/results?search_query=cpp+partial_sort+telugu
C++,Intermediate,What is the purpose of std::inplace_merge?,Merge two sorted ranges in-place,Create new merged range,Same as merge,Merge unsorted ranges,A,std::inplace_merge merges two consecutive sorted ranges into one sorted range in-place.,Algorithms,https://en.cppreference.com/w/cpp/algorithm/inplace_merge,https://youtube.com/results?search_query=cpp+inplace_merge,https://youtube.com/results?search_query=cpp+inplace_merge+hindi,https://youtube.com/results?search_query=cpp+inplace_merge+kannada,https://youtube.com/results?search_query=cpp+inplace_merge+tamil,https://youtube.com/results?search_query=cpp+inplace_merge+telugu
C++,Intermediate,Describe the concept of segmented iterators.,Iterators over non-contiguous sequences,Contiguous iterators,Random iterators,Bidirectional iterators,A,Segmented iterators traverse data structures with non-contiguous memory (like std::deque).,Iterators,https://en.cppreference.com/w/cpp/iterator,https://youtube.com/results?search_query=cpp+segmented+iterators,https://youtube.com/results?search_query=cpp+segmented+iterators+hindi,https://youtube.com/results?search_query=cpp+segmented+iterators+kannada,https://youtube.com/results?search_query=cpp+segmented+iterators+tamil,https://youtube.com/results?search_query=cpp+segmented+iterators+telugu
C++,Intermediate,How does std::nth_element work?,Partitions around nth element,Finds nth element only,Same as sort,Same as partition,A,std::nth_element rearranges elements so that nth element is in its sorted position and partitions around it.,Algorithms,https://en.cppreference.com/w/cpp/algorithm/nth_element,https://youtube.com/results?search_query=cpp+nth_element,https://youtube.com/results?search_query=cpp+nth_element+hindi,https://youtube.com/results?search_query=cpp+nth_element+kannada,https://youtube.com/results?search_query=cpp+nth_element+tamil,https://youtube.com/results?search_query=cpp+nth_element+telugu

skill,level,question_text,option_a,option_b,option_c,option_d,correct_answer,explanation,mdn_link,youtube_english,youtube_hindi,youtube_kannada,youtube_tamil,youtube_telugu
C++,Intermediate,Which inheritance type results in multiple copies of a base class in a derived class?,Single inheritance,Multiple inheritance,Multilevel inheritance,Hybrid inheritance,B,Multiple inheritance can lead to the diamond problem where base class copies are duplicated.,https://en.cppreference.com/w/cpp/language/inheritance,https://youtube.com/results?search_query=c%2B%2B+multiple+inheritance,https://youtube.com/results?search_query=c%2B%2B+multiple+inheritance+hindi,https://youtube.com/results?search_query=c%2B%2B+multiple+inheritance+kannada,https://youtube.com/results?search_query=c%2B%2B+multiple+inheritance+tamil,https://youtube.com/results?search_query=c%2B%2B+multiple+inheritance+telugu
C++,Intermediate,What is the output of a virtual function call in a constructor?,Undefined behavior,The derived class version,The base class version,Compilation error,C,During construction, the dynamic type is the class being constructed, so base class version is called.,https://en.cppreference.com/w/cpp/language/virtual,https://youtube.com/results?search_query=c%2B%2B+virtual+function+constructor,https://youtube.com/results?search_query=c%2B%2B+virtual+function+constructor+hindi,https://youtube.com/results?search_query=c%2B%2B+virtual+function+constructor+kannada,https://youtube.com/results?search_query=c%2B%2B+virtual+function+constructor+tamil,https://youtube.com/results?search_query=c%2B%2B+virtual+function+constructor+telugu
C++,Intermediate,Which keyword is used to resolve ambiguity in multiple inheritance?,virtual,override,final,using,A,virtual inheritance ensures only one copy of a base class.,https://en.cppreference.com/w/cpp/language/virtual,https://youtube.com/results?search_query=c%2B%2B+virtual+inheritance,https://youtube.com/results?search_query=c%2B%2B+virtual+inheritance+hindi,https://youtube.com/results?search_query=c%2B%2B+virtual+inheritance+kannada,https://youtube.com/results?search_query=c%2B%2B+virtual+inheritance+tamil,https://youtube.com/results?search_query=c%2B%2B+virtual+inheritance+telugu
C++,Intermediate,How do you declare a pure virtual function in C++?,virtual void func() = 0;,virtual void func();,void func() = 0;,virtual void func() pure;,A,The =0 syntax makes a function pure virtual.,https://en.cppreference.com/w/cpp/language/abstract_class,https://youtube.com/results?search_query=c%2B%2B+pure+virtual+function,https://youtube.com/results?search_query=c%2B%2B+pure+virtual+function+hindi,https://youtube.com/results?search_query=c%2B%2B+pure+virtual+function+kannada,https://youtube.com/results?search_query=c%2B%2B+pure+virtual+function+tamil,https://youtube.com/results?search_query=c%2B%2B+pure+virtual+function+telugu
C++,Intermediate,Which operator cannot be overloaded in C++?,+,=,::,<<,C,The scope resolution operator :: cannot be overloaded.,https://en.cppreference.com/w/cpp/language/operators,https://youtube.com/results?search_query=c%2B%2B+operator+overloading+restrictions,https://youtube.com/results?search_query=c%2B%2B+operator+overloading+restrictions+hindi,https://youtube.com/results?search_query=c%2B%2B+operator+overloading+restrictions+kannada,https://youtube.com/results?search_query=c%2B%2B+operator+overloading+restrictions+tamil,https://youtube.com/results?search_query=c%2B%2B+operator+overloading+restrictions+telugu
C++,Intermediate,What is the purpose of a friend function?,Access private members of a class,Become a member function,Be inherited,Be virtual,A,Friend functions can access private and protected members.,https://en.cppreference.com/w/cpp/language/friend,https://youtube.com/results?search_query=c%2B%2B+friend+function,https://youtube.com/results?search_query=c%2B%2B+friend+function+hindi,https://youtube.com/results?search_query=c%2B%2B+friend+function+kannada,https://youtube.com/results?search_query=c%2B%2B+friend+function+tamil,https://youtube.com/results?search_query=c%2B%2B+friend+function+telugu
C++,Intermediate,Which STL container is typically implemented as a dynamic array?,list,vector,deque,map,B,vector is a dynamic array.,https://en.cppreference.com/w/cpp/container/vector,https://youtube.com/results?search_query=c%2B%2B+vector,https://youtube.com/results?search_query=c%2B%2B+vector+hindi,https://youtube.com/results?search_query=c%2B%2B+vector+kannada,https://youtube.com/results?search_query=c%2B%2B+vector+tamil,https://youtube.com/results?search_query=c%2B%2B+vector+telugu
C++,Intermediate,What iterator category supports random access?,Input iterator,Forward iterator,Bidirectional iterator,Random access iterator,D,Random access iterators can jump directly.,https://en.cppreference.com/w/cpp/iterator/iterator_tags,https://youtube.com/results?search_query=c%2B%2B+iterator+categories,https://youtube.com/results?search_query=c%2B%2B+iterator+categories+hindi,https://youtube.com/results?search_query=c%2B%2B+iterator+categories+kannada,https://youtube.com/results?search_query=c%2B%2B+iterator+categories+tamil,https://youtube.com/results?search_query=c%2B%2B+iterator+categories+telugu
C++,Intermediate,Which file stream class is used for reading from files?,ifstream,ofstream,fstream,filebuf,A,ifstream is input file stream.,https://en.cppreference.com/w/cpp/io/basic_ifstream,https://youtube.com/results?search_query=c%2B%2B+ifstream,https://youtube.com/results?search_query=c%2B%2B+ifstream+hindi,https://youtube.com/results?search_query=c%2B%2B+ifstream+kannada,https://youtube.com/results?search_query=c%2B%2B+ifstream+tamil,https://youtube.com/results?search_query=c%2B%2B+ifstream+telugu
C++,Intermediate,What is the base class for all standard exceptions in C++?,exception,std::exception,error,runtime_error,B,std::exception is the base class.,https://en.cppreference.com/w/cpp/error/exception,https://youtube.com/results?search_query=c%2B%2B+exception+hierarchy,https://youtube.com/results?search_query=c%2B%2B+exception+hierarchy+hindi,https://youtube.com/results?search_query=c%2B%2B+exception+hierarchy+kannada,https://youtube.com/results?search_query=c%2B%2B+exception+hierarchy+tamil,https://youtube.com/results?search_query=c%2B%2B+exception+hierarchy+telugu
C++,Intermediate,How do you create a namespace alias in C++?,namespace alias = name;,using namespace name = alias;,namespace name alias;,alias namespace name = newname;,A,The syntax is namespace alias = original;.,https://en.cppreference.com/w/cpp/language/namespace,https://youtube.com/results?search_query=c%2B%2B+namespace+alias,https://youtube.com/results?search_query=c%2B%2B+namespace+alias+hindi,https://youtube.com/results?search_query=c%2B%2B+namespace+alias+kannada,https://youtube.com/results?search_query=c%2B%2B+namespace+alias+tamil,https://youtube.com/results?search_query=c%2B%2B+namespace+alias+telugu
C++,Intermediate,What is a static member function?,Can access only static members,Can access all members,Can be virtual,Can be const,A,Static member functions have no this pointer and can only access static members.,https://en.cppreference.com/w/cpp/language/static,https://youtube.com/results?search_query=c%2B%2B+static+member+function,https://youtube.com/results?search_query=c%2B%2B+static+member+function+hindi,https://youtube.com/results?search_query=c%2B%2B+static+member+function+kannada,https://youtube.com/results?search_query=c%2B%2B+static+member+function+tamil,https://youtube.com/results?search_query=c%2B%2B+static+member+function+telugu
C++,Intermediate,Which keyword prevents a class from being inherited?,final,sealed,private,abstract,A,final specifier (C++11) prevents further derivation.,https://en.cppreference.com/w/cpp/language/final,https://youtube.com/results?search_query=c%2B%2B+final+specifier,https://youtube.com/results?search_query=c%2B%2B+final+specifier+hindi,https://youtube.com/results?search_query=c%2B%2B+final+specifier+kannada,https://youtube.com/results?search_query=c%2B%2B+final+specifier+tamil,https://youtube.com/results?search_query=c%2B%2B+final+specifier+telugu
C++,Intermediate,What is the output of the following code? int x = 5; int &r = x; int *p = &r; *p = 10; cout << x;?,5,10,Address of x,Compilation error,B,References are aliases; pointers to references point to the original variable.,https://en.cppreference.com/w/cpp/language/reference,https://youtube.com/results?search_query=c%2B%2B+reference+and+pointer,https://youtube.com/results?search_query=c%2B%2B+reference+and+pointer+hindi,https://youtube.com/results?search_query=c%2B%2B+reference+and+pointer+kannada,https://youtube.com/results?search_query=c%2B%2B+reference+and+pointer+tamil,https://youtube.com/results?search_query=c%2B%2B+reference+and+pointer+telugu
C++,Intermediate,Which STL container allows duplicate elements and is sorted automatically?,set,multiset,map,multimap,B,multiset stores sorted elements allowing duplicates.,https://en.cppreference.com/w/cpp/container/multiset,https://youtube.com/results?search_query=c%2B%2B+multiset,https://youtube.com/results?search_query=c%2B%2B+multiset+hindi,https://youtube.com/results?search_query=c%2B%2B+multiset+kannada,https://youtube.com/results?search_query=c%2B%2B+multiset+tamil,https://youtube.com/results?search_query=c%2B%2B+multiset+telugu
C++,Intermediate,What is the purpose of an iterator in STL?,To iterate over containers,To perform algorithms,To provide a uniform interface to access elements,All of the above,D,Iterators are a generalization of pointers.,https://en.cppreference.com/w/cpp/iterator,https://youtube.com/results?search_query=c%2B%2B+iterators,https://youtube.com/results?search_query=c%2B%2B+iterators+hindi,https://youtube.com/results?search_query=c%2B%2B+iterators+kannada,https://youtube.com/results?search_query=c%2B%2B+iterators+tamil,https://youtube.com/results?search_query=c%2B%2B+iterators+telugu
C++,Intermediate,Which file opening mode is used to append to a file?,ios::app,ios::ate,ios::trunc,ios::in,A,ios::app appends to the end.,https://en.cppreference.com/w/cpp/io/ios_base/openmode,https://youtube.com/results?search_query=c%2B%2B+file+open+modes,https://youtube.com/results?search_query=c%2B%2B+file+open+modes+hindi,https://youtube.com/results?search_query=c%2B%2B+file+open+modes+kannada,https://youtube.com/results?search_query=c%2B%2B+file+open+modes+tamil,https://youtube.com/results?search_query=c%2B%2B+file+open+modes+telugu
C++,Intermediate,What does the throw keyword do in C++?,Throws an exception,Declares a function that can throw,Both A and B,None,A,throw is used to throw an exception.,https://en.cppreference.com/w/cpp/language/throw,https://youtube.com/results?search_query=c%2B%2B+throw,https://youtube.com/results?search_query=c%2B%2B+throw+hindi,https://youtube.com/results?search_query=c%2B%2B+throw+kannada,https://youtube.com/results?search_query=c%2B%2B+throw+tamil,https://youtube.com/results?search_query=c%2B%2B+throw+telugu
C++,Intermediate,How do you define a template function that takes two types?,template <typename T, typename U> void func(T a, U b);,template <class T, class U> void func(T a, U b);,Both A and B are valid,None of the above,C,Both typename and class are equivalent.,https://en.cppreference.com/w/cpp/language/templates,https://youtube.com/results?search_query=c%2B%2B+function+template,https://youtube.com/results?search_query=c%2B%2B+function+template+hindi,https://youtube.com/results?search_query=c%2B%2B+function+template+kannada,https://youtube.com/results?search_query=c%2B%2B+function+template+tamil,https://youtube.com/results?search_query=c%2B%2B+function+template+telugu
C++,Intermediate,What is the purpose of the override specifier?,To indicate a function overrides a virtual function,To make a function final,To overload a function,To hide a base class function,A,override (C++11) ensures the function is overriding a virtual.,https://en.cppreference.com/w/cpp/language/override,https://youtube.com/results?search_query=c%2B%2B+override+specifier,https://youtube.com/results?search_query=c%2B%2B+override+specifier+hindi,https://youtube.com/results?search_query=c%2B%2B+override+specifier+kannada,https://youtube.com/results?search_query=c%2B%2B+override+specifier+tamil,https://youtube.com/results?search_query=c%2B%2B+override+specifier+telugu
C++,Intermediate,Which operator is used for overloading output stream (<<) as a non-member function?,operator<<,operator>>,operator=,operator+,A,Overloading << as a non-member is common for ostream.,https://en.cppreference.com/w/cpp/language/operators,https://youtube.com/results?search_query=c%2B%2B+overload+output+operator,https://youtube.com/results?search_query=c%2B%2B+overload+output+operator+hindi,https://youtube.com/results?search_query=c%2B%2B+overload+output+operator+kannada,https://youtube.com/results?search_query=c%2B%2B+overload+output+operator+tamil,https://youtube.com/results?search_query=c%2B%2B+overload+output+operator+telugu
C++,Intermediate,What is the size of an empty class in C++?,0,1,4,8,B,Even an empty class has a non-zero size (typically 1) to ensure distinct addresses.,https://en.cppreference.com/w/cpp/language/classes,https://youtube.com/results?search_query=c%2B%2B+empty+class+size,https://youtube.com/results?search_query=c%2B%2B+empty+class+size+hindi,https://youtube.com/results?search_query=c%2B%2B+empty+class+size+kannada,https://youtube.com/results?search_query=c%2B%2B+empty+class+size+tamil,https://youtube.com/results?search_query=c%2B%2B+empty+class+size+telugu
C++,Intermediate,Which STL container is best for frequent insertions and deletions in the middle?,vector,list,deque,array,B,list (doubly linked list) allows constant-time insertions/deletions anywhere.,https://en.cppreference.com/w/cpp/container/list,https://youtube.com/results?search_query=c%2B%2B+list+vs+vector,https://youtube.com/results?search_query=c%2B%2B+list+vs+vector+hindi,https://youtube.com/results?search_query=c%2B%2B+list+vs+vector+kannada,https://youtube.com/results?search_query=c%2B%2B+list+vs+vector+tamil,https://youtube.com/results?search_query=c%2B%2B+list+vs+vector+telugu
