Topic,Difficulty,Question,Tag1,Tag2,Tag3,Tag4,Correct Option,Explanation,Category,Doc URL,Video Search EN,Video Search HI,Video Search KN,Video Search TA,Video Search TE
Docker,Advanced,How does Docker's architecture differ from traditional virtualization in resource utilization?,Containerization,Hypervisor,Resource efficiency,Isolation,A,Docker uses OS-level virtualization sharing host kernel, while VMs require full OS per instance with hypervisor overhead.,Architecture,https://docs.docker.com/get-started/overview/,https://youtube.com/results?search_query=docker+vs+virtualization+architecture,https://youtube.com/results?search_query=docker+vs+virtualization+architecture+hindi,https://youtube.com/results?search_query=docker+vs+virtualization+architecture+kannada,https://youtube.com/results?search_query=docker+vs+virtualization+architecture+tamil,https://youtube.com/results?search_query=docker+vs+virtualization+architecture+telugu
Docker,Advanced,What is the purpose of Docker's multi-stage builds and how do they optimize image size?,Image optimization,Multi-stage builds,Builder pattern,Size reduction,A,Multi-stage builds allow using multiple FROM statements to create intermediate images and copy only needed artifacts to final image.,Image Building,https://docs.docker.com/develop/develop-images/multistage-build/,https://youtube.com/results?search_query=docker+multi+stage+builds,https://youtube.com/results?search_query=docker+multi+stage+builds+hindi,https://youtube.com/results?search_query=docker+multi+stage+builds+kannada,https://youtube.com/results?search_query=docker+multi+stage+builds+tamil,https://youtube.com/results?search_query=docker+multi+stage+builds+telugu
Docker,Advanced,How does Docker Compose's networking differ from Docker's default bridge network?,Network isolation,Service discovery,Compose networking,Multi-container,A,Docker Compose creates custom bridge network per project allowing service discovery via service names, unlike default bridge.,Networking,https://docs.docker.com/compose/networking/,https://youtube.com/results?search_query=docker+compose+networking+vs+bridge,https://youtube.com/results?search_query=docker+compose+networking+vs+bridge+hindi,https://youtube.com/results?search_query=docker+compose+networking+vs+bridge+kannada,https://youtube.com/results?search_query=docker+compose+networking+vs+bridge+tamil,https://youtube.com/results?search_query=docker+compose+networking+vs+bridge+telugu
Docker,Advanced,What is Docker Swarm's Raft consensus algorithm used for in cluster management?,Cluster consensus,Leader election,Fault tolerance,Distributed systems,A,Raft maintains consistent cluster state across manager nodes, handling leader election and log replication for fault tolerance.,Orchestration,https://docs.docker.com/engine/swarm/raft/,https://youtube.com/results?search_query=docker+swarm+raft+consensus,https://youtube.com/results?search_query=docker+swarm+raft+consensus+hindi,https://youtube.com/results?search_query=docker+swarm+raft+consensus+kannada,https://youtube.com/results?search_query=docker+swarm+raft+consensus+tamil,https://youtube.com/results?search_query=docker+swarm+raft+consensus+telugu
Docker,Advanced,How do Docker volumes differ from bind mounts in terms of data persistence and management?,Storage drivers,Data persistence,Volume management,Bind mounts,A,Volumes are managed by Docker with lifecycle commands, while bind mounts directly map host paths with less Docker control.,Storage,https://docs.docker.com/storage/volumes/,https://youtube.com/results?search_query=docker+volumes+vs+bind+mounts,https://youtube.com/results?search_query=docker+volumes+vs+bind+mounts+hindi,https://youtube.com/results?search_query=docker+volumes+vs+bind+mounts+kannada,https://youtube.com/results?search_query=docker+volumes+vs+bind+mounts+tamil,https://youtube.com/results?search_query=docker+volumes+vs+bind+mounts+telugu
Docker,Advanced,What is the purpose of Docker's overlay network driver in multi-host container communication?,Overlay networks,Cross-host communication,Network plugins,Distributed networking,A,Overlay driver creates virtual networks spanning multiple Docker hosts, enabling containers on different hosts to communicate.,Networking,https://docs.docker.com/network/overlay/,https://youtube.com/results?search_query=docker+overlay+network+driver,https://youtube.com/results?search_query=docker+overlay+network+driver+hindi,https://youtube.com/results?search_query=docker+overlay+network+driver+kannada,https://youtube.com/results?search_query=docker+overlay+network+driver+tamil,https://youtube.com/results?search_query=docker+overlay+network+driver+telugu
Docker,Advanced,How does Docker's user namespace remapping enhance container security?,Security isolation,User mapping,Root escalation prevention,Namespace,A,User namespace maps container UID/GID to different host UID/GID, preventing container root from being host root.,Security,https://docs.docker.com/engine/security/userns-remap/,https://youtube.com/results?search_query=docker+user+namespace+remapping,https://youtube.com/results?search_query=docker+user+namespace+remapping+hindi,https://youtube.com/results?search_query=docker+user+namespace+remapping+kannada,https://youtube.com/results?search_query=docker+user+namespace+remapping+tamil,https://youtube.com/results?search_query=docker+user+namespace+remapping+telugu
Docker,Advanced,What is Docker Content Trust (DCT) and how does it ensure image integrity?,Image signing,Trust verification,Supply chain security,Notary,A,DCT uses digital signatures to verify image authenticity and integrity through Docker Notary service.,Security,https://docs.docker.com/engine/security/trust/,https://youtube.com/results?search_query=docker+content+trust+security,https://youtube.com/results?search_query=docker+content+trust+security+hindi,https://youtube.com/results?search_query=docker+content+trust+security+kannada,https://youtube.com/results?search_query=docker+content+trust+security+tamil,https://youtube.com/results?search_query=docker+content+trust+security+telugu
Docker,Advanced,How does Docker Swarm's service discovery differ from Kubernetes service discovery?,Service mesh,DNS resolution,Load balancing,Orchestration,A,Swarm uses embedded DNS server with VIP-based load balancing, while Kubernetes uses more complex service objects and kube-proxy.,Orchestration,https://docs.docker.com/engine/swarm/how-swarm-mode-works/services/,https://youtube.com/results?search_query=docker+swarm+vs+kubernetes+service+discovery,https://youtube.com/results?search_query=docker+swarm+vs+kubernetes+service+discovery+hindi,https://youtube.com/results?search_query=docker+swarm+vs+kubernetes+service+discovery+kannada,https://youtube.com/results?search_query=docker+swarm+vs+kubernetes+service+discovery+tamil,https://youtube.com/results?search_query=docker+swarm+vs+kubernetes+service+discovery+telugu
Docker,Advanced,What is the purpose of Docker's buildx and how does it enable multi-architecture builds?,Cross-platform builds,ARM support,BuildKit,Multi-arch,A,buildx extends docker build with BuildKit backend supporting simultaneous builds for multiple architectures (amd64, arm64).,Image Building,https://docs.docker.com/buildx/working-with-buildx/,https://youtube.com/results?search_query=docker+buildx+multi+architecture,https://youtube.com/results?search_query=docker+buildx+multi+architecture+hindi,https://youtube.com/results?search_query=docker+buildx+multi+architecture+kannada,https://youtube.com/results?search_query=docker+buildx+multi+architecture+tamil,https://youtube.com/results?search_query=docker+buildx+multi+architecture+telugu
Docker,Advanced,How does Docker's seccomp profile enhance container security at the kernel level?,System call filtering,Kernel security,Sandboxing,Seccomp,A,seccomp restricts system calls containers can make, reducing attack surface by blocking dangerous system calls.,Security,https://docs.docker.com/engine/security/seccomp/,https://youtube.com/results?search_query=docker+seccomp+security+profiles,https://youtube.com/results?search_query=docker+seccomp+security+profiles+hindi,https://youtube.com/results?search_query=docker+seccomp+security+profiles+kannada,https://youtube.com/results?search_query=docker+seccomp+security+profiles+tamil,https://youtube.com/results?search_query=docker+seccomp+security+profiles+telugu
Docker,Advanced,What is Docker's BuildKit and how does it improve upon the traditional Docker builder?,Parallel builds,Cache efficiency,Build performance,Secret management,A,BuildKit enables parallel layer building, improved cache reuse, and built-in secret management for safer builds.,Image Building,https://docs.docker.com/develop/develop-images/build_enhancements/,https://youtube.com/results?search_query=docker+buildkit+vs+traditional+builder,https://youtube.com/results?search_query=docker+buildkit+vs+traditional+builder+hindi,https://youtube.com/results?search_query=docker+buildkit+vs+traditional+builder+kannada,https://youtube.com/results?search_query=docker+buildkit+vs+traditional+builder+tamil,https://youtube.com/results?search_query=docker+buildkit+vs+traditional+builder+telugu
Docker,Advanced,How do Docker health checks improve container orchestration and self-healing?,Container monitoring,Liveness probes,Readiness checks,Orchestration,A,Health checks enable Docker to monitor container status and automatically restart unhealthy containers in orchestration.,Monitoring,https://docs.docker.com/engine/reference/builder/#healthcheck,https://youtube.com/results?search_query=docker+health+checks+orchestration,https://youtube.com/results?search_query=docker+health+checks+orchestration+hindi,https://youtube.com/results?search_query=docker+health+checks+orchestration+kannada,https://youtube.com/results?search_query=docker+health+checks+orchestration+tamil,https://youtube.com/results?search_query=docker+health+checks+orchestration+telugu
Docker,Advanced,What is Docker's Macvlan network driver and when would you use it over bridge networking?,MAC addresses,Network virtualization,Bare-metal performance,Legacy applications,A,Macvlan assigns MAC addresses to containers making them appear as physical devices on network, useful for legacy apps requiring MAC.,Networking,https://docs.docker.com/network/macvlan/,https://youtube.com/results?search_query=docker+macvlan+network+driver,https://youtube.com/results?search_query=docker+macvlan+network+driver+hindi,https://youtube.com/results?search_query=docker+macvlan+network+driver+kannada,https://youtube.com/results?search_query=docker+macvlan+network+driver+tamil,https://youtube.com/results?search_query=docker+macvlan+network+driver+telugu
Docker,Advanced,How does Docker Swarm's rolling update strategy ensure zero-downtime deployments?,Blue-green deployment,Rolling updates,Service updates,Orchestration,A,Swarm updates containers incrementally with health checks, maintaining service availability during deployment.,Orchestration,https://docs.docker.com/engine/swarm/swarm-tutorial/rolling-update/,https://youtube.com/results?search_query=docker+swarm+rolling+updates,https://youtube.com/results?search_query=docker+swarm+rolling+updates+hindi,https://youtube.com/results?search_query=docker+swarm+rolling+updates+kannada,https://youtube.com/results?search_query=docker+swarm+rolling+updates+tamil,https://youtube.com/results?search_query=docker+swarm+rolling+updates+telugu
Docker,Advanced,What is Docker's containerd and how does it relate to the Docker Engine architecture?,Container runtime,CRI,Engine architecture,Runtime interface,A,containerd is industry-standard container runtime that Docker Engine uses as lower-level component for container operations.,Architecture,https://docs.docker.com/get-started/overview/#docker-architecture,https://youtube.com/results?search_query=docker+containerd+runtime,https://youtube.com/results?search_query=docker+containerd+runtime+hindi,https://youtube.com/results?search_query=docker+containerd+runtime+kannada,https://youtube.com/results?search_query=docker+containerd+runtime+tamil,https://youtube.com/results?search_query=docker+containerd+runtime+telugu
Docker,Advanced,How do Docker configs and secrets differ in handling sensitive vs non-sensitive configuration data?,Configuration management,Secret storage,Swarm services,Encryption,A,Configs store non-sensitive configuration files; secrets encrypt sensitive data and are only mounted to in-memory filesystems.,Security,https://docs.docker.com/engine/swarm/secrets/,https://youtube.com/results?search_query=docker+configs+vs+secrets,https://youtube.com/results?search_query=docker+configs+vs+secrets+hindi,https://youtube.com/results?search_query=docker+configs+vs+secrets+kannada,https://youtube.com/results?search_query=docker+configs+vs+secrets+tamil,https://youtube.com/results?search_query=docker+configs+vs+secrets+telugu
Docker,Advanced,What is Docker's Cgroups v2 and how does it improve resource management over v1?,Resource limits,Cgroups,Memory management,CPU scheduling,A,Cgroups v2 provides unified hierarchy with improved memory, IO, and PID resource management and better container isolation.,Resource Management,https://docs.docker.com/config/containers/resource_constraints/,https://youtube.com/results?search_query=docker+cgroups+v2+vs+v1,https://youtube.com/results?search_query=docker+cgroups+v2+vs+v1+hindi,https://youtube.com/results?search_query=docker+cgroups+v2+vs+v1+kannada,https://youtube.com/results?search_query=docker+cgroups+v2+vs+v1+tamil,https://youtube.com/results?search_query=docker+cgroups+v2+vs+v1+telugu
Docker,Advanced,How does Docker's --privileged flag differ from specific capability grants with --cap-add?,Privileged containers,Linux capabilities,Security hardening,Root access,A,--privileged gives all capabilities; --cap-add grants specific capabilities only, following principle of least privilege.,Security,https://docs.docker.com/engine/reference/run/#runtime-privilege-and-linux-capabilities,https://youtube.com/results?search_query=docker+privileged+vs+cap+add,https://youtube.com/results?search_query=docker+privileged+vs+cap+add+hindi,https://youtube.com/results?search_query=docker+privileged+vs+cap+add+kannada,https://youtube.com/results?search_query=docker+privileged+vs+cap+add+tamil,https://youtube.com/results?search_query=docker+privileged+vs+cap+add+telugu
Docker,Advanced,What is Docker's rootless mode and how does it enhance security without root privileges?,Non-root containers,Security isolation,User namespace,Daemonless,A,Rootless mode runs Docker daemon and containers without root privileges using user namespaces and subordinate IDs.,Security,https://docs.docker.com/engine/security/rootless/,https://youtube.com/results?search_query=docker+rootless+mode+security,https://youtube.com/results?search_query=docker+rootless+mode+security+hindi,https://youtube.com/results?search_query=docker+rootless+mode+security+kannada,https://youtube.com/results?search_query=docker+rootless+mode+security+tamil,https://youtube.com/results?search_query=docker+rootless+mode+security+telugu
Docker,Advanced,How does Docker Compose's depends_on differ from actual service readiness waiting?,Service dependencies,Startup order,Health checks,Compose,A,depends_on only controls startup order; doesn't wait for service readiness - use healthchecks or scripts for readiness waiting.,Orchestration,https://docs.docker.com/compose/compose-file/compose-file-v3/#depends_on,https://youtube.com/results?search_query=docker+compose+depends_on+readiness,https://youtube.com/results?search_query=docker+compose+depends_on+readiness+hindi,https://youtube.com/results?search_query=docker+compose+depends_on+readiness+kannada,https://youtube.com/results?search_query=docker+compose+depends_on+readiness+tamil,https://youtube.com/results?search_query=docker+compose+depends_on+readiness+telugu
Docker,Advanced,What is Docker's Telemetry and how can it be configured for enterprise monitoring?,Monitoring,Metrics collection,Enterprise,Telemetry,A,Docker Enterprise Edition includes telemetry for monitoring container performance, security events, and compliance metrics.,Monitoring,https://docs.docker.com/ee/admin/monitor/,https://youtube.com/results?search_query=docker+telemetry+monitoring,https://youtube.com/results?search_query=docker+telemetry+monitoring+hindi,https://youtube.com/results?search_query=docker+telemetry+monitoring+kannada,https://youtube.com/results?search_query=docker+telemetry+monitoring+tamil,https://youtube.com/results?search_query=docker+telemetry+monitoring+telugu
Docker,Advanced,How does Docker's storage driver selection impact container performance and stability?,Storage drivers,Overlay2,Performance tuning,Filesystems,A,Storage drivers like overlay2, devicemapper, or btrfs affect I/O performance, layer management, and compatibility with host filesystem.,Storage,https://docs.docker.com/storage/storagedriver/select-storage-driver/,https://youtube.com/results?search_query=docker+storage+driver+performance,https://youtube.com/results?search_query=docker+storage+driver+performance+hindi,https://youtube.com/results?search_query=docker+storage+driver+performance+kannada,https://youtube.com/results?search_query=docker+storage+driver+performance+tamil,https://youtube.com/results?search_query=docker+storage+driver+performance+telugu
Docker,Advanced,What is Docker's checkpoint/restore feature and how does it enable live migration?,Checkpointing,Container migration,CRIU,Live migration,A,Checkpoint/restore uses CRIU to save container state to disk and restore elsewhere, enabling live migration without downtime.,Advanced Features,https://docs.docker.com/engine/reference/commandline/checkpoint/,https://youtube.com/results?search_query=docker+checkpoint+restore+migration,https://youtube.com/results?search_query=docker+checkpoint+restore+migration+hindi,https://youtube.com/results?search_query=docker+checkpoint+restore+migration+kannada,https://youtube.com/results?search_query=docker+checkpoint+restore+migration+tamil,https://youtube.com/results?search_query=docker+checkpoint+restore+migration+telugu
Docker,Advanced,How does Docker Swarm's ingress routing mesh work for external service access?,Load balancing,Ingress network,Service mesh,Routing mesh,A,Ingress mesh publishes service ports on all swarm nodes, routing external traffic to appropriate service tasks automatically.,Networking,https://docs.docker.com/engine/swarm/ingress/,https://youtube.com/results?search_query=docker+swarm+ingress+routing+mesh,https://youtube.com/results?search_query=docker+swarm+ingress+routing+mesh+hindi,https://youtube.com/results?search_query=docker+swarm+ingress+routing+mesh+kannada,https://youtube.com/results?search_query=docker+swarm+ingress+routing+mesh+tamil,https://youtube.com/results?search_query=docker+swarm+ingress+routing+mesh+telugu
Docker,Advanced,What is Docker's BuildKit cache manifest and how does it optimize CI/CD pipeline builds?,Build caching,Cache manifests,CI/CD optimization,Cache export,A,BuildKit cache manifest allows exporting/importing build cache between CI/CD pipeline stages, dramatically speeding up builds.,CI/CD,https://docs.docker.com/build/cache/backends/,https://youtube.com/results?search_query=docker+buildkit+cache+manifest,https://youtube.com/results?search_query=docker+buildkit+cache+manifest+hindi,https://youtube.com/results?search_query=docker+buildkit+cache+manifest+kannada,https://youtube.com/results?search_query=docker+buildkit+cache+manifest+tamil,https://youtube.com/results?search_query=docker+buildkit+cache+manifest+telugu
Docker,Advanced,How do Docker's resource reservations (--reserve-cpu/--reserve-memory) differ from limits?,Resource management,Reservations vs limits,Scheduling,Swarm,A,Reservations guarantee minimum resources for containers; limits set maximum usage - reservations affect swarm scheduling decisions.,Resource Management,https://docs.docker.com/config/containers/resource_constraints/,https://youtube.com/results?search_query=docker+resource+reservations+vs+limits,https://youtube.com/results?search_query=docker+resource+reservations+vs+limits+hindi,https://youtube.com/results?search_query=docker+resource+reservations+vs+limits+kannada,https://youtube.com/results?search_query=docker+resource+reservations+vs+limits+tamil,https://youtube.com/results?search_query=docker+resource+reservations+vs+limits+telugu
Docker,Advanced,What is Docker's IPAM (IP Address Management) driver and how does it customize network addressing?,IP management,Network configuration,IP allocation,Subnet management,A,IPAM drivers manage IP address allocation, allowing custom subnet configuration, gateway assignment, and IP range management.,Networking,https://docs.docker.com/network/ipam/,https://youtube.com/results?search_query=docker+ipam+network+driver,https://youtube.com/results?search_query=docker+ipam+network+driver+hindi,https://youtube.com/results?search_query=docker+ipam+network+driver+kannada,https://youtube.com/results?search_query=docker+ipam+network+driver+tamil,https://youtube.com/results?search_query=docker+ipam+network+driver+telugu
Docker,Advanced,How does Docker's --tmpfs mount differ from regular volume mounts for temporary data?,Temporary storage,In-memory filesystems,tmpfs,Performance,A,--tmpfs creates in-memory temporary filesystem without persistence, faster than volumes but data lost on container stop.,Storage,https://docs.docker.com/storage/tmpfs/,https://youtube.com/results?search_query=docker+tmpfs+mount+performance,https://youtube.com/results?search_query=docker+tmpfs+mount+performance+hindi,https://youtube.com/results?search_query=docker+tmpfs+mount+performance+kannada,https://youtube.com/results?search_query=docker+tmpfs+mount+performance+tamil,https://youtube.com/results?search_query=docker+tmpfs+mount+performance+telugu
Docker,Advanced,What is Docker's Windows container architecture and how does it differ from Linux containers?,Windows containers,Hyper-V isolation,OS compatibility,Platform,A,Windows containers use Windows kernel with two isolation modes: process (sharing kernel) and Hyper-V (lightweight VM).,Platform,https://docs.docker.com/desktop/windows/windows-containers/,https://youtube.com/results?search_query=docker+windows+containers+architecture,https://youtube.com/results?search_query=docker+windows+containers+architecture+hindi,https://youtube.com/results?search_query=docker+windows+containers+architecture+kannada,https://youtube.com/results?search_query=docker+windows+containers+architecture+tamil,https://youtube.com/results?search_query=docker+windows+containers+architecture+telugu
Docker,Advanced,How does Docker Swarm's global service mode differ from replicated service mode?,Service scheduling,Global vs replicated,Swarm mode,Node placement,A,Global services run one task per node; replicated services run specified number of tasks distributed across swarm.,Orchestration,https://docs.docker.com/engine/swarm/how-swarm-mode-works/services/,https://youtube.com/results?search_query=docker+swarm+global+vs+replicated+services,https://youtube.com/results?search_query=docker+swarm+global+vs+replicated+services+hindi,https://youtube.com/results?search_query=docker+swarm+global+vs+replicated+services+kannada,https://youtube.com/results?search_query=docker+swarm+global+vs+replicated+services+tamil,https://youtube.com/results?search_query=docker+swarm+global+vs+replicated+services+telugu
Docker,Advanced,What is Docker's Distroless base image strategy and how does it enhance security?,Minimal images,Security hardening,Vulnerability reduction,Base images,A,Distroless images contain only application and runtime dependencies, no shell or package managers, reducing attack surface.,Security,https://github.com/GoogleContainerTools/distroless,https://youtube.com/results?search_query=docker+distroless+base+images,https://youtube.com/results?search_query=docker+distroless+base+images+hindi,https://youtube.com/results?search_query=docker+distroless+base+images+kannada,https://youtube.com/results?search_query=docker+distroless+base+images+tamil,https://youtube.com/results?search_query=docker+distroless+base+images+telugu
Docker,Advanced,How does Docker's --link flag differ from modern Docker network service discovery?,Legacy linking,Service discovery,Networking evolution,DNS,A,--link creates legacy container links with environment variables; modern Docker networks use embedded DNS for service discovery.,Networking,https://docs.docker.com/network/links/,https://youtube.com/results?search_query=docker+link+vs+network+service+discovery,https://youtube.com/results?search_query=docker+link+vs+network+service+discovery+hindi,https://youtube.com/results?search_query=docker+link+vs+network+service+discovery+kannada,https://youtube.com/results?search_query=docker+link+vs+network+service+discovery+tamil,https://youtube.com/results?search_query=docker+link+vs+network+service+discovery+telugu
Docker,Advanced,What is Docker's BuildKit frontend and how does it enable custom Dockerfile syntax?,Build frontends,Custom syntax,Dockerfile extensions,BuildKit,A,BuildKit frontends allow using alternative syntax like Dockerfile v1.4+ features or custom DSLs for image building.,Image Building,https://docs.docker.com/engine/reference/builder/,https://youtube.com/results?search_query=docker+buildkit+frontend+custom+syntax,https://youtube.com/results?search_query=docker+buildkit+frontend+custom+syntax+hindi,https://youtube.com/results?search_query=docker+buildkit+frontend+custom+syntax+kannada,https://youtube.com/results?search_query=docker+buildkit+frontend+custom+syntax+tamil,https://youtube.com/results?search_query=docker+buildkit+frontend+custom+syntax+telugu
