Topic,Difficulty,Question,Tag1,Tag2,Tag3,Tag4,Correct Option,Explanation,Category,Doc URL,Video Search EN,Video Search HI,Video Search KN,Video Search TA,Video Search TE
Docker,Advanced,How does Docker's --oom-kill-disable flag manage Out-Of-Memory handling?,OOM killer,Memory management,Process termination,Resource limits,A,--oom-kill-disable prevents kernel OOM killer from terminating container processes, but container may freeze if out of memory.,Resource Management,https://docs.docker.com/config/containers/resource_constraints/#memory,https://youtube.com/results?search_query=docker+oom+kill+disable+flag,https://youtube.com/results?search_query=docker+oom+kill+disable+flag+hindi,https://youtube.com/results?search_query=docker+oom+kill+disable+flag+kannada,https://youtube.com/results?search_query=docker+oom+kill+disable+flag+tamil,https://youtube.com/results?search_query=docker+oom+kill+disable+flag+telugu
Docker,Advanced,What is Docker's support for Windows Server Core vs Nano Server base images?,Windows containers,Server Core,Nano Server,Image variants,A,Server Core includes full Windows APIs; Nano Server is minimal (no GUI, smaller) for .NET Core/ASP.NET apps.,Platform,https://docs.docker.com/desktop/windows/windows-containers/,https://youtube.com/results?search_query=docker+windows+server+core+nano+server,https://youtube.com/results?search_query=docker+windows+server+core+nano+server+hindi,https://youtube.com/results?search_query=docker+windows+server+core+nano+server+kannada,https://youtube.com/results?search_query=docker+windows+server+core+nano+server+tamil,https://youtube.com/results?search_query=docker+windows+server+core+nano+server+telugu
Docker,Advanced,How does Docker's --device-read-bps/--device-write-bps throttle device IO rates?,IO throttling,Device limits,Read/write bps,Performance control,A,These flags limit read/write rates (bytes per second) to specific block devices, preventing containers from saturating IO.,Resource Management,https://docs.docker.com/config/containers/resource_constraints/#block-io-bandwidth-blkio-constraints,https://youtube.com/results?search_query=docker+device+read+write+bps+throttling,https://youtube.com/results?search_query=docker+device+read+write+bps+throttling+hindi,https://youtube.com/results?search_query=docker+device+read+write+bps+throttling+kannada,https://youtube.com/results?search_query=docker+device+read+write+bps+throttling+tamil,https://youtube.com/results?search_query=docker+device+read+write+bps+throttling+telugu
Docker,Advanced,What is Docker's support for Docker App and cloud-native application bundles?,Application packaging,Docker App,CNAB,Multi-service apps,A,Docker App packages multi-service apps with parameters and deployment logic using CNAB specification.,Packaging,https://docs.docker.com/app/,https://youtube.com/results?search_query=docker+app+cnab+packaging,https://youtube.com/results?search_query=docker+app+cnab+packaging+hindi,https://youtube.com/results?search_query=docker+app+cnab+packaging+kannada,https://youtube.com/results?search_query=docker+app+cnab+packaging+tamil,https://youtube.com/results?search_query=docker+app+cnab+packaging+telugu
Docker,Advanced,How does Docker's --group-add add additional groups to container users?,User groups,Supplementary groups,Permission management,Access control,A,--group-add adds supplementary groups to container's primary user, granting additional permissions without changing UID.,Security,https://docs.docker.com/engine/reference/run/#additional-groups,https://youtube.com/results?search_query=docker+group+add+supplementary+groups,https://youtube.com/results?search_query=docker+group+add+supplementary+groups+hindi,https://youtube.com/results?search_query=docker+group+add+supplementary+groups+kannada,https://youtube.com/results?search_query=docker+group+add+supplementary+groups+tamil,https://youtube.com/results?search_query=docker+group+add+supplementary+groups+telugu
Docker,Advanced,What is Docker's BuildKit's provenance attestations for supply chain security?,Provenance,Supply chain security,SBOM,Image attestation,A,Provenance attestations cryptographically verify build source, parameters, and dependencies, generating SBOM for compliance.,Security,https://docs.docker.com/build/attestations/slsa-provenance/,https://youtube.com/results?search_query=docker+buildkit+provenance+attestations,https://youtube.com/results?search_query=docker+buildkit+provenance+attestations+hindi,https://youtube.com/results?search_query=docker+buildkit+provenance+attestations+kannada,https://youtube.com/results?search_query=docker+buildkit+provenance+attestations+tamil,https://youtube.com/results?search_query=docker+buildkit+provenance+attestations+telugu
Docker,Advanced,How does Docker's --ipc flag control Inter-Process Communication namespace sharing?,IPC namespace,Shared memory,Semaphores,Message queues,A,--ipc shares or isolates IPC namespaces, allowing or preventing shared memory/semaphores between containers/host.,Process Management,https://docs.docker.com/engine/reference/run/#ipc-settings---ipc,https://youtube.com/results?search_query=docker+ipc+namespace+sharing,https://youtube.com/results?search_query=docker+ipc+namespace+sharing+hindi,https://youtube.com/results?search_query=docker+ipc+namespace+sharing+kannada,https://youtube.com/results?search_query=docker+ipc+namespace+sharing+tamil,https://youtube.com/results?search_query=docker+ipc+namespace+sharing+telugu
Docker,Advanced,What is Docker's support for IPvlan L2/L3 modes and their networking implications?,IPvlan,L2 bridging,L3 routing,Network modes,A,IPvlan L2 mode acts like MACVLAN without MAC addresses; L3 mode routes at IP layer without ARP broadcast flooding.,Networking,https://docs.docker.com/network/ipvlan/,https://youtube.com/results?search_query=docker+ipvlan+l2+l3+modes,https://youtube.com/results?search_query=docker+ipvlan+l2+l3+modes+hindi,https://youtube.com/results?search_query=docker+ipvlan+l2+l3+modes+kannada,https://youtube.com/results?search_query=docker+ipvlan+l2+l3+modes+tamil,https://youtube.com/results?search_query=docker+ipvlan+l2+l3+modes+telugu
Docker,Advanced,How does Docker's --pids-limit control maximum number of processes per container?,Process limits,Fork bombs,Resource exhaustion,PID limiting,A,--pids-limit sets maximum number of processes/threads container can create, preventing fork bombs and resource exhaustion.,Resource Management,https://docs.docker.com/engine/reference/run/#runtime-constraints-on-resources,https://youtube.com/results?search_query=docker+pids+limit+process+control,https://youtube.com/results?search_query=docker+pids+limit+process+control+hindi,https://youtube.com/results?search_query=docker+pids+limit+process+control+kannada,https://youtube.com/results?search_query=docker+pids+limit+process+control+tamil,https://youtube.com/results?search_query=docker+pids+limit+process+control+telugu
Docker,Advanced,What is Docker's support for cluster management through Docker Context?,Context switching,Multi-cluster management,Remote daemons,Environment management,A,Docker Context stores connection details for different Docker environments (local, remote, swarm, ACI, ECS) for easy switching.,Management,https://docs.docker.com/engine/context/working-with-contexts/,https://youtube.com/results?search_query=docker+context+cluster+management,https://youtube.com/results?search_query=docker+context+cluster+management+hindi,https://youtube.com/results?search_query=docker+context+cluster+management+kannada,https://youtube.com/results?search_query=docker+context+cluster+management+tamil,https://youtube.com/results?search_query=docker+context+cluster+management+telugu
Docker,Advanced,How does Docker's --cap-drop improve security by removing Linux capabilities?,Capability dropping,Security hardening,Principle of least privilege,Capabilities,A,--cap-drop removes specific capabilities from container, reducing attack surface following principle of least privilege.,Security,https://docs.docker.com/engine/reference/run/#runtime-privilege-and-linux-capabilities,https://youtube.com/results?search_query=docker+cap+drop+security+hardening,https://youtube.com/results?search_query=docker+cap+drop+security+hardening+hindi,https://youtube.com/results?search_query=docker+cap+drop+security+hardening+kannada,https://youtube.com/results?search_query=docker+cap+drop+security+hardening+tamil,https://youtube.com/results?search_query=docker+cap+drop+security+hardening+telugu
Docker,Advanced,What is Docker's support for Azure Container Instances (ACI) integration?,Cloud integration,ACI,Hybrid cloud,Serverless containers,A,Docker ACI integration allows running containers in Azure cloud directly from Docker CLI using Docker Context.,Cloud,https://docs.docker.com/cloud/aci-integration/,https://youtube.com/results?search_query=docker+azure+container+instances+integration,https://youtube.com/results?search_query=docker+azure+container+instances+integration+hindi,https://youtube.com/results?search_query=docker+azure+container+instances+integration+kannada,https://youtube.com/results?search_query=docker+azure+container+instances+integration+tamil,https://youtube.com/results?search_query=docker+azure+container+instances+integration+telugu
Docker,Advanced,How does Docker's --memory-reservation implement soft memory limits?,Memory reservation,Soft limits,Memory guarantees,Scheduling,A,--memory-reservation sets soft memory limit that kernel tries to enforce, but container can use more if memory available.,Resource Management,https://docs.docker.com/config/containers/resource_constraints/#memory,https://youtube.com/results?search_query=docker+memory+reservation+soft+limits,https://youtube.com/results?search_query=docker+memory+reservation+soft+limits+hindi,https://youtube.com/results?search_query=docker+memory+reservation+soft+limits+kannada,https://youtube.com/results?search_query=docker+memory+reservation+soft+limits+tamil,https://youtube.com/results?search_query=docker+memory+reservation+soft+limits+telugu
Docker,Advanced,What is Docker's support for WebAssembly (WASM) runtime through containerd shims?,WebAssembly,WASM containers,Lightweight runtimes,Containerd,A,Docker can run WASM workloads using containerd shims like runwasi, enabling WebAssembly containers alongside Linux containers.,Runtimes,https://docs.docker.com/desktop/wasm/,https://youtube.com/results?search_query=docker+webassembly+wasm+containers,https://youtube.com/results?search_query=docker+webassembly+wasm+containers+hindi,https://youtube.com/results?search_query=docker+webassembly+wasm+containers+kannada,https://youtube.com/results?search_query=docker+webassembly+wasm+containers+tamil,https://youtube.com/results?search_query=docker+webassembly+wasm+containers+telugu
Docker,Advanced,How does Docker's --cgroupns control cgroup namespace isolation?,Cgroup namespace,Resource isolation,Cgroup v2,Namespace,A,--cgroupns private isolates container's cgroup hierarchy; host shares host's cgroup namespace for older cgroup v1.,Resource Management,https://docs.docker.com/engine/reference/run/#cgroup-namespace,https://youtube.com/results?search_query=docker+cgroupns+namespace+isolation,https://youtube.com/results?search_query=docker+cgroupns+namespace+isolation+hindi,https://youtube.com/results?search_query=docker+cgroupns+namespace+isolation+kannada,https://youtube.com/results?search_query=docker+cgroupns+namespace+isolation+tamil,https://youtube.com/results?search_query=docker+cgroupns+namespace+isolation+telugu
Docker,Advanced,What is Docker's support for confidential containers with hardware enclaves?,Confidential computing,Hardware enclaves,TEE,Intel SGX,A,Docker supports confidential containers through plugins like Intel SGX or AMD SEV for hardware-based memory encryption.,Security,https://docs.docker.com/engine/security/confidential-computing/,https://youtube.com/results?search_query=docker+confidential+containers+enclaves,https://youtube.com/results?search_query=docker+confidential+containers+enclaves+hindi,https://youtube.com/results?search_query=docker+confidential+containers+enclaves+kannada,https://youtube.com/results?search_query=docker+confidential+containers+enclaves+tamil,https://youtube.com/results?search_query=docker+confidential+containers+enclaves+telugu
Docker,Advanced,How does Docker's --storage-opt configure device mapper or overlay2 storage options?,Storage configuration,Device mapper,Overlay2 options,Filesystem,A,--storage-opt sets storage driver specific options like dm.basesize, dm.thinpooldev, or overlay2.override_kernel_check.,Storage,https://docs.docker.com/engine/reference/commandline/run/#set-storage-driver-options-per-container,https://youtube.com/results?search_query=docker+storage+opt+configuration,https://youtube.com/results?search_query=docker+storage+opt+configuration+hindi,https://youtube.com/results?search_query=docker+storage+opt+configuration+kannada,https://youtube.com/results?search_query=docker+storage+opt+configuration+tamil,https://youtube.com/results?search_query=docker+storage+opt+configuration+telugu
Docker,Advanced,What is Docker's support for OpenTelemetry integration for observability?,Observability,OpenTelemetry,Metrics tracing,Monitoring integration,A,Docker integrates with OpenTelemetry for distributed tracing and metrics collection through Docker Desktop and plugins.,Monitoring,https://docs.docker.com/config/daemon/opentelemetry/,https://youtube.com/results?search_query=docker+opentelemetry+observability,https://youtube.com/results?search_query=docker+opentelemetry+observability+hindi,https://youtube.com/results?search_query=docker+opentelemetry+observability+kannada,https://youtube.com/results?search_query=docker+opentelemetry+observability+tamil,https://youtube.com/results?search_query=docker+opentelemetry+observability+telugu
Docker,Advanced,How does Docker's --network=container:NAME enable container network namespace sharing?,Network namespace sharing,Container networking,Sidecar pattern,Network stack,A,--network=container:NAME shares another container's network stack, useful for sidecar patterns and network debugging.,Networking,https://docs.docker.com/engine/reference/run/#network-settings,https://youtube.com/results?search_query=docker+network+container+namespace+sharing,https://youtube.com/results?search_query=docker+network+container+namespace+sharing+hindi,https://youtube.com/results?search_query=docker+network+container+namespace+sharing+kannada,https://youtube.com/results?search_query=docker+network+container+namespace+sharing+tamil,https://youtube.com/results?search_query=docker+network+container+namespace+sharing+telugu
Docker,Advanced,What is Docker's BuildKit's cache garbage collection and retention policies?,Cache management,Garbage collection,Cache retention,Build optimization,A,BuildKit GC policies control cache layer retention based on size, age, and usage frequency to optimize storage utilization.,Image Building,https://docs.docker.com/build/cache/garbage-collection/,https://youtube.com/results?search_query=docker+buildkit+cache+garbage+collection,https://youtube.com/results?search_query=docker+buildkit+cache+garbage+collection+hindi,https://youtube.com/results?search_query=docker+buildkit+cache+garbage+collection+kannada,https://youtube.com/results?search_query=docker+buildkit+cache+garbage+collection+tamil,https://youtube.com/results?search_query=docker+buildkit+cache+garbage+collection+telugu
Docker,Advanced,How does Docker's --uts=host share host's hostname and domain name with container?,UTS namespace,Hostname sharing,Domain name,Namespace isolation,A,--uts=host shares host's UTS namespace, giving container same hostname and domain name as host system.,Networking,https://docs.docker.com/engine/reference/run/#uts-settings---uts,https://youtube.com/results?search_query=docker+uts+host+hostname+sharing,https://youtube.com/results?search_query=docker+uts+host+hostname+sharing+hindi,https://youtube.com/results?search_query=docker+uts+host+hostname+sharing+kannada,https://youtube.com/results?search_query=docker+uts+host+hostname+sharing+tamil,https://youtube.com/results?search_query=docker+uts+host+hostname+sharing+telugu
Docker,Advanced,What is Docker's support for GitLab CI/CD integration through Docker Executors?,CI/CD integration,GitLab CI,Docker executor,Pipeline automation,A,Docker Executor in GitLab CI runs jobs in Docker containers, providing isolation and environment consistency for pipelines.,CI/CD,https://docs.gitlab.com/runner/executors/docker.html,https://youtube.com/results?search_query=docker+gitlab+ci+cd+integration,https://youtube.com/results?search_query=docker+gitlab+ci+cd+integration+hindi,https://youtube.com/results?search_query=docker+gitlab+ci+cd+integration+kannada,https://youtube.com/results?search_query=docker+gitlab+ci+cd+integration+tamil,https://youtube.com/results?search_query=docker+gitlab+ci+cd+integration+telugu
Docker,Advanced,How does Docker's --shm-size control shared memory size for IPC between processes?,Shared memory,IPC,Shm size,Inter-process communication,A,--shm-size sets /dev/shm size for POSIX shared memory between processes within container, default is 64MB.,Resource Management,https://docs.docker.com/engine/reference/run/#runtime-constraints-on-resources,https://youtube.com/results?search_query=docker+shm+size+shared+memory,https://youtube.com/results?search_query=docker+shm+size+shared+memory+hindi,https://youtube.com/results?search_query=docker+shm+size+shared+memory+kannada,https://youtube.com/results?search_query=docker+shm+size+shared+memory+tamil,https://youtube.com/results?search_query=docker+shm+size+shared+memory+telugu
Docker,Advanced,What is Docker's support for Amazon ECS integration through Docker Compose?,Cloud integration,Amazon ECS,Compose cloud,Serverless,A,Docker Compose can deploy directly to Amazon ECS, translating compose files to ECS task definitions and services.,Cloud,https://docs.docker.com/cloud/ecs-integration/,https://youtube.com/results?search_query=docker+amazon+ecs+integration+compose,https://youtube.com/results?search_query=docker+amazon+ecs+integration+compose+hindi,https://youtube.com/results?search_query=docker+amazon+ecs+integration+compose+kannada,https://youtube.com/results?search_query=docker+amazon+ecs+integration+compose+tamil,https://youtube.com/results?search_query=docker+amazon+ecs+integration+compose+telugu
Docker,Advanced,How does Docker's --entrypoint override default container entrypoint while preserving CMD?,Entrypoint override,Container startup,Command execution,Process initiation,A,--entrypoint replaces default ENTRYPOINT but CMD becomes arguments to new entrypoint, allowing flexible startup commands.,Container Management,https://docs.docker.com/engine/reference/run/#entrypoint-default-command-to-execute-at-runtime,https://youtube.com/results?search_query=docker+entrypoint+override+cmd,https://youtube.com/results?search_query=docker+entrypoint+override+cmd+hindi,https://youtube.com/results?search_query=docker+entrypoint+override+cmd+kannada,https://youtube.com/results?search_query=docker+entrypoint+override+cmd+tamil,https://youtube.com/results?search_query=docker+entrypoint+override+cmd+telugu
Docker,Advanced,What is Docker's support for Moby Project and how does it relate to open source Docker?,Open source,Moby project,Upstream components,Community edition,A,Moby is open source project providing components used by Docker (containerd, runc, LinuxKit) while Docker adds commercial features.,Ecosystem,https://mobyproject.org/,https://youtube.com/results?search_query=docker+moby+project+open+source,https://youtube.com/results?search_query=docker+moby+project+open+source+hindi,https://youtube.com/results?search_query=docker+moby+project+open+source+kannada,https://youtube.com/results?search_query=docker+moby+project+open+source+tamil,https://youtube.com/results?search_query=docker+moby+project+open+source+telugu
Docker,Advanced,How does Docker's --read-only flag enhance security by making container filesystem read-only?,Read-only filesystem,Security hardening,Immutable containers,Write protection,A,--read-only mounts container root filesystem as read-only, preventing malicious writes while allowing tmpfs for /tmp.,Security,https://docs.docker.com/engine/reference/run/#read-only-mode,https://youtube.com/results?search_query=docker+read+only+filesystem+security,https://youtube.com/results?search_query=docker+read+only+filesystem+security+hindi,https://youtube.com/results?search_query=docker+read+only+filesystem+security+kannada,https://youtube.com/results?search_query=docker+read+only+filesystem+security+tamil,https://youtube.com/results?search_query=docker+read+only+filesystem+security+telugu
Docker,Advanced,What is Docker's support for Portainer for GUI-based container management?,GUI management,Portainer,Dashboard,Web interface,A,Portainer provides web-based GUI for managing Docker environments, containers, images, networks, and volumes.,Management,https://www.portainer.io/,https://youtube.com/results?search_query=docker+portainer+gui+management,https://youtube.com/results?search_query=docker+portainer+gui+management+hindi,https://youtube.com/results?search_query=docker+portainer+gui+management+kannada,https://youtube.com/results?search_query=docker+portainer+gui+management+tamil,https://youtube.com/results?search_query=docker+portainer+gui+management+telugu
Docker,Advanced,How does Docker's --stop-signal control graceful shutdown of containers?,Graceful shutdown,Signal handling,Process termination,Stop timeout,A,--stop-signal sets which signal Docker sends to container for stop (default SIGTERM), allowing custom graceful shutdown.,Container Management,https://docs.docker.com/engine/reference/run/#specify-an-init-process,https://youtube.com/results?search_query=docker+stop+signal+graceful+shutdown,https://youtube.com/results?search_query=docker+stop+signal+graceful+shutdown+hindi,https://youtube.com/results?search_query=docker+stop+signal+graceful+shutdown+kannada,https://youtube.com/results?search_query=docker+stop+signal+graceful+shutdown+tamil,https://youtube.com/results?search_query=docker+stop+signal+graceful+shutdown+telugu
Docker,Advanced,What is Docker's support for Red Hat OpenShift container platform integration?,Enterprise Kubernetes,OpenShift,Platform integration,CI/CD pipelines,A,Docker integrates with OpenShift through source-to-image (S2I), container registries, and OpenShift Pipelines for CI/CD.,Enterprise,https://docs.openshift.com/,https://youtube.com/results?search_query=docker+red+hat+openshift+integration,https://youtube.com/results?search_query=docker+red+hat+openshift+integration+hindi,https://youtube.com/results?search_query=docker+red+hat+openshift+integration+kannada,https://youtube.com/results?search_query=docker+red+hat+openshift+integration+tamil,https://youtube.com/results?search_query=docker+red+hat+openshift+integration+telugu
Docker,Advanced,How does Docker's --cpu-period and --cpu-quota implement CFS bandwidth control?,CPU bandwidth,CFS scheduler,Period and quota,CPU limiting,A,--cpu-period (default 100ms) and --cpu-quota limit CPU time per period, implementing Completely Fair Scheduler bandwidth control.,Resource Management,https://docs.docker.com/config/containers/resource_constraints/#cpu,https://youtube.com/results?search_query=docker+cpu+period+quota+cfs,https://youtube.com/results?search_query=docker+cpu+period+quota+cfs+hindi,https://youtube.com/results?search_query=docker+cpu+period+quota+cfs+kannada,https://youtube.com/results?search_query=docker+cpu+period+quota+cfs+tamil,https://youtube.com/results?search_query=docker+cpu+period+quota+cfs+telugu
Docker,Advanced,What is Docker's support for Trivy vulnerability scanning integration?,Vulnerability scanning,Trivy,Security scanning,Image security,A,Trivy integrates with Docker for scanning images for vulnerabilities in OS packages and dependencies.,Security,https://aquasecurity.github.io/trivy/,https://youtube.com/results?search_query=docker+trivy+vulnerability+scanning,https://youtube.com/results?search_query=docker+trivy+vulnerability+scanning+hindi,https://youtube.com/results?search_query=docker+trivy+vulnerability+scanning+kannada,https://youtube.com/results?search_query=docker+trivy+vulnerability+scanning+tamil,https://youtube.com/results?search_query=docker+trivy+vulnerability+scanning+telugu
Docker,Advanced,How does Docker's --detach-keys customize container detachment from interactive sessions?,Detachment keys,Interactive sessions,Keyboard shortcuts,Client configuration,A,--detach-keys sets key sequence (default Ctrl-p,Ctrl-q) to detach from interactive container without stopping it.,Client,https://docs.docker.com/engine/reference/commandline/attach/#description,https://youtube.com/results?search_query=docker+detach+keys+interactive+sessions,https://youtube.com/results?search_query=docker+detach+keys+interactive+sessions+hindi,https://youtube.com/results?search_query=docker+detach+keys+interactive+sessions+kannada,https://youtube.com/results?search_query=docker+detach+keys+interactive+sessions+tamil,https://youtube.com/results?search_query=docker+detach+keys+interactive+sessions+telugu
Docker,Advanced,What is Docker's support for WasmEdge runtime for WebAssembly containers?,WasmEdge,WebAssembly runtime,Edge computing,Lightweight containers,A,WasmEdge provides high-performance WebAssembly runtime for Docker, optimized for edge computing and serverless scenarios.,Runtimes,https://wasmedge.org/,https://youtube.com/results?search_query=docker+wasmedge+webassembly+runtime,https://youtube.com/results?search_query=docker+wasmedge+webassembly+runtime+hindi,https://youtube.com/results?search_query=docker+wasmedge+webassembly+runtime+kannada,https://youtube.com/results?search_query=docker+wasmedge+webassembly+runtime+tamil,https://youtube.com/results?search_query=docker+wasmedge+webassembly+runtime+telugu
