Topic,Difficulty,Question,Tag1,Tag2,Tag3,Tag4,Correct Option,Explanation,Category,Doc URL,Video Search EN,Video Search HI,Video Search KN,Video Search TA,Video Search TE
Docker,Advanced,How does Docker's --sig-proxy control signal proxying to container processes?,Signal proxying,Terminal signals,Process management,Client behavior,A,--sig-proxy=true (default) forwards client signals (Ctrl-C) to container process; false keeps signals with client only.,Client,https://docs.docker.com/engine/reference/commandline/attach/#options,https://youtube.com/results?search_query=docker+sig+proxy+signal+forwarding,https://youtube.com/results?search_query=docker+sig+proxy+signal+forwarding+hindi,https://youtube.com/results?search_query=docker+sig+proxy+signal+forwarding+kannada,https://youtube.com/results?search_query=docker+sig+proxy+signal+forwarding+tamil,https://youtube.com/results?search_query=docker+sig+proxy+signal+forwarding+telugu
Docker,Advanced,What is Docker's support for Nvidia Container Toolkit for GPU acceleration?,GPU containers,NVIDIA,Container Toolkit,CUDA,A,NVIDIA Container Toolkit provides runtime and libraries for GPU-accelerated containers with CUDA and cuDNN support.,Hardware Acceleration,https://docs.nvidia.com/datacenter/cloud-native/container-toolkit/install-guide.html,https://youtube.com/results?search_query=docker+nvidia+container+toolkit+gpu,https://youtube.com/results?search_query=docker+nvidia+container+toolkit+gpu+hindi,https://youtube.com/results?search_query=docker+nvidia+container+toolkit+gpu+kannada,https://youtube.com/results?search_query=docker+nvidia+container+toolkit+gpu+tamil,https://youtube.com/results?search_query=docker+nvidia+container+toolkit+gpu+telugu
Docker,Advanced,How does Docker's --health-cmd, --health-interval, and --health-retries configure custom health checks?,Health monitoring,Custom checks,Interval configuration,Retry logic,A,These flags define custom health check command, execution interval, and consecutive failures needed to mark unhealthy.,Monitoring,https://docs.docker.com/engine/reference/run/#healthcheck,https://youtube.com/results?search_query=docker+health+cmd+interval+retries,https://youtube.com/results?search_query=docker+health+cmd+interval+retries+hindi,https://youtube.com/results?search_query=docker+health+cmd+interval+retries+kannada,https://youtube.com/results?search_query=docker+health+cmd+interval+retries+tamil,https://youtube.com/results?search_query=docker+health+cmd+interval+retries+telugu
Docker,Advanced,What is Docker's support for running Docker-in-Docker (DinD) for CI/CD pipelines?,Docker in Docker,CI/CD pipelines,Nested containers,Security implications,A,DinD runs Docker daemon inside container, useful for CI/CD but requires privileged mode with significant security considerations.,CI/CD,https://hub.docker.com/_/docker,https://youtube.com/results?search_query=docker+in+docker+ci+cd,https://youtube.com/results?search_query=docker+in+docker+ci+cd+hindi,https://youtube.com/results?search_query=docker+in+docker+ci+cd+kannada,https://youtube.com/results?search_query=docker+in+docker+ci+cd+tamil,https://youtube.com/results?search_query=docker+in+docker+ci+cd+telugu
Docker,Advanced,How does Docker's --label add metadata to containers for filtering and organization?,Container labels,Metadata,Filtering,Organization,A,--label adds key-value metadata to containers, enabling filtering (docker ps -f label=key=value) and organizational policies.,Management,https://docs.docker.com/engine/reference/run/#set-metadata-on-container---label---label-file,https://youtube.com/results?search_query=docker+label+metadata+filtering,https://youtube.com/results?search_query=docker+label+metadata+filtering+hindi,https://youtube.com/results?search_query=docker+label+metadata+filtering+kannada,https://youtube.com/results?search_query=docker+label+metadata+filtering+tamil,https://youtube.com/results?search_query=docker+label+metadata+filtering+telugu
Docker,Advanced,What is Docker's support for Rancher for enterprise container management platform?,Enterprise management,Rancher,Kubernetes management,Multi-cluster,A,Rancher provides enterprise-grade container management platform on top of Docker and Kubernetes with multi-cluster support.,Enterprise,https://rancher.com/,https://youtube.com/results?search_query=docker+rancher+enterprise+management,https://youtube.com/results?search_query=docker+rancher+enterprise+management+hindi,https://youtube.com/results?search_query=docker+rancher+enterprise+management+kannada,https://youtube.com/results?search_query=docker+rancher+enterprise+management+tamil,https://youtube.com/results?search_query=docker+rancher+enterprise+management+telugu
Docker,Advanced,How does Docker's --cpus decimal value simplify CPU allocation compared to --cpu-period/quota?,CPU allocation,Simplified limits,Decimal cpus,Resource management,A,--cpus="1.5" sets CPU limit equivalent to --cpu-period=100000 --cpu-quota=150000, providing simpler CPU limit syntax.,Resource Management,https://docs.docker.com/config/containers/resource_constraints/#cpu,https://youtube.com/results?search_query=docker+cpus+decimal+simplified+allocation,https://youtube.com/results?search_query=docker+cpus+decimal+simplified+allocation+hindi,https://youtube.com/results?search_query=docker+cpus+decimal+simplified+allocation+kannada,https://youtube.com/results?search_query=docker+cpus+decimal+simplified+allocation+tamil,https://youtube.com/results?search_query=docker+cpus+decimal+simplified+allocation+telugu
Docker,Advanced,What is Docker's support for Podman's rootless containers through uidmap mapping?,Rootless containers,Podman compatibility,UID mapping,User namespace,A,Docker supports rootless through user namespace mapping similar to Podman, allowing non-root users to run containers.,Security,https://docs.docker.com/engine/security/rootless/,https://youtube.com/results?search_query=docker+podman+rootless+containers,https://youtube.com/results?search_query=docker+podman+rootless+containers+hindi,https://youtube.com/results?search_query=docker+podman+rootless+containers+kannada,https://youtube.com/results?search_query=docker+podman+rootless+containers+tamil,https://youtube.com/results?search_query=docker+podman+rootless+containers+telugu
Docker,Advanced,How does Docker's --stop-timeout control graceful shutdown period before force kill?,Stop timeout,Graceful shutdown,Termination period,Force kill,A,--stop-timeout sets seconds to wait for graceful stop before SIGKILL (default 10), allowing applications to clean up.,Container Management,https://docs.docker.com/engine/reference/run/#specify-an-init-process,https://youtube.com/results?search_query=docker+stop+timeout+graceful+shutdown,https://youtube.com/results?search_query=docker+stop+timeout+graceful+shutdown+hindi,https://youtube.com/results?search_query=docker+stop+timeout+graceful+shutdown+kannada,https://youtube.com/results?search_query=docker+stop+timeout+graceful+shutdown+tamil,https://youtube.com/results?search_query=docker+stop+timeout+graceful+shutdown+telugu
Docker,Advanced,What is Docker's support for Sysbox runtime for enhanced container isolation?,Enhanced isolation,Sysbox runtime,VM-like containers,Security hardening,A,Sysbox provides stronger isolation allowing containers to run system software (Docker, K8s, systemd) securely inside containers.,Security,https://github.com/nestybox/sysbox,https://youtube.com/results?search_query=docker+sysbox+runtime+isolation,https://youtube.com/results?search_query=docker+sysbox+runtime+isolation+hindi,https://youtube.com/results?search_query=docker+sysbox+runtime+isolation+kannada,https://youtube.com/results?search_query=docker+sysbox+runtime+isolation+tamil,https://youtube.com/results?search_query=docker+sysbox+runtime+isolation+telugu
Docker,Advanced,How does Docker's --mount provide more explicit volume mounting than --volume?,Mount syntax,Volume mounting,Explicit configuration,New syntax,A,--mount provides more verbose and explicit syntax with type, source, target, and options separated for better clarity.,Storage,https://docs.docker.com/storage/volumes/#choose-the--v-or---mount-flag,https://youtube.com/results?search_query=docker+mount+vs+volume+syntax,https://youtube.com/results?search_query=docker+mount+vs+volume+syntax+hindi,https://youtube.com/results?search_query=docker+mount+vs+volume+syntax+kannada,https://youtube.com/results?search_query=docker+mount+vs+volume+syntax+tamil,https://youtube.com/results?search_query=docker+mount+vs+volume+syntax+telugu
Docker,Advanced,What is Docker's support for Aqua Security for container security scanning and runtime protection?,Container security,Aqua Security,Runtime protection,Compliance,A,Aqua Security provides comprehensive container security including image scanning, runtime protection, and compliance monitoring.,Security,https://www.aquasec.com/,https://youtube.com/results?search_query=docker+aqua+security+container+protection,https://youtube.com/results?search_query=docker+aqua+security+container+protection+hindi,https://youtube.com/results?search_query=docker+aqua+security+container+protection+kannada,https://youtube.com/results?search_query=docker+aqua+security+container+protection+tamil,https://youtube.com/results?search_query=docker+aqua+security+container+protection+telugu
Docker,Advanced,How does Docker's --publish-all (-P) automatically map exposed container ports to host?,Port mapping,Automatic publishing,Exposed ports,Network configuration,A,-P publishes all exposed ports to random host ports, while -p specifies explicit host:container port mappings.,Networking,https://docs.docker.com/engine/reference/run/#expose-incoming-ports,https://youtube.com/results?search_query=docker+publish+all+port+mapping,https://youtube.com/results?search_query=docker+publish+all+port+mapping+hindi,https://youtube.com/results?search_query=docker+publish+all+port+mapping+kannada,https://youtube.com/results?search_query=docker+publish+all+port+mapping+tamil,https://youtube.com/results?search_query=docker+publish+all+port+mapping+telugu