Topic,Difficulty,Question,Tag1,Tag2,Tag3,Tag4,Correct Option,Explanation,Category,Doc URL,Video Search EN,Video Search HI,Video Search KN,Video Search TA,Video Search TE
Docker,Advanced,How does Docker's container lifecycle hook (--restart policy) work with different restart conditions?,Container lifecycle,Restart policies,Fault tolerance,Automation,A,Restart policies (no, on-failure, unless-stopped, always) control automatic container restart based on exit codes and manual stops.,Container Management,https://docs.docker.com/config/containers/start-containers-automatically/,https://youtube.com/results?search_query=docker+restart+policies+lifecycle,https://youtube.com/results?search_query=docker+restart+policies+lifecycle+hindi,https://youtube.com/results?search_query=docker+restart+policies+lifecycle+kannada,https://youtube.com/results?search_query=docker+restart+policies+lifecycle+tamil,https://youtube.com/results?search_query=docker+restart+policies+lifecycle+telugu
Docker,Advanced,What is Docker's support for NVIDIA GPU containers and how is it configured?,GPU acceleration,CUDA containers,NVIDIA runtime,GPU sharing,A,Docker uses nvidia-container-runtime to expose host GPUs to containers with --gpus flag or nvidia runtime configuration.,Hardware Acceleration,https://docs.docker.com/config/containers/resource_constraints/#gpu,https://youtube.com/results?search_query=docker+nvidia+gpu+containers,https://youtube.com/results?search_query=docker+nvidia+gpu+containers+hindi,https://youtube.com/results?search_query=docker+nvidia+gpu+containers+kannada,https://youtube.com/results?search_query=docker+nvidia+gpu+containers+tamil,https://youtube.com/results?search_query=docker+nvidia+gpu+containers+telugu
Docker,Advanced,How does Docker Compose's extension fields enable reusable and modular configuration?,Configuration reuse,Compose extensions,YAML anchors,Modular configs,A,Extension fields (x-*) allow defining reusable configuration blocks and using YAML anchors/aliases for modular compose files.,Orchestration,https://docs.docker.com/compose/compose-file/compose-file-v3/#extension-fields,https://youtube.com/results?search_query=docker+compose+extension+fields+reusable,https://youtube.com/results?search_query=docker+compose+extension+fields+reusable+hindi,https://youtube.com/results?search_query=docker+compose+extension+fields+reusable+kannada,https://youtube.com/results?search_query=docker+compose+extension+fields+reusable+tamil,https://youtube.com/results?search_query=docker+compose+extension+fields+reusable+telugu
Docker,Advanced,What is Docker's Logging Driver architecture and how do custom drivers integrate?,Log management,Log drivers,Fluentd,ELK integration,A,Docker supports various logging drivers (json-file, syslog, journald, fluentd, etc.) that can be extended with plugins.,Logging,https://docs.docker.com/config/containers/logging/configure/,https://youtube.com/results?search_query=docker+logging+drivers+architecture,https://youtube.com/results?search_query=docker+logging+drivers+architecture+hindi,https://youtube.com/results?search_query=docker+logging+drivers+architecture+kannada,https://youtube.com/results?search_query=docker+logging+drivers+architecture+tamil,https://youtube.com/results?search_query=docker+logging+drivers+architecture+telugu
Docker,Advanced,How does Docker's --init flag improve process signal handling in containers?,Process management,PID 1,Signal handling,Init systems,A,--init runs an init process as PID 1 that properly handles signals, reaps zombie processes, and manages orphaned children.,Process Management,https://docs.docker.com/engine/reference/run/#specify-an-init-process,https://youtube.com/results?search_query=docker+init+flag+signal+handling,https://youtube.com/results?search_query=docker+init+flag+signal+handling+hindi,https://youtube.com/results?search_query=docker+init+flag+signal+handling+kannada,https://youtube.com/results?search_query=docker+init+flag+signal+handling+tamil,https://youtube.com/results?search_query=docker+init+flag+signal+handling+telugu
Docker,Advanced,What is Docker's support for IPv6 networking and how is it configured?,IPv6,Network configuration,Dual stack,Modern networking,A,Docker supports IPv6 with --ipv6 flag, requiring daemon configuration and subnet allocation for dual-stack networking.,Networking,https://docs.docker.com/config/daemon/ipv6/,https://youtube.com/results?search_query=docker+ipv6+networking+configuration,https://youtube.com/results?search_query=docker+ipv6+networking+configuration+hindi,https://youtube.com/results?search_query=docker+ipv6+networking+configuration+kannada,https://youtube.com/results?search_query=docker+ipv6+networking+configuration+tamil,https://youtube.com/results?search_query=docker+ipv6+networking+configuration+telugu
Docker,Advanced,How does Docker Swarm's node labeling and constraint system work for service placement?,Node constraints,Service placement,Swarm scheduling,Labels,A,Node labels and service constraints allow controlling which nodes services run on based on hardware, geography, or custom attributes.,Orchestration,https://docs.docker.com/engine/swarm/services/#control-service-placement,https://youtube.com/results?search_query=docker+swarm+node+constraints+placement,https://youtube.com/results?search_query=docker+swarm+node+constraints+placement+hindi,https://youtube.com/results?search_query=docker+swarm+node+constraints+placement+kannada,https://youtube.com/results?search_query=docker+swarm+node+constraints+placement+tamil,https://youtube.com/results?search_query=docker+swarm+node+constraints+placement+telugu
Docker,Advanced,What is Docker's Image Manifest and how does it support multi-architecture images?,Image manifests,Multi-arch,Oci manifests,Platform selection,A,Image manifest lists reference multiple architecture-specific manifests, allowing docker pull to auto-select correct image.,Image Registry,https://docs.docker.com/registry/spec/manifest-v2-2/,https://youtube.com/results?search_query=docker+image+manifest+multi+arch,https://youtube.com/results?search_query=docker+image+manifest+multi+arch+hindi,https://youtube.com/results?search_query=docker+image+manifest+multi+arch+kannada,https://youtube.com/results?search_query=docker+image+manifest+multi+arch+tamil,https://youtube.com/results?search_query=docker+image+manifest+multi+arch+telugu
Docker,Advanced,How does Docker's --cgroup-parent option enable hierarchical cgroup management?,Cgroup hierarchy,Resource isolation,Parent cgroups,Systemd integration,A,--cgroup-parent places container in specific cgroup hierarchy, useful for integrating with systemd or custom resource managers.,Resource Management,https://docs.docker.com/config/containers/resource_constraints/,https://youtube.com/results?search_query=docker+cgroup+parent+hierarchy,https://youtube.com/results?search_query=docker+cgroup+parent+hierarchy+hindi,https://youtube.com/results?search_query=docker+cgroup+parent+hierarchy+kannada,https://youtube.com/results?search_query=docker+cgroup+parent+hierarchy+tamil,https://youtube.com/results?search_query=docker+cgroup+parent+hierarchy+telugu
Docker,Advanced,What is Docker's BuildKit's SSH agent forwarding and how does it secure build secrets?,SSH agent,Secret management,Build security,Private repos,A,BuildKit's SSH agent forwarding allows accessing private repositories during builds without embedding credentials in image.,Security,https://docs.docker.com/develop/develop-images/build_enhancements/#using-ssh-to-access-private-data-in-builds,https://youtube.com/results?search_query=docker+buildkit+ssh+agent+secrets,https://youtube.com/results?search_query=docker+buildkit+ssh+agent+secrets+hindi,https://youtube.com/results?search_query=docker+buildkit+ssh+agent+secrets+kannada,https://youtube.com/results?search_query=docker+buildkit+ssh+agent+secrets+tamil,https://youtube.com/results?search_query=docker+buildkit+ssh+agent+secrets+telugu
Docker,Advanced,How does Docker's --pid=host flag affect container process namespace isolation?,Process namespace,PID sharing,Host visibility,Security,A,--pid=host shares host's process namespace with container, allowing container to see and interact with host processes.,Security,https://docs.docker.com/engine/reference/run/#pid-settings-pid,https://youtube.com/results?search_query=docker+pid+host+namespace+isolation,https://youtube.com/results?search_query=docker+pid+host+namespace+isolation+hindi,https://youtube.com/results?search_query=docker+pid+host+namespace+isolation+kannada,https://youtube.com/results?search_query=docker+pid+host+namespace+isolation+tamil,https://youtube.com/results?search_query=docker+pid+host+namespace+isolation+telugu
Docker,Advanced,What is Docker's support for Persistent Reserverd Names (PRNs) in storage volumes?,Volume naming,Persistent names,Volume identification,Storage,A,PRNs provide stable volume names that persist across daemon restarts, unlike auto-generated names that may change.,Storage,https://docs.docker.com/storage/volumes/,https://youtube.com/results?search_query=docker+persistent+volume+names,https://youtube.com/results?search_query=docker+persistent+volume+names+hindi,https://youtube.com/results?search_query=docker+persistent+volume+names+kannada,https://youtube.com/results?search_query=docker+persistent+volume+names+tamil,https://youtube.com/results?search_query=docker+persistent+volume+names+telugu
Docker,Advanced,How does Docker Compose's profiles feature enable environment-specific service configuration?,Service profiles,Environment configuration,Compose profiles,Selective services,A,Profiles allow marking services for specific environments (dev, test, prod), enabling selective service startup with --profile.,Orchestration,https://docs.docker.com/compose/profiles/,https://youtube.com/results?search_query=docker+compose+profiles+environments,https://youtube.com/results?search_query=docker+compose+profiles+environments+hindi,https://youtube.com/results?search_query=docker+compose+profiles+environments+kannada,https://youtube.com/results?search_query=docker+compose+profiles+environments+tamil,https://youtube.com/results?search_query=docker+compose+profiles+environments+telugu
Docker,Advanced,What is Docker's Content Addressable Storage (CAS) and how does it enable image layer sharing?,Layer storage,CAS,Content addressing,Storage efficiency,A,CAS stores image layers by cryptographic hash, enabling deduplication and sharing across images with identical layers.,Storage,https://docs.docker.com/storage/storagedriver/,https://youtube.com/results?search_query=docker+content+addressable+storage+cas,https://youtube.com/results?search_query=docker+content+addressable+storage+cas+hindi,https://youtube.com/results?search_query=docker+content+addressable+storage+cas+kannada,https://youtube.com/results?search_query=docker+content+addressable+storage+cas+tamil,https://youtube.com/results?search_query=docker+content+addressable+storage+cas+telugu
Docker,Advanced,How does Docker's --device flag enable hardware device access in containers?,Device passthrough,Hardware access,GPU,USB devices,A,--device exposes host devices (GPUs, USB, etc.) to containers by mapping device nodes with appropriate permissions.,Hardware,https://docs.docker.com/engine/reference/run/#runtime-privilege-and-linux-capabilities,https://youtube.com/results?search_query=docker+device+flag+hardware+access,https://youtube.com/results?search_query=docker+device+flag+hardware+access+hindi,https://youtube.com/results?search_query=docker+device+flag+hardware+access+kannada,https://youtube.com/results?search_query=docker+device+flag+hardware+access+tamil,https://youtube.com/results?search_query=docker+device+flag+hardware+access+telugu
Docker,Advanced,What is Docker's support for FIPS 140-2 compliance and how is it configured?,FIPS compliance,Cryptographic standards,Security certification,Enterprise,A,Docker Enterprise Edition includes FIPS 140-2 validated cryptographic modules for regulated environments.,Security,https://docs.docker.com/ee/admin/compliance/fips/,https://youtube.com/results?search_query=docker+fips+140-2+compliance,https://youtube.com/results?search_query=docker+fips+140-2+compliance+hindi,https://youtube.com/results?search_query=docker+fips+140-2+compliance+kannada,https://youtube.com/results?search_query=docker+fips+140-2+compliance+tamil,https://youtube.com/results?search_query=docker+fips+140-2+compliance+telugu
Docker,Advanced,How does Docker's --ulimit flag manage resource limits at the process level?,Resource limits,Ulimits,File descriptors,Process limits,A,--ulimit sets per-process resource limits (file descriptors, CPU time, memory locks, etc.) within container.,Resource Management,https://docs.docker.com/engine/reference/commandline/run/#set-ulimits-in-container---ulimit,https://youtube.com/results?search_query=docker+ulimit+resource+limits,https://youtube.com/results?search_query=docker+ulimit+resource+limits+hindi,https://youtube.com/results?search_query=docker+ulimit+resource+limits+kannada,https://youtube.com/results?search_query=docker+ulimit+resource+limits+tamil,https://youtube.com/results?search_query=docker+ulimit+resource+limits+telugu
Docker,Advanced,What is Docker's BuildKit cache-to and cache-from options for distributed caching?,Distributed caching,CI/CD optimization,Cache sharing,Build performance,A,These options allow pushing/pulling build cache to/from remote registries or local directories for team cache sharing.,CI/CD,https://docs.docker.com/build/cache/backends/,https://youtube.com/results?search_query=docker+buildkit+cache+to+from,https://youtube.com/results?search_query=docker+buildkit+cache+to+from+hindi,https://youtube.com/results?search_query=docker+buildkit+cache+to+from+kannada,https://youtube.com/results?search_query=docker+buildkit+cache+to+from+tamil,https://youtube.com/results?search_query=docker+buildkit+cache+to+from+telugu
Docker,Advanced,How does Docker's --network-alias provide service discovery within custom networks?,Network aliases,Service discovery,DNS resolution,Custom networks,A,--network-alias adds additional DNS names for containers within network, enabling flexible service discovery patterns.,Networking,https://docs.docker.com/engine/reference/commandline/network_connect/,https://youtube.com/results?search_query=docker+network+alias+service+discovery,https://youtube.com/results?search_query=docker+network+alias+service+discovery+hindi,https://youtube.com/results?search_query=docker+network+alias+service+discovery+kannada,https://youtube.com/results?search_query=docker+network+alias+service+discovery+tamil,https://youtube.com/results?search_query=docker+network+alias+service+discovery+telugu
Docker,Advanced,What is Docker's support for ARM architecture and how does multi-arch building work?,ARM containers,Cross-platform,Raspberry Pi,Multi-arch builds,A,Docker supports ARM (arm64, arm/v7) through multi-arch builds using buildx with QEMU emulation or native builders.,Platform,https://docs.docker.com/docker-for-mac/multi-arch/,https://youtube.com/results?search_query=docker+arm+architecture+multi+arch,https://youtube.com/results?search_query=docker+arm+architecture+multi+arch+hindi,https://youtube.com/results?search_query=docker+arm+architecture+multi+arch+kannada,https://youtube.com/results?search_query=docker+arm+architecture+multi+arch+tamil,https://youtube.com/results?search_query=docker+arm+architecture+multi+arch+telugu
Docker,Advanced,How does Docker's --cpu-shares implement relative CPU allocation among containers?,CPU shares,Relative allocation,CPU scheduling,Fair share,A,--cpu-shares assigns relative CPU weight (default 1024), allowing containers to get proportional CPU time when contested.,Resource Management,https://docs.docker.com/config/containers/resource_constraints/#cpu,https://youtube.com/results?search_query=docker+cpu+shares+relative+allocation,https://youtube.com/results?search_query=docker+cpu+shares+relative+allocation+hindi,https://youtube.com/results?search_query=docker+cpu+shares+relative+allocation+kannada,https://youtube.com/results?search_query=docker+cpu+shares+relative+allocation+tamil,https://youtube.com/results?search_query=docker+cpu+shares+relative+allocation+telugu
Docker,Advanced,What is Docker's support for time synchronization between host and containers?,Time sync,Container time,Host time,Clock drift,A,Containers share host's clock via --uts=host or can have independent time with fake-hwclock package for testing.,System Time,https://docs.docker.com/engine/reference/run/#time,https://youtube.com/results?search_query=docker+time+synchronization+containers,https://youtube.com/results?search_query=docker+time+synchronization+containers+hindi,https://youtube.com/results?search_query=docker+time+synchronization+containers+kannada,https://youtube.com/results?search_query=docker+time+synchronization+containers+tamil,https://youtube.com/results?search_query=docker+time+synchronization+containers+telugu
Docker,Advanced,How does Docker Compose's deploy section configure Swarm-specific deployment options?,Compose deploy,Swarm configuration,Stack deployment,Orchestration,A,deploy section in compose files defines Swarm-specific settings (replicas, update config, resources) ignored in standalone mode.,Orchestration,https://docs.docker.com/compose/compose-file/compose-file-v3/#deploy,https://youtube.com/results?search_query=docker+compose+deploy+section+swarm,https://youtube.com/results?search_query=docker+compose+deploy+section+swarm+hindi,https://youtube.com/results?search_query=docker+compose+deploy+section+swarm+kannada,https://youtube.com/results?search_query=docker+compose+deploy+section+swarm+tamil,https://youtube.com/results?search_query=docker+compose+deploy+section+swarm+telugu
Docker,Advanced,What is Docker's support for encrypted overlay networks in Swarm mode?,Network encryption,Overlay encryption,Swarm security,Traffic protection,A,Swarm overlay networks can be encrypted with --opt encrypted flag, securing traffic between nodes with IPSec.,Security,https://docs.docker.com/engine/swarm/swarm-tutorial/create-overlay-network/,https://youtube.com/results?search_query=docker+encrypted+overlay+networks,https://youtube.com/results?search_query=docker+encrypted+overlay+networks+hindi,https://youtube.com/results?search_query=docker+encrypted+overlay+networks+kannada,https://youtube.com/results?search_query=docker+encrypted+overlay+networks+tamil,https://youtube.com/results?search_query=docker+encrypted+overlay+networks+telugu
Docker,Advanced,How does Docker's --memory-swap flag control swap usage for containers?,Swap memory,Memory limits,Swap partition,Resource control,A,--memory-swap sets total memory+swap limit; set to -1 for unlimited swap or same as memory for no swap.,Resource Management,https://docs.docker.com/config/containers/resource_constraints/#memory,https://youtube.com/results?search_query=docker+memory+swap+flag+control,https://youtube.com/results?search_query=docker+memory+swap+flag+control+hindi,https://youtube.com/results?search_query=docker+memory+swap+flag+control+kannada,https://youtube.com/results?search_query=docker+memory+swap+flag+control+tamil,https://youtube.com/results?search_query=docker+memory+swap+flag+control+telugu
Docker,Advanced,What is Docker's support for Runtime Class in Kubernetes through Docker Desktop?,Runtime classes,Container runtimes,Kubernetes integration,Windows containers,A,Docker Desktop configures runtime classes for selecting container runtimes (runsc, kata, etc.) in Kubernetes clusters.,Kubernetes,https://docs.docker.com/desktop/kubernetes/,https://youtube.com/results?search_query=docker+runtime+class+kubernetes,https://youtube.com/results?search_query=docker+runtime+class+kubernetes+hindi,https://youtube.com/results?search_query=docker+runtime+class+kubernetes+kannada,https://youtube.com/results?search_query=docker+runtime+class+kubernetes+tamil,https://youtube.com/results?search_query=docker+runtime+class+kubernetes+telugu
Docker,Advanced,How does Docker's --blkio-weight flag control block IO bandwidth allocation?,Block IO,Storage bandwidth,IO scheduling,Weighted fair queuing,A,--blkio-weight assigns relative block IO weight (10-1000, default 500) for proportional disk bandwidth allocation.,Resource Management,https://docs.docker.com/config/containers/resource_constraints/#block-io-bandwidth-blkio-constraints,https://youtube.com/results?search_query=docker+blkio+weight+block+io,https://youtube.com/results?search_query=docker+blkio+weight+block+io+hindi,https://youtube.com/results?search_query=docker+blkio+weight+block+io+kannada,https://youtube.com/results?search_query=docker+blkio+weight+block+io+tamil,https://youtube.com/results?search_query=docker+blkio+weight+block+io+telugu
Docker,Advanced,What is Docker's support for podman compatibility and OCI runtime standards?,OCI compliance,Podman compatibility,Open standards,Runtime spec,A,Docker follows OCI runtime and image specs, providing compatibility with podman and other OCI-compliant tools.,Standards,https://opencontainers.org/,https://youtube.com/results?search_query=docker+oci+podman+compatibility,https://youtube.com/results?search_query=docker+oci+podman+compatibility+hindi,https://youtube.com/results?search_query=docker+oci+podman+compatibility+kannada,https://youtube.com/results?search_query=docker+oci+podman+compatibility+tamil,https://youtube.com/results?search_query=docker+oci+podman+compatibility+telugu
Docker,Advanced,How does Docker's --dns and --dns-search configure container DNS resolution?,DNS configuration,Name resolution,Search domains,Network,A,--dns sets custom DNS servers; --dns-search adds search domains for incomplete hostname resolution in containers.,Networking,https://docs.docker.com/config/containers/container-networking/#dns-services,https://youtube.com/results?search_query=docker+dns+configuration+containers,https://youtube.com/results?search_query=docker+dns+configuration+containers+hindi,https://youtube.com/results?search_query=docker+dns+configuration+containers+kannada,https://youtube.com/results?search_query=docker+dns+configuration+containers+tamil,https://youtube.com/results?search_query=docker+dns+configuration+containers+telugu
Docker,Advanced,What is Docker's BuildKit's inline cache and how does it optimize layer caching?,Inline caching,Cache optimization,Registry caching,Layer reuse,A,Inline cache stores cache metadata in image config, allowing cache reuse without separate cache storage or export/import.,Image Building,https://docs.docker.com/build/cache/backends/#inline-cache,https://youtube.com/results?search_query=docker+buildkit+inline+cache,https://youtube.com/results?search_query=docker+buildkit+inline+cache+hindi,https://youtube.com/results?search_query=docker+buildkit+inline+cache+kannada,https://youtube.com/results?search_query=docker+buildkit+inline+cache+tamil,https://youtube.com/results?search_query=docker+buildkit+inline+cache+telugu
Docker,Advanced,How does Docker's --security-opt=no-new-privileges enhance container security?,Privilege escalation,Security hardening,setuid prevention,No new privs,A,no-new-privileges prevents privilege escalation via setuid binaries within container, blocking common attack vectors.,Security,https://docs.docker.com/engine/reference/run/#security-configuration,https://youtube.com/results?search_query=docker+no+new+privileges+security,https://youtube.com/results?search_query=docker+no+new+privileges+security+hindi,https://youtube.com/results?search_query=docker+no+new+privileges+security+kannada,https://youtube.com/results?search_query=docker+no+new+privileges+security+tamil,https://youtube.com/results?search_query=docker+no+new+privileges+security+telugu
Docker,Advanced,What is Docker's support for InfiniBand and RDMA networking in HPC environments?,High performance computing,RDMA,InfiniBand,Low latency networking,A,Docker supports InfiniBand/RDMA with --device for verbs devices and specialized network plugins for HPC workloads.,Networking,https://docs.docker.com/engine/reference/run/#runtime-privilege-and-linux-capabilities,https://youtube.com/results?search_query=docker+infiniband+rdma+hpc,https://youtube.com/results?search_query=docker+infiniband+rdma+hpc+hindi,https://youtube.com/results?search_query=docker+infiniband+rdma+hpc+kannada,https://youtube.com/results?search_query=docker+infiniband+rdma+hpc+tamil,https://youtube.com/results?search_query=docker+infiniband+rdma+hpc+telugu
Docker,Advanced,How does Docker's --cpuset-cpus pin containers to specific CPU cores?,CPU pinning,Core affinity,Performance isolation,NUMA,A,--cpuset-cpus restricts container to specific CPU cores/threads, improving cache locality and performance predictability.,Performance,https://docs.docker.com/config/containers/resource_constraints/#cpu,https://youtube.com/results?search_query=docker+cpuset+cpus+cpu+pinning,https://youtube.com/results?search_query=docker+cpuset+cpus+cpu+pinning+hindi,https://youtube.com/results?search_query=docker+cpuset+cpus+cpu+pinning+kannada,https://youtube.com/results?search_query=docker+cpuset+cpus+cpu+pinning+tamil,https://youtube.com/results?search_query=docker+cpuset+cpus+cpu+pinning+telugu
Docker,Advanced,What is Docker's support for SELinux and AppArmor security modules?,Mandatory access control,SELinux,AppArmor,Security profiles,A,Docker integrates with SELinux and AppArmor for mandatory access control, using security-opt to apply custom profiles.,Security,https://docs.docker.com/engine/security/security/,https://youtube.com/results?search_query=docker+selinux+apparmor+security,https://youtube.com/results?search_query=docker+selinux+apparmor+security+hindi,https://youtube.com/results?search_query=docker+selinux+apparmor+security+kannada,https://youtube.com/results?search_query=docker+selinux+apparmor+security+tamil,https://youtube.com/results?search_query=docker+selinux+apparmor+security+telugu
