Topic,Difficulty,Question,Tag1,Tag2,Tag3,Tag4,Correct Option,Explanation,Category,Doc URL,Video Search EN,Video Search HI,Video Search KN,Video Search TA,Video Search TE
Java,Advanced,How does Java's Epsilon GC differ from traditional garbage collectors?,Memory Management,Epsilon GC,No-op GC,Memory allocation,A,Epsilon GC only allocates memory without collection, for performance testing or short-lived applications.,Memory Management,https://openjdk.org/jeps/318,https://youtube.com/results?search_query=java+epsilon+gc+no+collection,https://youtube.com/results?search_query=java+epsilon+gc+no+collection+hindi,https://youtube.com/results?search_query=java+epsilon+gc+no+collection+kannada,https://youtube.com/results?search_query=java+epsilon+gc+no+collection+tamil,https://youtube.com/results?search_query=java+epsilon+gc+no+collection+telugu
Java,Advanced,What is the difference between class unloading and metaspace reclamation in JVM memory?,Memory Management,Class unloading,Metaspace,JVM memory,A,Class unloading removes unused classes; metaspace reclamation returns memory to OS when class metadata is freed.,Memory Management,https://docs.oracle.com/javase/9/gctuning/garbage-first-garbage-collector-tuning.html,https://youtube.com/results?search_query=java+class+unloading+vs+metaspace,https://youtube.com/results?search_query=java+class+unloading+vs+metaspace+hindi,https://youtube.com/results?search_query=java+class+unloading+vs+metaspace+kannada,https://youtube.com/results?search_query=java+class+unloading+vs+metaspace+tamil,https://youtube.com/results?search_query=java+class+unloading+vs+metaspace+telugu
Java,Advanced,How does Java's Optional improve null safety compared to traditional null checks?,Java Features,Optional,Null safety,API design,A,Optional explicitly models nullable values, forcing callers to handle absence and reducing NullPointerExceptions.,Java Features,https://docs.oracle.com/javase/8/docs/api/java/util/Optional.html,https://youtube.com/results?search_query=java+optional+null+safety,https://youtube.com/results?search_query=java+optional+null+safety+hindi,https://youtube.com/results?search_query=java+optional+null+safety+kannada,https://youtube.com/results?search_query=java+optional+null+safety+tamil,https://youtube.com/results?search_query=java+optional+null+safety+telugu
Java,Advanced,What is the purpose of Java's VarHandle release/acquire memory ordering semantics?,Concurrency,VarHandle,Memory ordering,Release-acquire,A,Release ensures prior writes visible to acquire; acquire ensures subsequent reads see writes from releasing thread.,Concurrency,https://docs.oracle.com/javase/9/docs/api/java/lang/invoke/VarHandle.html,https://youtube.com/results?search_query=java+varhandle+memory+ordering+release+acquire,https://youtube.com/results?search_query=java+varhandle+memory+ordering+release+acquire+hindi,https://youtube.com/results?search_query=java+varhandle+memory+ordering+release+acquire+kannada,https://youtube.com/results?search_query=java+varhandle+memory+ordering+release+acquire+tamil,https://youtube.com/results?search_query=java+varhandle+memory+ordering+release+acquire+telugu
Java,Advanced,How does Java's JFR (Java Flight Recorder) differ from traditional profiling tools?,Monitoring,JFR,Profiling,Diagnostics,A,JFR provides low-overhead production profiling with event streaming; traditional profilers have higher overhead.,Monitoring,https://docs.oracle.com/javase/8/docs/technotes/guides/jfr/index.html,https://youtube.com/results?search_query=java+jfr+vs+traditional+profiling,https://youtube.com/results?search_query=java+jfr+vs+traditional+profiling+hindi,https://youtube.com/results?search_query=java+jfr+vs+traditional+profiling+kannada,https://youtube.com/results?search_query=java+jfr+vs+traditional+profiling+tamil,https://youtube.com/results?search_query=java+jfr+vs+traditional+profiling+telugu
Java,Advanced,What is the difference between type inference with var and diamond operator in Java?,Java Features,Type inference,var,Diamond operator,A,var infers local variable type; diamond operator infers generic type arguments in constructor calls.,Java Features,https://docs.oracle.com/en/java/javase/17/language/local-variable-type-inference.html,https://youtube.com/results?search_query=java+var+vs+diamond+operator,https://youtube.com/results?search_query=java+var+vs+diamond+operator+hindi,https://youtube.com/results?search_query=java+var+vs+diamond+operator+kannada,https://youtube.com/results?search_query=java+var+vs+diamond+operator+tamil,https://youtube.com/results?search_query=java+var+vs+diamond+operator+telugu
Java,Advanced,How does Java's Parallel Collector differ from G1GC for throughput-oriented applications?,Memory Management,Parallel GC,G1GC,Throughput,A,Parallel GC uses multiple threads for young/old generation collection maximizing throughput; G1GC balances throughput/latency.,Memory Management,https://docs.oracle.com/javase/9/gctuning/parallel-collector1.htm,https://youtube.com/results?search_query=java+parallel+gc+vs+g1gc+throughput,https://youtube.com/results?search_query=java+parallel+gc+vs+g1gc+throughput+hindi,https://youtube.com/results?search_query=java+parallel+gc+vs+g1gc+throughput+kannada,https://youtube.com/results?search_query=java+parallel+gc+vs+g1gc+throughput+tamil,https://youtube.com/results?search_query=java+parallel+gc+vs+g1gc+throughput+telugu
Java,Advanced,What is the purpose of Java's Method References and how do they differ from lambda expressions?,Java Features,Method References,Lambdas,Syntax sugar,A,Method references refer to existing methods; lambdas define anonymous functions. Both implement functional interfaces.,Java Features,https://docs.oracle.com/javase/tutorial/java/javaOO/methodreferences.html,https://youtube.com/results?search_query=java+method+references+vs+lambdas,https://youtube.com/results?search_query=java+method+references+vs+lambdas+hindi,https://youtube.com/results?search_query=java+method+references+vs+lambdas+kannada,https://youtube.com/results?search_query=java+method+references+vs+lambdas+tamil,https://youtube.com/results?search_query=java+method+references+vs+lambdas+telugu
Java,Advanced,How does Java's ByteBuffer differ from direct buffers for I/O operations?,I/O,ByteBuffer,Direct buffers,Native memory,A,Direct ByteBuffer uses native memory for zero-copy I/O; heap ByteBuffer uses JVM heap with copy overhead.,I/O,https://docs.oracle.com/javase/8/docs/api/java/nio/ByteBuffer.html,https://youtube.com/results?search_query=java+bytebuffer+direct+vs+heap,https://youtube.com/results?search_query=java+bytebuffer+direct+vs+heap+hindi,https://youtube.com/results?search_query=java+bytebuffer+direct+vs+heap+kannada,https://youtube.com/results?search_query=java+bytebuffer+direct+vs+heap+tamil,https://youtube.com/results?search_query=java+bytebuffer+direct+vs+heap+telugu
Java,Advanced,What is the difference between class file version and source compatibility in Java?,Java Platform,Class file,Source compatibility,Versioning,A,Class file version determines JVM compatibility; source compatibility determines compiler compatibility with language features.,Java Platform,https://docs.oracle.com/javase/specs/jvms/se17/html/jvms-4.html,https://youtube.com/results?search_query=java+class+file+vs+source+compatibility,https://youtube.com/results?search_query=java+class+file+vs+source+compatibility+hindi,https://youtube.com/results?search_query=java+class+file+vs+source+compatibility+kannada,https://youtube.com/results?search_query=java+class+file+vs+source+compatibility+tamil,https://youtube.com/results?search_query=java+class+file+vs+source+compatibility+telugu
Java,Advanced,How does Java's PhantomReference differ from finalize() for resource cleanup?,Memory Management,PhantomReference,Finalize,Cleanup,A,PhantomReference allows controlled cleanup in ReferenceQueue; finalize() is unreliable with GC timing issues.,Memory Management,https://docs.oracle.com/javase/8/docs/api/java/lang/ref/PhantomReference.html,https://youtube.com/results?search_query=java+phantomreference+vs+finalize,https://youtube.com/results?search_query=java+phantomreference+vs+finalize+hindi,https://youtube.com/results?search_query=java+phantomreference+vs+finalize+kannada,https://youtube.com/results?search_query=java+phantomreference+vs+finalize+tamil,https://youtube.com/results?search_query=java+phantomreference+vs+finalize+telugu
Java,Advanced,What is the purpose of Java's @Repeatable annotation for repeated annotations?,Java Features,Repeatable annotation,Metadata,Annotation processing,A,@Repeatable allows same annotation multiple times on element, stored in container annotation for backward compatibility.,Java Features,https://docs.oracle.com/javase/tutorial/java/annotations/repeating.html,https://youtube.com/results?search_query=java+repeatable+annotation+metadata,https://youtube.com/results?search_query=java+repeatable+annotation+metadata+hindi,https://youtube.com/results?search_query=java+repeatable+annotation+metadata+kannada,https://youtube.com/results?search_query=java+repeatable+annotation+metadata+tamil,https://youtube.com/results?search_query=java+repeatable+annotation+metadata+telugu
Java,Advanced,How does Java's VarHandle compareAndExchange() differ from compareAndSet()?,Concurrency,VarHandle,CompareAndExchange,Atomic operations,A,compareAndExchange() returns current value (always); compareAndSet() returns boolean success (may fail spuriously).,Concurrency,https://docs.oracle.com/javase/9/docs/api/java/lang/invoke/VarHandle.html,https://youtube.com/results?search_query=java+varhandle+compareandexchange+vs+compareandset,https://youtube.com/results?search_query=java+varhandle+compareandexchange+vs+compareandset+hindi,https://youtube.com/results?search_query=java+varhandle+compareandexchange+vs+compareandset+kannada,https://youtube.com/results?search_query=java+varhandle+compareandexchange+vs+compareandset+tamil,https://youtube.com/results?search_query=java+varhandle+compareandexchange+vs+compareandset+telugu
Java,Advanced,What is the difference between JVM's client and server compilation modes?,JVM,Client compiler,Server compiler,Compilation modes,A,Client compiler (C1) optimizes for startup; Server compiler (C2) optimizes for peak performance with more aggressive optimizations.,Performance,https://docs.oracle.com/javase/8/docs/technotes/guides/vm/performance-enhancements-7.html,https://youtube.com/results?search_query=java+jvm+client+vs+server+compiler,https://youtube.com/results?search_query=java+jvm+client+vs+server+compiler+hindi,https://youtube.com/results?search_query=java+jvm+client+vs+server+compiler+kannada,https://youtube.com/results?search_query=java+jvm+client+vs+server+compiler+tamil,https://youtube.com/results?search_query=java+jvm+client+vs+server+compiler+telugu
Java,Advanced,How does Java's String::transform method enable fluent string transformations?,Java Features,String transform,Fluent API,Method chaining,A,String::transform applies function to string returning result, enabling method chaining for string processing.,Java Features,https://docs.oracle.com/en/java/javase/12/docs/api/java.base/java/lang/String.html#transform(java.util.function.Function),https://youtube.com/results?search_query=java+string+transform+fluent+api,https://youtube.com/results?search_query=java+string+transform+fluent+api+hindi,https://youtube.com/results?search_query=java+string+transform+fluent+api+kannada,https://youtube.com/results?search_query=java+string+transform+fluent+api+tamil,https://youtube.com/results?search_query=java+string+transform+fluent+api+telugu
Java,Advanced,What is the purpose of Java's JVM TI (Tool Interface) for profiling and debugging agents?,JVM,JVM TI,Profiling agents,Debugging interface,A,JVM TI provides C/C++ API for tools to inspect JVM state, control execution, and monitor events for profiling/debugging.,Debugging,https://docs.oracle.com/javase/8/docs/technotes/guides/jvmti/,https://youtube.com/results?search_query=java+jvm+ti+profiling+agents,https://youtube.com/results?search_query=java+jvm+ti+profiling+agents+hindi,https://youtube.com/results?search_query=java+jvm+ti+profiling+agents+kannada,https://youtube.com/results?search_query=java+jvm+ti+profiling+agents+tamil,https://youtube.com/results?search_query=java+jvm+ti+profiling+agents+telugu
Java,Advanced,How does Java's Memory Access API (Project Panama) differ from ByteBuffer for native memory?,Native Integration,Memory Access API,ByteBuffer,Project Panama,A,Memory Access API provides type-safe, segment-based memory access with spatial/temporal safety; ByteBuffer is less safe.,Native Integration,https://openjdk.org/jeps/454,https://youtube.com/results?search_query=java+memory+access+api+vs+bytebuffer,https://youtube.com/results?search_query=java+memory+access+api+vs+bytebuffer+hindi,https://youtube.com/results?search_query=java+memory+access+api+vs+bytebuffer+kannada,https://youtube.com/results?search_query=java+memory+access+api+vs+bytebuffer+tamil,https://youtube.com/results?search_query=java+memory+access+api+vs+bytebuffer+telugu
Java,Advanced,What is the difference between Java's Stream.peek() and Stream.map() for intermediate operations?,Streams,Stream peek,Stream map,Intermediate operations,A,peek() performs action without modifying stream (for debugging); map() transforms elements producing new stream.,Streams,https://docs.oracle.com/javase/8/docs/api/java/util/stream/Stream.html,https://youtube.com/results?search_query=java+stream+peek+vs+map,https://youtube.com/results?search_query=java+stream+peek+vs+map+hindi,https://youtube.com/results?search_query=java+stream+peek+vs+map+kannada,https://youtube.com/results?search_query=java+stream+peek+vs+map+tamil,https://youtube.com/results?search_query=java+stream+peek+vs+map+telugu
Java,Advanced,How does Java's VarHandle getAndAdd() provide atomic accumulation operations?,Concurrency,VarHandle,GetAndAdd,Atomic accumulation,A,VarHandle.getAndAdd() atomically adds value and returns previous value, similar to AtomicInteger.getAndAdd().,Concurrency,https://docs.oracle.com/javase/9/docs/api/java/lang/invoke/VarHandle.html,https://youtube.com/results?search_query=java+varhandle+getandadd+atomic,https://youtube.com/results?search_query=java+varhandle+getandadd+atomic+hindi,https://youtube.com/results?search_query=java+varhandle+getandadd+atomic+kannada,https://youtube.com/results?search_query=java+varhandle+getandadd+atomic+tamil,https://youtube.com/results?search_query=java+varhandle+getandadd+atomic+telugu
Java,Advanced,What is the purpose of Java's @FunctionalInterface annotation for lambda target types?,Java Features,FunctionalInterface,Lambda target,Interface validation,A,@FunctionalInterface ensures interface has exactly one abstract method, enabling lambda expressions and method references.,Java Features,https://docs.oracle.com/javase/8/docs/api/java/lang/FunctionalInterface.html,https://youtube.com/results?search_query=java+functionalinterface+lambda+target,https://youtube.com/results?search_query=java+functionalinterface+lambda+target+hindi,https://youtube.com/results?search_query=java+functionalinterface+lambda+target+kannada,https://youtube.com/results?search_query=java+functionalinterface+lambda+target+tamil,https://youtube.com/results?search_query=java+functionalinterface+lambda+target+telugu
Java,Advanced,How does Java's ConcurrentHashMap.computeIfAbsent() ensure thread-safe lazy initialization?,Concurrency,ConcurrentHashMap,ComputeIfAbsent,Thread-safe initialization,A,computeIfAbsent() atomically computes value if key absent, preventing race conditions in lazy initialization patterns.,Concurrency,https://docs.oracle.com/javase/8/docs/api/java/util/concurrent/ConcurrentHashMap.html,https://youtube.com/results?search_query=java+concurrenthashmap+computeifabsent+thread+safe,https://youtube.com/results?search_query=java+concurrenthashmap+computeifabsent+thread+safe+hindi,https://youtube.com/results?search_query=java+concurrenthashmap+computeifabsent+thread+safe+kannada,https://youtube.com/results?search_query=java+concurrenthashmap+computeifabsent+thread+safe+tamil,https://youtube.com/results?search_query=java+concurrenthashmap+computeifabsent+thread+safe+telugu
Java,Advanced,What is the difference between Java's Module Path and Class Path for dependency resolution?,Java Platform,Module path,Class path,Dependency resolution,A,Module path uses module descriptors for explicit dependencies; class path uses JAR scanning with implicit dependencies.,Java Platform,https://docs.oracle.com/javase/9/migrate/toc.htm#JSMIG-GUID-7744EF96-5899-4FB2-B34E-86D49B2E89B6,https://youtube.com/results?search_query=java+module+path+vs+class+path,https://youtube.com/results?search_query=java+module+path+vs+class+path+hindi,https://youtube.com/results?search_query=java+module+path+vs+class+path+kannada,https://youtube.com/results?search_query=java+module+path+vs+class+path+tamil,https://youtube.com/results?search_query=java+module+path+vs+class+path+telugu
Java,Advanced,How does Java's MethodHandles.Lookup provides access control for private method access?,Reflection,MethodHandles.Lookup,Private access,Security,A,MethodHandles.Lookup created in caller context retains access privileges for private/package-private member access.,Reflection,https://docs.oracle.com/javase/8/docs/api/java/lang/invoke/MethodHandles.Lookup.html,https://youtube.com/results?search_query=java+methodhandles+lookup+private+access,https://youtube.com/results?search_query=java+methodhandles+lookup+private+access+hindi,https://youtube.com/results?search_query=java+methodhandles+lookup+private+access+kannada,https://youtube.com/results?search_query=java+methodhandles+lookup+private+access+tamil,https://youtube.com/results?search_query=java+methodhandles+lookup+private+access+telugu
Java,Advanced,What is the purpose of Java's @SuppressWarnings annotation for compiler warnings?,Java Features,SuppressWarnings,Compiler warnings,Code quality,A,@SuppressWarnings suppresses specific compiler warnings for code that is intentionally violating warning rules.,Java Features,https://docs.oracle.com/javase/8/docs/api/java/lang/SuppressWarnings.html,https://youtube.com/results?search_query=java+suppresswarnings+compiler+warnings,https://youtube.com/results?search_query=java+suppresswarnings+compiler+warnings+hindi,https://youtube.com/results?search_query=java+suppresswarnings+compiler+warnings+kannada,https://youtube.com/results?search_query=java+suppresswarnings+compiler+warnings+tamil,https://youtube.com/results?search_query=java+suppresswarnings+compiler+warnings+telugu
Java,Advanced,How does Java's VarHandle fence operations (loadFence, storeFence, fullFence) ensure memory visibility?,Concurrency,VarHandle,Memory fences,Visibility guarantees,A,Memory fences ensure ordering: loadFence (reads before), storeFence (writes before), fullFence (both reads/writes).,Concurrency,https://docs.oracle.com/javase/9/docs/api/java/lang/invoke/VarHandle.html,https://youtube.com/results?search_query=java+varhandle+memory+fences+visibility,https://youtube.com/results?search_query=java+varhandle+memory+fences+visibility+hindi,https://youtube.com/results?search_query=java+varhandle+memory+fences+visibility+kannada,https://youtube.com/results?search_query=java+varhandle+memory+fences+visibility+tamil,https://youtube.com/results?search_query=java+varhandle+memory+fences+visibility+telugu
Java,Advanced,What is the difference between Java's String.intern() and String pool for memory optimization?,Memory Management,String intern,String pool,Memory optimization,A,String.intern() returns canonical representation from pool; string pool automatically interns compile-time literals.,Memory Management,https://docs.oracle.com/javase/8/docs/api/java/lang/String.html#intern(),https://youtube.com/results?search_query=java+string+intern+vs+string+pool,https://youtube.com/results?search_query=java+string+intern+vs+string+pool+hindi,https://youtube.com/results?search_query=java+string+intern+vs+string+pool+kannada,https://youtube.com/results?search_query=java+string+intern+vs+string+pool+tamil,https://youtube.com/results?search_query=java+string+intern+vs+string+pool+telugu
Java,Advanced,How does Java's CompletableFuture.exceptionally() handle errors in async chains?,Concurrency,CompletableFuture,Exception handling,Async error,A,exceptionally() provides fallback value when previous stage completes exceptionally, recovering from errors.,Concurrency,https://docs.oracle.com/javase/8/docs/api/java/util/concurrent/CompletableFuture.html,https://youtube.com/results?search_query=java+completablefuture+exceptionally+error+handling,https://youtube.com/results?search_query=java+completablefuture+exceptionally+error+handling+hindi,https://youtube.com/results?search_query=java+completablefuture+exceptionally+error+handling+kannada,https://youtube.com/results?search_query=java+completablefuture+exceptionally+error+handling+tamil,https://youtube.com/results?search_query=java+completablefuture+exceptionally+error+handling+telugu
Java,Advanced,What is the purpose of Java's Module Resolution during startup and runtime?,Java Platform,Module resolution,Dependency resolution,Startup process,A,Module resolution builds module graph from root modules, verifying dependencies and accessibility at startup.,Java Platform,https://docs.oracle.com/javase/9/migrate/toc.htm#JSMIG-GUID-7744EF96-5899-4FB2-B34E-86D49B2E89B6,https://youtube.com/results?search_query=java+module+resolution+startup,https://youtube.com/results?search_query=java+module+resolution+startup+hindi,https://youtube.com/results?search_query=java+module+resolution+startup+kannada,https://youtube.com/results?search_query=java+module+resolution+startup+tamil,https://youtube.com/results?search_query=java+module+resolution+startup+telugu
Java,Advanced,How does Java's VarHandle compareAndSet() ensure atomic compare-and-swap operations?,Concurrency,VarHandle,CompareAndSet,CAS operations,A,VarHandle.compareAndSet() uses hardware CAS instruction to atomically update if current value matches expected.,Concurrency,https://docs.oracle.com/javase/9/docs/api/java/lang/invoke/VarHandle.html,https://youtube.com/results?search_query=java+varhandle+compareandset+atomic+cas,https://youtube.com/results?search_query=java+varhandle+compareandset+atomic+cas+hindi,https://youtube.com/results?search_query=java+varhandle+compareandset+atomic+cas+kannada,https://youtube.com/results?search_query=java+varhandle+compareandset+atomic+cas+tamil,https://youtube.com/results?search_query=java+varhandle+compareandset+atomic+cas+telugu
Java,Advanced,What is the difference between Java's Type Annotations and regular annotations?,Java Features,Type annotations,Annotations,Java 8,A,Type annotations can be applied to type uses (generics, casts); regular annotations apply to declarations.,Java Features,https://docs.oracle.com/javase/tutorial/java/annotations/type_annotations.html,https://youtube.com/results?search_query=java+type+annotations+vs+regular+annotations,https://youtube.com/results?search_query=java+type+annotations+vs+regular+annotations+hindi,https://youtube.com/results?search_query=java+type+annotations+vs+regular+annotations+kannada,https://youtube.com/results?search_query=java+type+annotations+vs+regular+annotations+tamil,https://youtube.com/results?search_query=java+type+annotations+vs+regular+annotations+telugu
Java,Advanced,How does Java's Stream.collect() with Collector interface enable custom reduction operations?,Streams,Stream collect,Collector,Custom reduction,A,Collector provides mutable container, accumulator, combiner, finisher for custom parallelizable reduction operations.,Streams,https://docs.oracle.com/javase/8/docs/api/java/util/stream/Collector.html,https://youtube.com/results?search_query=java+stream+collect+collector+custom+reduction,https://youtube.com/results?search_query=java+stream+collect+collector+custom+reduction+hindi,https://youtube.com/results?search_query=java+stream+collect+collector+custom+reduction+kannada,https://youtube.com/results?search_query=java+stream+collect+collector+custom+reduction+tamil,https://youtube.com/results?search_query=java+stream+collect+collector+custom+reduction+telugu
Java,Advanced,What is the purpose of Java's @Native annotation for constants mapping to native values?,Native Integration,Native annotation,Constants,JNI mapping,A,@Native indicates constant field value may be referenced from native code, matching native header definitions.,Native Integration,https://docs.oracle.com/javase/8/docs/api/java/lang/annotation/Native.html,https://youtube.com/results?search_query=java+native+annotation+constants,https://youtube.com/results?search_query=java+native+annotation+constants+hindi,https://youtube.com/results?search_query=java+native+annotation+constants+kannada,https://youtube.com/results?search_query=java+native+annotation+constants+tamil,https://youtube.com/results?search_query=java+native+annotation+constants+telugu
Java,Advanced,How does Java's CompletableFuture.thenCompose() enable flatMap-like async composition?,Concurrency,CompletableFuture,ThenCompose,Async composition,A,thenCompose() chains CompletableFutures, flattening nested futures (flatMap pattern) for sequential async operations.,Concurrency,https://docs.oracle.com/javase/8/docs/api/java/util/concurrent/CompletableFuture.html,https://youtube.com/results?search_query=java+completablefuture+thencompose+async+composition,https://youtube.com/results?search_query=java+completablefuture+thencompose+async+composition+hindi,https://youtube.com/results?search_query=java+completablefuture+thencompose+async+composition+kannada,https://youtube.com/results?search_query=java+completablefuture+thencompose+async+composition+tamil,https://youtube.com/results?search_query=java+completablefuture+thencompose+async+composition+telugu
