Topic,Difficulty,Question,Tag1,Tag2,Tag3,Tag4,Correct Option,Explanation,Category,Doc URL,Video Search EN,Video Search HI,Video Search KN,Video Search TA,Video Search TE
Java,Advanced,How does Java's Garbage Collection mechanism differ between G1GC and CMS collectors?,Memory Management,Garbage Collection,G1GC,CMS,A,G1GC uses region-based heap and predictable pause times; CMS uses concurrent mark-sweep with shorter pauses but fragmentation.,Memory Management,https://docs.oracle.com/javase/9/gctuning/garbage-first-garbage-collector.htm,https://youtube.com/results?search_query=java+g1gc+vs+cms+garbage+collection,https://youtube.com/results?search_query=java+g1gc+vs+cms+garbage+collection+hindi,https://youtube.com/results?search_query=java+g1gc+vs+cms+garbage+collection+kannada,https://youtube.com/results?search_query=java+g1gc+vs+cms+garbage+collection+tamil,https://youtube.com/results?search_query=java+g1gc+vs+cms+garbage+collection+telugu
Java,Advanced,What is the purpose of Java's Module System (JPMS) and how does it improve encapsulation?,Java Platform,Module System,Encapsulation,Jigsaw,A,JPMS provides strong encapsulation, explicit dependencies, and service loading to avoid classpath hell.,Java Platform,https://openjdk.org/projects/jigsaw/,https://youtube.com/results?search_query=java+module+system+jpms+encapsulation,https://youtube.com/results?search_query=java+module+system+jpms+encapsulation+hindi,https://youtube.com/results?search_query=java+module+system+jpms+encapsulation+kannada,https://youtube.com/results?search_query=java+module+system+jpms+encapsulation+tamil,https://youtube.com/results?search_query=java+module+system+jpms+encapsulation+telugu
Java,Advanced,How does Java's CompletableFuture differ from Future for asynchronous programming?,Concurrency,CompletableFuture,Future,Async Programming,A,CompletableFuture supports chaining, combining async operations and manual completion; Future only gets result.,Concurrency,https://docs.oracle.com/javase/8/docs/api/java/util/concurrent/CompletableFuture.html,https://youtube.com/results?search_query=java+completablefuture+vs+future,https://youtube.com/results?search_query=java+completablefuture+vs+future+hindi,https://youtube.com/results?search_query=java+completablefuture+vs+future+kannada,https://youtube.com/results?search_query=java+completablefuture+vs+future+tamil,https://youtube.com/results?search_query=java+completablefuture+vs+future+telugu
Java,Advanced,What is the difference between ClassLoader hierarchy and module layer in Java 9+?,Class Loading,ClassLoader,Module Layer,Java 9,A,ClassLoader uses parent delegation; Module Layer creates isolated configurations with explicit dependencies.,Class Loading,https://docs.oracle.com/javase/9/docs/api/java/lang/ModuleLayer.html,https://youtube.com/results?search_query=java+classloader+vs+module+layer,https://youtube.com/results?search_query=java+classloader+vs+module+layer+hindi,https://youtube.com/results?search_query=java+classloader+vs+module+layer+kannada,https://youtube.com/results?search_query=java+classloader+vs+module+layer+tamil,https://youtube.com/results?search_query=java+classloader+vs+module+layer+telugu
Java,Advanced,How does Java's Records feature reduce boilerplate code compared to traditional classes?,Java Features,Records,Data Classes,Java 14,A,Records automatically generate constructor, getters, equals(), hashCode(), toString() for immutable data carriers.,Java Features,https://docs.oracle.com/en/java/javase/16/language/records.html,https://youtube.com/results?search_query=java+records+boilerplate+reduction,https://youtube.com/results?search_query=java+records+boilerplate+reduction+hindi,https://youtube.com/results?search_query=java+records+boilerplate+reduction+kannada,https://youtube.com/results?search_query=java+records+boilerplate+reduction+tamil,https://youtube.com/results?search_query=java+records+boilerplate+reduction+telugu
Java,Advanced,What is the purpose of Java's VarHandle and how does it improve upon Atomic classes?,Concurrency,VarHandle,Atomic classes,Memory access,A,VarHandle provides type-safe, direct variable access with fine-grained memory ordering control and low overhead.,Concurrency,https://docs.oracle.com/javase/9/docs/api/java/lang/invoke/VarHandle.html,https://youtube.com/results?search_query=java+varhandle+vs+atomic+classes,https://youtube.com/results?search_query=java+varhandle+vs+atomic+classes+hindi,https://youtube.com/results?search_query=java+varhandle+vs+atomic+classes+kannada,https://youtube.com/results?search_query=java+varhandle+vs+atomic+classes+tamil,https://youtube.com/results?search_query=java+varhandle+vs+atomic+classes+telugu
Java,Advanced,How does Java's Sealed Classes restrict inheritance hierarchy compared to final classes?,Java Features,Sealed Classes,Inheritance control,Java 17,A,Sealed classes specify which classes can extend them; final classes prevent all inheritance entirely.,Java Features,https://docs.oracle.com/en/java/javase/17/language/sealed-classes-and-interfaces.html,https://youtube.com/results?search_query=java+sealed+classes+vs+final,https://youtube.com/results?search_query=java+sealed+classes+vs+final+hindi,https://youtube.com/results?search_query=java+sealed+classes+vs+final+kannada,https://youtube.com/results?search_query=java+sealed+classes+vs+final+tamil,https://youtube.com/results?search_query=java+sealed+classes+vs+final+telugu
Java,Advanced,What is the difference between Phantom References and Soft/Weak References in Java?,Memory Management,Phantom References,Weak References,Soft References,A,Phantom References don't prevent GC but allow cleanup; Weak get cleared when only weakly reachable; Soft cleared under memory pressure.,Memory Management,https://docs.oracle.com/javase/8/docs/api/java/lang/ref/package-summary.html,https://youtube.com/results?search_query=java+phantom+weak+soft+references,https://youtube.com/results?search_query=java+phantom+weak+soft+references+hindi,https://youtube.com/results?search_query=java+phantom+weak+soft+references+kannada,https://youtube.com/results?search_query=java+phantom+weak+soft+references+tamil,https://youtube.com/results?search_query=java+phantom+weak+soft+references+telugu
Java,Advanced,How does Java's Pattern Matching for instanceof simplify type checking and casting?,Java Features,Pattern Matching,instanceof,Java 16,A,Pattern matching combines type check and variable declaration, eliminating explicit casting after instanceof.,Java Features,https://docs.oracle.com/en/java/javase/16/language/pattern-matching-instanceof-operator.html,https://youtube.com/results?search_query=java+pattern+matching+instanceof,https://youtube.com/results?search_query=java+pattern+matching+instanceof+hindi,https://youtube.com/results?search_query=java+pattern+matching+instanceof+kannada,https://youtube.com/results?search_query=java+pattern+matching+instanceof+tamil,https://youtube.com/results?search_query=java+pattern+matching+instanceof+telugu
Java,Advanced,What is the purpose of Java's Foreign Function & Memory API (Project Panama) for native interop?,Native Integration,Project Panama,FFI,JNI replacement,A,Project Panama provides safe, efficient native interop without JNI overhead using memory segments and native calls.,Native Integration,https://openjdk.org/projects/panama/,https://youtube.com/results?search_query=java+project+panama+ffi+jni,https://youtube.com/results?search_query=java+project+panama+ffi+jni+hindi,https://youtube.com/results?search_query=java+project+panama+ffi+jni+kannada,https://youtube.com/results?search_query=java+project+panama+ffi+jni+tamil,https://youtube.com/results?search_query=java+project+panama+ffi+jni+telugu
Java,Advanced,How does Java's ZGC achieve sub-millisecond pause times for large heaps?,Memory Management,Z Garbage Collector,Low latency,Sub-millisecond pauses,A,ZGC uses colored pointers and load barriers for concurrent compaction, enabling <1ms pauses regardless of heap size.,Memory Management,https://docs.oracle.com/en/java/javase/17/gctuning/z-garbage-collector.html,https://youtube.com/results?search_query=java+zgc+sub+millisecond+pauses,https://youtube.com/results?search_query=java+zgc+sub+millisecond+pauses+hindi,https://youtube.com/results?search_query=java+zgc+sub+millisecond+pauses+kannada,https://youtube.com/results?search_query=java+zgc+sub+millisecond+pauses+tamil,https://youtube.com/results?search_query=java+zgc+sub+millisecond+pauses+telugu
Java,Advanced,What is the difference between Virtual Threads (Project Loom) and Platform Threads?,Concurrency,Virtual Threads,Project Loom,Platform Threads,A,Virtual threads are lightweight user-mode threads; platform threads are OS threads with 1:1 mapping.,Concurrency,https://openjdk.org/projects/loom/,https://youtube.com/results?search_query=java+virtual+threads+vs+platform+threads,https://youtube.com/results?search_query=java+virtual+threads+vs+platform+threads+hindi,https://youtube.com/results?search_query=java+virtual+threads+vs+platform+threads+kannada,https://youtube.com/results?search_query=java+virtual+threads+vs+platform+threads+tamil,https://youtube.com/results?search_query=java+virtual+threads+vs+platform+threads+telugu
Java,Advanced,How does Java's Memory Model ensure visibility and ordering in concurrent code?,Concurrency,Java Memory Model,Happens-before,Visibility,A,JMM defines happens-before relationships via synchronization actions ensuring memory visibility across threads.,Concurrency,https://docs.oracle.com/javase/specs/jls/se17/html/jls-17.html#jls-17.4,https://youtube.com/results?search_query=java+memory+model+visibility+ordering,https://youtube.com/results?search_query=java+memory+model+visibility+ordering+hindi,https://youtube.com/results?search_query=java+memory+model+visibility+ordering+kannada,https://youtube.com/results?search_query=java+memory+model+visibility+ordering+tamil,https://youtube.com/results?search_query=java+memory+model+visibility+ordering+telugu
Java,Advanced,What is the purpose of Java's ServiceLoader and how does it enable pluggable architectures?,SPI,ServiceLoader,Pluggable architecture,Service Provider,A,ServiceLoader discovers and loads service implementations from META-INF/services enabling extensible designs.,SPI,https://docs.oracle.com/javase/8/docs/api/java/util/ServiceLoader.html,https://youtube.com/results?search_query=java+serviceloader+pluggable+architecture,https://youtube.com/results?search_query=java+serviceloader+pluggable+architecture+hindi,https://youtube.com/results?search_query=java+serviceloader+pluggable+architecture+kannada,https://youtube.com/results?search_query=java+serviceloader+pluggable+architecture+tamil,https://youtube.com/results?search_query=java+serviceloader+pluggable+architecture+telugu
Java,Advanced,How does Java's StackWalker API improve upon Thread.getStackTrace() for stack traversal?,Debugging,StackWalker,Stack traces,Performance,A,StackWalker provides lazy, efficient stack frame access with filtering options; getStackTrace() captures full stack eagerly.,Debugging,https://docs.oracle.com/javase/9/docs/api/java/lang/StackWalker.html,https://youtube.com/results?search_query=java+stackwalker+vs+getstacktrace,https://youtube.com/results?search_query=java+stackwalker+vs+getstacktrace+hindi,https://youtube.com/results?search_query=java+stackwalker+vs+getstacktrace+kannada,https://youtube.com/results?search_query=java+stackwalker+vs+getstacktrace+tamil,https://youtube.com/results?search_query=java+stackwalker+vs+getstacktrace+telugu
Java,Advanced,What is the difference between biased locking and lightweight locking in JVM synchronization?,JVM,Biased Locking,Lightweight Locking,Synchronization optimization,A,Biased locking assumes single thread access; lightweight locking uses CAS when contention detected (deprecated in Java 15).,JVM,https://openjdk.org/jeps/374,https://youtube.com/results?search_query=java+biased+locking+vs+lightweight+locking,https://youtube.com/results?search_query=java+biased+locking+vs+lightweight+locking+hindi,https://youtube.com/results?search_query=java+biased+locking+vs+lightweight+locking+kannada,https://youtube.com/results?search_query=java+biased+locking+vs+lightweight+locking+tamil,https://youtube.com/results?search_query=java+biased+locking+vs+lightweight+locking+telugu
Java,Advanced,How does Java's String Deduplication feature in G1GC reduce memory footprint?,Memory Management,String Deduplication,G1GC,Memory optimization,A,G1GC identifies duplicate strings and replaces them with single char[] instance, reducing heap usage.,Memory Management,https://docs.oracle.com/javase/8/docs/technotes/guides/vm/gctuning/g1_gc_tuning.html,https://youtube.com/results?search_query=java+string+deduplication+g1gc,https://youtube.com/results?search_query=java+string+deduplication+g1gc+hindi,https://youtube.com/results?search_query=java+string+deduplication+g1gc+kannada,https://youtube.com/results?search_query=java+string+deduplication+g1gc+tamil,https://youtube.com/results?search_query=java+string+deduplication+g1gc+telugu
Java,Advanced,What is the purpose of Java's Varargs with @SafeVarargs annotation for generic array safety?,Java Features,Varargs,SafeVarargs,Generic arrays,A,@SafeVarargs suppresses heap pollution warnings when generic varargs are used safely in final/private methods.,Java Features,https://docs.oracle.com/javase/8/docs/api/java/lang/SafeVarargs.html,https://youtube.com/results?search_query=java+safevargs+annotation+generic+arrays,https://youtube.com/results?search_query=java+safevargs+annotation+generic+arrays+hindi,https://youtube.com/results?search_query=java+safevargs+annotation+generic+arrays+kannada,https://youtube.com/results?search_query=java+safevargs+annotation+generic+arrays+tamil,https://youtube.com/results?search_query=java+safevargs+annotation+generic+arrays+telugu
Java,Advanced,How does Java's ForkJoinPool differ from ExecutorService for parallel task execution?,Concurrency,ForkJoinPool,ExecutorService,Parallel processing,A,ForkJoinPool uses work-stealing algorithm for recursive tasks; ExecutorService uses fixed/thread pool for independent tasks.,Concurrency,https://docs.oracle.com/javase/8/docs/api/java/util/concurrent/ForkJoinPool.html,https://youtube.com/results?search_query=java+forkjoinpool+vs+executorservice,https://youtube.com/results?search_query=java+forkjoinpool+vs+executorservice+hindi,https://youtube.com/results?search_query=java+forkjoinpool+vs+executorservice+kannada,https://youtube.com/results?search_query=java+forkjoinpool+vs+executorservice+tamil,https://youtube.com/results?search_query=java+forkjoinpool+vs+executorservice+telugu
Java,Advanced,What is the difference between Escape Analysis and Scalar Replacement in JIT optimizations?,JVM,Escape Analysis,Scalar Replacement,JIT optimization,A,Escape Analysis determines if object escapes method; Scalar Replacement replaces object with its fields on stack.,Performance,https://wiki.openjdk.org/display/HotSpot/PerformanceTechniques,https://youtube.com/results?search_query=java+escape+analysis+scalar+replacement,https://youtube.com/results?search_query=java+escape+analysis+scalar+replacement+hindi,https://youtube.com/results?search_query=java+escape+analysis+scalar+replacement+kannada,https://youtube.com/results?search_query=java+escape+analysis+scalar+replacement+tamil,https://youtube.com/results?search_query=java+escape+analysis+scalar+replacement+telugu
Java,Advanced,How does Java's MethodHandles API improve upon Reflection for method invocation?,Reflection,MethodHandles,Method invocation,Performance,A,MethodHandles provides type-safe, JIT-optimizable method invocation with lower overhead than Reflection.,Reflection,https://docs.oracle.com/javase/8/docs/api/java/lang/invoke/MethodHandle.html,https://youtube.com/results?search_query=java+methodhandles+vs+reflection,https://youtube.com/results?search_query=java+methodhandles+vs+reflection+hindi,https://youtube.com/results?search_query=java+methodhandles+vs+reflection+kannada,https://youtube.com/results?search_query=java+methodhandles+vs+reflection+tamil,https://youtube.com/results?search_query=java+methodhandles+vs+reflection+telugu
Java,Advanced,What is the purpose of Java's Compact Strings optimization in Java 9+?,Performance,Compact Strings,Memory efficiency,String optimization,A,Compact Strings use byte[] instead of char[] for Latin-1 characters, reducing String memory usage by half.,Performance,https://openjdk.org/jeps/254,https://youtube.com/results?search_query=java+compact+strings+memory+optimization,https://youtube.com/results?search_query=java+compact+strings+memory+optimization+hindi,https://youtube.com/results?search_query=java+compact+strings+memory+optimization+kannada,https://youtube.com/results?search_query=java+compact+strings+memory+optimization+tamil,https://youtube.com/results?search_query=java+compact+strings+memory+optimization+telugu
Java,Advanced,How does Java's StampedLock differ from ReentrantReadWriteLock for read-write synchronization?,Concurrency,StampedLock,ReadWriteLock,Optimistic locking,A,StampedLock supports optimistic reads, write lock conversion and lower contention; ReentrantReadWriteLock doesn't.,Concurrency,https://docs.oracle.com/javase/8/docs/api/java/util/concurrent/locks/StampedLock.html,https://youtube.com/results?search_query=java+stampedlock+vs+reentrantreadwritelock,https://youtube.com/results?search_query=java+stampedlock+vs+reentrantreadwritelock+hindi,https://youtube.com/results?search_query=java+stampedlock+vs+reentrantreadwritelock+kannada,https://youtube.com/results?search_query=java+stampedlock+vs+reentrantreadwritelock+tamil,https://youtube.com/results?search_query=java+stampedlock+vs+reentrantreadwritelock+telugu
Java,Advanced,What is the difference between Class Data Sharing (CDS) and Application Class Data Sharing?,JVM,CDS,AppCDS,Startup optimization,A,CDS shares system classes; AppCDS extends to application classes, improving startup time and memory footprint.,Performance,https://docs.oracle.com/javase/9/vm/class-data-sharing.htm,https://youtube.com/results?search_query=java+cds+vs+appcds,https://youtube.com/results?search_query=java+cds+vs+appcds+hindi,https://youtube.com/results?search_query=java+cds+vs+appcds+kannada,https://youtube.com/results?search_query=java+cds+vs+appcds+tamil,https://youtube.com/results?search_query=java+cds+vs+appcds+telugu
Java,Advanced,How does Java's Flow API (Reactive Streams) differ from traditional Stream API for async streams?,Reactive Programming,Flow API,Reactive Streams,Stream API,A,Flow API supports backpressure and async stream processing; Stream API is for synchronous data processing.,Reactive Programming,https://docs.oracle.com/javase/9/docs/api/java/util/concurrent/Flow.html,https://youtube.com/results?search_query=java+flow+api+vs+stream+api,https://youtube.com/results?search_query=java+flow+api+vs+stream+api+hindi,https://youtube.com/results?search_query=java+flow+api+vs+stream+api+kannada,https://youtube.com/results?search_query=java+flow+api+vs+stream+api+tamil,https://youtube.com/results?search_query=java+flow+api+vs+stream+api+telugu
Java,Advanced,What is the purpose of Java's @Contended annotation for reducing false sharing in concurrent code?,Concurrency,Contended annotation,False sharing,Cache lines,A,@Contended pads fields to separate them into different cache lines, preventing false sharing in multi-core systems.,Concurrency,https://openjdk.org/jeps/142,https://youtube.com/results?search_query=java+contended+annotation+false+sharing,https://youtube.com/results?search_query=java+contended+annotation+false+sharing+hindi,https://youtube.com/results?search_query=java+contended+annotation+false+sharing+kannada,https://youtube.com/results?search_query=java+contended+annotation+false+sharing+tamil,https://youtube.com/results?search_query=java+contended+annotation+false+sharing+telugu
Java,Advanced,How does Java's GraalVM Native Image ahead-of-time compilation differ from JIT compilation?,Compilation,GraalVM,Native Image,AOT compilation,A,Native Image compiles to standalone executable with faster startup; JIT compiles at runtime with peak performance.,Compilation,https://www.graalvm.org/native-image/,https://youtube.com/results?search_query=java+graalvm+native+image+vs+jit,https://youtube.com/results?search_query=java+graalvm+native+image+vs+jit+hindi,https://youtube.com/results?search_query=java+graalvm+native+image+vs+jit+kannada,https://youtube.com/results?search_query=java+graalvm+native+image+vs+jit+tamil,https://youtube.com/results?search_query=java+graalvm+native+image+vs+jit+telugu
Java,Advanced,What is the difference between Shenandoah GC and ZGC for low-latency garbage collection?,Memory Management,Shenandoah GC,ZGC,Low latency,A,Shenandoah uses Brooks pointers for concurrent compaction; ZGC uses colored pointers with different region sizes.,Memory Management,https://openjdk.org/projects/shenandoah/,https://youtube.com/results?search_query=java+shenandoah+vs+zgc+latency,https://youtube.com/results?search_query=java+shenandoah+vs+zgc+latency+hindi,https://youtube.com/results?search_query=java+shenandoah+vs+zgc+latency+kannada,https://youtube.com/results?search_query=java+shenandoah+vs+zgc+latency+tamil,https://youtube.com/results?search_query=java+shenandoah+vs+zgc+latency+telugu
Java,Advanced,How does Java's Pattern Matching for switch expressions improve code readability?,Java Features,Pattern Matching,Switch expressions,Java 17,A,Pattern matching in switch allows type patterns, null handling, and exhaustiveness checking in switch statements.,Java Features,https://docs.oracle.com/en/java/javase/17/language/pattern-matching-switch-expressions-statements.html,https://youtube.com/results?search_query=java+pattern+matching+switch+expressions,https://youtube.com/results?search_query=java+pattern+matching+switch+expressions+hindi,https://youtube.com/results?search_query=java+pattern+matching+switch+expressions+kannada,https://youtube.com/results?search_query=java+pattern+matching+switch+expressions+tamil,https://youtube.com/results?search_query=java+pattern+matching+switch+expressions+telugu
Java,Advanced,What is the purpose of Java's Vector API (Project Panama) for SIMD operations?,Performance,Vector API,SIMD,Project Panama,A,Vector API enables explicit SIMD operations for numerical computations, leveraging CPU vector instructions.,Performance,https://openjdk.org/jeps/338,https://youtube.com/results?search_query=java+vector+api+simd+operations,https://youtube.com/results?search_query=java+vector+api+simd+operations+hindi,https://youtube.com/results?search_query=java+vector+api+simd+operations+kannada,https://youtube.com/results?search_query=java+vector+api+simd+operations+tamil,https://youtube.com/results?search_query=java+vector+api+simd+operations+telugu
Java,Advanced,How does Java's ThreadLocalRandom improve upon Random for concurrent random number generation?,Concurrency,ThreadLocalRandom,Random,Performance,A,ThreadLocalRandom provides per-thread random instances avoiding contention; Random uses atomic seed with contention.,Concurrency,https://docs.oracle.com/javase/8/docs/api/java/util/concurrent/ThreadLocalRandom.html,https://youtube.com/results?search_query=java+threadlocalrandom+vs+random,https://youtube.com/results?search_query=java+threadlocalrandom+vs+random+hindi,https://youtube.com/results?search_query=java+threadlocalrandom+vs+random+kannada,https://youtube.com/results?search_query=java+threadlocalrandom+vs+random+tamil,https://youtube.com/results?search_query=java+threadlocalrandom+vs+random+telugu
Java,Advanced,What is the difference between heap dump and thread dump for Java application diagnostics?,Diagnostics,Heap dump,Thread dump,Debugging,A,Heap dump shows memory allocation; Thread dump shows thread states and stack traces for deadlock detection.,Diagnostics,https://docs.oracle.com/javase/8/docs/technotes/guides/troubleshoot/tooldescr.html,https://youtube.com/results?search_query=java+heap+dump+vs+thread+dump,https://youtube.com/results?search_query=java+heap+dump+vs+thread+dump+hindi,https://youtube.com/results?search_query=java+heap+dump+vs+thread+dump+kannada,https://youtube.com/results?search_query=java+heap+dump+vs+thread+dump+tamil,https://youtube.com/results?search_query=java+heap+dump+vs+thread+dump+telugu
Java,Advanced,How does Java's invokedynamic bytecode instruction enable dynamic language features?,JVM,invokedynamic,Dynamic languages,Method handles,A,invokedynamic defers linkage to bootstrap method, enabling dynamic method dispatch for languages like JavaScript.,JVM,https://docs.oracle.com/javase/8/docs/technotes/guides/vm/multiple-language-support.html,https://youtube.com/results?search_query=java+invokedynamic+bytecode+dynamic,https://youtube.com/results?search_query=java+invokedynamic+bytecode+dynamic+hindi,https://youtube.com/results?search_query=java+invokedynamic+bytecode+dynamic+kannada,https://youtube.com/results?search_query=java+invokedynamic+bytecode+dynamic+tamil,https://youtube.com/results?search_query=java+invokedynamic+bytecode+dynamic+telugu
Java,Advanced,What is the purpose of Java's Process API improvements for native process management?,Process Management,Process API,Native processes,Java 9,A,Process API provides better control over native processes with pipes, I/O redirection, and async completion.,Process Management,https://docs.oracle.com/javase/9/docs/api/java/lang/Process.html,https://youtube.com/results?search_query=java+process+api+native+management,https://youtube.com/results?search_query=java+process+api+native+management+hindi,https://youtube.com/results?search_query=java+process+api+native+management+kannada,https://youtube.com/results?search_query=java+process+api+native+management+tamil,https://youtube.com/results?search_query=java+process+api+native+management+telugu
