skill,level,question_text,option_a,option_b,option_c,option_d,correct_answer,explanation,topic,mdn_link,youtube_english,youtube_hindi,youtube_kannada,youtube_tamil,youtube_telugu

Topic,Difficulty,Question,Keywords,Answer Type,Short Answer,Category,Docs URL,YouTube English,YouTube Hindi,YouTube Kannada,YouTube Tamil,YouTube Telugu
MongoDB,Advanced,What is the difference between embedded documents and references in MongoDB data modeling?,Data modeling,Embedded documents,References,Relationships,A,"Embedded: documents within documents (denormalization); References: separate documents linked by IDs (normalization)",Data Modeling,https://www.mongodb.com/docs/manual/core/data-modeling-introduction/,https://youtube.com/results?search_query=mongodb+embedded+vs+references,https://youtube.com/results?search_query=mongodb+embedded+vs+references+hindi,https://youtube.com/results?search_query=mongodb+embedded+vs+references+kannada,https://youtube.com/results?search_query=mongodb+embedded+vs+references+tamil,https://youtube.com/results?search_query=mongodb+embedded+vs+references+telugu
MongoDB,Advanced,How does MongoDB implement transactions and what are the limitations?,Transactions,ACID,Multi-document,A,"Multi-document transactions with ACID guarantees; requires replica set; limited to single shard in sharded clusters (v4.2+ cross-shard)",Transactions,https://www.mongodb.com/docs/manual/core/transactions/,https://youtube.com/results?search_query=mongodb+transactions+implementation,https://youtube.com/results?search_query=mongodb+transactions+implementation+hindi,https://youtube.com/results?search_query=mongodb+transactions+implementation+kannada,https://youtube.com/results?search_query=mongodb+transactions+implementation+tamil,https://youtube.com/results?search_query=mongodb+transactions+implementation+telugu
MongoDB,Advanced,What are MongoDB aggregation pipelines and pipeline stages?,Aggregation,Pipeline,$match,$group,A,"Data processing pipelines with stages: $match, $group, $sort, $project, $lookup, $unwind, etc.",Aggregation,https://www.mongodb.com/docs/manual/core/aggregation-pipeline/,https://youtube.com/results?search_query=mongodb+aggregation+pipeline,https://youtube.com/results?search_query=mongodb+aggregation+pipeline+hindi,https://youtube.com/results?search_query=mongodb+aggregation+pipeline+kannada,https://youtube.com/results?search_query=mongodb+aggregation+pipeline+tamil,https://youtube.com/results?search_query=mongodb+aggregation+pipeline+telugu
MongoDB,Advanced,What is the difference between find() and aggregate() operations?,Querying,Aggregation,Performance,A,"find(): simple queries; aggregate(): complex data processing, transformations, computations",Querying,https://www.mongodb.com/docs/manual/aggregation/,https://youtube.com/results?search_query=mongodb+find+vs+aggregate,https://youtube.com/results?search_query=mongodb+find+vs+aggregate+hindi,https://youtube.com/results?search_query=mongodb+find+vs+aggregate+kannada,https://youtube.com/results?search_query=mongodb+find+vs+aggregate+tamil,https://youtube.com/results?search_query=mongodb+find+vs+aggregate+telugu
MongoDB,Advanced,How does MongoDB implement indexing strategies for optimal performance?,Indexing,Performance,Query optimization,A,"Create indexes on frequently queried fields; compound indexes, multikey indexes, text indexes, geospatial indexes",Indexing,https://www.mongodb.com/docs/manual/indexes/,https://youtube.com/results?search_query=mongodb+indexing+strategies,https://youtube.com/results?search_query=mongodb+indexing+strategies+hindi,https://youtube.com/results?search_query=mongodb+indexing+strategies+kannada,https://youtube.com/results?search_query=mongodb+indexing+strategies+tamil,https://youtube.com/results?search_query=mongodb+indexing+strategies+telugu
MongoDB,Advanced,What are MongoDB replica sets and how do they ensure high availability?,Replica sets,High availability,Automatic failover,A,"Replica sets: primary + secondaries; automatic failover; data replication; read scalability",Replication,https://www.mongodb.com/docs/manual/replication/,https://youtube.com/results?search_query=mongodb+replica+sets+high+availability,https://youtube.com/results?search_query=mongodb+replica+sets+high+availability+hindi,https://youtube.com/results?search_query=mongodb+replica+sets+high+availability+kannada,https://youtube.com/results?search_query=mongodb+replica+sets+high+availability+tamil,https://youtube.com/results?search_query=mongodb+replica+sets+high+availability+telugu
MongoDB,Advanced,How does MongoDB implement sharding and data distribution?,Sharding,Horizontal scaling,Data partitioning,A,"Sharding: partitions data across multiple servers; shard key determines distribution; mongos router directs queries",Sharding,https://www.mongodb.com/docs/manual/sharding/,https://youtube.com/results?search_query=mongodb+sharding+implementation,https://youtube.com/results?search_query=mongodb+sharding+implementation+hindi,https://youtube.com/results?search_query=mongodb+sharding+implementation+kannada,https://youtube.com/results?search_query=mongodb+sharding+implementation+tamil,https://youtube.com/results?search_query=mongodb+sharding+implementation+telugu
MongoDB,Advanced,What is the difference between capped collections and regular collections?,Collections,Capped collections,Fixed size,A,"Capped collections: fixed size, FIFO order, high-performance writes; Regular collections: dynamic growth",Collections,https://www.mongodb.com/docs/manual/core/capped-collections/,https://youtube.com/results?search_query=mongodb+capped+vs+regular+collections,https://youtube.com/results?search_query=mongodb+capped+vs+regular+collections+hindi,https://youtube.com/results?search_query=mongodb+capped+vs+regular+collections+kannada,https://youtube.com/results?search_query=mongodb+capped+vs+regular+collections+tamil,https://youtube.com/results?search_query=mongodb+capped+vs+regular+collections+telugu
MongoDB,Advanced,How does MongoDB implement change streams for real-time data changes?,Change streams,Real-time,Event-driven,A,"Change streams: watch collections for changes; return change events; uses oplog",Change Streams,https://www.mongodb.com/docs/manual/changeStreams/,https://youtube.com/results?search_query=mongodb+change+streams,https://youtube.com/results?search_query=mongodb+change+streams+hindi,https://youtube.com/results?search_query=mongodb+change+streams+kannada,https://youtube.com/results?search_query=mongodb+change+streams+tamil,https://youtube.com/results?search_query=mongodb+change+streams+telugu
MongoDB,Advanced,What are MongoDB aggregation pipeline operators and their categories?,Aggregation operators,Expression operators,Accumulators,A,"Operators: $sum, $avg, $push, $addToSet; Categories: arithmetic, array, comparison, date, string",Aggregation,https://www.mongodb.com/docs/manual/reference/operator/aggregation/,https://youtube.com/results?search_query=mongodb+aggregation+operators,https://youtube.com/results?search_query=mongodb+aggregation+operators+hindi,https://youtube.com/results?search_query=mongodb+aggregation+operators+kannada,https://youtube.com/results?search_query=mongodb+aggregation+operators+tamil,https://youtube.com/results?search_query=mongodb+aggregation+operators+telugu
MongoDB,Advanced,How does MongoDB implement text search and full-text indexing?,Text search,Full-text search,Text indexes,A,"Text indexes support text search; $text operator for searching; language support, stemming",Indexing,https://www.mongodb.com/docs/manual/text-search/,https://youtube.com/results?search_query=mongodb+text+search+full+text,https://youtube.com/results?search_query=mongodb+text+search+full+text+hindi,https://youtube.com/results?search_query=mongodb+text+search+full+text+kannada,https://youtube.com/results?search_query=mongodb+text+search+full+text+tamil,https://youtube.com/results?search_query=mongodb+text+search+full+text+telugu
MongoDB,Advanced,What is the difference between $lookup and embedded documents for joins?,Joins,$lookup,Embedded documents,A,"$lookup: perform left outer joins; Embedded: pre-joined data; choose based on query patterns",Aggregation,https://www.mongodb.com/docs/manual/reference/operator/aggregation/lookup/,https://youtube.com/results?search_query=mongodb+lookup+vs+embedded,https://youtube.com/results?search_query=mongodb+lookup+vs+embedded+hindi,https://youtube.com/results?search_query=mongodb+lookup+vs+embedded+kannada,https://youtube.com/results?search_query=mongodb+lookup+vs+embedded+tamil,https://youtube.com/results?search_query=mongodb+lookup+vs+embedded+telugu
MongoDB,Advanced,How does MongoDB implement geospatial queries and indexing?,Geospatial,Location data,GeoJSON,A,"2dsphere indexes for spherical geometry; geoWithin, near queries; GeoJSON format for coordinates",Geospatial,https://www.mongodb.com/docs/manual/geospatial-queries/,https://youtube.com/results?search_query=mongodb+geospatial+queries,https://youtube.com/results?search_query=mongodb+geospatial+queries+hindi,https://youtube.com/results?search_query=mongodb+geospatial+queries+kannada,https://youtube.com/results?search_query=mongodb+geospatial+queries+tamil,https://youtube.com/results?search_query=mongodb+geospatial+queries+telugu
MongoDB,Advanced,What are MongoDB write concern and read concern levels?,Write concern,Read concern,Data consistency,A,"Write concern: acknowledgment level (w:1, majority); Read concern: isolation level (local, majority, linearizable)",Consistency,https://www.mongodb.com/docs/manual/reference/write-concern/,https://youtube.com/results?search_query=mongodb+write+read+concern,https://youtube.com/results?search_query=mongodb+write+read+concern+hindi,https://youtube.com/results?search_query=mongodb+write+read+concern+kannada,https://youtube.com/results?search_query=mongodb+write+read+concern+tamil,https://youtube.com/results?search_query=mongodb+write+read+concern+telugu
MongoDB,Advanced,How does MongoDB implement compound indexes and index intersection?,Compound indexes,Index intersection,Query optimization,A,"Compound indexes: multiple fields; Index intersection: use multiple indexes for query; covered queries",Indexing,https://www.mongodb.com/docs/manual/core/index-compound/,https://youtube.com/results?search_query=mongodb+compound+indexes+intersection,https://youtube.com/results?search_query=mongodb+compound+indexes+intersection+hindi,https://youtube.com/results?search_query=mongodb+compound+indexes+intersection+kannada,https://youtube.com/results?search_query=mongodb+compound+indexes+intersection+tamil,https://youtube.com/results?search_query=mongodb+compound+indexes+intersection+telugu
MongoDB,Advanced,What is the difference between MongoDB Atlas and self-managed MongoDB?,Deployment,Atlas,Self-managed,A,"Atlas: MongoDB's managed service (DBaaS); Self-managed: install, configure, maintain yourself",Deployment,https://www.mongodb.com/atlas,https://youtube.com/results?search_query=mongodb+atlas+vs+self+managed,https://youtube.com/results?search_query=mongodb+atlas+vs+self+managed+hindi,https://youtube.com/results?search_query=mongodb+atlas+vs+self+managed+kannada,https://youtube.com/results?search_query=mongodb+atlas+vs+self+managed+tamil,https://youtube.com/results?search_query=mongodb+atlas+vs+self+managed+telugu
MongoDB,Advanced,How does MongoDB implement document validation and schema enforcement?,Document validation,Schema validation,JSON Schema,A,"Document validation rules using JSON Schema; validate on insert/update",Validation,https://www.mongodb.com/docs/manual/core/schema-validation/,https://youtube.com/results?search_query=mongodb+document+validation,https://youtube.com/results?search_query=mongodb+document+validation+hindi,https://youtube.com/results?search_query=mongodb+document+validation+kannada,https://youtube.com/results?search_query=mongodb+document+validation+tamil,https://youtube.com/results?search_query=mongodb+document+validation+telugu
MongoDB,Advanced,What are MongoDB aggregation pipeline optimizations and performance tips?,Aggregation optimization,Performance,$match,$sort,A,"Pipeline optimizations: $match early, $project to limit fields, $sort before $group, use indexes",Aggregation,https://www.mongodb.com/docs/manual/core/aggregation-pipeline-optimization/,https://youtube.com/results?search_query=mongodb+aggregation+optimization,https://youtube.com/results?search_query=mongodb+aggregation+optimization+hindi,https://youtube.com/results?search_query=mongodb+aggregation+optimization+kannada,https://youtube.com/results?search_query=mongodb+aggregation+optimization+tamil,https://youtube.com/results?search_query=mongodb+aggregation+optimization+telugu
MongoDB,Advanced,How does MongoDB implement time series collections and their benefits?,Time series,Time-based data,Optimized storage,A,"Time series collections: optimized for time-series data; automatic partitioning, compression, aggregation",Time Series,https://www.mongodb.com/docs/manual/core/timeseries-collections/,https://youtube.com/results?search_query=mongodb+time+series+collections,https://youtube.com/results?search_query=mongodb+time+series+collections+hindi,https://youtube.com/results?search_query=mongodb+time+series+collections+kannada,https://youtube.com/results?search_query=mongodb+time+series+collections+tamil,https://youtube.com/results?search_query=mongodb+time+series+collections+telugu
MongoDB,Advanced,What is the difference between MongoDB's WiredTiger and MMAPv1 storage engines?,Storage engines,WiredTiger,MMAPv1,A,"WiredTiger: default, document-level locking, compression; MMAPv1: legacy, collection-level locking",Storage,https://www.mongodb.com/docs/manual/core/wiredtiger/,https://youtube.com/results?search_query=mongodb+wiredtiger+vs+mmapv1,https://youtube.com/results?search_query=mongodb+wiredtiger+vs+mmapv1+hindi,https://youtube.com/results?search_query=mongodb+wiredtiger+vs+mmapv1+kannada,https://youtube.com/results?search_query=mongodb+wiredtiger+vs+mmapv1+tamil,https://youtube.com/results?search_query=mongodb+wiredtiger+vs+mmapv1+telugu
MongoDB,Advanced,How does MongoDB implement collations for language-specific string comparison?,Collations,Locale, String comparison,A,"Collations: language-specific string comparison rules; specify locale, strength, case level",Collations,https://www.mongodb.com/docs/manual/reference/collation/,https://youtube.com/results?search_query=mongodb+collations+string+comparison,https://youtube.com/results?search_query=mongodb+collations+string+comparison+hindi,https://youtube.com/results?search_query=mongodb+collations+string+comparison+kannada,https://youtube.com/results?search_query=mongodb+collations+string+comparison+tamil,https://youtube.com/results?search_query=mongodb+collations+string+comparison+telugu
MongoDB,Advanced,What are MongoDB aggregation pipeline expressions and accumulator operators?,Expressions,Accumulators,$add,$multiply,A,"Expressions: $add, $subtract, $multiply; Accumulators: $sum, $avg, $push, $addToSet (in $group)",Aggregation,https://www.mongodb.com/docs/manual/meta/aggregation-quick-reference/,https://youtube.com/results?search_query=mongodb+aggregation+expressions,https://youtube.com/results?search_query=mongodb+aggregation+expressions+hindi,https://youtube.com/results?search_query=mongodb+aggregation+expressions+kannada,https://youtube.com/results?search_query=mongodb+aggregation+expressions+tamil,https://youtube.com/results?search_query=mongodb+aggregation+expressions+telugu
MongoDB,Advanced,How does MongoDB implement query profiling and performance analysis?,Profiling,Performance analysis,Slow queries,A,"Database profiler: logs slow operations; explain() method: shows query execution plan",Performance,https://www.mongodb.com/docs/manual/tutorial/manage-the-database-profiler/,https://youtube.com/results?search_query=mongodb+query+profiling,https://youtube.com/results?search_query=mongodb+query+profiling+hindi,https://youtube.com/results?search_query=mongodb+query+profiling+kannada,https://youtube.com/results?search_query=mongodb+query+profiling+tamil,https://youtube.com/results?search_query=mongodb+query+profiling+telugu
MongoDB,Advanced,What is the difference between MongoDB's $unwind and $lookup stages?,Aggregation stages,$unwind,$lookup,Array handling,A,"$unwind: deconstructs array field; $lookup: performs left outer join between collections",Aggregation,https://www.mongodb.com/docs/manual/reference/operator/aggregation/unwind/,https://youtube.com/results?search_query=mongodb+unwind+vs+lookup,https://youtube.com/results?search_query=mongodb+unwind+vs+lookup+hindi,https://youtube.com/results?search_query=mongodb+unwind+vs+lookup+kannada,https://youtube.com/results?search_query=mongodb+unwind+vs+lookup+tamil,https://youtube.com/results?search_query=mongodb+unwind+vs+lookup+telugu
MongoDB,Advanced,How does MongoDB implement data compression in WiredTiger storage engine?,Compression,WiredTiger,Storage efficiency,A,"WiredTiger compression: snappy (default), zlib, zstd; reduces storage footprint, trade-off with CPU",Storage,https://www.mongodb.com/docs/manual/core/wiredtiger/#compression,https://youtube.com/results?search_query=mongodb+wiredtiger+compression,https://youtube.com/results?search_query=mongodb+wiredtiger+compression+hindi,https://youtube.com/results?search_query=mongodb+wiredtiger+compression+kannada,https://youtube.com/results?search_query=mongodb+wiredtiger+compression+tamil,https://youtube.com/results?search_query=mongodb+wiredtiger+compression+telugu
MongoDB,Advanced,What are MongoDB aggregation pipeline $facet and multiple aggregation pipelines?,Facet,Multiple pipelines,Bucketing,A,"$facet: processes multiple aggregation pipelines within single stage; returns multiple result sets",Aggregation,https://www.mongodb.com/docs/manual/reference/operator/aggregation/facet/,https://youtube.com/results?search_query=mongodb+facet+aggregation,https://youtube.com/results?search_query=mongodb+facet+aggregation+hindi,https://youtube.com/results?search_query=mongodb+facet+aggregation+kannada,https://youtube.com/results?search_query=mongodb+facet+aggregation+tamil,https://youtube.com/results?search_query=mongodb+facet+aggregation+telugu
MongoDB,Advanced,How does MongoDB implement partial indexes and sparse indexes?,Partial indexes,Sparse indexes,Conditional indexing,A,"Partial indexes: index subset of documents (filter expression); Sparse indexes: skip null/missing values",Indexing,https://www.mongodb.com/docs/manual/core/index-partial/,https://youtube.com/results?search_query=mongodb+partial+sparse+indexes,https://youtube.com/results?search_query=mongodb+partial+sparse+indexes+hindi,https://youtube.com/results?search_query=mongodb+partial+sparse+indexes+kannada,https://youtube.com/results?search_query=mongodb+partial+sparse+indexes+tamil,https://youtube.com/results?search_query=mongodb+partial+sparse+indexes+telugu
MongoDB,Advanced,What is the difference between MongoDB aggregation $group and $bucket stages?,Aggregation stages,$group,$bucket,Bucketing,A,"$group: groups by expression; $bucket: groups into predefined ranges (buckets)",Aggregation,https://www.mongodb.com/docs/manual/reference/operator/aggregation/bucket/,https://youtube.com/results?search_query=mongodb+group+vs+bucket,https://youtube.com/results?search_query=mongodb+group+vs+bucket+hindi,https://youtube.com/results?search_query=mongodb+group+vs+bucket+kannada,https://youtube.com/results?search_query=mongodb+group+vs+bucket+tamil,https://youtube.com/results?search_query=mongodb+group+vs+bucket+telugu
MongoDB,Advanced,How does MongoDB implement connection pooling and manage client connections?,Connection pooling,Client connections,Performance,A,"Connection pooling: reuse connections; driver-level pooling; monitor with db.serverStatus().connections",Performance,https://www.mongodb.com/docs/manual/administration/connection-pool-overview/,https://youtube.com/results?search_query=mongodb+connection+pooling,https://youtube.com/results?search_query=mongodb+connection+pooling+hindi,https://youtube.com/results?search_query=mongodb+connection+pooling+kannada,https://youtube.com/results?search_query=mongodb+connection+pooling+tamil,https://youtube.com/results?search_query=mongodb+connection+pooling+telugu
MongoDB,Advanced,What are MongoDB aggregation pipeline $graphLookup for graph traversal?,Graph traversal,$graphLookup,Recursive search,A,"$graphLookup: recursive search on documents; for hierarchical data, graph data",Aggregation,https://www.mongodb.com/docs/manual/reference/operator/aggregation/graphLookup/,https://youtube.com/results?search_query=mongodb+graphlookup+aggregation,https://youtube.com/results?search_query=mongodb+graphlookup+aggregation+hindi,https://youtube.com/results?search_query=mongodb+graphlookup+aggregation+kannada,https://youtube.com/results?search_query=mongodb+graphlookup+aggregation+tamil,https://youtube.com/results?search_query=mongodb+graphlookup+aggregation+telugu
MongoDB,Advanced,How does MongoDB implement TTL (Time-To-Live) indexes for automatic data expiration?,TTL indexes,Data expiration,Automatic deletion,A,"TTL indexes: automatically remove documents after specified time; background thread cleans up",Indexing,https://www.mongodb.com/docs/manual/core/index-ttl/,https://youtube.com/results?search_query=mongodb+ttl+indexes,https://youtube.com/results?search_query=mongodb+ttl+indexes+hindi,https://youtube.com/results?search_query=mongodb+ttl+indexes+kannada,https://youtube.com/results?search_query=mongodb+ttl+indexes+tamil,https://youtube.com/results?search_query=mongodb+ttl+indexes+telugu
MongoDB,Advanced,What is the difference between MongoDB's $match and $project stages in aggregation?,Aggregation stages,$match,$project,Filtering vs shaping,A,"$match: filters documents (like WHERE); $project: reshapes documents (selects/renames fields)",Aggregation,https://www.mongodb.com/docs/manual/reference/operator/aggregation/match/,https://youtube.com/results?search_query=mongodb+match+vs+project,https://youtube.com/results?search_query=mongodb+match+vs+project+hindi,https://youtube.com/results?search_query=mongodb+match+vs+project+kannada,https://youtube.com/results?search_query=mongodb+match+vs+project+tamil,https://youtube.com/results?search_query=mongodb+match+vs+project+telugu
MongoDB,Advanced,How does MongoDB implement database profiling levels and slow query threshold?,Profiling levels,Slow queries,Threshold,A,"Profiling levels: 0=off, 1=slow, 2=all; slowMs threshold defines 'slow' operations",Performance,https://www.mongodb.com/docs/manual/tutorial/manage-the-database-profiler/,https://youtube.com/results?search_query=mongodb+profiling+levels,https://youtube.com/results?search_query=mongodb+profiling+levels+hindi,https://youtube.com/results?search_query=mongodb+profiling+levels+kannada,https://youtube.com/results?search_query=mongodb+profiling+levels+tamil,https://youtube.com/results?search_query=mongodb+profiling+levels+telugu
MongoDB,Advanced,What are MongoDB aggregation pipeline $addFields and $set stages?,Aggregation stages,$addFields,$set,Field addition,A,"$addFields/$set: add new fields or replace existing fields; similar functionality",Aggregation,https://www.mongodb.com/docs/manual/reference/operator/aggregation/addFields/,https://youtube.com/results?search_query=mongodb+addFields+set,https://youtube.com/results?search_query=mongodb+addFields+set+hindi,https://youtube.com/results?search_query=mongodb+addFields+set+kannada,https://youtube.com/results?search_query=mongodb+addFields+set+tamil,https://youtube.com/results?search_query=mongodb+addFields+set+telugu
MongoDB,Advanced,How does MongoDB implement hashed indexes and their use in sharding?,Hashed indexes,Sharding,Data distribution,A,"Hashed indexes: hash of field value; used as shard key for more even data distribution",Indexing,https://www.mongodb.com/docs/manual/core/index-hashed/,https://youtube.com/results?search_query=mongodb+hashed+indexes+sharding,https://youtube.com/results?search_query=mongodb+hashed+indexes+sharding+hindi,https://youtube.com/results?search_query=mongodb+hashed+indexes+sharding+kannada,https://youtube.com/results?search_query=mongodb+hashed+indexes+sharding+tamil,https://youtube.com/results?search_query=mongodb+hashed+indexes+sharding+telugu
MongoDB,Advanced,What is the difference between MongoDB's $out and $merge aggregation stages?,Aggregation stages,$out,$merge,Output handling,A,"$out: replaces collection; $merge: merges into existing collection (insert, merge, replace, keep)",Aggregation,https://www.mongodb.com/docs/manual/reference/operator/aggregation/merge/,https://youtube.com/results?search_query=mongodb+out+vs+merge,https://youtube.com/results?search_query=mongodb+out+vs+merge+hindi,https://youtube.com/results?search_query=mongodb+out+vs+merge+kannada,https://youtube.com/results?search_query=mongodb+out+vs+merge+tamil,https://youtube.com/results?search_query=mongodb+out+vs+merge+telugu
MongoDB,Advanced,How does MongoDB implement journaling for crash recovery?,Journaling,Crash recovery,Durability,A,"Journal: write-ahead log; ensures durability; can be disabled for performance (risk data loss)",Durability,https://www.mongodb.com/docs/manual/core/journaling/,https://youtube.com/results?search_query=mongodb+journaling+crash+recovery,https://youtube.com/results?search_query=mongodb+journaling+crash+recovery+hindi,https://youtube.com/results?search_query=mongodb+journaling+crash+recovery+kannada,https://youtube.com/results?search_query=mongodb+journaling+crash+recovery+tamil,https://youtube.com/results?search_query=mongodb+journaling+crash+recovery+telugu
