skill,level,question_text,option_a,option_b,option_c,option_d,correct_answer,explanation,topic,mdn_link,youtube_english,youtube_hindi,youtube_kannada,youtube_tamil,youtube_telugu
MongoDB,Advanced,What are MongoDB aggregation pipeline $rand and random value generation?,Random values,$rand,Statistical functions,A,"$rand: generates random float between 0 and 1; useful for sampling, random sorting",Aggregation,https://www.mongodb.com/docs/manual/reference/operator/aggregation/rand/,https://youtube.com/results?search_query=mongodb+rand+aggregation,https://youtube.com/results?search_query=mongodb+rand+aggregation+hindi,https://youtube.com/results?search_query=mongodb+rand+aggregation+kannada,https://youtube.com/results?search_query=mongodb+rand+aggregation+tamil,https://youtube.com/results?search_query=mongodb+rand+aggregation+telugu
MongoDB,Advanced,How does MongoDB implement change stream with startAtOperationTime for historical changes?,Change streams,startAtOperationTime,Historical changes,A,"startAtOperationTime: starts change stream at specific timestamp; for processing historical changes",Change Streams,https://www.mongodb.com/docs/manual/changeStreams/#start-at-operation-time,https://youtube.com/results?search_query=mongodb+change+stream+startAtOperationTime,https://youtube.com/results?search_query=mongodb+change+stream+startAtOperationTime+hindi,https://youtube.com/results?search_query=mongodb+change+stream+startAtOperationTime+kannada,https://youtube.com/results?search_query=mongodb+change+stream+startAtOperationTime+tamil,https://youtube.com/results?search_query=mongodb+change+stream+startAtOperationTime+telugu
MongoDB,Advanced,What is the difference between MongoDB's $addToSet and $push with $each?,Array operators,$addToSet,$push with $each,A,"$addToSet ensures uniqueness; $push with $each adds multiple values but allows duplicates",Updates,https://www.mongodb.com/docs/manual/reference/operator/update/addToSet/,https://youtube.com/results?search_query=mongodb+addToSet+push+each,https://youtube.com/results?search_query=mongodb+addToSet+push+each+hindi,https://youtube.com/results?search_query=mongodb+addToSet+push+each+kannada,https://youtube.com/results?search_query=mongodb+addToSet+push+each+tamil,https://youtube.com/results?search_query=mongodb+addToSet+push+each+telugu
MongoDB,Advanced,How does MongoDB implement database commands with helper methods in drivers?,Driver helpers,Database commands,Client libraries,A,"Drivers provide helper methods (insertOne(), find(), etc.) that wrap database commands",API,https://www.mongodb.com/docs/drivers/,https://youtube.com/results?search_query=mongodb+driver+helpers,https://youtube.com/results?search_query=mongodb+driver+helpers+hindi,https://youtube.com/results?search_query=mongodb+driver+helpers+kannada,https://youtube.com/results?search_query=mongodb+driver+helpers+tamil,https://youtube.com/results?search_query=mongodb+driver+helpers+telugu
MongoDB,Advanced,What are MongoDB aggregation pipeline $function for custom JavaScript functions?,Custom functions,$function,JavaScript execution,A,"$function: executes JavaScript function in aggregation pipeline; use sparingly due to performance",Aggregation,https://www.mongodb.com/docs/manual/reference/operator/aggregation/function/,https://youtube.com/results?search_query=mongodb+function+aggregation,https://youtube.com/results?search_query=mongodb+function+aggregation+hindi,https://youtube.com/results?search_query=mongodb+function+aggregation+kannada,https://youtube.com/results?search_query=mongodb+function+aggregation+tamil,https://youtube.com/results?search_query=mongodb+function+aggregation+telugu
MongoDB,Advanced,How does MongoDB implement mongorestore with --drop and --noIndexRestore options?,mongorestore,Options,Data restoration,A,"--drop: drops collections before restore; --noIndexRestore: skips index creation",Backup,https://www.mongodb.com/docs/database-tools/mongorestore/,https://youtube.com/results?search_query=mongodb+mongorestore+options,https://youtube.com/results?search_query=mongodb+mongorestore+options+hindi,https://youtube.com/results?search_query=mongodb+mongorestore+options+kannada,https://youtube.com/results?search_query=mongodb+mongorestore+options+tamil,https://youtube.com/results?search_query=mongodb+mongorestore+options+telugu