skill,level,question_text,option_a,option_b,option_c,option_d,correct_answer,explanation,topic,mdn_link,youtube_english,youtube_hindi,youtube_kannada,youtube_tamil,youtube_telugu
Oracle Guided Learning,Intermediate,How do you train OGL content creators?,Administration,Training,Skills,Provide training on OGL Studio, instructional design principles, and application knowledge to content creators.,Administration,https://docs.oracle.com/cd/E52319_01/infoportal/guided_learning.html,https://youtube.com/results?search_query=oracle+guided+learning+content+creator+training,https://youtube.com/results?search_query=oracle+guided+learning+content+creator+training+hindi,https://youtube.com/results?search_query=oracle+guided+learning+content+creator+training+kannada,https://youtube.com/results?search_query=oracle+guided+learning+content+creator+training+tamil,https://youtube.com/results?search_query=oracle+guided+learning+content+creator+training+telugu
Oracle Guided Learning,Intermediate,What is the difference between OGL and traditional help systems?,Comparison,Help Systems,Effectiveness,OGL provides interactive, contextual guidance vs. traditional static help that users must search for separately.,Comparison,https://www.oracle.com/applications/guided-learning/,https://youtube.com/results?search_query=oracle+guided+learning+vs+traditional+help,https://youtube.com/results?search_query=oracle+guided+learning+vs+traditional+help+hindi,https://youtube.com/results?search_query=oracle+guided+learning+vs+traditional+help+kannada,https://youtube.com/results?search_query=oracle+guided+learning+vs+traditional+help+tamil,https://youtube.com/results?search_query=oracle+guided+learning+vs+traditional+help+telugu
Oracle Guided Learning,Intermediate,When should you use OGL for process compliance?,Use Cases,Process Compliance,Auditing,Use OGL when processes must be followed exactly for regulatory compliance, quality control, or audit requirements.,Use Cases,https://spearmc.com/peoplesoft-training/oracle-guided-learning/,https://youtube.com/results?search_query=oracle+guided+learning+process+compliance,https://youtube.com/results?search_query=oracle+guided+learning+process+compliance+hindi,https://youtube.com/results?search_query=oracle+guided+learning+process+compliance+kannada,https://youtube.com/results?search_query=oracle+guided+learning+process+compliance+tamil,https://youtube.com/results?search_query=oracle+guided+learning+process+compliance+telugu
Oracle Guided Learning,Intermediate,How does OGL handle updates to Oracle applications?,Maintenance,Updates,Compatibility,OGL content may need updates when underlying applications change; test compatibility after application updates.,Maintenance,https://docs.oracle.com/cd/E52319_01/infoportal/guided_learning.html,https://youtube.com/results?search_query=oracle+guided+learning+application+updates,https://youtube.com/results?search_query=oracle+guided+learning+application+updates+hindi,https://youtube.com/results?search_query=oracle+guided+learning+application+updates+kannada,https://youtube.com/results?search_query=oracle+guided+learning+application+updates+tamil,https://youtube.com/results?search_query=oracle+guided+learning+application+updates+telugu
Oracle Guided Learning,Intermediate,What are OGL best practices for content design?,Best Practices,Content Design,Usability,Keep content concise, use clear language, include visuals, test with real users, and iterate based on feedback.,Best Practices,https://www.oracle.com/applications/guided-learning/,https://youtube.com/results?search_query=oracle+guided+learning+content+design+best+practices,https://youtube.com/results?search_query=oracle+guided+learning+content+design+best+practices+hindi,https://youtube.com/results?search_query=oracle+guided+learning+content+design+best+practices+kannada,https://youtube.com/results?search_query=oracle+guided+learning+content+design+best+practices+tamil,https://youtube.com/results?search_query=oracle+guided+learning+content+design+best+practices+telugu
Oracle Guided Learning,Intermediate,Why is OGL considered a digital adoption platform?,Platform,Categories,DAP,OGL is a DAP because it helps users adopt digital tools through in-app guidance, reducing friction and improving proficiency.,Platform Overview,https://spearmc.com/peoplesoft-training/oracle-guided-learning/,https://youtube.com/results?search_query=oracle+guided+learning+digital+adoption+platform,https://youtube.com/results?search_query=oracle+guided+learning+digital+adoption+platform+hindi,https://youtube.com/results?search_query=oracle+guided+learning+digital+adoption+platform+kannada,https://youtube.com/results?search_query=oracle+guided+learning+digital+adoption+platform+tamil,https://youtube.com/results?search_query=oracle+guided+learning+digital+adoption+platform+telugu
Oracle Guided Learning,Intermediate,How do you secure OGL content?,Security,Access Control,Protection,Use role-based access, secure authentication, and encryption to protect OGL content and user data.,Security,https://docs.oracle.com/cd/E52319_01/infoportal/guided_learning.html,https://youtube.com/results?search_query=oracle+guided+learning+security,https://youtube.com/results?search_query=oracle+guided+learning+security+hindi,https://youtube.com/results?search_query=oracle+guided+learning+security+kannada,https://youtube.com/results?search_query=oracle+guided+learning+security+tamil,https://youtube.com/results?search_query=oracle+guided+learning+security+telugu
Oracle Guided Learning,Intermediate,What is the OGL implementation process?,Implementation,Process,Phases,Implementation includes planning, content creation, testing, deployment, and ongoing optimization.,Implementation,https://www.oracle.com/applications/guided-learning/,https://youtube.com/results?search_query=oracle+guided+learning+implementation+process,https://youtube.com/results?search_query=oracle+guided+learning+implementation+process+hindi,https://youtube.com/results?search_query=oracle+guided+learning+implementation+process+kannada,https://youtube.com/results?search_query=oracle+guided+learning+implementation+process+tamil,https://youtube.com/results?search_query=oracle+guided+learning+implementation+process+telugu
Oracle Guided Learning,Intermediate,When should you use OGL for seasonal workers?,Use Cases,Seasonal Workers,Training,Use OGL for seasonal workers to provide quick, consistent training without extensive preparation time.,Use Cases,https://spearmc.com/peoplesoft-training/oracle-guided-learning/,https://youtube.com/results?search_query=oracle+guided+learning+seasonal+workers,https://youtube.com/results?search_query=oracle+guided+learning+seasonal+workers+hindi,https://youtube.com/results?search_query=oracle+guided+learning+seasonal+workers+kannada,https://youtube.com/results?search_query=oracle+guided+learning+seasonal+workers+tamil,https://youtube.com/results?search_query=oracle+guided+learning+seasonal+workers+telugu
Oracle Guided Learning,Intermediate,How does OGL support continuous improvement?,Features,Continuous Improvement,Optimization,OGL supports continuous improvement through analytics, user feedback, and iterative content updates.,Best Practices,https://www.oracle.com/applications/guided-learning/features/,https://youtube.com/results?search_query=oracle+guided+learning+continuous+improvement,https://youtube.com/results?search_query=oracle+guided+learning+continuous+improvement+hindi,https://youtube.com/results?search_query=oracle+guided+learning+continuous+improvement+kannada,https://youtube.com/results?search_query=oracle+guided+learning+continuous+improvement+tamil,https://youtube.com/results?search_query=oracle+guided+learning+continuous+improvement+telugu
Oracle Guided Learning,Intermediate,What is a key consideration for OGL performance?,Performance,Optimization,System Load,Ensure guidance loads quickly, minimize steps in walkthroughs, and use efficient triggers to avoid slowing down the host application.,Best Practices,https://docs.oracle.com/cd/E52319_01/infoportal/guided_learning.html,https://youtube.com/results?search_query=oracle+guided+learning+performance,https://youtube.com/results?search_query=oracle+guided+learning+performance+hindi,https://youtube.com/results?search_query=oracle+guided+learning+performance+kannada,https://youtube.com/results?search_query=oracle+guided+learning+performance+tamil,https://youtube.com/results?search_query=oracle+guided+learning+performance+telugu
Oracle Guided Learning,Intermediate,How do you deactivate outdated OGL content?,Maintenance,Archiving,Lifecycle,Use the OGL Content Manager to archive or unpublish content that is no longer relevant or accurate.,Content Management,https://spearmc.com/peoplesoft-training/oracle-guided-learning/,https://youtube.com/results?search_query=oracle+guided+learning+deactivate+content,https://youtube.com/results?search_query=oracle+guided+learning+deactivate+content+hindi,https://youtube.com/results?search_query=oracle+guided+learning+deactivate+content+kannada,https://youtube.com/results?search_query=oracle+guided+learning+deactivate+content+tamil,https://youtube.com/results?search_query=oracle+guided+learning+deactivate+content+telugu
Oracle Guided Learning,Intermediate,What is the purpose of A/B testing in OGL?,Analytics,Optimization,Testing,To compare two versions of guidance content and determine which is more effective based on user completion or feedback.,Advanced Features,https://www.oracle.com/applications/guided-learning/features/,https://youtube.com/results?search_query=oracle+guided+learning+ab+testing,https://youtube.com/results?search_query=oracle+guided+learning+ab+testing+hindi,https://youtube.com/results?search_query=oracle+guided+learning+ab+testing+kannada,https://youtube.com/results?search_query=oracle+guided+learning+ab+testing+tamil,https://youtube.com/results?search_query=oracle+guided+learning+ab+testing+telugu
Oracle Guided Learning,Intermediate,What are the different types of triggers available?,Features,Triggers,Types,Common triggers include Page Load, Element Click, URL Change, Custom Event, and Time-based triggers.,Configuration,https://docs.oracle.com/cd/E52319_01/infoportal/guided_learning.html,https://youtube.com/results?search_query=oracle+guided+learning+trigger+types,https://youtube.com/results?search_query=oracle+guided+learning+trigger+types+hindi,https://youtube.com/results?search_query=oracle+guided+learning+trigger+types+kannada,https://youtube.com/results?search_query=oracle+guided+learning+trigger+types+tamil,https://youtube.com/results?search_query=oracle+guided+learning+trigger+types+telugu
Oracle Guided Learning,Intermediate,How do you customize the look and feel of OGL?,Features,Customization,Branding,Use OGL Studio to modify colors, fonts, button styles, and positioning to match corporate branding.,Configuration,https://spearmc.com/peoplesoft-training/oracle-guided-learning/,https://youtube.com/results?search_query=oracle+guided+learning+customization,https://youtube.com/results?search_query=oracle+guided+learning+customization+hindi,https://youtube.com/results?search_query=oracle+guided+learning+customization+kannada,https://youtube.com/results?search_query=oracle+guided+learning+customization+tamil,https://youtube.com/results?search_query=oracle+guided+learning+customization+telugu
Oracle Guided Learning,Intermediate,What is a guided tour in OGL?,Features,Guided Tour,Walkthroughs,A guided tour is a type of walkthrough that introduces users to key areas and features of an application.,Content Types,https://docs.oracle.com/cd/E52319_01/infoportal/guided_learning.html,https://youtube.com/results?search_query=oracle+guided+learning+guided+tour,https://youtube.com/results?search_query=oracle+guided+learning+guided+tour+hindi,https://youtube.com/results?search_query=oracle+guided+learning+guided+tour+kannada,https://youtube.com/results?search_query=oracle+guided+learning+guided+tour+tamil,https://youtube.com/results?search_query=oracle+guided+learning+guided+tour+telugu
Oracle Guided Learning,Intermediate,How do you handle dynamic content in OGL?,Features,Dynamic Content,Variables,Use variables and dynamic selectors to handle content that changes based on user input or application state.,Advanced Features,https://spearmc.com/peoplesoft-training/oracle-guided-learning/,https://youtube.com/results?search_query=oracle+guided+learning+dynamic+content,https://youtube.com/results?search_query=oracle+guided+learning+dynamic+content+hindi,https://youtube.com/results?search_query=oracle+guided+learning+dynamic+content+kannada,https://youtube.com/results?search_query=oracle+guided+learning+dynamic+content+tamil,https://youtube.com/results?search_query=oracle+guided+learning+dynamic+content+telugu
Oracle Guided Learning,Intermediate,What are the notification options in OGL?,Features,Notifications,Alerts,OGL can show notifications for new content, updates, or important announcements to users.,Features,https://www.oracle.com/applications/guided-learning/features/,https://youtube.com/results?search_query=oracle+guided+learning+notifications,https://youtube.com/results?search_query=oracle+guided+learning+notifications+hindi,https://youtube.com/results?search_query=oracle+guided+learning+notifications+kannada,https://youtube.com/results?search_query=oracle+guided+learning+notifications+tamil,https://youtube.com/results?search_query=oracle+guided+learning+notifications+telugu
Oracle Guided Learning,Intermediate,How do you export and import OGL content?,Administration,Export Import,Migration,Use OGL's export/import functionality to migrate content between environments or for backup purposes.,Administration,https://docs.oracle.com/cd/E52319_01/infoportal/guided_learning.html,https://youtube.com/results?search_query=oracle+guided+learning+export+import,https://youtube.com/results?search_query=oracle+guided+learning+export+import+hindi,https://youtube.com/results?search_query=oracle+guided+learning+export+import+kannada,https://youtube.com/results?search_query=oracle+guided+learning+export+import+tamil,https://youtube.com/results?search_query=oracle+guided+learning+export+import+telugu
Oracle Guided Learning,Intermediate,What is the OGL Dashboard?,Features,Dashboard,Analytics,The OGL Dashboard provides an overview of content performance, user engagement, and key metrics.,Analytics,https://spearmc.com/peoplesoft-training/oracle-guided-learning/,https://youtube.com/results?search_query=oracle+guided+learning+dashboard,https://youtube.com/results?search_query=oracle+guided+learning+dashboard+hindi,https://youtube.com/results?search_query=oracle+guided+learning+dashboard+kannada,https://youtube.com/results?search_query=oracle+guided+learning+dashboard+tamil,https://youtube.com/results?search_query=oracle+guided+learning+dashboard+telugu
Oracle Guided Learning,Intermediate,How do you set up role-based access in OGL?,Security,Roles,Permissions,Define user roles in OGL Studio and assign permissions for content creation, editing, publishing, and viewing.,Administration,https://docs.oracle.com/cd/E52319_01/infoportal/guided_learning.html,https://youtube.com/results?search_query=oracle+guided+learning+role+based+access,https://youtube.com/results?search_query=oracle+guided+learning+role+based+access+hindi,https://youtube.com/results?search_query=oracle+guided+learning+role+based+access+kannada,https://youtube.com/results?search_query=oracle+guided+learning+role+based+access+tamil,https://youtube.com/results?search_query=oracle+guided+learning+role+based+access+telugu
Oracle Guided Learning,Intermediate,What is the difference between OGL and Oracle User Assistance?,Comparison,User Assistance,Integration,OGL provides interactive, in-app guidance while Oracle User Assistance offers traditional help documentation.,Comparison,https://spearmc.com/peoplesoft-training/oracle-guided-learning/,https://youtube.com/results?search_query=oracle+guided+learning+vs+user+assistance,https://youtube.com/results?search_query=oracle+guided+learning+vs+user+assistance+hindi,https://youtube.com/results?search_query=oracle+guided+learning+vs+user+assistance+kannada,https://youtube.com/results?search_query=oracle+guided+learning+vs+user+assistance+tamil,https://youtube.com/results?search_query=oracle+guided+learning+vs+user+assistance+telugu
Oracle Guided Learning,Intermediate,How do you create conditional logic in OGL?,Features,Conditional Logic,Branching,Use if/then conditions based on user attributes, application data, or previous choices to create dynamic guidance.,Advanced Features,https://docs.oracle.com/cd/E52319_01/infoportal/guided_learning.html,https://youtube.com/results?search_query=oracle+guided+learning+conditional+logic,https://youtube.com/results?search_query=oracle+guided+learning+conditional+logic+hindi,https://youtube.com/results?search_query=oracle+guided+learning+conditional+logic+kannada,https://youtube.com/results?search_query=oracle+guided+learning+conditional+logic+tamil,https://youtube.com/results?search_query=oracle+guided+learning+conditional+logic+telugu
Oracle Guided Learning,Intermediate,What are the common pitfalls to avoid in OGL?,Best Practices,Pitfalls,Mistakes,Common pitfalls include creating too many steps, not testing thoroughly, ignoring user feedback, and not updating content.,Best Practices,https://www.oracle.com/applications/guided-learning/,https://youtube.com/results?search_query=oracle+guided+learning+pitfalls,https://youtube.com/results?search_query=oracle+guided+learning+pitfalls+hindi,https://youtube.com/results?search_query=oracle+guided+learning+pitfalls+kannada,https://youtube.com/results?search_query=oracle+guided+learning+pitfalls+tamil,https://youtube.com/results?search_query=oracle+guided+learning+pitfalls+telugu
Oracle Guided Learning,Intermediate,How do you measure user engagement with OGL?,Analytics,Engagement,Metrics,Track metrics like content views, completion rates, time spent, and repeat usage to measure engagement.,Analytics,https://spearmc.com/peoplesoft-training/oracle-guided-learning/,https://youtube.com/results?search_query=oracle+guided+learning+user+engagement,https://youtube.com/results?search_query=oracle+guided+learning+user+engagement+hindi,https://youtube.com/results?search_query=oracle+guided+learning+user+engagement+kannada,https://youtube.com/results?search_query=oracle+guided+learning+user+engagement+tamil,https://youtube.com/results?search_query=oracle+guided+learning+user+engagement+telugu
Oracle Guided Learning,Intermediate,What is the OGL Content Lifecycle?,Administration,Lifecycle,Management,The content lifecycle includes planning, creation, testing, publishing, monitoring, updating, and retiring content.,Best Practices,https://docs.oracle.com/cd/E52319_01/infoportal/guided_learning.html,https://youtube.com/results?search_query=oracle+guided+learning+content+lifecycle,https://youtube.com/results?search_query=oracle+guided+learning+content+lifecycle+hindi,https://youtube.com/results?search_query=oracle+guided+learning+content+lifecycle+kannada,https://youtube.com/results?search_query=oracle+guided+learning+content+lifecycle+tamil,https://youtube.com/results?search_query=oracle+guided+learning+content+lifecycle+telugu
Oracle Guided Learning,Intermediate,How does OGL support remote workforce training?,Use Cases,Remote Workforce,Training,OGL enables consistent training for remote employees without needing in-person sessions or travel.,Use Cases,https://www.oracle.com/applications/guided-learning/use-cases/,https://youtube.com/results?search_query=oracle+guided+learning+remote+workforce,https://youtube.com/results?search_query=oracle+guided+learning+remote+workforce+hindi,https://youtube.com/results?search_query=oracle+guided+learning+remote+workforce+kannada,https://youtube.com/results?search_query=oracle+guided+learning+remote+workforce+tamil,https://youtube.com/results?search_query=oracle+guided+learning+remote+workforce+telugu
Oracle Guided Learning,Intermediate,What are the keyboard shortcuts in OGL Studio?,Administration,Shortcuts,Productivity,OGL Studio has keyboard shortcuts for common actions like saving, previewing, and navigating the interface.,Administration,https://docs.oracle.com/cd/E52319_01/infoportal/guided_learning.html,https://youtube.com/results?search_query=oracle+guided+learning+keyboard+shortcuts,https://youtube.com/results?search_query=oracle+guided+learning+keyboard+shortcuts+hindi,https://youtube.com/results?search_query=oracle+guided+learning+keyboard+shortcuts+kannada,https://youtube.com/results?search_query=oracle+guided+learning+keyboard+shortcuts+tamil,https://youtube.com/results?search_query=oracle+guided+learning+keyboard+shortcuts+telugu
