skill,level,question_text,option_a,option_b,option_c,option_d,correct_answer,explanation,topic,mdn_link,youtube_english,youtube_hindi,youtube_kannada,youtube_tamil,youtube_telugu

Topic,Level,Question,Category1,Category2,Category3,Answer,Doc Link,EN YouTube,HI YouTube,KN YouTube,TA YouTube,TE YouTube
Oracle Guided Learning,Intermediate,What is the main purpose of Oracle Guided Learning?,Platform,Purpose,Overview,Oracle Guided Learning is a digital adoption platform that provides in-application guidance, walkthroughs, and training to help users learn Oracle applications effectively.,Platform Overview,https://docs.oracle.com/cd/E52319_01/infoportal/guided_learning.html,https://youtube.com/results?search_query=oracle+guided+learning+overview,https://youtube.com/results?search_query=oracle+guided+learning+overview+hindi,https://youtube.com/results?search_query=oracle+guided+learning+overview+kannada,https://youtube.com/results?search_query=oracle+guided+learning+overview+tamil,https://youtube.com/results?search_query=oracle+guided+learning+overview+telugu
Oracle Guided Learning,Intermediate,Why should organizations implement Oracle Guided Learning?,Platform,Benefits,Implementation,To reduce training costs, improve user adoption, decrease support tickets, and accelerate time-to-competency for Oracle applications.,Benefits,https://www.oracle.com/applications/guided-learning/,https://youtube.com/results?search_query=oracle+guided+learning+benefits,https://youtube.com/results?search_query=oracle+guided+learning+benefits+hindi,https://youtube.com/results?search_query=oracle+guided+learning+benefits+kannada,https://youtube.com/results?search_query=oracle+guided+learning+benefits+tamil,https://youtube.com/results?search_query=oracle+guided+learning+benefits+telugu
Oracle Guided Learning,Intermediate,How does Oracle Guided Learning integrate with Oracle Fusion Applications?,Integration,Fusion Apps,Deployment,OGL integrates natively with Oracle Fusion Apps through embedded guidance, contextual help, and real-time walkthroughs within the application interface.,Integration,https://docs.oracle.com/cd/E52319_01/infoportal/guided_learning.html#getstarted,https://youtube.com/results?search_query=oracle+guided+learning+fusion+integration,https://youtube.com/results?search_query=oracle+guided+learning+fusion+integration+hindi,https://youtube.com/results?search_query=oracle+guided+learning+fusion+integration+kannada,https://youtube.com/results?search_query=oracle+guided+learning+fusion+integration+tamil,https://youtube.com/results?search_query=oracle+guided+learning+fusion+integration+telugu
Oracle Guided Learning,Intermediate,When should you use walkthroughs versus tooltips in OGL?,Features,Walkthroughs,Tooltips,Use walkthroughs for multi-step processes and complex tasks; use tooltips for quick explanations of fields or simple UI elements.,Feature Usage,https://docs.oracle.com/cd/E52319_01/infoportal/guided_learning.html,https://youtube.com/results?search_query=oracle+guided+learning+walkthroughs+vs+tooltips,https://youtube.com/results?search_query=oracle+guided+learning+walkthroughs+vs+tooltips+hindi,https://youtube.com/results?search_query=oracle+guided+learning+walkthroughs+vs+tooltips+kannada,https://youtube.com/results?search_query=oracle+guided+learning+walkthroughs+vs+tooltips+tamil,https://youtube.com/results?search_query=oracle+guided+learning+walkthroughs+vs+tooltips+telugu
Oracle Guided Learning,Intermediate,What is the role of the OGL Content Manager?,Administration,Content Manager,Roles,The Content Manager creates, edits, publishes, and manages guidance content including walkthroughs, tooltips, and learning paths.,Administration,https://spearmc.com/peoplesoft-training/oracle-guided-learning/,https://youtube.com/results?search_query=oracle+guided+learning+content+manager,https://youtube.com/results?search_query=oracle+guided+learning+content+manager+hindi,https://youtube.com/results?search_query=oracle+guided+learning+content+manager+kannada,https://youtube.com/results?search_query=oracle+guided+learning+content+manager+tamil,https://youtube.com/results?search_query=oracle+guided+learning+content+manager+telugu
Oracle Guided Learning,Intermediate,Why is contextual guidance important in OGL?,Features,Contextual Guidance,Personalization,Contextual guidance provides relevant help based on user role, location in application, and task context, improving learning effectiveness.,Best Practices,https://www.oracle.com/applications/guided-learning/features/,https://youtube.com/results?search_query=oracle+guided+learning+contextual+guidance,https://youtube.com/results?search_query=oracle+guided+learning+contextual+guidance+hindi,https://youtube.com/results?search_query=oracle+guided+learning+contextual+guidance+kannada,https://youtube.com/results?search_query=oracle+guided+learning+contextual+guidance+tamil,https://youtube.com/results?search_query=oracle+guided+learning+contextual+guidance+telugu
Oracle Guided Learning,Intermediate,How do you create a new walkthrough in Oracle Guided Learning?,Content Creation,Walkthroughs,Building,Use the OGL Studio interface to record steps, add instructions, set triggers, and configure completion criteria for the walkthrough.,Content Creation,https://docs.oracle.com/cd/E52319_01/infoportal/guided_learning.html,https://youtube.com/results?search_query=oracle+guided+learning+create+walkthrough,https://youtube.com/results?search_query=oracle+guided+learning+create+walkthrough+hindi,https://youtube.com/results?search_query=oracle+guided+learning+create+walkthrough+kannada,https://youtube.com/results?search_query=oracle+guided+learning+create+walkthrough+tamil,https://youtube.com/results?search_query=oracle+guided+learning+create+walkthrough+telugu
Oracle Guided Learning,Intermediate,When should you use branching in OGL walkthroughs?,Features,Branching,Logic,Use branching when different user paths require different guidance based on conditions like user role, data values, or previous choices.,Advanced Features,https://spearmc.com/peoplesoft-training/oracle-guided-learning/,https://youtube.com/results?search_query=oracle+guided+learning+branching,https://youtube.com/results?search_query=oracle+guided+learning+branching+hindi,https://youtube.com/results?search_query=oracle+guided+learning+branching+kannada,https://youtube.com/results?search_query=oracle+guided+learning+branching+tamil,https://youtube.com/results?search_query=oracle+guided+learning+branching+telugu
Oracle Guided Learning,Intermediate,What are triggers in Oracle Guided Learning?,Features,Triggers,Activation,Triggers are conditions that activate guidance content, such as page load, button click, or specific user actions.,Configuration,https://docs.oracle.com/cd/E52319_01/infoportal/guided_learning.html,https://youtube.com/results?search_query=oracle+guided+learning+triggers,https://youtube.com/results?search_query=oracle+guided+learning+triggers+hindi,https://youtube.com/results?search_query=oracle+guided+learning+triggers+kannada,https://youtube.com/results?search_query=oracle+guided+learning+triggers+tamil,https://youtube.com/results?search_query=oracle+guided+learning+triggers+telugu
Oracle Guided Learning,Intermediate,Why should you test OGL content before publishing?,Best Practices,Testing,Quality,Testing ensures guidance works correctly, appears in right context, and provides accurate instructions to prevent user confusion.,Best Practices,https://spearmc.com/peoplesoft-training/oracle-guided-learning/,https://youtube.com/results?search_query=oracle+guided+learning+testing,https://youtube.com/results?search_query=oracle+guided+learning+testing+hindi,https://youtube.com/results?search_query=oracle+guided+learning+testing+kannada,https://youtube.com/results?search_query=oracle+guided+learning+testing+tamil,https://youtube.com/results?search_query=oracle+guided+learning+testing+telugu
Oracle Guided Learning,Intermediate,How do you measure the effectiveness of OGL content?,Analytics,Measurement,ROI,Use OGL analytics to track completion rates, user feedback, time savings, and reduction in support tickets.,Analytics,https://www.oracle.com/applications/guided-learning/features/,https://youtube.com/results?search_query=oracle+guided+learning+analytics,https://youtube.com/results?search_query=oracle+guided+learning+analytics+hindi,https://youtube.com/results?search_query=oracle+guided+learning+analytics+kannada,https://youtube.com/results?search_query=oracle+guided+learning+analytics+tamil,https://youtube.com/results?search_query=oracle+guided+learning+analytics+telugu
Oracle Guided Learning,Intermediate,What is the difference between OGL and traditional training methods?,Comparison,Training Methods,Effectiveness,OGL provides in-application, just-in-time guidance vs. traditional classroom/online training that's separate from actual work.,Comparison,https://spearmc.com/peoplesoft-training/oracle-guided-learning/,https://youtube.com/results?search_query=oracle+guided+learning+vs+traditional+training,https://youtube.com/results?search_query=oracle+guided+learning+vs+traditional+training+hindi,https://youtube.com/results?search_query=oracle+guided+learning+vs+traditional+training+kannada,https://youtube.com/results?search_query=oracle+guided+learning+vs+traditional+training+tamil,https://youtube.com/results?search_query=oracle+guided+learning+vs+traditional+training+telugu
Oracle Guided Learning,Intermediate,When should you update OGL content?,Maintenance,Updates,Content Management,Update OGL content when applications change, processes evolve, or user feedback indicates confusion or errors.,Maintenance,https://docs.oracle.com/cd/E52319_01/infoportal/guided_learning.html,https://youtube.com/results?search_query=oracle+guided+learning+content+updates,https://youtube.com/results?search_query=oracle+guided+learning+content+updates+hindi,https://youtube.com/results?search_query=oracle+guided+learning+content+updates+kannada,https://youtube.com/results?search_query=oracle+guided+learning+content+updates+tamil,https://youtube.com/results?search_query=oracle+guided+learning+content+updates+telugu
Oracle Guided Learning,Intermediate,How does OGL support multiple languages?,Features,Multilingual,Localization,OGL supports content translation and localization for different languages and regional requirements.,Internationalization,https://www.oracle.com/applications/guided-learning/features/,https://youtube.com/results?search_query=oracle+guided+learning+multiple+languages,https://youtube.com/results?search_query=oracle+guided+learning+multiple+languages+hindi,https://youtube.com/results?search_query=oracle+guided+learning+multiple+languages+kannada,https://youtube.com/results?search_query=oracle+guided+learning+multiple+languages+tamil,https://youtube.com/results?search_query=oracle+guided+learning+multiple+languages+telugu
Oracle Guided Learning,Intermediate,What are learning paths in OGL?,Features,Learning Paths,Sequencing,Learning paths are structured sequences of guidance content that take users through complete processes or skill development.,Content Organization,https://spearmc.com/peoplesoft-training/oracle-guided-learning/,https://youtube.com/results?search_query=oracle+guided+learning+learning+paths,https://youtube.com/results?search_query=oracle+guided+learning+learning+paths+hindi,https://youtube.com/results?search_query=oracle+guided+learning+learning+paths+kannada,https://youtube.com/results?search_query=oracle+guided+learning+learning+paths+tamil,https://youtube.com/results?search_query=oracle+guided+learning+learning+paths+telugu
Oracle Guided Learning,Intermediate,Why is user feedback important in OGL?,Features,Feedback,Improvement,User feedback helps identify confusing content, gaps in guidance, and opportunities for improvement.,Best Practices,https://docs.oracle.com/cd/E52319_01/infoportal/guided_learning.html,https://youtube.com/results?search_query=oracle+guided+learning+user+feedback,https://youtube.com/results?search_query=oracle+guided+learning+user+feedback+hindi,https://youtube.com/results?search_query=oracle+guided+learning+user+feedback+kannada,https://youtube.com/results?search_query=oracle+guided+learning+user+feedback+tamil,https://youtube.com/results?search_query=oracle+guided+learning+user+feedback+telugu
Oracle Guided Learning,Intermediate,How do you manage OGL content versions?,Administration,Version Control,Management,Use OGL's versioning system to track changes, roll back if needed, and maintain different versions for different user groups.,Administration,https://spearmc.com/peoplesoft-training/oracle-guided-learning/,https://youtube.com/results?search_query=oracle+guided+learning+version+control,https://youtube.com/results?search_query=oracle+guided+learning+version+control+hindi,https://youtube.com/results?search_query=oracle+guided+learning+version+control+kannada,https://youtube.com/results?search_query=oracle+guided+learning+version+control+tamil,https://youtube.com/results?search_query=oracle+guided+learning+version+control+telugu
Oracle Guided Learning,Intermediate,What are the system requirements for OGL?,Deployment,System Requirements,Prerequisites,OGL requires compatible Oracle applications, supported browsers, and appropriate user permissions.,Deployment,https://docs.oracle.com/cd/E52319_01/infoportal/guided_learning.html#getstarted,https://youtube.com/results?search_query=oracle+guided+learning+system+requirements,https://youtube.com/results?search_query=oracle+guided+learning+system+requirements+hindi,https://youtube.com/results?search_query=oracle+guided+learning+system+requirements+kannada,https://youtube.com/results?search_query=oracle+guided+learning+system+requirements+tamil,https://youtube.com/results?search_query=oracle+guided+learning+system+requirements+telugu
Oracle Guided Learning,Intermediate,When should you use OGL for compliance training?,Use Cases,Compliance,Training,Use OGL for compliance training when procedures are complex, frequently updated, or require step-by-step guidance.,Use Cases,https://www.oracle.com/applications/guided-learning/use-cases/,https://youtube.com/results?search_query=oracle+guided+learning+compliance+training,https://youtube.com/results?search_query=oracle+guided+learning+compliance+training+hindi,https://youtube.com/results?search_query=oracle+guided+learning+compliance+training+kannada,https://youtube.com/results?search_query=oracle+guided+learning+compliance+training+tamil,https://youtube.com/results?search_query=oracle+guided+learning+compliance+training+telugu
Oracle Guided Learning,Intermediate,How does OGL handle accessibility requirements?,Features,Accessibility,WCAG,OGL supports accessibility standards like WCAG with keyboard navigation, screen reader compatibility, and adjustable text sizes.,Compliance,https://docs.oracle.com/cd/E52319_01/infoportal/guided_learning.html,https://youtube.com/results?search_query=oracle+guided+learning+accessibility,https://youtube.com/results?search_query=oracle+guided+learning+accessibility+hindi,https://youtube.com/results?search_query=oracle+guided+learning+accessibility+kannada,https://youtube.com/results?search_query=oracle+guided+learning+accessibility+tamil,https://youtube.com/results?search_query=oracle+guided+learning+accessibility+telugu
Oracle Guided Learning,Intermediate,What is the OGL Content Library?,Features,Content Library,Repository,The Content Library stores all guidance assets, walkthroughs, tooltips, and learning paths for organization and reuse.,Content Management,https://spearmc.com/peoplesoft-training/oracle-guided-learning/,https://youtube.com/results?search_query=oracle+guided+learning+content+library,https://youtube.com/results?search_query=oracle+guided+learning+content+library+hindi,https://youtube.com/results?search_query=oracle+guided+learning+content+library+kannada,https://youtube.com/results?search_query=oracle+guided+learning+content+library+tamil,https://youtube.com/results?search_query=oracle+guided+learning+content+library+telugu
Oracle Guided Learning,Intermediate,Why should you segment users in OGL?,Features,User Segmentation,Targeting,User segmentation allows delivering relevant content to specific roles, departments, or experience levels.,Personalization,https://www.oracle.com/applications/guided-learning/features/,https://youtube.com/results?search_query=oracle+guided+learning+user+segmentation,https://youtube.com/results?search_query=oracle+guided+learning+user+segmentation+hindi,https://youtube.com/results?search_query=oracle+guided+learning+user+segmentation+kannada,https://youtube.com/results?search_query=oracle+guided+learning+user+segmentation+tamil,https://youtube.com/results?search_query=oracle+guided+learning+user+segmentation+telugu
Oracle Guided Learning,Intermediate,How do you schedule content delivery in OGL?,Features,Scheduling,Timing,Use scheduling features to release content at specific times, dates, or based on user milestones.,Content Delivery,https://docs.oracle.com/cd/E52319_01/infoportal/guided_learning.html,https://youtube.com/results?search_query=oracle+guided+learning+scheduling,https://youtube.com/results?search_query=oracle+guided+learning+scheduling+hindi,https://youtube.com/results?search_query=oracle+guided+learning+scheduling+kannada,https://youtube.com/results?search_query=oracle+guided+learning+scheduling+tamil,https://youtube.com/results?search_query=oracle+guided+learning+scheduling+telugu
Oracle Guided Learning,Intermediate,What are OGL templates and when to use them?,Features,Templates,Reusability,Templates are pre-built guidance structures for common tasks that speed up content creation and ensure consistency.,Content Creation,https://spearmc.com/peoplesoft-training/oracle-guided-learning/,https://youtube.com/results?search_query=oracle+guided+learning+templates,https://youtube.com/results?search_query=oracle+guided+learning+templates+hindi,https://youtube.com/results?search_query=oracle+guided+learning+templates+kannada,https://youtube.com/results?search_query=oracle+guided+learning+templates+tamil,https://youtube.com/results?search_query=oracle+guided+learning+templates+telugu
Oracle Guided Learning,Intermediate,When should you use OGL for software rollouts?,Use Cases,Software Rollouts,Adoption,Use OGL during software rollouts to accelerate user adoption, reduce training burden, and minimize disruption.,Use Cases,https://www.oracle.com/applications/guided-learning/use-cases/,https://youtube.com/results?search_query=oracle+guided+learning+software+rollouts,https://youtube.com/results?search_query=oracle+guided+learning+software+rollouts+hindi,https://youtube.com/results?search_query=oracle+guided+learning+software+rollouts+kannada,https://youtube.com/results?search_query=oracle+guided+learning+software+rollouts+tamil,https://youtube.com/results?search_query=oracle+guided+learning+software+rollouts+telugu
Oracle Guided Learning,Intermediate,How does OGL integrate with Oracle Cloud?,Integration,Oracle Cloud,Deployment,OGL integrates natively with Oracle Cloud applications through embedded services and APIs.,Integration,https://docs.oracle.com/cd/E52319_01/infoportal/guided_learning.html#getstarted,https://youtube.com/results?search_query=oracle+guided+learning+cloud+integration,https://youtube.com/results?search_query=oracle+guided+learning+cloud+integration+hindi,https://youtube.com/results?search_query=oracle+guided+learning+cloud+integration+kannada,https://youtube.com/results?search_query=oracle+guided+learning+cloud+integration+tamil,https://youtube.com/results?search_query=oracle+guided+learning+cloud+integration+telugu
Oracle Guided Learning,Intermediate,What are the licensing requirements for OGL?,Administration,Licensing,Cost,OGL requires appropriate Oracle licensing based on user count, modules used, and deployment type.,Administration,https://spearmc.com/peoplesoft-training/oracle-guided-learning/,https://youtube.com/results?search_query=oracle+guided+learning+licensing,https://youtube.com/results?search_query=oracle+guided+learning+licensing+hindi,https://youtube.com/results?search_query=oracle+guided+learning+licensing+kannada,https://youtube.com/results?search_query=oracle+guided+learning+licensing+tamil,https://youtube.com/results?search_query=oracle+guided+learning+licensing+telugu
Oracle Guided Learning,Intermediate,Why is OGL particularly useful for complex ERP systems?,Use Cases,ERP Systems,Complexity,ERP systems have complex processes; OGL provides contextual, step-by-step guidance reducing learning curve and errors.,Use Cases,https://www.oracle.com/applications/guided-learning/use-cases/,https://youtube.com/results?search_query=oracle+guided+learning+erp+systems,https://youtube.com/results?search_query=oracle+guided+learning+erp+systems+hindi,https://youtube.com/results?search_query=oracle+guided+learning+erp+systems+kannada,https://youtube.com/results?search_query=oracle+guided+learning+erp+systems+tamil,https://youtube.com/results?search_query=oracle+guided+learning+erp+systems+telugu
Oracle Guided Learning,Intermediate,How do you troubleshoot OGL content issues?,Troubleshooting,Issues,Debugging,Use OGL preview mode, check browser console, verify triggers, and test with different user roles to troubleshoot issues.,Troubleshooting,https://docs.oracle.com/cd/E52319_01/infoportal/guided_learning.html,https://youtube.com/results?search_query=oracle+guided+learning+troubleshooting,https://youtube.com/results?search_query=oracle+guided+learning+troubleshooting+hindi,https://youtube.com/results?search_query=oracle+guided+learning+troubleshooting+kannada,https://youtube.com/results?search_query=oracle+guided+learning+troubleshooting+tamil,https://youtube.com/results?search_query=oracle+guided+learning+troubleshooting+telugu
Oracle Guided Learning,Intermediate,What is the role of OGL in change management?,Use Cases,Change Management,Adoption,OGL supports change management by providing training during transitions, reducing resistance, and ensuring smooth adoption.,Use Cases,https://spearmc.com/peoplesoft-training/oracle-guided-learning/,https://youtube.com/results?search_query=oracle+guided+learning+change+management,https://youtube.com/results?search_query=oracle+guided+learning+change+management+hindi,https://youtube.com/results?search_query=oracle+guided+learning+change+management+kannada,https://youtube.com/results?search_query=oracle+guided+learning+change+management+tamil,https://youtube.com/results?search_query=oracle+guided+learning+change+management+telugu
Oracle Guided Learning,Intermediate,When should you use OGL for onboarding new employees?,Use Cases,Onboarding,Training,Use OGL for onboarding to provide consistent training, reduce mentor dependency, and accelerate time-to-productivity.,Use Cases,https://www.oracle.com/applications/guided-learning/use-cases/,https://youtube.com/results?search_query=oracle+guided+learning+employee+onboarding,https://youtube.com/results?search_query=oracle+guided+learning+employee+onboarding+hindi,https://youtube.com/results?search_query=oracle+guided+learning+employee+onboarding+kannada,https://youtube.com/results?search_query=oracle+guided+learning+employee+onboarding+tamil,https://youtube.com/results?search_query=oracle+guided+learning+employee+onboarding+telugu
Oracle Guided Learning,Intermediate,How does OGL support mobile users?,Features,Mobile Support,Responsive,OGL provides responsive guidance that works on mobile devices with touch-friendly interfaces and mobile-optimized content.,Mobile,https://docs.oracle.com/cd/E52319_01/infoportal/guided_learning.html,https://youtube.com/results?search_query=oracle+guided+learning+mobile+support,https://youtube.com/results?search_query=oracle+guided+learning+mobile+support+hindi,https://youtube.com/results?search_query=oracle+guided+learning+mobile+support+kannada,https://youtube.com/results?search_query=oracle+guided+learning+mobile+support+tamil,https://youtube.com/results?search_query=oracle+guided+learning+mobile+support+telugu
Oracle Guided Learning,Intermediate,What are OGL analytics capabilities?,Analytics,Reports,Insights,OGL provides analytics on usage, completion rates, user satisfaction, and performance improvements.,Analytics,https://www.oracle.com/applications/guided-learning/features/,https://youtube.com/results?search_query=oracle+guided+learning+analytics+capabilities,https://youtube.com/results?search_query=oracle+guided+learning+analytics+capabilities+hindi,https://youtube.com/results?search_query=oracle+guided+learning+analytics+capabilities+kannada,https://youtube.com/results?search_query=oracle+guided+learning+analytics+capabilities+tamil,https://youtube.com/results?search_query=oracle+guided+learning+analytics+capabilities+telugu
Oracle Guided Learning,Intermediate,Why should you establish OGL governance?,Best Practices,Governance,Management,Governance ensures consistent quality, proper approval processes, and alignment with organizational standards.,Best Practices,https://spearmc.com/peoplesoft-training/oracle-guided-learning/,https://youtube.com/results?search_query=oracle+guided+learning+governance,https://youtube.com/results?search_query=oracle+guided+learning+governance+hindi,https://youtube.com/results?search_query=oracle+guided+learning+governance+kannada,https://youtube.com/results?search_query=oracle+guided+learning+governance+tamil,https://youtube.com/results?search_query=oracle+guided+learning+governance+telugu
