skill,level,question_text,option_a,option_b,option_c,option_d,correct_answer,explanation,topic,mdn_link,youtube_english,youtube_hindi,youtube_kannada,youtube_tamil,youtube_telugu
React,intermediate,How does useOptimistic integrate with form actions?,It works seamlessly with <form action> + useActionState,It replaces form actions,It requires manual rollback,It only works with client state,A,useOptimistic pairs naturally with server actions for instant feedback,React 19,https://react.dev/reference/react/useOptimistic,https://youtube.com/results?search_query=react+useOptimistic+form,https://youtube.com/results?search_query=optimistic+form+hindi,https://youtube.com/results?search_query=optimistic+form+kannada,https://youtube.com/results?search_query=optimistic+form+tamil,https://youtube.com/results?search_query=optimistic+form+telugu
React,intermediate,What is the primary reason many teams are moving away from Redux in 2024–2025?,Modern Context + useReducer or Zustand/Jotai are simpler & sufficient for most apps,Redux is deprecated,Redux Toolkit is too slow,All Redux features are in React core now,A,Many apps don't need Redux boilerplate anymore; lighter solutions win,State Management,https://react.dev/learn/scaling-up-with-reducer-and-context,https://youtube.com/results?search_query=why+move+away+from+redux,https://youtube.com/results?search_query=redux+vs+context+hindi,https://youtube.com/results?search_query=redux+vs+context+kannada,https://youtube.com/results?search_query=redux+vs+context+tamil,https://youtube.com/results?search_query=redux+vs+context+telugu
React,intermediate,Which library is often used for global state with minimal boilerplate?,Zustand,Jotai,Recoil,All of the above,D,All are popular lightweight alternatives to Redux/Context for medium/large apps,State Management,https://zustand-demo.pmnd.rs/,https://youtube.com/results?search_query=react+zustand+vs+jotai,https://youtube.com/results?search_query=zustand+jotai+hindi,https://youtube.com/results?search_query=zustand+jotai+kannada,https://youtube.com/results?search_query=zustand+jotai+tamil,https://youtube.com/results?search_query=zustand+jotai+telugu
React,intermediate,What is the biggest performance pitfall when using Context for frequently changing state?,Every consumer re-renders on value change,Context is slower than props,Context cannot be memoized,Context causes memory leaks,A,Context re-renders all consumers → split contexts or use selectors/memoization,Context,https://react.dev/learn/passing-data-deeply-with-context#caveats,https://youtube.com/results?search_query=react+context+performance+pitfall,https://youtube.com/results?search_query=react+context+perf+hindi,https://youtube.com/results?search_query=react+context+perf+kannada,https://youtube.com/results?search_query=react+context+perf+tamil,https://youtube.com/results?search_query=react+context+perf+telugu
React,intermediate,How can you reduce Context re-renders when value changes often?,Split into multiple small contexts,Use useMemo on value object,Use memoized consumers (React.memo),All of the above,D,All techniques help limit re-render scope when using Context,Context,https://react.dev/learn/passing-data-deeply-with-context#optimizing-re-renders,https://youtube.com/results?search_query=react+optimize+context+re-renders,https://youtube.com/results?search_query=react+context+optimization+hindi,https://youtube.com/results?search_query=react+context+optimization+kannada,https://youtube.com/results?search_query=react+context+optimization+tamil,https://youtube.com/results?search_query=react+context+optimization+telugu
React,intermediate,What is the recommended way to handle global theme/auth state in 2024?,Context + useReducer / Zustand,Redux Toolkit,Recoil,Jotai,All are still valid,D,Context + reducer or lightweight libs are most common for medium apps,State Management,https://react.dev/learn/scaling-up-with-reducer-and-context,https://youtube.com/results?search_query=react+global+state+2024,https://youtube.com/results?search_query=react+global+state+hindi,https://youtube.com/results?search_query=react+global+state+kannada,https://youtube.com/results?search_query=react+global+state+tamil,https://youtube.com/results?search_query=react+global+state+telugu
React,intermediate,Which pattern is commonly used with Server Components for authentication?,Server Actions + cookies/headers,Client-side auth libraries only,Context on client only,All of the above,A,Server Components can read auth directly from headers/cookies on server,Server Components,https://react.dev/reference/rsc/server-components#accessing-server-only-data,https://youtube.com/results?search_query=react+server+components+auth,https://youtube.com/results?search_query=rsc+auth+hindi,https://youtube.com/results?search_query=rsc+auth+kannada,https://youtube.com/results?search_query=rsc+auth+tamil,https://youtube.com/results?search_query=rsc+auth+telugu
React,intermediate,How do you protect a route in Next.js App Router (Server Components)?,Use middleware or server-side check in page,Use client-side redirect in useEffect,Use protected layout component,All are valid,D,Middleware is preferred for protected routes in Next.js App Router,Next.js,https://nextjs.org/docs/app/building-your-application/routing/middleware,https://youtube.com/results?search_query=nextjs+protected+route+app+router,https://youtube.com/results?search_query=nextjs+protected+hindi,https://youtube.com/results?search_query=nextjs+protected+kannada,https://youtube.com/results?search_query=nextjs+protected+tamil,https://youtube.com/results?search_query=nextjs+protected+telugu
React,intermediate,What is the main advantage of Server Actions over traditional API routes?,Progressive enhancement (works without JS),No need for separate endpoint files,Built-in pending/error states,All of the above,D,Server Actions are invoked directly from client forms → simpler DX,React 19 / Next.js,https://react.dev/reference/rsc/server-actions,https://youtube.com/results?search_query=react+server+actions+vs+api+routes,https://youtube.com/results?search_query=server+actions+hindi,https://youtube.com/results?search_query=server+actions+kannada,https://youtube.com/results?search_query=server+actions+tamil,https://youtube.com/results?search_query=server+actions+telugu
React,intermediate,Which pattern is used to handle loading states in Next.js App Router?,Suspense boundaries around pages / components,Manual loading.tsx files,Both A and B,Only loading.tsx,B,Next.js automatically uses loading.tsx for Suspense-like streaming,Next.js,https://nextjs.org/docs/app/building-your-application/routing/loading-ui-and-streaming,https://youtube.com/results?search_query=nextjs+loading+ui+suspense,https://youtube.com/results?search_query=nextjs+loading+hindi,https://youtube.com/results?search_query=nextjs+loading+kannada,https://youtube.com/results?search_query=nextjs+loading+tamil,https://youtube.com/results?search_query=nextjs+loading+telugu
React,intermediate,What is the role of error.tsx in Next.js App Router?,Catches render errors in route segment and shows fallback UI,Handles form validation errors,Handles 404 pages,Handles server action errors,A,error.tsx is the file-based Error Boundary for route segments,Next.js,https://nextjs.org/docs/app/building-your-application/routing/error-handling,https://youtube.com/results?search_query=nextjs+error.tsx,https://youtube.com/results?search_query=nextjs+error+hindi,https://youtube.com/results?search_query=nextjs+error+kannada,https://youtube.com/results?search_query=nextjs+error+tamil,https://youtube.com/results?search_query=nextjs+error+telugu
React,intermediate,How do you create a global loading indicator across route changes in Next.js?,Use <Suspense> in root layout with fallback,Use loading.tsx in every folder,Use nprogress library,All are valid,D,Root layout Suspense + fallback is cleanest for app-wide loading,Next.js,https://nextjs.org/docs/app/building-your-application/routing/loading-ui-and-streaming,https://youtube.com/results?search_query=nextjs+global+loading+indicator,https://youtube.com/results?search_query=nextjs+loading+global+hindi,https://youtube.com/results?search_query=nextjs+loading+global+kannada,https://youtube.com/results?search_query=nextjs+loading+global+tamil,https://youtube.com/results?search_query=nextjs+loading+global+telugu
React,intermediate,What is the recommended way to handle authentication in Next.js App Router?,Middleware + cookies/session,Client-side auth libraries only,Server Components reading headers,All are valid,D,Middleware + Server Components reading auth headers is most secure/performant,Next.js,https://nextjs.org/docs/app/building-your-application/routing/middleware#authentication,https://youtube.com/results?search_query=nextjs+app+router+authentication,https://youtube.com/results?search_query=nextjs+auth+hindi,https://youtube.com/results?search_query=nextjs+auth+kannada,https://youtube.com/results?search_query=nextjs+auth+tamil,https://youtube.com/results?search_query=nextjs+auth+telugu
React,intermediate,Which pattern avoids client-side flickering during auth checks in Next.js?,Server Components + middleware redirect,Client-side check with useEffect,Use loading.tsx for auth,All of the above,A,Server Components + middleware provide instant redirects without flicker,Next.js,https://nextjs.org/docs/app/building-your-application/routing/middleware#authentication,https://youtube.com/results?search_query=nextjs+auth+no+flicker,https://youtube.com/results?search_query=nextjs+auth+flicker+hindi,https://youtube.com/results?search_query=nextjs+auth+flicker+kannada,https://youtube.com/results?search_query=nextjs+auth+flicker+tamil,https://youtube.com/results?search_query=nextjs+auth+flicker+telugu
React,intermediate,What is the purpose of not-found.tsx in Next.js App Router?,Renders custom 404 page for route segment,Handles form errors,Handles server action errors,Replaces error.tsx,A,not-found.tsx is the file-based 404 handler per route segment,Next.js,https://nextjs.org/docs/app/api-reference/file-conventions/not-found,https://youtube.com/results?search_query=nextjs+not-found.tsx,https://youtube.com/results?search_query=nextjs+not+found+hindi,https://youtube.com/results?search_query=nextjs+not+found+kannada,https://youtube.com/results?search_query=nextjs+not+found+tamil,https://youtube.com/results?search_query=nextjs+not+found+telugu
React,intermediate,How do you create a loading UI for a specific route in Next.js App Router?,Create loading.tsx in the same folder as page.tsx,Wrap page in Suspense,Use <Suspense> in layout,All are valid,D,loading.tsx is automatic; Suspense can be used manually too,Next.js,https://nextjs.org/docs/app/building-your-application/routing/loading-ui-and-streaming,https://youtube.com/results?search_query=nextjs+loading.tsx,https://youtube.com/results?search_query=nextjs+loading+hindi,https://youtube.com/results?search_query=nextjs+loading+kannada,https://youtube.com/results?search_query=nextjs+loading+tamil,https://youtube.com/results?search_query=nextjs+loading+telugu
React,intermediate,What is the benefit of colocating loading.tsx / error.tsx / not-found.tsx?,Route-segment specific UI states,Global error handling,Improved SEO,All of the above,A,File-system conventions give fine-grained control over loading/error/404 per route,Next.js,https://nextjs.org/docs/app/building-your-application/routing/loading-ui-and-streaming,https://youtube.com/results?search_query=nextjs+colocated+loading+error,https://youtube.com/results?search_query=nextjs+colocated+hindi,https://youtube.com/results?search_query=nextjs+colocated+kannada,https://youtube.com/results?search_query=nextjs+colocated+tamil,https://youtube.com/results?search_query=nextjs+colocated+telugu
React,intermediate,Which pattern is commonly used to protect routes in Next.js App Router?,Middleware checks auth → redirect if not authenticated,Client-side check in layout,useEffect redirect,All are valid,A,Middleware runs before page render → most secure and no flicker,Next.js,https://nextjs.org/docs/app/building-your-application/routing/middleware#authentication,https://youtube.com/results?search_query=nextjs+middleware+auth,https://youtube.com/results?search_query=nextjs+middleware+hindi,https://youtube.com/results?search_query=nextjs+middleware+kannada,https://youtube.com/results?search_query=nextjs+middleware+tamil,https://youtube.com/results?search_query=nextjs+middleware+telugu
React,intermediate,What is the main reason to use Server Actions instead of API routes in Next.js?,Simpler DX (no separate endpoint files),Progressive enhancement,Automatic pending/error UI,All of the above,D,Server Actions are invoked directly from client → less boilerplate + better UX,Next.js / React 19,https://nextjs.org/docs/app/building-your-application/data-fetching/server-actions-and-mutations,https://youtube.com/results?search_query=nextjs+server+actions+vs+api+routes,https://youtube.com/results?search_query=server+actions+hindi,https://youtube.com/results?search_query=server+actions+kannada,https://youtube.com/results?search_query=server+actions+tamil,https://youtube.com/results?search_query=server+actions+telugu
React,intermediate,How do you handle file uploads with Server Actions?,Use formData in action function,Use multipart/form-data in fetch,Use libraries only,All of the above,A,Server Actions receive FormData natively (including files),Next.js,https://nextjs.org/docs/app/building-your-application/data-fetching/server-actions-and-mutations#handling-formdata,https://youtube.com/results?search_query=nextjs+server+actions+file+upload,https://youtube.com/results?search_query=server+actions+file+hindi,https://youtube.com/results?search_query=server+actions+file+kannada,https://youtube.com/results?search_query=server+actions+file+tamil,https://youtube.com/results?search_query=server+actions+file+telugu
React,intermediate,What is the benefit of revalidatePath / revalidateTag in Next.js?,Invalidate cache for specific paths/tags after mutations,Force full page reload,Replace useEffect fetch,Replace Router cache,A,Revalidation allows fine-grained cache invalidation after mutations,Next.js,https://nextjs.org/docs/app/building-your-application/data-fetching/revalidating,https://youtube.com/results?search_query=nextjs+revalidatepath+revalidatetag,https://youtube.com/results?search_query=nextjs+revalidate+hindi,https://youtube.com/results?search_query=nextjs+revalidate+kannada,https://youtube.com/results?search_query=nextjs+revalidate+tamil,https://youtube.com/results?search_query=nextjs+revalidate+telugu
React,intermediate,Which caching strategy does Next.js App Router use by default for fetch()?,No cache (force-cache in Next.js 14+),Cache forever,Revalidate on every request,Cache for 1 hour,A,fetch() defaults to force-cache (cache forever) unless revalidate or dynamic opts are used,Next.js,https://nextjs.org/docs/app/building-your-application/data-fetching/fetching-caching-and-revalidating#caching-data,https://youtube.com/results?search_query=nextjs+fetch+caching,https://youtube.com/results?search_query=nextjs+fetch+hindi,https://youtube.com/results?search_query=nextjs+fetch+kannada,https://youtube.com/results?search_query=nextjs+fetch+tamil,https://youtube.com/results?search_query=nextjs+fetch+telugu
React,intermediate,How do you opt into dynamic rendering for a page in Next.js?,Export const dynamic = 'force-dynamic',Use cookies() or headers() in Server Component,Use searchParams in page,All of the above,D,Using dynamic functions or force-dynamic opts disables static rendering,Next.js,https://nextjs.org/docs/app/building-your-application/rendering/static-and-dynamic#dynamic-rendering,https://youtube.com/results?search_query=nextjs+dynamic+rendering,https://youtube.com/results?search_query=nextjs+dynamic+hindi,https://youtube.com/results?search_query=nextjs+dynamic+kannada,https://youtube.com/results?search_query=nextjs+dynamic+tamil,https://youtube.com/results?search_query=nextjs+dynamic+telugu
React,intermediate,What is the difference between force-dynamic and force-static in Next.js?,force-dynamic = always SSR, force-static = always SSG,force-dynamic = client-only, force-static = server-only,force-dynamic = no cache, force-static = cache forever,All are incorrect,A,force-dynamic forces dynamic rendering (SSR); force-static forces static rendering (SSG),Next.js,https://nextjs.org/docs/app/api-reference/next-config-js/dynamic,https://youtube.com/results?search_query=nextjs+force-dynamic+vs+force-static,https://youtube.com/results?search_query=nextjs+force+dynamic+hindi,https://youtube.com/results?search_query=nextjs+force+dynamic+kannada,https://youtube.com/results?search_query=nextjs+force+dynamic+tamil,https://youtube.com/results?search_query=nextjs+force+dynamic+telugu
React,intermediate,Which file convention handles 404 pages per route segment in Next.js?,not-found.tsx,error.tsx,loading.tsx,layout.tsx,A,not-found.tsx renders custom 404 UI for that route segment,Next.js,https://nextjs.org/docs/app/api-reference/file-conventions/not-found,https://youtube.com/results?search_query=nextjs+not-found.tsx,https://youtube.com/results?search_query=nextjs+not+found+hindi,https://youtube.com/results?search_query=nextjs+not+found+kannada,https://youtube.com/results?search_query=nextjs+not+found+tamil,https://youtube.com/results?search_query=nextjs+not+found+telugu
React,intermediate,How do you catch render errors in a specific route segment in Next.js?,Use error.tsx file in the folder,Use ErrorBoundary component,Use try/catch in page,Use global error handler,A,error.tsx is the file-based Error Boundary per route segment,Next.js,https://nextjs.org/docs/app/building-your-application/routing/error-handling,https://youtube.com/results?search_query=nextjs+error.tsx,https://youtube.com/results?search_query=nextjs+error+hindi,https://youtube.com/results?search_query=nextjs+error+kannada,https://youtube.com/results?search_query=nextjs+error+tamil,https://youtube.com/results?search_query=nextjs+error+telugu
React,intermediate,What is the purpose of loading.tsx in Next.js App Router?,Automatic Suspense fallback UI for that route segment,Manual loading spinner,Global loading indicator,Replaces Suspense,A,loading.tsx is shown instantly while page / children are streaming,Next.js,https://nextjs.org/docs/app/building-your-application/routing/loading-ui-and-streaming,https://youtube.com/results?search_query=nextjs+loading.tsx+purpose,https://youtube.com/results?search_query=nextjs+loading+hindi,https://youtube.com/results?search_query=nextjs+loading+kannada,https://youtube.com/results?search_query=nextjs+loading+tamil,https://youtube.com/results?search_query=nextjs+loading+telugu
React,intermediate,Which Next.js feature enables instant loading UI before JavaScript loads?,loading.tsx + streaming SSR,Client-side skeleton components,Manual Suspense in root layout,All of the above,A,loading.tsx provides immediate UI while server streams content,Next.js,https://nextjs.org/docs/app/building-your-application/routing/loading-ui-and-streaming,https://youtube.com/results?search_query=nextjs+instant+loading,https://youtube.com/results?search_query=nextjs+loading+instant+hindi,https://youtube.com/results?search_query=nextjs+loading+instant+kannada,https://youtube.com/results?search_query=nextjs+loading+instant+tamil,https://youtube.com/results?search_query=nextjs+loading+instant+telugu
React,intermediate,How do you create a global error page in Next.js App Router?,Create error.tsx in app/ root folder,Use global-error.tsx in app/,Use _error.tsx,Use custom 500 page,A,error.tsx at root handles uncaught errors for the entire app,Next.js,https://nextjs.org/docs/app/api-reference/file-conventions/error,https://youtube.com/results?search_query=nextjs+global+error+page,https://youtube.com/results?search_query=nextjs+global+error+hindi,https://youtube.com/results?search_query=nextjs+global+error+kannada,https://youtube.com/results?search_query=nextjs+global+error+tamil,https://youtube.com/results?search_query=nextjs+global+error+telugu
React,intermediate,What is the difference between error.tsx and global-error.tsx in Next.js?,error.tsx = segment-specific, global-error.tsx = root-level fallback,global-error.tsx replaces error.tsx at root,error.tsx handles 404, global-error handles 500,A,error.tsx for local segments; global-error.tsx for root uncaught errors,Next.js,https://nextjs.org/docs/app/api-reference/file-conventions/global-error,https://youtube.com/results?search_query=nextjs+global-error.tsx+vs+error.tsx,https://youtube.com/results?search_query=nextjs+global+error+hindi,https://youtube.com/results?search_query=nextjs+global+error+kannada,https://youtube.com/results?search_query=nextjs+global+error+tamil,https://youtube.com/results?search_query=nextjs+global+error+telugu
React,intermediate,Which pattern is used to create protected layouts in Next.js App Router?,Create a layout.tsx that checks auth server-side and redirects,A client-side wrapper component,Use middleware only,All are valid,A,Server Components in layout.tsx can read cookies/headers and redirect immediately,Next.js,https://nextjs.org/docs/app/building-your-application/routing/parallel-routes#intercepting-routes-with-auth,https://youtube.com/results?search_query=nextjs+protected+layout,https://youtube.com/results?search_query=nextjs+protected+hindi,https://youtube.com/results?search_query=nextjs+protected+kannada,https://youtube.com/results?search_query=nextjs+protected+tamil,https://youtube.com/results?search_query=nextjs+protected+telugu
React,intermediate,What is the recommended way to handle auth loading states in Next.js?,Show loading.tsx until auth check completes in layout,Use client-side skeleton + useEffect,Use Suspense + fallback in layout,All are valid,D,Server-side loading.tsx is instant; Suspense can be used too,Next.js,https://nextjs.org/docs/app/building-your-application/routing/loading-ui-and-streaming,https://youtube.com/results?search_query=nextjs+auth+loading+state,https://youtube.com/results?search_query=nextjs+auth+loading+hindi,https://youtube.com/results?search_query=nextjs+auth+loading+kannada,https://youtube.com/results?search_query=nextjs+auth+loading+tamil,https://youtube.com/results?search_query=nextjs+auth+loading+telugu
React,intermediate,How do you prefetch routes in Next.js App Router?,Use <Link prefetch>,Router.prefetch(),Next.js automatically prefetches on hover,All of the above,D,Next.js prefetches on viewport/hover by default; explicit prefetch is also possible,Next.js,https://nextjs.org/docs/app/api-reference/components/link#prefetching,https://youtube.com/results?search_query=nextjs+link+prefetch,https://youtube.com/results?search_query=nextjs+prefetch+hindi,https://youtube.com/results?search_query=nextjs+prefetch+kannada,https://youtube.com/results?search_query=nextjs+prefetch+tamil,https://youtube.com/results?search_query=nextjs+prefetch+telugu
React,intermediate,What is the purpose of parallel routes in Next.js App Router?,Render multiple pages in the same layout at the same time,Run multiple loaders concurrently,Handle modals without changing URL,All of the above,D,Parallel routes enable modals, tabs, dashboard panels without URL change,Next.js,https://nextjs.org/docs/app/building-your-application/routing/parallel-routes,https://youtube.com/results?search_query=nextjs+parallel+routes,https://youtube.com/results?search_query=parallel+routes+hindi,https://youtube.com/results?search_query=parallel+routes+kannada,https://youtube.com/results?search_query=parallel+routes+tamil,https://youtube.com/results?search_query=parallel+routes+telugu
React,intermediate,How do you implement a modal that doesn't change URL in Next.js?,Use parallel routes with @modal slot,Use client-side state + portal,Use intercepting routes,All are valid,D,All patterns are used; parallel + intercepting is the App Router idiomatic way,Next.js,https://nextjs.org/docs/app/building-your-application/routing/parallel-routes#modals,https://youtube.com/results?search_query=nextjs+modal+no+url+change,https://youtube.com/results?search_query=nextjs+modal+hindi,https://youtube.com/results?search_query=nextjs+modal+kannada,https://youtube.com/results?search_query=nextjs+modal+tamil,https://youtube.com/results?search_query=nextjs+modal+telugu
React,intermediate,What is intercepting routes in Next.js?,Allow rendering a route while keeping previous URL (e.g. photo modal),Replace current page completely,Redirect to another route,Handle 404 pages,A,Intercepting routes show new content (modal) without changing browser URL,Next.js,https://nextjs.org/docs/app/building-your-application/routing/intercepting-routes,https://youtube.com/results?search_query=nextjs+intercepting+routes,https://youtube.com/results?search_query=intercepting+routes+hindi,https://youtube.com/results?search_query=intercepting+routes+kannada,https://youtube.com/results?search_query=intercepting+routes+tamil,https://youtube.com/results?search_query=intercepting+routes+telugu
React,intermediate,Which file convention handles custom 404 pages in Next.js App Router?,not-found.tsx,404.tsx,error.tsx,loading.tsx,A,not-found.tsx is the modern file-based 404 handler,Next.js,https://nextjs.org/docs/app/api-reference/file-conventions/not-found,https://youtube.com/results?search_query=nextjs+not-found.tsx,https://youtube.com/results?search_query=nextjs+not+found+hindi,https://youtube.com/results?search_query=nextjs+not+found+kannada,https://youtube.com/results?search_query=nextjs+not+found+tamil,https://youtube.com/results?search_query=nextjs+not+found+telugu
