skill,level,question_text,option_a,option_b,option_c,option_d,correct_answer,explanation,topic,mdn_link,youtube_english,youtube_hindi,youtube_kannada,youtube_tamil,youtube_telugu
React,intermediate,Which concurrent feature lets you show a fallback while data is loading?,Suspense,Transition,DeferredValue,flushSync,A,<Suspense fallback={<Loading />}> wraps components that suspend.,Concurrent Mode,https://react.dev/reference/react/Suspense,https://youtube.com/results?search_query=react+suspense+data+fetching,https://youtube.com/results?search_query=react+suspense+data+hindi,https://youtube.com/results?search_query=react+suspense+data+kannada,https://youtube.com/results?search_query=react+suspense+data+tamil,https://youtube.com/results?search_query=react+suspense+data+telugu
React,intermediate,What is the main goal of the React Compiler (React Forget)?,To automatically memoize components and hooks,To remove the need for useMemo/useCallback,To compile JSX to native code,To improve SSR performance,A,React Forget aims to eliminate manual memoization by analyzing code at compile time.,React Compiler,https://react.dev/blog/2024/04/25/react-19#react-compiler,https://youtube.com/results?search_query=react+forget+compiler,https://youtube.com/results?search_query=react+forget+hindi,https://youtube.com/results?search_query=react+forget+kannada,https://youtube.com/results?search_query=react+forget+tamil,https://youtube.com/results?search_query=react+forget+telugu
React,intermediate,When will the React Compiler become stable?,It is experimental (2024),React 19 release,React 20,Already stable in React 18,A,As of 2025 the compiler is still experimental / in development.,React Compiler,https://react.dev/blog/2024/04/25/react-19#react-compiler,https://youtube.com/results?search_query=react+compiler+status,https://youtube.com/results?search_query=react+forget+status+hindi,https://youtube.com/results?search_query=react+forget+status+kannada,https://youtube.com/results?search_query=react+forget+status+tamil,https://youtube.com/results?search_query=react+forget+status+telugu
React,intermediate,What is the primary advantage of Server Components in React 19?,They run only on the server and reduce client bundle size,They replace all client components,They handle state automatically,They remove the need for Suspense,A,Server Components execute on the server → less JavaScript sent to client.,Server Components,https://react.dev/reference/rsc/server-components,https://youtube.com/results?search_query=react+server+components,https://youtube.com/results?search_query=react+rsc+hindi,https://youtube.com/results?search_query=react+rsc+kannada,https://youtube.com/results?search_query=react+rsc+tamil,https://youtube.com/results?search_query=react+rsc+telugu
React,intermediate,Which component type can use async/await directly in React 19?,Server Components,Client Components,Class components,All components,A,Server Components support async functions natively (e.g. await fetch).,Server Components,https://react.dev/reference/rsc/server-components#async-server-components,https://youtube.com/results?search_query=react+async+server+components,https://youtube.com/results?search_query=async+rsc+hindi,https://youtube.com/results?search_query=async+rsc+kannada,https://youtube.com/results?search_query=async+rsc+tamil,https://youtube.com/results?search_query=async+rsc+telugu
React,intermediate,What is the role of Suspense in data fetching with Server Components?,To stream fallback UI while data loads,To handle errors only,To batch state updates,To enable client navigation,A,Suspense enables streaming SSR with immediate fallback + progressive hydration.,Server Components,https://react.dev/reference/react/Suspense#displaying-a-fallback-while-content-is-loading,https://youtube.com/results?search_query=react+suspense+data+fetching,https://youtube.com/results?search_query=react+suspense+fetch+hindi,https://youtube.com/results?search_query=react+suspense+fetch+kannada,https://youtube.com/results?search_query=react+suspense+fetch+tamil,https://youtube.com/results?search_query=react+suspense+fetch+telugu
React,intermediate,Which pattern replaces traditional Redux in many modern React apps?,Zustand or Jotai,React Context + useReducer,Redux Toolkit,All are still used equally,D,Context + useReducer or lightweight libraries like Zustand/Jotai are often enough now.,State Management,https://react.dev/learn/scaling-up-with-reducer-and-context,https://youtube.com/results?search_query=react+modern+state+management,https://youtube.com/results?search_query=react+state+management+hindi,https://youtube.com/results?search_query=react+state+management+kannada,https://youtube.com/results?search_query=react+state+management+tamil,https://youtube.com/results?search_query=react+state+management+telugu
React,intermediate,What is the main drawback of using Context for large-scale state?,Every consumer re-renders when value changes,It is slower than Redux,It cannot handle async logic,It lacks middleware,A,Context triggers re-renders in all consumers on value change (unless memoized).,Context,https://react.dev/learn/passing-data-deeply-with-context#caveats,https://youtube.com/results?search_query=react+context+drawback,https://youtube.com/results?search_query=react+context+problem+hindi,https://youtube.com/results?search_query=react+context+problem+kannada,https://youtube.com/results?search_query=react+context+problem+tamil,https://youtube.com/results?search_query=react+context+problem+telugu
React,intermediate,How do you optimize Context performance when the value changes frequently?,Split contexts,Use memoization on consumers,Use useMemo on value object,All of the above,D,Splitting contexts + memoization reduces unnecessary re-renders.,Performance,https://react.dev/learn/passing-data-deeply-with-context#optimizing-re-renders,https://youtube.com/results?search_query=react+optimize+context,https://youtube.com/results?search_query=react+context+optimization+hindi,https://youtube.com/results?search_query=react+context+optimization+kannada,https://youtube.com/results?search_query=react+context+optimization+tamil,https://youtube.com/results?search_query=react+context+optimization+telugu
React,intermediate,Which library provides a minimalistic alternative to Redux?,Zustand,Jotai,Recoil,All of the above,D,All are lightweight modern alternatives to Redux.,State Management,https://zustand-demo.pmnd.rs/,https://youtube.com/results?search_query=zustand+react,https://youtube.com/results?search_query=jotai+react+hindi,https://youtube.com/results?search_query=recoil+react+kannada,https://youtube.com/results?search_query=react+state+lightweight+tamil,https://youtube.com/results?search_query=react+zustand+vs+redux+telugu
React,intermediate,What is the benefit of using React Server Components?,Zero client-side JavaScript for static parts,Full access to server resources (fs, db),Better SEO and initial load time,All of the above,D,RSC reduces bundle size, enables direct backend access, improves performance.,Server Components,https://react.dev/reference/rsc/server-components,https://youtube.com/results?search_query=react+server+components+benefits,https://youtube.com/results?search_query=rsc+react+hindi,https://youtube.com/results?search_query=rsc+react+kannada,https://youtube.com/results?search_query=rsc+react+tamil,https://youtube.com/results?search_query=rsc+react+telugu
React,intermediate,Which feature allows streaming HTML from the server in React 18/19?,Suspense + Server Components,ReactDOMServer.renderToString,flushSync,React.lazy,A,Suspense boundaries + RSC enable progressive streaming of HTML.,Server Components,https://react.dev/reference/react/Suspense#streaming-html-from-the-server,https://youtube.com/results?search_query=react+streaming+ssr,https://youtube.com/results?search_query=react+streaming+hindi,https://youtube.com/results?search_query=react+streaming+kannada,https://youtube.com/results?search_query=react+streaming+tamil,https://youtube.com/results?search_query=react+streaming+telugu
React,intermediate,What is hydration in React?,Attaching event listeners to server-rendered HTML,Fetching data on client,Rendering on server only,Running useEffect on server,A,Hydration makes static server HTML interactive by attaching React event handlers.,SSR,https://react.dev/learn/react-dom#hydration,https://youtube.com/results?search_query=react+hydration+explained,https://youtube.com/results?search_query=react+hydration+hindi,https://youtube.com/results?search_query=react+hydration+kannada,https://youtube.com/results?search_query=react+hydration+tamil,https://youtube.com/results?search_query=react+hydration+telugu
React,intermediate,Why do we sometimes see "hydration error" warnings?,Server and client rendered different markup,Props changed during hydration,State was initialized on server,All of the above,D,Hydration errors occur when server HTML does not match client render output.,SSR,https://react.dev/link/hydration-mismatch,https://youtube.com/results?search_query=react+hydration+error,https://youtube.com/results?search_query=hydration+error+hindi,https://youtube.com/results?search_query=hydration+error+kannada,https://youtube.com/results?search_query=hydration+error+tamil,https://youtube.com/results?search_query=hydration+error+telugu
React,intermediate,How can you suppress hydration warnings for third-party scripts?,Use suppressHydrationWarning prop on the element,Use useEffect to patch DOM,Use ReactDOM.hydrateRoot with option,All of the above,D,suppressHydrationWarning is the official way for intentional mismatches (e.g. timestamps).,SSR,https://react.dev/reference/react-dom/hydrateRoot#suppressing-unavoidable-hydration-mismatch-warnings,https://youtube.com/results?search_query=react+suppress+hydration+warning,https://youtube.com/results?search_query=suppress+hydration+hindi,https://youtube.com/results?search_query=suppress+hydration+kannada,https://youtube.com/results?search_query=suppress+hydration+tamil,https://youtube.com/results?search_query=suppress+hydration+telugu
React,intermediate,What is ErrorBoundary in React?,A component that catches JavaScript errors in its child tree,An HOC for forms,An event listener wrapper,A context provider,A,Error Boundaries catch errors during rendering, in lifecycles, and constructors.,Error Handling,https://react.dev/reference/react/Component#catching-rendering-errors-with-an-error-boundary,https://youtube.com/results?search_query=react+error+boundary,https://youtube.com/results?search_query=error+boundary+hindi,https://youtube.com/results?search_query=error+boundary+kannada,https://youtube.com/results?search_query=error+boundary+tamil,https://youtube.com/results?search_query=error+boundary+telugu
React,intermediate,Which lifecycle methods can be used to implement ErrorBoundary?,static getDerivedStateFromError & componentDidCatch,componentDidMount & componentDidUpdate,render & shouldComponentUpdate,constructor & getSnapshotBeforeUpdate,A,getDerivedStateFromError updates UI fallback; componentDidCatch logs errors.,Error Handling,https://react.dev/reference/react/Component#catching-rendering-errors-with-an-error-boundary,https://youtube.com/results?search_query=react+error+boundary+lifecycle,https://youtube.com/results?search_query=error+boundary+lifecycle+hindi,https://youtube.com/results?search_query=error+boundary+lifecycle+kannada,https://youtube.com/results?search_query=error+boundary+lifecycle+tamil,https://youtube.com/results?search_query=error+boundary+lifecycle+telugu
React,intermediate,Why can't Error Boundaries catch errors in event handlers?,Event handlers run after render phase,Error Boundaries only catch render/lifecycle errors,Event errors are async,All of the above,D,Errors in event handlers, async code, and useEffect must be caught manually.,Error Handling,https://react.dev/reference/react/Component#catching-rendering-errors-with-an-error-boundary#caveats,https://youtube.com/results?search_query=why+error+boundary+not+catch+event+handler,https://youtube.com/results?search_query=react+error+event+hindi,https://youtube.com/results?search_query=react+error+event+kannada,https://youtube.com/results?search_query=react+error+event+tamil,https://youtube.com/results?search_query=react+error+event+telugu
React,intermediate,How do you catch errors in async code inside useEffect?,Use try/catch inside async function,Use window.onerror,Use ErrorBoundary,Use React Profiler,A,try/catch around await fetch() or Promise is required.,Error Handling,https://react.dev/learn/render-and-commit#caveats,https://youtube.com/results?search_query=react+error+handling+async,https://youtube.com/results?search_query=react+async+error+hindi,https://youtube.com/results?search_query=react+async+error+kannada,https://youtube.com/results?search_query=react+async+error+tamil,https://youtube.com/results?search_query=react+async+error+telugu
React,intermediate,What is the recommended way to create a custom hook?,Prefix with 'use' and call other hooks inside,Prefix with 'custom' and use class,Use HOC instead,Use render props only,A,Custom hooks must start with 'use' and follow rules of hooks.,Custom Hooks,https://react.dev/learn/reusing-logic-with-custom-hooks,https://youtube.com/results?search_query=react+custom+hooks,https://youtube.com/results?search_query=custom+hooks+hindi,https://youtube.com/results?search_query=custom+hooks+kannada,https://youtube.com/results?search_query=custom+hooks+tamil,https://youtube.com/results?search_query=custom+hooks+telugu
React,intermediate,Which rule must custom hooks follow?,They can only be called at top level of function components or other hooks,They can be called conditionally,They can be called inside loops,They must be class methods,A,Rules of Hooks apply exactly the same to custom hooks.,Custom Hooks,https://react.dev/learn/reusing-logic-with-custom-hooks#rules-of-hooks,https://youtube.com/results?search_query=react+custom+hook+rules,https://youtube.com/results?search_query=custom+hook+rules+hindi,https://youtube.com/results?search_query=custom+hook+rules+kannada,https://youtube.com/results?search_query=custom+hook+rules+tamil,https://youtube.com/results?search_query=custom+hook+rules+telugu
React,intermediate,What is a good example of a custom hook use case?,useFetch for data fetching,Use localStorage sync,Use window resize listener,All of the above,D,Custom hooks extract reusable stateful logic (fetching, storage, events, etc.).,Custom Hooks,https://react.dev/learn/reusing-logic-with-custom-hooks,https://youtube.com/results?search_query=react+custom+hooks+examples,https://youtube.com/results?search_query=custom+hooks+examples+hindi,https://youtube.com/results?search_query=custom+hooks+examples+kannada,https://youtube.com/results?search_query=custom+hooks+examples+tamil,https://youtube.com/results?search_query=custom+hooks+examples+telugu
React,intermediate,How do you share logic between class and function components?,Extract to custom hook and use in function,Use HOC or render props for class,Use inheritance,All of the above,D,Custom hooks are preferred for new code; HOCs/render props still work for class components.,Custom Hooks,https://react.dev/learn/reusing-logic-with-custom-hooks,https://youtube.com/results?search_query=react+share+logic+hook,https://youtube.com/results?search_query=react+logic+sharing+hindi,https://youtube.com/results?search_query=react+logic+sharing+kannada,https://youtube.com/results?search_query=react+logic+sharing+tamil,https://youtube.com/results?search_query=react+logic+sharing+telugu
React,intermediate,What is the purpose of React 19's useActionState hook?,To manage form state and pending actions,To replace useReducer,To handle navigation,To memoize form values,A,useActionState simplifies form actions with pending/error states (React 19).,React 19,https://react.dev/reference/react-dom/hooks/useActionState,https://youtube.com/results?search_query=react+useActionState,https://youtube.com/results?search_query=useActionState+hindi,https://youtube.com/results?search_query=useActionState+kannada,https://youtube.com/results?search_query=useActionState+tamil,https://youtube.com/results?search_query=useActionState+telugu
React,intermediate,Which React 19 feature allows actions to be invoked with form elements?,useActionState,Actions in forms,FormAction prop,All of the above,D,React 19 introduces actions that can be passed directly to <form action={...}>,React 19,https://react.dev/reference/react-dom/components/form#using-a-form-action,https://youtube.com/results?search_query=react+19+form+actions,https://youtube.com/results?search_query=react+form+action+hindi,https://youtube.com/results?search_query=react+form+action+kannada,https://youtube.com/results?search_query=react+form+action+tamil,https://youtube.com/results?search_query=react+form+action+telugu
React,intermediate,What is the benefit of the new <form> action pattern in React 19?,Progressive enhancement + automatic pending state,Replaces all useState in forms,Removes need for onSubmit,All of the above,A,Form actions provide progressive enhancement and built-in pending/error handling.,React 19,https://react.dev/reference/react-dom/components/form#using-a-form-action,https://youtube.com/results?search_query=react+19+form+actions,https://youtube.com/results?search_query=react+19+actions+hindi,https://youtube.com/results?search_query=react+19+actions+kannada,https://youtube.com/results?search_query=react+19+actions+tamil,https://youtube.com/results?search_query=react+19+actions+telugu
React,intermediate,How does React handle optimistic updates in React 19?,Use useOptimistic hook,Use startTransition with optimistic state,Use setState with callback,All of the above,D,React 19 introduces useOptimistic for declarative optimistic UI.,React 19,https://react.dev/reference/react/useOptimistic,https://youtube.com/results?search_query=react+useOptimistic,https://youtube.com/results?search_query=useOptimistic+hindi,https://youtube.com/results?search_query=useOptimistic+kannada,https://youtube.com/results?search_query=useOptimistic+tamil,https://youtube.com/results?search_query=useOptimistic+telugu
React,intermediate,What is the main goal of the React Compiler (Forget)?,Automatically apply memoization where safe,Remove need for useMemo/useCallback,Improve developer experience,All of the above,D,Forget analyzes code at compile time to eliminate manual memoization.,React Compiler,https://react.dev/blog/2024/04/25/react-19#react-compiler,https://youtube.com/results?search_query=react+forget+compiler,https://youtube.com/results?search_query=react+forget+hindi,https://youtube.com/results?search_query=react+forget+kannada,https://youtube.com/results?search_query=react+forget+tamil,https://youtube.com/results?search_query=react+forget+telugu
React,intermediate,When is the React Compiler expected to be stable?,2025–2026,Already in React 18,React 20,It is abandoned,A,As of 2025 the compiler is still experimental / rolling out gradually.,React Compiler,https://react.dev/blog/2024/04/25/react-19#react-compiler,https://youtube.com/results?search_query=react+compiler+status,https://youtube.com/results?search_query=react+forget+status+hindi,https://youtube.com/results?search_query=react+forget+status+kannada,https://youtube.com/results?search_query=react+forget+status+tamil,https://youtube.com/results?search_query=react+forget+status+telugu
React,intermediate,What is the primary advantage of Server Components in React 19?,They run only on the server → zero client JS for that part,They replace all client components,They handle client state automatically,They remove Suspense,A,Server Components reduce client bundle size and enable direct backend access.,Server Components,https://react.dev/reference/rsc/server-components,https://youtube.com/results?search_query=react+server+components+advantage,https://youtube.com/results?search_query=rsc+advantage+hindi,https://youtube.com/results?search_query=rsc+advantage+kannada,https://youtube.com/results?search_query=rsc+advantage+tamil,https://youtube.com/results?search_query=rsc+advantage+telugu
React,intermediate,Which type of component can directly await fetch() in React 19?,Server Components,Client Components,Class components,All components,A,Server Components support async/await natively.,Server Components,https://react.dev/reference/rsc/server-components#async-server-components,https://youtube.com/results?search_query=react+async+server+component,https://youtube.com/results?search_query=async+rsc+hindi,https://youtube.com/results?search_query=async+rsc+kannada,https://youtube.com/results?search_query=async+rsc+tamil,https://youtube.com/results?search_query=async+rsc+telugu
React,intermediate,How does Suspense enable streaming in Server Components?,It streams fallback → content as it becomes ready,It blocks the entire page until all data loads,It only works with client fetching,It replaces React.lazy,A,Suspense boundaries allow progressive streaming of HTML.,Server Components,https://react.dev/reference/react/Suspense#streaming-html-from-the-server,https://youtube.com/results?search_query=react+streaming+suspense,https://youtube.com/results?search_query=react+streaming+hindi,https://youtube.com/results?search_query=react+streaming+kannada,https://youtube.com/results?search_query=react+streaming+tamil,https://youtube.com/results?search_query=react+streaming+telugu
React,intermediate,What is the benefit of the new <form action> pattern in React 19?,Progressive enhancement + built-in pending/error states,Replaces all useState in forms,Removes need for onSubmit handler,All of the above,A,Form actions provide progressive enhancement and automatic pending UI.,React 19,https://react.dev/reference/react-dom/components/form#using-a-form-action,https://youtube.com/results?search_query=react+19+form+action,https://youtube.com/results?search_query=react+form+action+hindi,https://youtube.com/results?search_query=react+form+action+kannada,https://youtube.com/results?search_query=react+form+action+tamil,https://youtube.com/results?search_query=react+form+action+telugu
React,intermediate,Which hook in React 19 manages form actions and pending state?,useActionState,useFormStatus,useOptimistic,useTransition,A,useActionState provides pending/error states for form submissions.,React 19,https://react.dev/reference/react-dom/hooks/useActionState,https://youtube.com/results?search_query=react+useActionState,https://youtube.com/results?search_query=useActionState+hindi,https://youtube.com/results?search_query=useActionState+kannada,https://youtube.com/results?search_query=useActionState+tamil,https://youtube.com/results?search_query=useActionState+telugu
React,intermediate,What is the main advantage of useOptimistic in React 19?,It provides instant UI feedback before server confirms,It replaces useState,It handles errors automatically,It memoizes form values,A,useOptimistic applies optimistic updates that revert on error.,React 19,https://react.dev/reference/react/useOptimistic,https://youtube.com/results?search_query=react+useOptimistic,https://youtube.com/results?search_query=useOptimistic+hindi,https://youtube.com/results?search_query=useOptimistic+kannada,https://youtube.com/results?search_query=useOptimistic+tamil,https://youtube.com/results?search_query=useOptimistic+telugu
React,intermediate,Which pattern does useOptimistic replace in older code?,Manual optimistic UI with rollback on error,Manual setState with try/catch,Manual loading states,All of the above,D,useOptimistic makes optimistic UI declarative and handles rollback.,React 19,https://react.dev/reference/react/useOptimistic,https://youtube.com/results?search_query=react+optimistic+ui+useOptimistic,https://youtube.com/results?search_query=optimistic+ui+hindi,https://youtube.com/results?search_query=optimistic+ui+kannada,https://youtube.com/results?search_query=optimistic+ui+tamil,https://youtube.com/results?search_query=optimistic+ui+telugu
React,intermediate,What is the recommended way to handle errors in Server Actions?,Throw serializable errors,Use try/catch + return {error},Use ErrorBoundary,All of the above,D,Server Actions support throwing errors that are caught on client.,React 19,https://react.dev/reference/rsc/server-actions#handling-errors,https://youtube.com/results?search_query=react+server+actions+error,https://youtube.com/results?search_query=server+actions+error+hindi,https://youtube.com/results?search_query=server+actions+error+kannada,https://youtube.com/results?search_query=server+actions+error+tamil,https://youtube.com/results?search_query=server+actions+error+telugu
React,intermediate,How do you access form status in React 19?,useFormStatus hook,Check pending state in useActionState,Use context,All of the above,D,useFormStatus provides pending, data, method, action status.,React 19,https://react.dev/reference/react-dom/hooks/useFormStatus,https://youtube.com/results?search_query=react+useFormStatus,https://youtube.com/results?search_query=useFormStatus+hindi,https://youtube.com/results?search_query=useFormStatus+kannada,https://youtube.com/results?search_query=useFormStatus+tamil,https://youtube.com/results?search_query=useFormStatus+telugu
React,intermediate,What is the main benefit of the React Compiler (Forget)?,Removes need for manual useMemo / useCallback,Compiles JSX to native code,Improves SSR speed,Replaces Server Components,A,Forget automatically memoizes where safe → cleaner code.,React Compiler,https://react.dev/blog/2024/04/25/react-19#react-compiler,https://youtube.com/results?search_query=react+forget+compiler,https://youtube.com/results?search_query=react+compiler+hindi,https://youtube.com/results?search_query=react+compiler+kannada,https://youtube.com/results?search_query=react+compiler+tamil,https://youtube.com/results?search_query=react+compiler+telugu
