skill,level,question_text,option_a,option_b,option_c,option_d,correct_answer,explanation,topic,mdn_link,youtube_english,youtube_hindi,youtube_kannada,youtube_tamil,youtube_telugu
ReactJS,Intermediate,How do you implement real-time location tracking in React?,Advanced Features,Geolocation,Real-time,Use navigator.geolocation.watchPosition for updates, manage position state, display on map (Leaflet/Google Maps), clean up watcher.,https://reactjs.org/docs/hooks-effect.html,https://youtube.com/results?search_query=react+geolocation,https://youtube.com/results?search_query=react+geolocation+hindi,https://youtube.com/results?search_query=react+geolocation+kannada,https://youtube.com/results?search_query=react+geolocation+tamil,https://youtube.com/results?search_query=react+geolocation+telugu
ReactJS,Intermediate,How do you implement real-time stock ticker in React?,Advanced Features,Stock Ticker,WebSocket,Use WebSocket for price updates, manage symbols state," format numbers, color-code changes", animate price movements.,https://reactjs.org/docs/hooks-effect.html,https://youtube.com/results?search_query=react+stock+ticker,https://youtube.com/results?search_query=stock+ticker+hindi,https://youtube.com/results?search_query=stock+ticker+kannada,https://youtube.com/results?search_query=stock+ticker+tamil,https://youtube.com/results?search_query=stock+ticker+telugu
ReactJS,Intermediate,What are React hooks for browser APIs (geolocation, media, etc.)?,Hooks,Browser APIs,Custom,"Create custom hooks for browser APIs: useGeolocation, useMediaQuery, useLocalStorage, useSessionStorage", useOnlineStatus.,https://reactjs.org/docs/hooks-custom.html,https://youtube.com/results?search_query=react+custom+hooks+browser+apis,https://youtube.com/results?search_query=react+browser+apis+hindi,https://youtube.com/results?search_query=react+browser+apis+kannada,https://youtube.com/results?search_query=react+browser+apis+tamil,https://youtube.com/results?search_query=react+browser+apis+telugu
ReactJS,Intermediate,How do you implement real-time voting/polling system in React?,Advanced Features,Voting,Real-time,Use WebSocket for vote updates, manage poll state," update results in real-time, prevent duplicate voting", display live charts.,https://reactjs.org/docs/hooks-effect.html,https://youtube.com/results?search_query=react+voting+system,https://youtube.com/results?search_query=react+voting+hindi,https://youtube.com/results?search_query=react+voting+kannada,https://youtube.com/results?search_query=react+voting+tamil,https://youtube.com/results?search_query=react+voting+telugu


React,intermediate,What happens if you forget to include a dependency in useEffect's dependency array?,The effect runs only once,The effect may run too often or miss updates,React throws an error immediately,The effect never runs,B,Forgetting dependencies can cause stale closures or infinite loops; React's linter warns about it,Hooks,https://react.dev/reference/react/useEffect#examples-dependencies,https://youtube.com/results?search_query=react+useEffect+dependencies,https://youtube.com/results?search_query=react+useEffect+dependencies+hindi,https://youtube.com/results?search_query=react+useEffect+dependencies+kannada,https://youtube.com/results?search_query=react+useEffect+dependencies+tamil,https://youtube.com/results?search_query=react+useEffect+dependencies+telugu
React,intermediate,Which hook should you use to memoize a value that depends on props or state?,useMemo,useCallback,useEffect,useRef,A,useMemo caches the result of an expensive calculation until its dependencies change,Hooks,https://react.dev/reference/react/useMemo,https://youtube.com/results?search_query=react+useMemo,https://youtube.com/results?search_query=react+useMemo+hindi,https://youtube.com/results?search_query=react+useMemo+kannada,https://youtube.com/results?search_query=react+useMemo+tamil,https://youtube.com/results?search_query=react+useMemo+telugu
React,intermediate,What is the main reason to wrap a callback in useCallback?,To prevent unnecessary re-renders of memoized children,To avoid running the function on every render,To make the function asynchronous,To store the previous value,B,Without useCallback a new function instance is created on every render → breaks memoized children,Hooks,https://react.dev/reference/react/useCallback,https://youtube.com/results?search_query=react+useCallback,https://youtube.com/results?search_query=react+useCallback+hindi,https://youtube.com/results?search_query=react+useCallback+kannada,https://youtube.com/results?search_query=react+useCallback+tamil,https://youtube.com/results?search_query=react+useCallback+telugu
React,intermediate,When is useReducer usually preferred over multiple useState calls?,When state logic is complex or involves multiple related values,When state is a single number,When you only need one effect,When using Context API,A,useReducer centralizes complex state transitions in one reducer function,Hooks,https://react.dev/reference/react/useReducer,https://youtube.com/results?search_query=react+useReducer,https://youtube.com/results?search_query=react+useReducer+hindi,https://youtube.com/results?search_query=react+useReducer+kannada,https://youtube.com/results?search_query=react+useReducer+tamil,https://youtube.com/results?search_query=react+useReducer+telugu
React,intermediate,What does the dispatch function returned by useReducer do?,It always causes a re-render,It only updates state if the value is different,It replaces the reducer function,It merges state shallowly,A,dispatch always schedules a state update (even if reducer returns same value),Hooks,https://react.dev/reference/react/useReducer#dispatching-actions,https://youtube.com/results?search_query=react+useReducer+dispatch,https://youtube.com/results?search_query=react+useReducer+dispatch+hindi,https://youtube.com/results?search_query=react+useReducer+dispatch+kannada,https://youtube.com/results?search_query=react+useReducer+dispatch+tamil,https://youtube.com/results?search_query=react+useReducer+dispatch+telugu
React,intermediate,Why does React 18 batch state updates inside promises and timeouts?,To reduce re-renders,To make updates synchronous,To improve server rendering,To support legacy code,A,Automatic batching in React 18 includes async code inside event handlers,React 18,https://react.dev/blog/2022/03/29/react-v18#automatic-batching,https://youtube.com/results?search_query=react+18+automatic+batch,https://youtube.com/results?search_query=react+18+batch+hindi,https://youtube.com/results?search_query=react+18+batch+kannada,https://youtube.com/results?search_query=react+18+batch+tamil,https://youtube.com/results?search_query=react+18+batch+telugu
React,intermediate,What happens when you update state inside a setTimeout callback in React 17?,Each update causes a separate re-render,All updates are batched,React throws an error,State is lost,A,In React 17 state updates in timeouts were not batched → multiple re-renders,React 18,https://react.dev/blog/2022/03/29/react-v18#automatic-batching,https://youtube.com/results?search_query=react+batch+timeout,https://youtube.com/results?search_query=react+batch+timeout+hindi,https://youtube.com/results?search_query=react+batch+timeout+kannada,https://youtube.com/results?search_query=react+batch+timeout+tamil,https://youtube.com/results?search_query=react+batch+timeout+telugu
React,intermediate,How do you opt out of automatic batching in React 18?,Use flushSync from react-dom,Use React.unstable_batchedUpdates,Set __DEV__ = false,You cannot opt out,A,flushSync forces synchronous render (breaks batching intentionally),React 18,https://react.dev/reference/react-dom/flushSync,https://youtube.com/results?search_query=react+flushSync,https://youtube.com/results?search_query=react+flushSync+hindi,https://youtube.com/results?search_query=react+flushSync+kannada,https://youtube.com/results?search_query=react+flushSync+tamil,https://youtube.com/results?search_query=react+flushSync+telugu
React,intermediate,What is the recommended way to read an up-to-date value inside an async callback?,Use functional update form of setState,Use useRef to store the value,Use useEffect to sync the value,All of the above,D,All approaches are valid; functional updates and refs are most common,State,https://react.dev/reference/react/useState#updating-state-based-on-the-previous-state,https://youtube.com/results?search_query=react+stale+state+closure,https://youtube.com/results?search_query=react+stale+closure+hindi,https://youtube.com/results?search_query=react+stale+closure+kannada,https://youtube.com/results?search_query=react+stale+closure+tamil,https://youtube.com/results?search_query=react+stale+closure+telugu
React,intermediate,Why do we sometimes see stale props or state in useEffect?,Because closures capture values from the render they were created in,Because useEffect runs before render,Because React batches effects,Because dependencies are wrong,A,Closures capture the values from the render when the effect was defined,Hooks,https://react.dev/learn/lifecycles-in-react#the-problem-with-stale-closures,https://youtube.com/results?search_query=react+stale+props+useEffect,https://youtube.com/results?search_query=react+stale+props+hindi,https://youtube.com/results?search_query=react+stale+props+kannada,https://youtube.com/results?search_query=react+stale+props+tamil,https://youtube.com/results?search_query=react+stale+props+telugu
React,intermediate,What pattern fixes stale closures in callbacks inside useEffect?,Use functional setState,Add function to dependency array,Use useRef to store mutable value,All of the above,D,All are valid solutions depending on the exact situation,Hooks,https://react.dev/learn/lifecycles-in-react#the-problem-with-stale-closures,https://youtube.com/results?search_query=react+stale+closure+fix,https://youtube.com/results?search_query=react+stale+closure+hindi,https://youtube.com/results?search_query=react+stale+closure+kannada,https://youtube.com/results?search_query=react+stale+closure+tamil,https://youtube.com/results?search_query=react+stale+closure+telugu
React,intermediate,Which hook lets you imperatively manipulate the DOM?,useRef,useImperativeHandle,useLayoutEffect,useEffect,C,useImperativeHandle customizes the instance value exposed when using ref on a component,Advanced Hooks,https://react.dev/reference/react/useImperativeHandle,https://youtube.com/results?search_query=react+useImperativeHandle,https://youtube.com/results?search_query=useImperativeHandle+hindi,https://youtube.com/results?search_query=useImperativeHandle+kannada,https://youtube.com/results?search_query=useImperativeHandle+tamil,https://youtube.com/results?search_query=useImperativeHandle+telugu
React,intermediate,When should you use useLayoutEffect instead of useEffect?,When you need to read layout before browser paints,When fetching data,When setting up subscriptions,When cleaning up intervals,A,useLayoutEffect runs synchronously after DOM mutations but before paint.,Advanced Hooks,https://react.dev/reference/react/useLayoutEffect,https://youtube.com/results?search_query=react+useLayoutEffect+vs+useEffect,https://youtube.com/results?search_query=useLayoutEffect+hindi,https://youtube.com/results?search_query=useLayoutEffect+kannada,https://youtube.com/results?search_query=useLayoutEffect+tamil,https://youtube.com/results?search_query=useLayoutEffect+telugu
React,intermediate,What is the main difference between useEffect and useLayoutEffect?,useLayoutEffect runs before browser paint, useEffect after paint,They run at the same time,Only useLayoutEffect has cleanup,Only useEffect supports async,A,useLayoutEffect is synchronous and blocks paint; useEffect is async and does not.,Advanced Hooks,https://react.dev/reference/react/useLayoutEffect,https://youtube.com/results?search_query=useLayoutEffect+vs+useEffect,https://youtube.com/results?search_query=useLayoutEffect+vs+useEffect+hindi,https://youtube.com/results?search_query=useLayoutEffect+vs+useEffect+kannada,https://youtube.com/results?search_query=useLayoutEffect+vs+useEffect+tamil,https://youtube.com/results?search_query=useLayoutEffect+vs+useEffect+telugu
React,intermediate,Which pattern should you use to forward a ref to a child DOM element?,useImperativeHandle + forwardRef,forwardRef only,createRef + useRef,React.forwardRef + useImperativeHandle,D,forwardRef passes the ref down; useImperativeHandle customizes the exposed ref.,Advanced Hooks,https://react.dev/reference/react/forwardRef,https://youtube.com/results?search_query=react+forwardRef+useImperativeHandle,https://youtube.com/results?search_query=forwardRef+hindi,https://youtube.com/results?search_query=forwardRef+kannada,https://youtube.com/results?search_query=forwardRef+tamil,https://youtube.com/results?search_query=forwardRef+telugu
React,intermediate,What is the purpose of React.forwardRef?,To forward a ref from parent to child DOM node,To create refs automatically,To memoize components,To handle context forwarding,A,forwardRef lets a parent component pass a ref to a child DOM element.,Advanced Hooks,https://react.dev/reference/react/forwardRef,https://youtube.com/results?search_query=react+forwardRef,https://youtube.com/results?search_query=forwardRef+hindi,https://youtube.com/results?search_query=forwardRef+kannada,https://youtube.com/results?search_query=forwardRef+tamil,https://youtube.com/results?search_query=forwardRef+telugu
React,intermediate,How do you expose imperative methods from a function component?,useImperativeHandle + forwardRef,useRef + expose method,createRef + attach method,All of the above,A,forwardRef + useImperativeHandle is the standard pattern.,Advanced Hooks,https://react.dev/reference/react/useImperativeHandle,https://youtube.com/results?search_query=react+useImperativeHandle+example,https://youtube.com/results?search_query=useImperativeHandle+hindi,https://youtube.com/results?search_query=useImperativeHandle+kannada,https://youtube.com/results?search_query=useImperativeHandle+tamil,https://youtube.com/results?search_query=useImperativeHandle+telugu
React,intermediate,When is useImperativeHandle useful?,When parent needs to control child imperative API (focus, scroll, etc.),When child needs to read parent state,When using Context API,When memoizing functions,A,Common for <input ref={ref} />.focus() from parent.,Advanced Hooks,https://react.dev/reference/react/useImperativeHandle,https://youtube.com/results?search_query=when+to+use+useImperativeHandle,https://youtube.com/results?search_query=useImperativeHandle+use+hindi,https://youtube.com/results?search_query=useImperativeHandle+use+kannada,https://youtube.com/results?search_query=useImperativeHandle+use+tamil,https://youtube.com/results?search_query=useImperativeHandle+use+telugu
React,intermediate,What does the flushSync function from react-dom do?,Forces synchronous render (breaks batching),Flushes pending state updates,Forces layout effect to run,All of the above,D,flushSync forces immediate commit (useful when you need DOM to update synchronously).,React 18,https://react.dev/reference/react-dom/flushSync,https://youtube.com/results?search_query=react+flushSync,https://youtube.com/results?search_query=flushSync+hindi,https://youtube.com/results?search_query=flushSync+kannada,https://youtube.com/results?search_query=flushSync+tamil,https://youtube.com/results?search_query=flushSync+telugu
React,intermediate,In which scenario would you use flushSync?,When you need to read layout measurement right after a state update,When batching is desired,When using legacy code only,When writing tests,A,flushSync is useful when setState must update DOM synchronously (e.g. before measuring position).,React 18,https://react.dev/reference/react-dom/flushSync,https://youtube.com/results?search_query=when+to+use+flushSync+react,https://youtube.com/results?search_query=flushSync+use+hindi,https://youtube.com/results?search_query=flushSync+use+kannada,https://youtube.com/results?search_query=flushSync+use+tamil,https://youtube.com/results?search_query=flushSync+use+telugu
React,intermediate,What is the primary benefit of React's concurrent rendering?,Ability to interrupt and prioritize rendering work,Automatic memoization,Built-in routing,Server components support,A,Concurrent mode allows React to pause low-priority work for high-priority updates.,Concurrent Mode,https://react.dev/learn/react-18-concurrent-features,https://youtube.com/results?search_query=react+concurrent+mode,https://youtube.com/results?search_query=concurrent+mode+hindi,https://youtube.com/results?search_query=concurrent+mode+kannada,https://youtube.com/results?search_query=concurrent+mode+tamil,https://youtube.com/results?search_query=concurrent+mode+telugu
React,intermediate,Which hook marks state updates as low-priority in React 18?,useTransition,useDeferredValue,useSyncExternalStore,useInsertionEffect,A,useTransition marks updates as non-urgent so React can interrupt them.,Concurrent Mode,https://react.dev/reference/react/useTransition,https://youtube.com/results?search_query=react+useTransition,https://youtube.com/results?search_query=useTransition+hindi,https://youtube.com/results?search_query=useTransition+kannada,https://youtube.com/results?search_query=useTransition+tamil,https://youtube.com/results?search_query=useTransition+telugu
React,intermediate,What does useDeferredValue return?,A deferred (lagged) version of the value,An immediate value,The previous value,A debounced value,A,useDeferredValue lags the value so UI can stay responsive during heavy updates.,Concurrent Mode,https://react.dev/reference/react/useDeferredValue,https://youtube.com/results?search_query=react+useDeferredValue,https://youtube.com/results?search_query=useDeferredValue+hindi,https://youtube.com/results?search_query=useDeferredValue+kannada,https://youtube.com/results?search_query=useDeferredValue+tamil,https://youtube.com/results?search_query=useDeferredValue+telugu
React,intermediate,When is useDeferredValue preferred over debouncing?,When you want to keep the UI responsive while typing or filtering,When you need exact timing,When using class components,When managing form submissions,A,useDeferredValue is declarative and integrates with React's scheduler.,Concurrent Mode,https://react.dev/reference/react/useDeferredValue,https://youtube.com/results?search_query=when+to+use+useDeferredValue,https://youtube.com/results?search_query=useDeferredValue+when+hindi,https://youtube.com/results?search_query=useDeferredValue+when+kannada,https://youtube.com/results?search_query=useDeferredValue+when+tamil,https://youtube.com/results?search_query=useDeferredValue+when+telugu
React,intermediate,What is the main purpose of Suspense in React?,To show fallback UI while loading components or data,To handle errors,To manage state updates,To lazy load CSS, A,Suspense displays fallback content during lazy loading or data fetching.,Suspense,https://react.dev/reference/react/Suspense,https://youtube.com/results?search_query=react+suspense+explained,https://youtube.com/results?search_query=react+suspense+hindi,https://youtube.com/results?search_query=react+suspense+kannada,https://youtube.com/results?search_query=react+suspense+tamil,https://youtube.com/results?search_query=react+suspense+telugu
React,intermediate,How do you combine React.lazy with Suspense?,Wrap lazy component in <Suspense fallback={<Spinner />}> ,Use lazy inside useEffect,Use Suspense only for data fetching,Use lazy without Suspense,A,<Suspense fallback={<Loading />}> <LazyComponent /> </Suspense>,Suspense,https://react.dev/reference/react/lazy#with-suspense,https://youtube.com/results?search_query=react+lazy+suspense,https://youtube.com/results?search_query=react+lazy+hindi,https://youtube.com/results?search_query=react+lazy+kannada,https://youtube.com/results?search_query=react+lazy+tamil,https://youtube.com/results?search_query=react+lazy+telugu
React,intermediate,What is code splitting in React?,Loading only the code needed for the current route/view,Minifying JavaScript files,Removing unused imports,Using tree shaking,A,React.lazy + Suspense enables dynamic import / code splitting.,Performance,https://react.dev/reference/react/lazy,https://youtube.com/results?search_query=react+code+splitting,https://youtube.com/results?search_query=react+code+splitting+hindi,https://youtube.com/results?search_query=react+code+splitting+kannada,https://youtube.com/results?search_query=react+code+splitting+tamil,https://youtube.com/results?search_query=react+code+splitting+telugu
React,intermediate,Which component is required to show a loading state during code splitting?,Suspense,ErrorBoundary,LoadingSpinner,Transition,A,<Suspense fallback={<Loading />} > wraps lazy components.,Performance,https://react.dev/reference/react/Suspense,https://youtube.com/results?search_query=react+suspense+code+splitting,https://youtube.com/results?search_query=react+suspense+code+hindi,https://youtube.com/results?search_query=react+suspense+code+kannada,https://youtube.com/results?search_query=react+suspense+code+tamil,https://youtube.com/results?search_query=react+suspense+code+telugu
React,intermediate,What is the main advantage of using React.memo over PureComponent?,It works with function components,It does deep comparison,It supports hooks,It is faster,A,React.memo is the function-component version of PureComponent (shallow prop compare).,Performance,https://react.dev/reference/react/memo,https://youtube.com/results?search_query=react+memo+vs+purecomponent,https://youtube.com/results?search_query=react+memo+vs+pure+hindi,https://youtube.com/results?search_query=react+memo+vs+pure+kannada,https://youtube.com/results?search_query=react+memo+vs+pure+tamil,https://youtube.com/results?search_query=react+memo+vs+pure+telugu
React,intermediate,In which scenario is React.memo most effective?,When props change infrequently but parent re-renders often,When component has heavy render logic,When using class components,When using Context only,A,Memoization prevents wasteful renders when props are stable.,Performance,https://react.dev/reference/react/memo#when-to-use-memo,https://youtube.com/results?search_query=when+to+use+react+memo,https://youtube.com/results?search_query=react+memo+scenario+hindi,https://youtube.com/results?search_query=react+memo+scenario+kannada,https://youtube.com/results?search_query=react+memo+scenario+tamil,https://youtube.com/results?search_query=react+memo+scenario+telugu
React,intermediate,What is the key difference between useMemo and memoizing with React.memo?,useMemo memoizes a value, React.memo memoizes a component,They are identical,One is for state, one for props,A,useMemo caches any value; React.memo prevents component re-render.,Performance,https://react.dev/reference/react/useMemo#usememo-vs-reactmemo,https://youtube.com/results?search_query=useMemo+vs+react+memo,https://youtube.com/results?search_query=useMemo+vs+memo+hindi,https://youtube.com/results?search_query=useMemo+vs+memo+kannada,https://youtube.com/results?search_query=useMemo+vs+memo+tamil,https://youtube.com/results?search_query=useMemo+vs+memo+telugu
React,intermediate,How can you prevent a child from re-rendering when its parent re-renders?,Wrap child in React.memo(),Use useMemo on child props,Use useCallback on callbacks passed to child,All of the above,D,All three techniques help avoid unnecessary child renders.,Performance,https://react.dev/learn/performance,https://youtube.com/results?search_query=react+prevent+child+re-render,https://youtube.com/results?search_query=react+prevent+re-render+hindi,https://youtube.com/results?search_query=react+prevent+re-render+kannada,https://youtube.com/results?search_query=react+prevent+re-render+tamil,https://youtube.com/results?search_query=react+prevent+re-render+telugu
React,intermediate,What is the purpose of useTransition in React 18?,To mark low-priority state updates so React can interrupt them,To delay all state updates,To batch effects,To disable concurrent mode,A,useTransition allows non-urgent UI updates to be interruptible.,Concurrent Mode,https://react.dev/reference/react/useTransition,https://youtube.com/results?search_query=react+useTransition+explained,https://youtube.com/results?search_query=useTransition+hindi,https://youtube.com/results?search_query=useTransition+kannada,https://youtube.com/results?search_query=useTransition+tamil,https://youtube.com/results?search_query=useTransition+telugu
React,intermediate,In which scenario is useDeferredValue most useful?,When typing in a search input that filters a large list,When fetching data on mount,When updating theme,When submitting forms,A,useDeferredValue lags the search term so UI stays responsive while filtering.,Concurrent Mode,https://react.dev/reference/react/useDeferredValue,https://youtube.com/results?search_query=react+useDeferredValue+example,https://youtube.com/results?search_query=useDeferredValue+hindi,https://youtube.com/results?search_query=useDeferredValue+kannada,https://youtube.com/results?search_query=useDeferredValue+tamil,https://youtube.com/results?search_query=useDeferredValue+telugu
React,intermediate,What is the benefit of SuspenseList in React?,To coordinate reveal order of multiple Suspense boundaries,To replace all Suspense components,To lazy load CSS,To handle errors,A,SuspenseList controls the order in which fallbacks disappear.,Concurrent Mode,https://react.dev/reference/react/SuspenseList,https://youtube.com/results?search_query=react+SuspenseList,https://youtube.com/results?search_query=SuspenseList+hindi,https://youtube.com/results?search_query=SuspenseList+kannada,https://youtube.com/results?search_query=SuspenseList+tamil,https://youtube.com/results?search_query=SuspenseList+telugu
