skill,level,question_text,option_a,option_b,option_c,option_d,correct_answer,explanation,topic,mdn_link,youtube_english,youtube_hindi,youtube_kannada,youtube_tamil,youtube_telugu
Ruby,Advanced,Explain Ruby's money gem for currency handling,Finance,Currency,Money gem, currency, monetary values,Money gem provides currency handling: arithmetic, conversion, formatting. Use for financial calculations.,https://github.com/RubyMoney/money,https://youtube.com/results?search_query=ruby+money+gem,https://youtube.com/results?search_query=ruby+money+gem+hindi,https://youtube.com/results?search_query=ruby+money+gem+kannada,https://youtube.com/results?search_query=ruby+money+gem+tamil,https://youtube.com/results?search_query=ruby+money+gem+telugu
Ruby,Advanced,What are Ruby's i18n and localization?,Internationalization,Localization,I18n, localization, translation,I18n provides internationalization: locale files, interpolation, pluralization. Use for multi-language applications.,https://github.com/ruby-i18n/i18n,https://youtube.com/results?search_query=ruby+i18n,https://youtube.com/results?search_query=ruby+i18n+hindi,https://youtube.com/results?search_query=ruby+i18n+kannada,https://youtube.com/results?search_query=ruby+i18n+tamil,https://youtube.com/results?search_query=ruby+i18n+telugu
Ruby,Advanced,Explain Ruby's paper_trail for auditing,Auditing,Versioning,PaperTrail, auditing, versioning,PaperTrail tracks changes to models: who, what, when. Use for audit trails and version history.,https://github.com/paper-trail-gem/paper_trail,https://youtube.com/results?search_query=ruby+paper+trail,https://youtube.com/results?search_query=ruby+paper+trail+hindi,https://youtube.com/results?search_query=ruby+paper+trail+kannada,https://youtube.com/results?search_query=ruby+paper+trail+tamil,https://youtube.com/results?search_query=ruby+paper+trail+telugu
Ruby,Advanced,What is Ruby's friendly_id for SEO-friendly URLs?,SEO,URLs,FriendlyId, slugs, SEO-friendly URLs,FriendlyId creates human-readable URLs from model attributes. Use for better SEO and user experience.,https://github.com/norman/friendly_id,https://youtube.com/results?search_query=ruby+friendly+id,https://youtube.com/results?search_query=ruby+friendly+id+hindi,https://youtube.com/results?search_query=ruby+friendly+id+kannada,https://youtube.com/results?search_query=ruby+friendly+id+tamil,https://youtube.com/results?search_query=ruby+friendly+id+telugu
Ruby,Advanced,Explain Ruby's sorbet and type checking,Type Safety,Static Typing,Sorbet, type checking, static analysis,Sorbet adds static type checking to Ruby. Gradual typing: add types incrementally. Use for large codebases.,https://sorbet.org/,https://youtube.com/results?search_query=ruby+sorbet,https://youtube.com/results?search_query=ruby+sorbet+hindi,https://youtube.com/results?search_query=ruby+sorbet+kannada,https://youtube.com/results?search_query=ruby+sorbet+tamil,https://youtube.com/results?search_query=ruby+sorbet+telugu
Ruby,Advanced,What are Ruby's steep and RBS for type signatures?,Type Safety,Type Annotations,Steep, RBS, type signatures,RBS is Ruby type signature language. Steep is type checker using RBS. Use with Sorbet for type safety.,https://github.com/soutaro/steep,https://youtube.com/results?search_query=ruby+steep+rbs,https://youtube.com/results?search_query=ruby+steep+rbs+hindi,https://youtube.com/results?search_query=ruby+steep+rbs+kannada,https://youtube.com/results?search_query=ruby+steep+rbs+tamil,https://youtube.com/results?search_query=ruby+steep+rbs+telugu
Ruby,Advanced,Explain Ruby's debugger and byebug for debugging,Debugging,Tools,Debugger, byebug, breakpoints,The debugger gem (Ruby 3.1+) provides debugging. byebug is popular alternative. Use binding.break for breakpoints.,https://github.com/ruby/debug,https://youtube.com/results?search_query=ruby+debugger,https://youtube.com/results?search_query=ruby+debugger+hindi,https://youtube.com/results?search_query=ruby+debugger+kannada,https://youtube.com/results?search_query=ruby+debugger+tamil,https://youtube.com/results?search_query=ruby+debugger+telugu
Ruby,Advanced,What is Ruby's ruby-prof for profiling?,Performance,Profiling,Ruby-prof, profiling, call graphs,ruby-prof is sampling profiler. Provides call graphs, flat profiles. Use for performance optimization.,https://github.com/ruby-prof/ruby-prof,https://youtube.com/results?search_query=ruby+profiler,https://youtube.com/results?search_query=ruby+profiler+hindi,https://youtube.com/results?search_query=ruby+profiler+kannada,https://youtube.com/results?search_query=ruby+profiler+tamil,https://youtube.com/results?search_query=ruby+profiler+telugu
Ruby,Advanced,Explain Ruby's celluloid-io for async I/O,Concurrency,Async I/O,Celluloid-io, async I/O, event-driven,Celluloid-io provides async I/O using celluloid. Reactor pattern for non-blocking operations. Use for high concurrency.,https://github.com/celluloid/celluloid-io,https://youtube.com/results?search_query=ruby+celluloid+io,https://youtube.com/results?search_query=ruby+celluloid+io+hindi,https://youtube.com/results?search_query=ruby+celluloid+io+kannada,https://youtube.com/results?search_query=ruby+celluloid+io+tamil,https://youtube.com/results?search_query=ruby+celluloid+io+telugu
Ruby,Advanced,What are Ruby's concurrent features in Ruby 3?,Language Features,Concurrency,Fiber scheduler, Ractors, async/await,Ruby 3 adds Fiber scheduler for async I/O, Ractors for parallelism. Use for high-performance concurrent applications.,https://ruby-doc.org/core-3.1.2/doc/syntax/control_expressions_rdoc.html,https://youtube.com/results?search_query=ruby+3+concurrency,https://youtube.com/results?search_query=ruby+3+concurrency+hindi,https://youtube.com/results?search_query=ruby+3+concurrency+kannada,https://youtube.com/results?search_query=ruby+3+concurrency+tamil,https://youtube.com/results?search_query=ruby+3+concurrency+telugu
Ruby,Advanced,Explain Ruby's pattern matching in case statements,Language Features,Pattern Matching,Case pattern matching, deconstruction, guard clauses,Ruby 2.7+ supports pattern matching in case: case value; in [x, y] if x > y. Use for complex conditional logic.,https://ruby-doc.org/core-3.1.2/doc/syntax/pattern_matching_rdoc.html,https://youtube.com/results?search_query=ruby+case+pattern,https://youtube.com/results?search_query=ruby+case+pattern+hindi,https://youtube.com/results?search_query=ruby+case+pattern+kannada,https://youtube.com/results?search_query=ruby+case+pattern+tamil,https://youtube.com/results?search_query=ruby+case+pattern+telugu
Ruby,Advanced,What is Ruby's data class proposal and value objects?,Language Features,Data Classes,Data class, value objects, immutable,Data class proposal (Ruby 3.2+) provides simple value objects. Immutable with positional or keyword initialization.,https://bugs.ruby-lang.org/issues/16122,https://youtube.com/results?search_query=ruby+data+class,https://youtube.com/results?search_query=ruby+data+class+hindi,https://youtube.com/results?search_query=ruby+data+class+kannada,https://youtube.com/results?search_query=ruby+data+class+tamil,https://youtube.com/results?search_query=ruby+data+class+telugu
Ruby,Advanced,Explain Ruby's endless method definition syntax,Language Features,Method Syntax,Endless methods, one-line methods,Ruby 3.0+ supports endless methods: def method = expression. Returns expression value. Clean for simple methods.,https://ruby-doc.org/core-3.1.2/doc/syntax/methods_rdoc.html,https://youtube.com/results?search_query=ruby+endless+method,https://youtube.com/results?search_query=ruby+endless+method+hindi,https://youtube.com/results?search_query=ruby+endless+method+kannada,https://youtube.com/results?search_query=ruby+endless+method+tamil,https://youtube.com/results?search_query=ruby+endless+method+telugu
Ruby,Advanced,What are Ruby's numbered block parameters?,Language Features,Block Parameters,Numbered parameters, _1, _2, implicit blocks,Ruby 2.7+ supports numbered parameters: array.map { _1 * 2 }. _1 is first parameter, _2 second, etc. Use for concise blocks.,https://ruby-doc.org/core-3.1.2/doc/syntax/literals_rdoc.html,https://youtube.com/results?search_query=ruby+numbered+parameters,https://youtube.com/results?search_query=ruby+numbered+parameters+hindi,https://youtube.com/results?search_query=ruby+numbered+parameters+kannada,https://youtube.com/results?search_query=ruby+numbered+parameters+tamil,https://youtube.com/results?search_query=ruby+numbered+parameters+telugu
Ruby,Advanced,Explain Ruby's find pattern in pattern matching,Language Features,Pattern Matching,Find pattern, variable binding, pattern matching,Find pattern in pattern matching: case array; in [*, x, *, y, *]. Matches elements anywhere in sequence.,https://ruby-doc.org/core-3.1.2/doc/syntax/pattern_matching_rdoc.html,https://youtube.com/results?search_query=ruby+find+pattern,https://youtube.com/results?search_query=ruby+find+pattern+hindi,https://youtube.com/results?search_query=ruby+find+pattern+kannada,https://youtube.com/results?search_query=ruby+find+pattern+tamil,https://youtube.com/results?search_query=ruby+find+pattern+telugu
Ruby,Advanced,What is Ruby's rightward assignment operator?,Language Features,Operators,Rightward assignment, =>, pattern matching,Rightward assignment: expression => pattern. Useful in pattern matching and destructuring. Example: {a: 1} => {a:}.,https://ruby-doc.org/core-3.1.2/doc/syntax/pattern_matching_rdoc.html,https://youtube.com/results?search_query=ruby+rightward+assignment,https://youtube.com/results?search_query=ruby+rightward+assignment+hindi,https://youtube.com/results?search_query=ruby+rightward+assignment+kannada,https://youtube.com/results?search_query=ruby+rightward+assignment+tamil,https://youtube.com/results?search_query=ruby+rightward+assignment+telugu
Ruby,Advanced,Explain Ruby's shareable_constant_value pragma,Concurrency,Constants,Shareable_constant_value, Ractor-shared constants,shareable_constant_value pragma makes constants Ractor-shared. Use for frozen arrays/hashes shared between Ractors.,https://ruby-doc.org/core-3.1.2/doc/syntax/comments_rdoc.html,https://youtube.com/results?search_query=ruby+shareable+constant,https://youtube.com/results?search_query=ruby+shareable+constant+hindi,https://youtube.com/results?search_query=ruby+shareable+constant+kannada,https://youtube.com/results?search_query=ruby+shareable+constant+tamil,https://youtube.com/results?search_query=ruby+shareable+constant+telugu
Ruby,Advanced,What are Ruby's experimental features and warnings?,Development,Language Evolution,Experimental features, warning categories,Ruby has experimental features with warnings. Use Warning[] to control warnings. Experimental features may change.,https://ruby-doc.org/core-3.1.2/Warning.html,https://youtube.com/results?search_query=ruby+experimental+features,https://youtube.com/results?search_query=ruby+experimental+features+hindi,https://youtube.com/results?search_query=ruby+experimental+features+kannada,https://youtube.com/results?search_query=ruby+experimental+features+tamil,https://youtube.com/results?search_query=ruby+experimental+features+telugu
Ruby,Advanced,Explain Ruby's RubyVM::AST for abstract syntax trees,Language Internals,AST,Abstract syntax tree, parse tree, code analysis,RubyVM::AST provides access to Ruby AST. Use parse, parse_file. Useful for static analysis and code transformation.,https://ruby-doc.org/core-3.1.2/RubyVM/AST.html,https://youtube.com/results?search_query=ruby+ast+parsing,https://youtube.com/results?search_query=ruby+ast+parsing+hindi,https://youtube.com/results?search_query=ruby+ast+parsing+kannada,https://youtube.com/results?search_query=ruby+ast+parsing+tamil,https://youtube.com/results?search_query=ruby+ast+parsing+telugu
Ruby,Advanced,What is Ruby's GC.compact for memory defragmentation?,Memory Management,Garbage Collection,GC.compact, memory compaction, fragmentation,GC.compact (Ruby 2.7+) reduces memory fragmentation by moving objects. Improves cache locality and memory usage.,https://ruby-doc.org/core-3.1.2/GC.html#method-c-compact,https://youtube.com/results?search_query=ruby+gc+compact,https://youtube.com/results?search_query=ruby+gc+compact+hindi,https://youtube.com/results?search_query=ruby+gc+compact+kannada,https://youtube.com/results?search_query=ruby+gc+compact+tamil,https://youtube.com/results?search_query=ruby+gc+compact+telugu
Ruby,Advanced,Explain Ruby's ObjectSpace.dump_all for heap analysis,Memory Management,Heap Analysis,ObjectSpace.dump_all, heap dump, memory analysis,ObjectSpace.dump_all writes heap to JSON. Use for debugging memory issues and leak detection.,https://ruby-doc.org/core-3.1.2/ObjectSpace.html#method-c-dump_all,https://youtube.com/results?search_query=ruby+heap+dump,https://youtube.com/results?search_query=ruby+heap+dump+hindi,https://youtube.com/results?search_query=ruby+heap+dump+kannada,https://youtube.com/results?search_query=ruby+heap+dump+tamil,https://youtube.com/results?search_query=ruby+heap+dump+telugu
Ruby,Advanced,What are Ruby's coverage for branch coverage?,Testing,Coverage,Branch coverage, condition coverage, edge coverage,Ruby 3.1+ supports branch coverage. Measures which branches executed in conditionals. Use Coverage.start(branches: true).,https://ruby-doc.org/stdlib-3.1.2/libdoc/coverage/rdoc/Coverage.html,https://youtube.com/results?search_query=ruby+branch+coverage,https://youtube.com/results?search_query=ruby+branch+coverage+hindi,https://youtube.com/results?search_query=ruby+branch+coverage+kannada,https://youtube.com/results?search_query=ruby+branch+coverage+tamil,https://youtube.com/results?search_query=ruby+branch+coverage+telugu
Ruby,Advanced,Explain Ruby's Socket.tcp for non-blocking sockets,Networking,Sockets,Socket.tcp, non-blocking, connect timeout,Socket.tcp with non-blocking option. Use for timeout control and async connection establishment.,https://ruby-doc.org/stdlib-3.1.2/libdoc/socket/rdoc/Socket.html#method-c-tcp,https://youtube.com/results?search_query=ruby+socket+tcp,https://youtube.com/results?search_query=ruby+socket+tcp+hindi,https://youtube.com/results?search_query=ruby+socket+tcp+kannada,https://youtube.com/results?search_query=ruby+socket+tcp+tamil,https://youtube.com/results?search_query=ruby+socket+tcp+telugu
Ruby,Advanced,What is Ruby's OpenURI for simplified HTTP?,Networking,HTTP,OpenURI, simplified HTTP, URI.open,OpenURI extends open to handle HTTP/HTTPS. Simple API but limited features. Use for quick HTTP requests.,https://ruby-doc.org/stdlib-3.1.2/libdoc/open-uri/rdoc/OpenURI.html,https://youtube.com/results?search_query=ruby+openuri,https://youtube.com/results?search_query=ruby+openuri+hindi,https://youtube.com/results?search_query=ruby+openuri+kannada,https://youtube.com/results?search_query=ruby+openuri+tamil,https://youtube.com/results?search_query=ruby+openuri+telugu
Ruby,Advanced,Explain Ruby's StringScanner for parsing,Text Processing,Parsing,StringScanner, lexical analysis, tokenization,StringScanner provides lexical scanning. Moves cursor through string. Use for parsing and tokenization.,https://ruby-doc.org/stdlib-3.1.2/libdoc/strscan/rdoc/StringScanner.html,https://youtube.com/results?search_query=ruby+stringscanner,https://youtube.com/results?search_query=ruby+stringscanner+hindi,https://youtube.com/results?search_query=ruby+stringscanner+kannada,https://youtube.com/results?search_query=ruby+stringscanner+tamil,https://youtube.com/results?search_query=ruby+stringscanner+telugu
Ruby,Advanced,What are Ruby's Abbrev and Soundex for text processing?,Text Processing,Algorithms,Abbrev, Soundex, text algorithms,Abbrev generates abbreviations. Soundex phonetic matching. Use for autocomplete and name matching.,https://ruby-doc.org/stdlib-3.1.2/libdoc/abbrev/rdoc/Abbrev.html,https://youtube.com/results?search_query=ruby+abbrev+soundex,https://youtube.com/results?search_query=ruby+abbrev+soundex+hindi,https://youtube.com/results?search_query=ruby+abbrev+soundex+kannada,https://youtube.com/results?search_query=ruby+abbrev+soundex+tamil,https://youtube.com/results?search_query=ruby+abbrev+soundex+telugu
Ruby,Advanced,Explain Ruby's WeakRef for weak references,Memory Management,Weak References,WeakRef, weak references, garbage collection,WeakRef doesn't prevent GC of referenced object. Use for caches without memory leaks. Access with WeakRef#__getobj__.,https://ruby-doc.org/stdlib-3.1.2/libdoc/weakref/rdoc/WeakRef.html,https://youtube.com/results?search_query=ruby+weakref,https://youtube.com/results?search_query=ruby+weakref+hindi,https://youtube.com/results?search_query=ruby+weakref+kannada,https://youtube.com/results?search_query=ruby+weakref+tamil,https://youtube.com/results?search_query=ruby+weakref+telugu
Ruby,Advanced,What is Ruby's TSort for topological sorting?,Algorithms,Graph Algorithms,TSort, topological sort, dependency resolution,TSort provides topological sorting. Use for dependency resolution and task scheduling.,https://ruby-doc.org/stdlib-3.1.2/libdoc/tsort/rdoc/TSort.html,https://youtube.com/results?search_query=ruby+tsort,https://youtube.com/results?search_query=ruby+tsort+hindi,https://youtube.com/results?search_query=ruby+tsort+kannada,https://youtube.com/results?search_query=ruby+tsort+tamil,https://youtube.com/results?search_query=ruby+tsort+telugu
Ruby,Advanced,Explain Ruby's Shellwords for shell escaping,Shell,Command Execution,Shellwords, shell escaping, command building,Shellwords escapes strings for shell commands. Use Shellwords.join for safe command building.,https://ruby-doc.org/stdlib-3.1.2/libdoc/shellwords/rdoc/Shellwords.html,https://youtube.com/results?search_query=ruby+shellwords,https://youtube.com/results?search_query=ruby+shellwords+hindi,https://youtube.com/results?search_query=ruby+shellwords+kannada,https://youtube.com/results?search_query=ruby+shellwords+tamil,https://youtube.com/results?search_query=ruby+shellwords+telugu
Ruby,Advanced,What are Ruby's Etc and Sys modules for system info?,System,System Information,Etc, Sys, system information, user info,Etc provides user/group info. Sys provides system calls. Use for system-level programming.,https://ruby-doc.org/stdlib-3.1.2/libdoc/etc/rdoc/Etc.html,https://youtube.com/results?search_query=ruby+etc+sys,https://youtube.com/results?search_query=ruby+etc+sys+hindi,https://youtube.com/results?search_query=ruby+etc+sys+kannada,https://youtube.com/results?search_query=ruby+etc+sys+tamil,https://youtube.com/results?search_query=ruby+etc+sys+telugu
Ruby,Advanced,Explain Ruby's Fiddle for C extensions,Extensions,C Extensions,Fiddle, C extensions, FFI,Fiddle provides FFI to C libraries. Alternative to C extensions. Use for calling C code without compilation.,https://ruby-doc.org/stdlib-3.1.2/libdoc/fiddle/rdoc/Fiddle.html,https://youtube.com/results?search_query=ruby+fiddle,https://youtube.com/results?search_query=ruby+fiddle+hindi,https://youtube.com/results?search_query=ruby+fiddle+kannada,https://youtube.com/results?search_query=ruby+fiddle+tamil,https://youtube.com/results?search_query=ruby+fiddle+telugu
Ruby,Advanced,What is Ruby's RubyGems and gem building?,Packaging,Gem Development,RubyGems, gem specification, gem building,RubyGems manages gem packaging. Use .gemspec file for metadata. Build with gem build, install with gem install.,https://guides.rubygems.org/,https://youtube.com/results?search_query=ruby+gem+building,https://youtube.com/results?search_query=ruby+gem+building+hindi,https://youtube.com/results?search_query=ruby+gem+building+kannada,https://youtube.com/results?search_query=ruby+gem+building+tamil,https://youtube.com/results?search_query=ruby+gem+building+telugu
Ruby,Advanced,Explain Ruby's Ruby 3.1 debugger integration,Debugging,Tools,Debugger integration, binding.break, breakpoints,Ruby 3.1 integrates debugger. Use binding.break for breakpoints. REPL at breakpoint with local variable access.,https://github.com/ruby/debug,https://youtube.com/results?search_query=ruby+3.1+debugger,https://youtube.com/results?search_query=ruby+3.1+debugger+hindi,https://youtube.com/results?search_query=ruby+3.1+debugger+kannada,https://youtube.com/results?search_query=ruby+3.1+debugger+tamil,https://youtube.com/results?search_query=ruby+3.1+debugger+telugu
Ruby,Advanced,What are Ruby's error highlighting in Ruby 3.1?,Development,Error Handling,Error highlighting, diagnostic messages,Ruby 3.1 highlights error location in code. Shows relevant lines and points to error. Improves debugging experience.,https://ruby-doc.org/core-3.1.2/doc/syntax/control_expressions_rdoc.html,https://youtube.com/results?search_query=ruby+error+highlighting,https://youtube.com/results?search_query=ruby+error+highlighting+hindi,https://youtube.com/results?search_query=ruby+error+highlighting+kannada,https://youtube.com/results?search_query=ruby+error+highlighting+tamil,https://youtube.com/results?search_query=ruby+error+highlighting+telugu
Ruby,Advanced,Explain Ruby's YJIT in Ruby 3.1+,Performance,JIT Compilation,YJIT, JIT compiler, performance,YJIT is new JIT compiler in Ruby 3.1 (experimental). Uses LIR (Lightweight IR) and inlines method calls. Faster for Rails.,https://ruby-doc.org/core-3.1.2/doc/jit_rdoc.html,https://youtube.com/results?search_query=ruby+yjit,https://youtube.com/results?search_query=ruby+yjit+hindi,https://youtube.com/results?search_query=ruby+yjit+kannada,https://youtube.com/results?search_query=ruby+yjit+tamil,https://youtube.com/results?search_query=ruby+yjit+telugu
Ruby,Advanced,What is Ruby's anonymous rest and keyword rest parameters?,Language Features,Parameters,Anonymous rest, keyword rest, **nil,Anonymous rest (*) and keyword rest (**) parameters. **nil explicitly rejects keyword arguments.,https://ruby-doc.org/core-3.1.2/doc/syntax/methods_rdoc.html,https://youtube.com/results?search_query=ruby+rest+parameters,https://youtube.com/results?search_query=ruby+rest+parameters+hindi,https://youtube.com/results?search_query=ruby+rest+parameters+kannada,https://youtube.com/results?search_query=ruby+rest+parameters+tamil,https://youtube.com/results?search_query=ruby+rest+parameters+telugu
Ruby,Advanced,Explain Ruby's pin operator in pattern matching,Language Features,Pattern Matching,Pin operator, ^, variable pinning,Pin operator (^) matches against variable value, not binding. Use in pattern matching to match existing variable.,https://ruby-doc.org/core-3.1.2/doc/syntax/pattern_matching_rdoc.html,https://youtube.com/results?search_query=ruby+pin+operator,https://youtube.com/results?search_query=ruby+pin+operator+hindi,https://youtube.com/results?search_query=ruby+pin+operator+kannada,https://youtube.com/results?search_query=ruby+pin+operator+tamil,https://youtube.com/results?search_query=ruby+pin+operator+telugu
Ruby,Advanced,What are Ruby's private attr_accessor and friends?,Metaprogramming,Accessors,Private attr_accessor, attr_reader, attr_writer,Private attr_accessor creates private getter/setter. Use private :attr_accessor after definition or private attr_accessor :var.,https://ruby-doc.org/core-3.1.2/Module.html#method-i-attr_accessor,https://youtube.com/results?search_query=ruby+private+attr_accessor,https://youtube.com/results?search_query=ruby+private+attr_accessor+hindi,https://youtube.com/results?search_query=ruby+private+attr_accessor+kannada,https://youtube.com/results?search_query=ruby+private+attr_accessor+tamil,https://youtube.com/results?search_query=ruby+private+attr_accessor+telugu
Ruby,Advanced,Explain Ruby's Module#attr with inheritance,Metaprogramming,Accessors,Attr, attribute inheritance, superclass attributes,Module#attr creates getter (and optionally setter). Inherited by subclasses. Redefinable in subclasses.,https://ruby-doc.org/core-3.1.2/Module.html#method-i-attr,https://youtube.com/results?search_query=ruby+attr+inheritance,https://youtube.com/results?search_query=ruby+attr+inheritance+hindi,https://youtube.com/results?search_query=ruby+attr+inheritance+kannada,https://youtube.com/results?search_query=ruby+attr+inheritance+tamil,https://youtube.com/results?search_query=ruby+attr+inheritance+telugu
Ruby,Advanced,What is Ruby's refinement module inclusion?,Metaprogramming,Refinements,Refinement include, module in refinement,Refinements can include modules. Included methods become part of refinement. Use for composing refinements.,https://ruby-doc.org/core-3.1.2/doc/syntax/refinements_rdoc.html,https://youtube.com/results?search_query=ruby+refinement+include,https://youtube.com/results?search_query=ruby+refinement+include+hindi,https://youtube.com/results?search_query=ruby+refinement+include+kannada,https://youtube.com/results?search_query=ruby+refinement+include+tamil,https://youtube.com/results?search_query=ruby+refinement+include+telugu
Ruby,Advanced,Explain Ruby's TracePoint for method coverage,Debugging,Profiling,TracePoint method coverage, defined_method event,TracePoint :defined_method event fires when method defined. Use for tracking method definitions and meta-programming.,https://ruby-doc.org/core-3.1.2/TracePoint.html,https://youtube.com/results?search_query=ruby+tracepoint+method,https://youtube.com/results?search_query=ruby+tracepoint+method+hindi,https://youtube.com/results?search_query=ruby+tracepoint+method+kannada,https://youtube.com/results?search_query=ruby+tracepoint+method+tamil,https://youtube.com/results?search_query=ruby+tracepoint+method+telugu
Ruby,Advanced,What are Ruby's Ractor exceptions and error handling?,Concurrency,Ractors,Ractor exceptions, remote error handling,Ractor exceptions raised in receiver Ractor. Use Ractor.select with move: false to handle exceptions. Isolated error handling.,https://ruby-doc.org/core-3.1.2/Ractor.html,https://youtube.com/results?search_query=ruby+ractor+exceptions,https://youtube.com/results?search_query=ruby+ractor+exceptions+hindi,https://youtube.com/results?search_query=ruby+ractor+exceptions+kannada,https://youtube.com/results?search_query=ruby+ractor+exceptions+tamil,https://youtube.com/results?search_query=ruby+ractor+exceptions+telugu
