skill,level,question_text,option_a,option_b,option_c,option_d,correct_answer,explanation,topic,mdn_link,youtube_english,youtube_hindi,youtube_kannada,youtube_tamil,youtube_telugu

Ruby,Advanced,Explain Ruby's object model and how method lookup works,Language Fundamentals,Object Model,Singleton classes, method lookup chain, ancestors,Method lookup: 1) Singleton class methods 2) Class methods 3) Included modules (last included first) 4) Superclass chain. Use .ancestors to see lookup chain.,https://ruby-doc.org/core-3.1.2/doc/syntax/modules_and_classes_rdoc.html,https://youtube.com/results?search_query=ruby+method+lookup,https://youtube.com/results?search_query=ruby+method+lookup+hindi,https://youtube.com/results?search_query=ruby+method+lookup+kannada,https://youtube.com/results?search_query=ruby+method+lookup+tamil,https://youtube.com/results?search_query=ruby+method+lookup+telugu
Ruby,Advanced,What are Ruby fibers and how do they differ from threads?,Concurrency,Fibers vs Threads,Fibers, cooperative multitasking, yield, resume,Fibers are lightweight concurrency primitives for cooperative multitasking. Unlike threads, they must explicitly yield control. Use Fiber.yield and Fiber#resume.,https://ruby-doc.org/core-3.1.2/Fiber.html,https://youtube.com/results?search_query=ruby+fibers,https://youtube.com/results?search_query=ruby+fibers+hindi,https://youtube.com/results?search_query=ruby+fibers+kannada,https://youtube.com/results?search_query=ruby+fibers+tamil,https://youtube.com/results?search_query=ruby+fibers+telugu
Ruby,Advanced,Explain Ruby's memory model and garbage collection algorithm,Performance,Memory Management,Major GC, minor GC, generational GC, marking, sweeping,Ruby 2.1+ uses generational GC with major/minor collections. Objects start in young generation, promoted after surviving collections. Uses tri-color marking.,https://ruby-doc.org/core-3.1.2/GC.html,https://youtube.com/results?search_query=ruby+garbage+collection,https://youtube.com/results?search_query=ruby+garbage+collection+hindi,https://youtube.com/results?search_query=ruby+garbage+collection+kannada,https://youtube.com/results?search_query=ruby+garbage+collection+tamil,https://youtube.com/results?search_query=ruby+garbage+collection+telugu
Ruby,Advanced,What is Ruby's constant lookup algorithm?,Language Fundamentals,Constants,Constant lookup, lexical scope, inheritance, ancestors,Constants lookup: 1) Lexical scope 2) Inheritance chain 3) Object space. Use :: for absolute lookup. Modules included in ancestors also searched.,https://ruby-doc.org/core-3.1.2/doc/syntax/modules_and_classes_rdoc.html,https://youtube.com/results?search_query=ruby+constant+lookup,https://youtube.com/results?search_query=ruby+constant+lookup+hindi,https://youtube.com/results?search_query=ruby+constant+lookup+kannada,https://youtube.com/results?search_query=ruby+constant+lookup+tamil,https://youtube.com/results?search_query=ruby+constant+lookup+telugu
Ruby,Advanced,Explain Ruby's method binding and unbinding,Metaprogramming,Binding,Method objects, unbind, bind, Method#unbind,Method objects can be unbound from original receiver and bound to new objects. Useful for dynamic dispatch: method.unbind.bind(new_receiver).call.,https://ruby-doc.org/core-3.1.2/Method.html,https://youtube.com/results?search_query=ruby+method+binding,https://youtube.com/results?search_query=ruby+method+binding+hindi,https://youtube.com/results?search_query=ruby+method+binding+kannada,https://youtube.com/results?search_query=ruby+method+binding+tamil,https://youtube.com/results?search_query=ruby+method+binding+telugu
Ruby,Advanced,What are Ruby refinements and their limitations?,Metaprogramming,Refinements,Refinements, using, refinement scoping,Refinements modify classes only in specific scope via 'using'. Limitations: 1) File scope 2) Not dynamic 3) No module inclusion refinement.,https://ruby-doc.org/core-3.1.2/doc/syntax/refinements_rdoc.html,https://youtube.com/results?search_query=ruby+refinements,https://youtube.com/results?search_query=ruby+refinements+hindi,https://youtube.com/results?search_query=ruby+refinements+kannada,https://youtube.com/results?search_query=ruby+refinements+tamil,https://youtube.com/results?search_query=ruby+refinements+telugu
Ruby,Advanced,Explain Ruby's tracepoint API for debugging,Debugging,TracePoint,TracePoint, events, hooks, call tracing,TracePoint hooks into Ruby execution: call, return, line, class, etc. Use TracePoint.trace { |tp| ... }. Be careful of performance.,https://ruby-doc.org/core-3.1.2/TracePoint.html,https://youtube.com/results?search_query=ruby+tracepoint,https://youtube.com/results?search_query=ruby+tracepoint+hindi,https://youtube.com/results?search_query=ruby+tracepoint+kannada,https://youtube.com/results?search_query=ruby+tracepoint+tamil,https://youtube.com/results?search_query=ruby+tracepoint+telugu
Ruby,Advanced,What is Ruby's Ractor model and thread safety?,Concurrency,Ractors,Ractors, actor model, thread safety, shareable objects,Ractors are Ruby's actor implementation for true parallelism. Each ractor has isolated objects; share only immutable or specially marked objects.,https://ruby-doc.org/core-3.1.2/Ractor.html,https://youtube.com/results?search_query=ruby+ractors,https://youtube.com/results?search_query=ruby+ractors+hindi,https://youtube.com/results?search_query=ruby+ractors+kannada,https://youtube.com/results?search_query=ruby+ractors+tamil,https://youtube.com/results?search_query=ruby+ractors+telugu
Ruby,Advanced,Explain Ruby's parser and AST manipulation,Language Internals,Parsing,Ripper, AST, parse tree, abstract syntax tree,Ruby's Ripper module provides access to parser and AST. Use Ripper.sexp(raw_code) to get AST. Useful for code analysis and transformation.,https://ruby-doc.org/stdlib-3.1.2/libdoc/ripper/rdoc/Ripper.html,https://youtube.com/results?search_query=ruby+ast+ripper,https://youtube.com/results?search_query=ruby+ast+ripper+hindi,https://youtube.com/results?search_query=ruby+ast+ripper+kannada,https://youtube.com/results?search_query=ruby+ast+ripper+tamil,https://youtube.com/results?search_query=ruby+ast+ripper+telugu
Ruby,Advanced,What are Ruby's enumerators and lazy evaluation?,Collections,Enumerators,Enumerator, lazy, infinite sequences, external iteration,Enumerators decouple iteration from data. Lazy enumerators enable infinite sequences and chained operations without intermediate arrays.,https://ruby-doc.org/core-3.1.2/Enumerator/Lazy.html,https://youtube.com/results?search_query=ruby+lazy+enumerators,https://youtube.com/results?search_query=ruby+lazy+enumerators+hindi,https://youtube.com/results?search_query=ruby+lazy+enumerators+kannada,https://youtube.com/results?search_query=ruby+lazy+enumerators+tamil,https://youtube.com/results?search_query=ruby+lazy+enumerators+telugu
Ruby,Advanced,Explain Ruby's method caching and inline caching,Performance,Optimization,Method cache, inline cache, global method cache,Ruby caches method lookups in inline caches at call sites. Global method cache invalidated on method definition. Use #prepend to see cache effects.,https://ruby-doc.org/core-3.1.2/doc/syntax/modules_and_classes_rdoc.html,https://youtube.com/results?search_query=ruby+method+caching,https://youtube.com/results?search_query=ruby+method+caching+hindi,https://youtube.com/results?search_query=ruby+method+caching+kannada,https://youtube.com/results?search_query=ruby+method+caching+tamil,https://youtube.com/results?search_query=ruby+method+caching+telugu
Ruby,Advanced,What is Ruby's binding of caller?,Metaprogramming,Binding,Binding.of_caller, frame introspection, caller binding,Requires binding_of_caller gem. Accesses binding of calling method. Powerful but dangerous - can modify caller's locals.,https://github.com/banister/binding_of_caller,https://youtube.com/results?search_query=ruby+binding+of+caller,https://youtube.com/results?search_query=ruby+binding+of+caller+hindi,https://youtube.com/results?search_query=ruby+binding+of+caller+kannada,https://youtube.com/results?search_query=ruby+binding+of+caller+tamil,https://youtube.com/results?search_query=ruby+binding+of+caller+telugu
Ruby,Advanced,Explain Ruby's autoload and zeitwerk constant loading,Modules,Loading,Autoload, zeitwerk, require, load,Autoload defers loading until constant accessed. Zeitwerk (Rails 6+) is modern autoloader with explicit conventions and thread safety.,https://ruby-doc.org/core-3.1.2/Kernel.html#method-i-autoload,https://youtube.com/results?search_query=ruby+autoload+zeitwerk,https://youtube.com/results?search_query=ruby+autoload+zeitwerk+hindi,https://youtube.com/results?search_query=ruby+autoload+zeitwerk+kannada,https://youtube.com/results?search_query=ruby+autoload+zeitwerk+tamil,https://youtube.com/results?search_query=ruby+autoload+zeitwerk+telugu
Ruby,Advanced,What are Ruby's finalizers and their risks?,Memory Management,Finalization,ObjectSpace.define_finalizer, garbage collection finalization,Finalizers run before object GC. Risks: 1) Can resurrect objects 2) Execution order undefined 3) Not guaranteed to run.,https://ruby-doc.org/core-3.1.2/ObjectSpace.html#method-c-define_finalizer,https://youtube.com/results?search_query=ruby+finalizers,https://youtube.com/results?search_query=ruby+finalizers+hindi,https://youtube.com/results?search_query=ruby+finalizers+kannada,https://youtube.com/results?search_query=ruby+finalizers+tamil,https://youtube.com/results?search_query=ruby+finalizers+telugu
Ruby,Advanced,Explain Ruby's coverage module for code analysis,Testing,Coverage,Coverage, code coverage, branch coverage,Ruby's Coverage module measures code execution. Use Coverage.start and Coverage.result. Supports line and branch coverage in Ruby 3.,https://ruby-doc.org/stdlib-3.1.2/libdoc/coverage/rdoc/Coverage.html,https://youtube.com/results?search_query=ruby+coverage+module,https://youtube.com/results?search_query=ruby+coverage+module+hindi,https://youtube.com/results?search_query=ruby+coverage+module+kannada,https://youtube.com/results?search_query=ruby+coverage+module+tamil,https://youtube.com/results?search_query=ruby+coverage+module+telugu
Ruby,Advanced,What is Ruby's prepend and how differs from include?,Modules,Inclusion,Prepend, include, method lookup, ancestors,Prepend inserts module before class in ancestors chain. Include inserts after. Prepend overrides class methods, include doesn't.,https://ruby-doc.org/core-3.1.2/Module.html#method-i-prepend,https://youtube.com/results?search_query=ruby+prepend+vs+include,https://youtube.com/results?search_query=ruby+prepend+vs+include+hindi,https://youtube.com/results?search_query=ruby+prepend+vs+include+kannada,https://youtube.com/results?search_query=ruby+prepend+vs+include+tamil,https://youtube.com/results?search_query=ruby+prepend+vs+include+telugu
Ruby,Advanced,Explain Ruby's method_added and singleton_method_added hooks,Metaprogramming,Hooks,Method hooks, method_added, singleton_method_added,These hooks fire when methods defined. method_added for instance methods, singleton_method_added for class/singleton methods.,https://ruby-doc.org/core-3.1.2/Module.html#method-i-method_added,https://youtube.com/results?search_query=ruby+method+hooks,https://youtube.com/results?search_query=ruby+method+hooks+hindi,https://youtube.com/results?search_query=ruby+method+hooks+kannada,https://youtube.com/results?search_query=ruby+method+hooks+tamil,https://youtube.com/results?search_query=ruby+method+hooks+telugu
Ruby,Advanced,What is Ruby's UnboundMethod and its use cases?,Metaprogramming,Method Objects,UnboundMethod, method objects, method manipulation,UnboundMethod is method not bound to object. Can bind to compatible objects. Useful for delegation patterns and dynamic dispatch.,https://ruby-doc.org/core-3.1.2/UnboundMethod.html,https://youtube.com/results?search_query=ruby+unboundmethod,https://youtube.com/results?search_query=ruby+unboundmethod+hindi,https://youtube.com/results?search_query=ruby+unboundmethod+kannada,https://youtube.com/results?search_query=ruby+unboundmethod+tamil,https://youtube.com/results?search_query=ruby+unboundmethod+telugu
Ruby,Advanced,Explain Ruby's instance_eval vs class_eval,Metaprogramming,Evaluation,instance_eval, class_eval, exec context, self modification,instance_eval changes self to receiver, class_eval opens class context. instance_eval defines singleton methods, class_eval defines instance methods.,https://ruby-doc.org/core-3.1.2/BasicObject.html#method-i-instance_eval,https://youtube.com/results?search_query=ruby+instance_eval+class_eval,https://youtube.com/results?search_query=ruby+instance_eval+class_eval+hindi,https://youtube.com/results?search_query=ruby+instance_eval+class_eval+kannada,https://youtube.com/results?search_query=ruby+instance_eval+class_eval+tamil,https://youtube.com/results?search_query=ruby+instance_eval+class_eval+telugu
Ruby,Advanced,What are Ruby's refinements and why were they introduced?,Metaprogramming,Refinements,Refinements, monkey patching, safe monkey patching,Refinements allow controlled monkey patching scoped to specific files/modules. Introduced to solve global namespace pollution from open classes.,https://ruby-doc.org/core-3.1.2/doc/syntax/refinements_rdoc.html,https://youtube.com/results?search_query=ruby+refinements+purpose,https://youtube.com/results?search_query=ruby+refinements+purpose+hindi,https://youtube.com/results?search_query=ruby+refinements+purpose+kannada,https://youtube.com/results?search_query=ruby+refinements+purpose+tamil,https://youtube.com/results?search_query=ruby+refinements+purpose+telugu
Ruby,Advanced,Explain Ruby's ObjectSpace and its performance implications,Memory Management,Object Introspection,ObjectSpace, each_object, garbage collection,ObjectSpace allows iteration over all live objects. Heavy performance impact - triggers full GC. Use only for debugging/profiling.,https://ruby-doc.org/core-3.1.2/ObjectSpace.html,https://youtube.com/results?search_query=ruby+objectspace,https://youtube.com/results?search_query=ruby+objectspace+hindi,https://youtube.com/results?search_query=ruby+objectspace+kannada,https://youtube.com/results?search_query=ruby+objectspace+tamil,https://youtube.com/results?search_query=ruby+objectspace+telugu
Ruby,Advanced,What is Ruby's Marshal module and security considerations?,Serialization,Marshalling,Marshal, serialization, security, remote code execution,Marshal serializes Ruby objects. Security risk: loading untrusted data can execute arbitrary code. Use with trusted data only.,https://ruby-doc.org/core-3.1.2/Marshal.html,https://youtube.com/results?search_query=ruby+marshal+security,https://youtube.com/results?search_query=ruby+marshal+security+hindi,https://youtube.com/results?search_query=ruby+marshal+security+kannada,https://youtube.com/results?search_query=ruby+marshal+security+tamil,https://youtube.com/results?search_query=ruby+marshal+security+telugu
Ruby,Advanced,Explain Ruby's GC::Profiler and memory profiling,Performance,Profiling,GC profiling, memory profiling, allocation tracing,GC::Profiler provides GC statistics. Use GC::Profiler.enable and GC::Profiler.report. Also ObjectSpace.trace_object_allocations.,https://ruby-doc.org/core-3.1.2/GC/Profiler.html,https://youtube.com/results?search_query=ruby+gc+profiler,https://youtube.com/results?search_query=ruby+gc+profiler+hindi,https://youtube.com/results?search_query=ruby+gc+profiler+kannada,https://youtube.com/results?search_query=ruby+gc+profiler+tamil,https://youtube.com/results?search_query=ruby+gc+profiler+telugu
Ruby,Advanced,What are Ruby's thread variables and thread-local storage?,Concurrency,Threading,Thread.current, thread variables, fiber-local variables,Thread.current[:var] for thread-local, Thread.current.thread_variable_set for fiber-local. Fiber-local variables inherited by child fibers.,https://ruby-doc.org/core-3.1.2/Thread.html,https://youtube.com/results?search_query=ruby+thread+variables,https://youtube.com/results?search_query=ruby+thread+variables+hindi,https://youtube.com/results?search_query=ruby+thread+variables+kannada,https://youtube.com/results?search_query=ruby+thread+variables+tamil,https://youtube.com/results?search_query=ruby+thread+variables+telugu
Ruby,Advanced,Explain Ruby's Queue and SizedQueue for thread communication,Concurrency,Thread Communication,Queue, SizedQueue, thread-safe queues,Queue is thread-safe FIFO. SizedQueue has fixed capacity, blocks when full. Use for producer-consumer patterns.,https://ruby-doc.org/core-3.1.2/Queue.html,https://youtube.com/results?search_query=ruby+queue+sizedqueue,https://youtube.com/results?search_query=ruby+queue+sizedqueue+hindi,https://youtube.com/results?search_query=ruby+queue+sizedqueue+kannada,https://youtube.com/results?search_query=ruby+queue+sizedqueue+tamil,https://youtube.com/results?search_query=ruby+queue+sizedqueue+telugu
Ruby,Advanced,What is Ruby's DRb and distributed objects?,Distributed Systems,DRb,Distributed Ruby, remote method invocation, marshalling,DRb allows objects in different Ruby processes to communicate. Uses Marshal for serialization. Security concerns with untrusted networks.,https://ruby-doc.org/stdlib-3.1.2/libdoc/drb/rdoc/DRb.html,https://youtube.com/results?search_query=ruby+drb,https://youtube.com/results?search_query=ruby+drb+hindi,https://youtube.com/results?search_query=ruby+drb+kannada,https://youtube.com/results?search_query=ruby+drb+tamil,https://youtube.com/results?search_query=ruby+drb+telugu
Ruby,Advanced,Explain Ruby's singleton class (eigenclass) inheritance,Metaprogramming,Singleton Classes,Eigenclass, singleton class, class << self,Singleton classes inherit from object's class. Each object has unique singleton class. Class methods live in class's singleton class.,https://ruby-doc.org/core-3.1.2/doc/syntax/modules_and_classes_rdoc.html,https://youtube.com/results?search_query=ruby+singleton+class,https://youtube.com/results?search_query=ruby+singleton+class+hindi,https://youtube.com/results?search_query=ruby+singleton+class+kannada,https://youtube.com/results?search_query=ruby+singleton+class+tamil,https://youtube.com/results?search_query=ruby+singleton+class+telugu
Ruby,Advanced,What are Ruby's private and protected visibility rules?,Language Fundamentals,Visibility,Private, protected, public, method visibility,Private: can only be called with implicit receiver. Protected: can be called by any instance of same class or descendants.,https://ruby-doc.org/core-3.1.2/doc/syntax/modules_and_classes_rdoc.html,https://youtube.com/results?search_query=ruby+private+protected,https://youtube.com/results?search_query=ruby+private+protected+hindi,https://youtube.com/results?search_query=ruby+private+protected+kannada,https://youtube.com/results?search_query=ruby+private+protected+tamil,https://youtube.com/results?search_query=ruby+private+protected+telugu
Ruby,Advanced,Explain Ruby's method_missing and respond_to_missing,Metaprogramming,Dynamic Methods,method_missing, respond_to_missing, dynamic dispatch,method_missing catches undefined methods. Must override respond_to_missing? for consistency. Use for DSLs and delegation.,https://ruby-doc.org/core-3.1.2/BasicObject.html#method-i-method_missing,https://youtube.com/results?search_query=ruby+method_missing,https://youtube.com/results?search_query=ruby+method_missing+hindi,https://youtube.com/results?search_query=ruby+method_missing+kannada,https://youtube.com/results?search_query=ruby+method_missing+tamil,https://youtube.com/results?search_query=ruby+method_missing+telugu
Ruby,Advanced,What is Ruby's REXML and Nokogiri for XML parsing?,Libraries,XML Parsing,REXML, Nokogiri, XML parsing, XPath,REXML is Ruby's built-in XML parser. Nokogiri is faster, C-based alternative with XPath/CSS support. Use Nokogiri for production.,https://ruby-doc.org/stdlib-3.1.2/libdoc/rexml/rdoc/REXML.html,https://youtube.com/results?search_query=ruby+xml+parsing,https://youtube.com/results?search_query=ruby+xml+parsing+hindi,https://youtube.com/results?search_query=ruby+xml+parsing+kannada,https://youtube.com/results?search_query=ruby+xml+parsing+tamil,https://youtube.com/results?search_query=ruby+xml+parsing+telugu
Ruby,Advanced,Explain Ruby's BigDecimal for precise decimal arithmetic,Numerics,Precision,BigDecimal, decimal arithmetic, floating point precision,BigDecimal provides arbitrary precision decimal arithmetic. Avoids floating point errors for financial calculations.,https://ruby-doc.org/stdlib-3.1.2/libdoc/bigdecimal/rdoc/BigDecimal.html,https://youtube.com/results?search_query=ruby+bigdecimal,https://youtube.com/results?search_query=ruby+bigdecimal+hindi,https://youtube.com/results?search_query=ruby+bigdecimal+kannada,https://youtube.com/results?search_query=ruby+bigdecimal+tamil,https://youtube.com/results?search_query=ruby+bigdecimal+telugu
Ruby,Advanced,What are Ruby's Set and SortedSet collections?,Collections,Sets,Set, SortedSet, unique collections, hash-based sets,Set stores unique elements using hash. SortedSet maintains order using red-black tree. Requires 'set' require.,https://ruby-doc.org/stdlib-3.1.2/libdoc/set/rdoc/Set.html,https://youtube.com/results?search_query=ruby+set+sortedset,https://youtube.com/results?search_query=ruby+set+sortedset+hindi,https://youtube.com/results?search_query=ruby+set+sortedset+kannada,https://youtube.com/results?search_query=ruby+set+sortedset+tamil,https://youtube.com/results?search_query=ruby+set+sortedset+telugu
Ruby,Advanced,Explain Ruby's CSV parsing with headers and converters,File I/O,CSV,CSV parsing, headers, converters, encoding,CSV module supports headers, type conversion, and encoding. Use CSV.foreach for streaming, CSV.read for small files.,https://ruby-doc.org/stdlib-3.1.2/libdoc/csv/rdoc/CSV.html,https://youtube.com/results?search_query=ruby+csv+parsing,https://youtube.com/results?search_query=ruby+csv+parsing+hindi,https://youtube.com/results?search_query=ruby+csv+parsing+kannada,https://youtube.com/results?search_query=ruby+csv+parsing+tamil,https://youtube.com/results?search_query=ruby+csv+parsing+telugu
Ruby,Advanced,What is Ruby's OpenStruct and its performance considerations?,Data Structures,OpenStruct,OpenStruct, dynamic attributes, performance overhead,OpenStruct creates objects with dynamic attributes using method_missing. Slower than Struct or Hash. Good for prototyping.,https://ruby-doc.org/stdlib-3.1.2/libdoc/ostruct/rdoc/OpenStruct.html,https://youtube.com/results?search_query=ruby+openstruct,https://youtube.com/results?search_query=ruby+openstruct+hindi,https://youtube.com/results?search_query=ruby+openstruct+kannada,https://youtube.com/results?search_query=ruby+openstruct+tamil,https://youtube.com/results?search_query=ruby+openstruct+telugu
Ruby,Advanced,Explain Ruby's Date, Time, and DateTime differences,Date/Time,Time Handling,Date, Time, DateTime, time zones, precision,Date: calendar date. Time: seconds since epoch with timezone. DateTime: historical dates with time. Use Time for modern timestamps.,https://ruby-doc.org/stdlib-3.1.2/libdoc/date/rdoc/Date.html,https://youtube.com/results?search_query=ruby+date+time,https://youtube.com/results?search_query=ruby+date+time+hindi,https://youtube.com/results?search_query=ruby+date+time+kannada,https://youtube.com/results?search_query=ruby+date+time+tamil,https://youtube.com/results?search_query=ruby+date+time+telugu
Ruby,Advanced,What are Ruby's procs, lambdas, and blocks differences?,Language Fundamentals,Callable Objects,Proc, lambda, block, return behavior, closure,Lambdas check arity, return from lambda. Procs don't check arity, return from enclosing method. Blocks are Proc objects.,https://ruby-doc.org/core-3.1.2/Proc.html,https://youtube.com/results?search_query=ruby+proc+lambda,https://youtube.com/results?search_query=ruby+proc+lambda+hindi,https://youtube.com/results?search_query=ruby+proc+lambda+kannada,https://youtube.com/results?search_query=ruby+proc+lambda+tamil,https://youtube.com/results?search_query=ruby+proc+lambda+telugu
Ruby,Advanced,Explain Ruby's URI and Net::HTTP modules,Networking,HTTP,URI, Net::HTTP, HTTP requests, REST,URI parses URLs. Net::HTTP makes HTTP requests. Use with OpenTimeout and ReadTimeout. Consider HTTParty for simpler API.,https://ruby-doc.org/stdlib-3.1.2/libdoc/uri/rdoc/URI.html,https://youtube.com/results?search_query=ruby+net+http,https://youtube.com/results?search_query=ruby+net+http+hindi,https://youtube.com/results?search_query=ruby+net+http+kannada,https://youtube.com/results?search_query=ruby+net+http+tamil,https://youtube.com/results?search_query=ruby+net+http+telugu
Ruby,Advanced,What is Ruby's YAML and Psych for configuration?,Serialization,YAML,YAML, Psych, configuration, serialization,YAML is human-readable serialization. Psych is Ruby's YAML parser. Use YAML.load_file for config. Security: use safe_load for untrusted data.,https://ruby-doc.org/stdlib-3.1.2/libdoc/psych/rdoc/Psych.html,https://youtube.com/results?search_query=ruby+yaml+psych,https://youtube.com/results?search_query=ruby+yaml+psych+hindi,https://youtube.com/results?search_query=ruby+yaml+psych+kannada,https://youtube.com/results?search_query=ruby+yaml+psych+tamil,https://youtube.com/results?search_query=ruby+yaml+psych+telugu
Ruby,Advanced,Explain Ruby's JSON parsing and generation,Serialization,JSON,JSON, parsing, generation, Oj gem,JSON module provides parse and generate. Oj gem is faster alternative. Use symbolize_names: true for symbol keys.,https://ruby-doc.org/stdlib-3.1.2/libdoc/json/rdoc/JSON.html,https://youtube.com/results?search_query=ruby+json+parsing,https://youtube.com/results?search_query=ruby+json+parsing+hindi,https://youtube.com/results?search_query=ruby+json+parsing+kannada,https://youtube.com/results?search_query=ruby+json+parsing+tamil,https://youtube.com/results?search_query=ruby+json+parsing+telugu
