skill,level,question_text,option_a,option_b,option_c,option_d,correct_answer,explanation,topic,mdn_link,youtube_english,youtube_hindi,youtube_kannada,youtube_tamil,youtube_telugu
Ruby,Advanced,What are Ruby's English library for readable aliases?,Readability,English Names,English library, $-variables, readable aliases,English library provides readable names for Perl-style variables: $INPUT_RECORD_SEPARATOR for $/.,https://ruby-doc.org/stdlib-3.1.2/libdoc/English/rdoc/English.html,https://youtube.com/results?search_query=ruby+english+library,https://youtube.com/results?search_query=ruby+english+library+hindi,https://youtube.com/results?search_query=ruby+english+library+kannada,https://youtube.com/results?search_query=ruby+english+library+tamil,https://youtube.com/results?search_query=ruby+english+library+telugu
Ruby,Advanced,Explain Ruby's getoptlong for command-line parsing,Command Line,Argument Parsing,GetoptLong, command-line options, argument parsing,GetoptLong parses command-line options with long/short forms. Similar to GNU getopt. Use for CLI tools.,https://ruby-doc.org/stdlib-3.1.2/libdoc/getoptlong/rdoc/GetoptLong.html,https://youtube.com/results?search_query=ruby+getoptlong,https://youtube.com/results?search_query=ruby+getoptlong+hindi,https://youtube.com/results?search_query=ruby+getoptlong+kannada,https://youtube.com/results?search_query=ruby+getoptlong+tamil,https://youtube.com/results?search_query=ruby+getoptlong+telugu
Ruby,Advanced,What is Ruby's optparse for option parsing?,Command Line,Option Parsing,OptionParser, option parsing, help generation,OptionParser provides declarative option parsing with automatic help. More Ruby-ish than GetoptLong. Use for complex CLIs.,https://ruby-doc.org/stdlib-3.1.2/libdoc/optparse/rdoc/OptionParser.html,https://youtube.com/results?search_query=ruby+optparse,https://youtube.com/results?search_query=ruby+optparse+hindi,https://youtube.com/results?search_query=ruby+optparse+kannada,https://youtube.com/results?search_query=ruby+optparse+tamil,https://youtube.com/results?search_query=ruby+optparse+telugu
Ruby,Advanced,Explain Ruby's fileutils for file operations,File I/O,File Operations,FileUtils, file operations, directory operations,FileUtils provides Unix-like file operations: cp, mv, rm, mkdir, etc. Use for cross-platform file management.,https://ruby-doc.org/stdlib-3.1.2/libdoc/fileutils/rdoc/FileUtils.html,https://youtube.com/results?search_query=ruby+fileutils,https://youtube.com/results?search_query=ruby+fileutils+hindi,https://youtube.com/results?search_query=ruby+fileutils+kannada,https://youtube.com/results?search_query=ruby+fileutils+tamil,https://youtube.com/results?search_query=ruby+fileutils+telugu
Ruby,Advanced,What are Ruby's pathname for path manipulation?,File I/O,Path Manipulation,Pathname, path manipulation, directory traversal,Pathname provides object-oriented path manipulation. Use / for path joining, cleanpath for normalization.,https://ruby-doc.org/stdlib-3.1.2/libdoc/pathname/rdoc/Pathname.html,https://youtube.com/results?search_query=ruby+pathname,https://youtube.com/results?search_query=ruby+pathname+hindi,https://youtube.com/results?search_query=ruby+pathname+kannada,https://youtube.com/results?search_query=ruby+pathname+tamil,https://youtube.com/results?search_query=ruby+pathname+telugu
Ruby,Advanced,Explain Ruby's find module for directory traversal,File I/O,Directory Traversal,Find module, directory traversal, file finding,Find module traverses directories: Find.find('dir') { |f| ... }. Use for recursive file operations.,https://ruby-doc.org/stdlib-3.1.2/libdoc/find/rdoc/Find.html,https://youtube.com/results?search_query=ruby+find+module,https://youtube.com/results?search_query=ruby+find+module+hindi,https://youtube.com/results?search_query=ruby+find+module+kannada,https://youtube.com/results?search_query=ruby+find+module+tamil,https://youtube.com/results?search_query=ruby+find+module+telugu
Ruby,Advanced,What is Ruby's benchmark-ips for performance measurement?,Performance,Benchmarking,Benchmark-ips, iterations per second, performance measurement,benchmark-ips gem measures iterations per second. More accurate than Benchmark for microbenchmarks.,https://github.com/evanphx/benchmark-ips,https://youtube.com/results?search_query=ruby+benchmark+ips,https://youtube.com/results?search_query=ruby+benchmark+ips+hindi,https://youtube.com/results?search_query=ruby+benchmark+ips+kannada,https://youtube.com/results?search_query=ruby+benchmark+ips+tamil,https://youtube.com/results?search_query=ruby+benchmark+ips+telugu
Ruby,Advanced,Explain Ruby's memory_profiler for memory analysis,Performance,Memory Profiling,MemoryProfiler, memory allocation, heap analysis,memory_profiler gem profiles memory allocations. Reports allocations by gem, file, location. Use for memory optimization.,https://github.com/SamSaffron/memory_profiler,https://youtube.com/results?search_query=ruby+memory+profiler,https://youtube.com/results?search_query=ruby+memory+profiler+hindi,https://youtube.com/results?search_query=ruby+memory+profiler+kannada,https://youtube.com/results?search_query=ruby+memory+profiler+tamil,https://youtube.com/results?search_query=ruby+memory+profiler+telugu
Ruby,Advanced,What are Ruby's stackprof and flamegraphs?,Performance,Profiling,StackProf, flamegraphs, CPU profiling,stackprof gem provides sampling profiler. flamegraph generates interactive flamegraphs. Use for performance optimization.,https://github.com/tmm1/stackprof,https://youtube.com/results?search_query=ruby+stackprof+flamegraph,https://youtube.com/results?search_query=ruby+stackprof+flamegraph+hindi,https://youtube.com/results?search_query=ruby+stackprof+flamegraph+kannada,https://youtube.com/results?search_query=ruby+stackprof+flamegraph+tamil,https://youtube.com/results?search_query=ruby+stackprof+flamegraph+telugu
Ruby,Advanced,Explain Ruby's rbtree and sorted containers,Collections,Trees,RBTree, red-black trees, sorted containers,rbtree gem provides red-black tree implementation. Faster than Hash for range queries. Use for sorted data structures.,https://github.com/skandragon/rbtree,https://youtube.com/results?search_query=ruby+rbtree,https://youtube.com/results?search_query=ruby+rbtree+hindi,https://youtube.com/results?search_query=ruby+rbtree+kannada,https://youtube.com/results?search_query=ruby+rbtree+tamil,https://youtube.com/results?search_query=ruby+rbtree+telugu
Ruby,Advanced,What is Ruby's concurrent-ruby for concurrency?,Concurrency,Concurrent Ruby,Concurrent Ruby, promises, futures, thread pools,concurrent-ruby gem provides high-level concurrency: promises, futures, thread pools, agents, actors. Use for robust concurrency.,https://github.com/ruby-concurrency/concurrent-ruby,https://youtube.com/results?search_query=ruby+concurrent+ruby,https://youtube.com/results?search_query=ruby+concurrent+ruby+hindi,https://youtube.com/results?search_query=ruby+concurrent+ruby+kannada,https://youtube.com/results?search_query=ruby+concurrent+ruby+tamil,https://youtube.com/results?search_query=ruby+concurrent+ruby+telugu
Ruby,Advanced,Explain Ruby's celluloid actor framework,Concurrency,Actors,Celluloid, actor framework, message passing,Celluloid gem provides actor model with automatic supervision. Each actor runs in separate thread. Use for concurrent systems.,https://github.com/celluloid/celluloid,https://youtube.com/results?search_query=ruby+celluloid,https://youtube.com/results?search_query=ruby+celluloid+hindi,https://youtube.com/results?search_query=ruby+celluloid+kannada,https://youtube.com/results?search_query=ruby+celluloid+tamil,https://youtube.com/results?search_query=ruby+celluloid+telugu
Ruby,Advanced,What are Ruby's dry-rb and rom-rb for functional programming?,Frameworks,Functional Ruby,Dry-rb, rom-rb, functional programming, composition,dry-rb provides functional tools: validation, transactions, monads. rom-rb is Ruby object mapper. Use for maintainable code.,https://dry-rb.org/,https://youtube.com/results?search_query=ruby+dry+rb,https://youtube.com/results?search_query=ruby+dry+rb+hindi,https://youtube.com/results?search_query=ruby+dry+rb+kannada,https://youtube.com/results?search_query=ruby+dry+rb+tamil,https://youtube.com/results?search_query=ruby+dry+rb+telugu
Ruby,Advanced,Explain Ruby's hanami framework architecture,Frameworks,Hanami,Hanami, framework, clean architecture,Hanami is full-stack Ruby framework emphasizing clean architecture, small memory footprint, and performance.,https://hanamirb.org/,https://youtube.com/results?search_query=ruby+hanami,https://youtube.com/results?search_query=ruby+hanami+hindi,https://youtube.com/results?search_query=ruby+hanami+kannada,https://youtube.com/results?search_query=ruby+hanami+tamil,https://youtube.com/results?search_query=ruby+hanami+telugu
Ruby,Advanced,What is Ruby's Grape API framework?,Frameworks,API Development,Grape, API framework, REST APIs,Grape is REST-like API micro-framework. DSL for defining APIs. Use for building API services.,https://github.com/ruby-grape/grape,https://youtube.com/results?search_query=ruby+grape+api,https://youtube.com/results?search_query=ruby+grape+api+hindi,https://youtube.com/results?search_query=ruby+grape+api+kannada,https://youtube.com/results?search_query=ruby+grape+api+tamil,https://youtube.com/results?search_query=ruby+grape+api+telugu
Ruby,Advanced,Explain Ruby's Sinatra and modular applications,Frameworks,Sinatra,Sinatra, DSL, modular apps, Rack,Sinatra is DSL for web applications. Supports classic and modular styles. Use Rack middleware. Lightweight alternative to Rails.,http://sinatrarb.com/,https://youtube.com/results?search_query=ruby+sinatra,https://youtube.com/results?search_query=ruby+sinatra+hindi,https://youtube.com/results?search_query=ruby+sinatra+kannada,https://youtube.com/results?search_query=ruby+sinatra+tamil,https://youtube.com/results?search_query=ruby+sinatra+telugu
Ruby,Advanced,What are Ruby's Rack middleware and builders?,Web,Rack,Rack, middleware, builder, request processing,Rack is Ruby web server interface. Middleware processes requests in stack. Use Rack::Builder to compose middleware.,https://github.com/rack/rack,https://youtube.com/results?search_query=ruby+rack+middleware,https://youtube.com/results?search_query=ruby+rack+middleware+hindi,https://youtube.com/results?search_query=ruby+rack+middleware+kannada,https://youtube.com/results?search_query=ruby+rack+middleware+tamil,https://youtube.com/results?search_query=ruby+rack+middleware+telugu
Ruby,Advanced,Explain Ruby's Puma and Falcon web servers,Web,Servers,Puma, Falcon, web servers, concurrency,Puma is threaded web server. Falcon uses async I/O. Choose based on concurrency model: threads vs fibers.,https://puma.io/,https://youtube.com/results?search_query=ruby+puma+falcon,https://youtube.com/results?search_query=ruby+puma+falcon+hindi,https://youtube.com/results?search_query=ruby+puma+falcon+kannada,https://youtube.com/results?search_query=ruby+puma+falcon+tamil,https://youtube.com/results?search_query=ruby+puma+falcon+telugu
Ruby,Advanced,What is Ruby's JIT compiler (MJIT) and performance?,Performance,JIT Compilation,MJIT, JIT compilation, method compilation,MJIT (Method-based JIT) compiles hot methods to C. Ruby 2.6+ experimental, improved in 3.0+. Use --jit flag.,https://ruby-doc.org/core-3.1.2/doc/jit_rdoc.html,https://youtube.com/results?search_query=ruby+mjit,https://youtube.com/results?search_query=ruby+mjit+hindi,https://youtube.com/results?search_query=ruby+mjit+kannada,https://youtube.com/results?search_query=ruby+mjit+tamil,https://youtube.com/results?search_query=ruby+mjit+telugu
Ruby,Advanced,Explain Ruby's TruffleRuby and GraalVM,Language Implementations,Alternative Ruby,TruffleRuby, GraalVM, high performance,TruffleRuby runs on GraalVM with peak performance higher than MRI. Uses AST interpretation and Graal JIT. Good for long-running apps.,https://github.com/oracle/truffleruby,https://youtube.com/results?search_query=ruby+truffleruby,https://youtube.com/results?search_query=ruby+truffleruby+hindi,https://youtube.com/results?search_query=ruby+truffleruby+kannada,https://youtube.com/results?search_query=ruby+truffleruby+tamil,https://youtube.com/results?search_query=ruby+truffleruby+telugu
Ruby,Advanced,What are Ruby's JRuby and Java interoperability?,Language Implementations,JRuby,JRuby, Java integration, JVM,JRuby runs Ruby on JVM. Access Java classes directly. Use for Java library integration and JVM performance.,https://www.jruby.org/,https://youtube.com/results?search_query=ruby+jruby,https://youtube.com/results?search_query=ruby+jruby+hindi,https://youtube.com/results?search_query=ruby+jruby+kannada,https://youtube.com/results?search_query=ruby+jruby+tamil,https://youtube.com/results?search_query=ruby+jruby+telugu
Ruby,Advanced,Explain Ruby's mruby for embedded systems,Language Implementations,Embedded Ruby,Mruby, embedded systems, lightweight,Mruby is lightweight Ruby implementation for embedding. No eval, reduced stdlib. Use for IoT, scripting in applications.,https://mruby.org/,https://youtube.com/results?search_query=ruby+mruby,https://youtube.com/results?search_query=ruby+mruby+hindi,https://youtube.com/results?search_query=ruby+mruby+kannada,https://youtube.com/results?search_query=ruby+mruby+tamil,https://youtube.com/results?search_query=ruby+mruby+telugu
Ruby,Advanced,What is Ruby's RubySpec and language specification?,Testing,Specification,RubySpec, language specification, compliance,RubySpec was community language specification. Now superseded by ruby/spec. Tests Ruby language behavior.,https://github.com/ruby/spec,https://youtube.com/results?search_query=ruby+specification,https://youtube.com/results?search_query=ruby+specification+hindi,https://youtube.com/results?search_query=ruby+specification+kannada,https://youtube.com/results?search_query=ruby+specification+tamil,https://youtube.com/results?search_query=ruby+specification+telugu
Ruby,Advanced,Explain Ruby's Minitest vs RSpec testing frameworks,Testing,Frameworks,Minitest, RSpec, testing frameworks,Minitest is built-in, simpler. RSpec has richer DSL for BDD. Choose based on team preference and project needs.,https://github.com/seattlerb/minitest,https://youtube.com/results?search_query=ruby+minitest+rspec,https://youtube.com/results?search_query=ruby+minitest+rspec+hindi,https://youtube.com/results?search_query=ruby+minitest+rspec+kannada,https://youtube.com/results?search_query=ruby+minitest+rspec+tamil,https://youtube.com/results?search_query=ruby+minitest+rspec+telugu
Ruby,Advanced,What are Ruby's factory_bot and fixtures for testing?,Testing,Test Data,FactoryBot, fixtures, test data generation,FactoryBot creates test objects with defined factories. Better than fixtures for complex data. Use for test setup.,https://github.com/thoughtbot/factory_bot,https://youtube.com/results?search_query=ruby+factory+bot,https://youtube.com/results?search_query=ruby+factory+bot+hindi,https://youtube.com/results?search_query=ruby+factory+bot+kannada,https://youtube.com/results?search_query=ruby+factory+bot+tamil,https://youtube.com/results?search_query=ruby+factory+bot+telugu
Ruby,Advanced,Explain Ruby's VCR for HTTP testing,Testing,HTTP Mocking,VCR, HTTP recording, test fixtures,VCR records HTTP interactions and replays them. Isolates tests from external services. Use for reliable HTTP testing.,https://github.com/vcr/vcr,https://youtube.com/results?search_query=ruby+vcr,https://youtube.com/results?search_query=ruby+vcr+hindi,https://youtube.com/results?search_query=ruby+vcr+kannada,https://youtube.com/results?search_query=ruby+vcr+tamil,https://youtube.com/results?search_query=ruby+vcr+telugu
Ruby,Advanced,What is Ruby's simplecov for code coverage?,Testing,Coverage,SimpleCov, code coverage, report generation,SimpleCov gem provides code coverage reporting. Integrates with Minitest/RSpec. Generates HTML reports.,https://github.com/simplecov-ruby/simplecov,https://youtube.com/results?search_query=ruby+simplecov,https://youtube.com/results?search_query=ruby+simplecov+hindi,https://youtube.com/results?search_query=ruby+simplecov+kannada,https://youtube.com/results?search_query=ruby+simplecov+tamil,https://youtube.com/results?search_query=ruby+simplecov+telugu
Ruby,Advanced,Explain Ruby's rubocop for code linting,Code Quality,Linting,Rubocop, code style, static analysis,Rubocop enforces Ruby style guide. Auto-correct available. Use for consistent code and catching potential issues.,https://github.com/rubocop/rubocop,https://youtube.com/results?search_query=ruby+rubocop,https://youtube.com/results?search_query=ruby+rubocop+hindi,https://youtube.com/results?search_query=ruby+rubocop+kannada,https://youtube.com/results?search_query=ruby+rubocop+tamil,https://youtube.com/results?search_query=ruby+rubocop+telugu
Ruby,Advanced,What are Ruby's bundler and Gemfile.lock?,Dependency Management,Bundler,Bundler, Gemfile, Gemfile.lock, dependency resolution,Bundler manages gem dependencies. Gemfile declares dependencies. Gemfile.lock locks specific versions for reproducibility.,https://bundler.io/,https://youtube.com/results?search_query=ruby+bundler,https://youtube.com/results?search_query=ruby+bundler+hindi,https://youtube.com/results?search_query=ruby+bundler+kannada,https://youtube.com/results?search_query=ruby+bundler+tamil,https://youtube.com/results?search_query=ruby+bundler+telugu
Ruby,Advanced,Explain Ruby's rake for task automation,Tools,Rake,Rake, task automation, Ruby make,Rake is Ruby build tool. Define tasks with dependencies. Use for automation: testing, deployment, database tasks.,https://github.com/ruby/rake,https://youtube.com/results?search_query=ruby+rake,https://youtube.com/results?search_query=ruby+rake+hindi,https://youtube.com/results?search_query=ruby+rake+kannada,https://youtube.com/results?search_query=ruby+rake+tamil,https://youtube.com/results?search_query=ruby+rake+telugu
Ruby,Advanced,What is Ruby's thor for CLI building?,Tools,CLI Building,Thor, CLI framework, command-line tools,Thor gem helps build CLI tools with subcommands, options, and documentation. Used by Rails, Bundler.,https://github.com/rails/thor,https://youtube.com/results?search_query=ruby+thor,https://youtube.com/results?search_query=ruby+thor+hindi,https://youtube.com/results?search_query=ruby+thor+kannada,https://youtube.com/results?search_query=ruby+thor+tamil,https://youtube.com/results?search_query=ruby+thor+telugu
Ruby,Advanced,Explain Ruby's zeitwerk code loader,Autoloading,Code Loading,Zeitwerk, code loading, Rails autoloader,Zeitwerk is modern code loader for Ruby. Used by Rails 6+. Provides constant autoloading with explicit conventions.,https://github.com/fxn/zeitwerk,https://youtube.com/results?search_query=ruby+zeitwerk,https://youtube.com/results?search_query=ruby+zeitwerk+hindi,https://youtube.com/results?search_query=ruby+zeitwerk+kannada,https://youtube.com/results?search_query=ruby+zeitwerk+tamil,https://youtube.com/results?search_query=ruby+zeitwerk+telugu
Ruby,Advanced,What are Ruby's dry-transaction and dry-monads?,Functional Programming,Monads,Dry-transaction, dry-monads, functional patterns,dry-transaction provides transaction pattern. dry-monads provides Maybe, Either, Try monads. Use for functional error handling.,https://dry-rb.org/gems/dry-transaction/,https://youtube.com/results?search_query=ruby+dry+monads,https://youtube.com/results?search_query=ruby+dry+monads+hindi,https://youtube.com/results?search_query=ruby+dry+monads+kannada,https://youtube.com/results?search_query=ruby+dry+monads+tamil,https://youtube.com/results?search_query=ruby+dry+monads+telugu
Ruby,Advanced,Explain Ruby's trailblazer for business logic,Frameworks,Architecture,Trailblazer, business logic, architecture,Trailblazer provides architecture for business logic: operations, contracts, policies. Keeps models thin.,https://trailblazer.to/,https://youtube.com/results?search_query=ruby+trailblazer,https://youtube.com/results?search_query=ruby+trailblazer+hindi,https://youtube.com/results?search_query=ruby+trailblazer+kannada,https://youtube.com/results?search_query=ruby+trailblazer+tamil,https://youtube.com/results?search_query=ruby+trailblazer+telugu
Ruby,Advanced,What is Ruby's Pact for consumer-driven contracts?,Testing,Contract Testing,Pact, consumer-driven contracts, API testing,Pact implements consumer-driven contracts. Consumers define expectations, providers verify. Use for microservices integration.,https://docs.pact.io/,https://youtube.com/results?search_query=ruby+pact,https://youtube.com/results?search_query=ruby+pact+hindi,https://youtube.com/results?search_query=ruby+pact+kannada,https://youtube.com/results?search_query=ruby+pact+tamil,https://youtube.com/results?search_query=ruby+pact+telugu
Ruby,Advanced,Explain Ruby's sidekiq and background jobs,Background Jobs,Queues,Sidekiq, background jobs, Redis queues,Sidekiq uses Redis for job queues. Provides retries, scheduling, monitoring. Use for async task processing.,https://sidekiq.org/,https://youtube.com/results?search_query=ruby+sidekiq,https://youtube.com/results?search_query=ruby+sidekiq+hindi,https://youtube.com/results?search_query=ruby+sidekiq+kannada,https://youtube.com/results?search_query=ruby+sidekiq+tamil,https://youtube.com/results?search_query=ruby+sidekiq+telugu
Ruby,Advanced,What are Ruby's whenever and clockwork for scheduling?,Scheduling,Cron Jobs,Whenever, clockwork, task scheduling,Whenever gem provides cron syntax in Ruby. Clockwork runs tasks within Ruby process. Use for scheduled jobs.,https://github.com/javan/whenever,https://youtube.com/results?search_query=ruby+whenever+clockwork,https://youtube.com/results?search_query=ruby+whenever+clockwork+hindi,https://youtube.com/results?search_query=ruby+whenever+clockwork+kannada,https://youtube.com/results?search_query=ruby+whenever+clockwork+tamil,https://youtube.com/results?search_query=ruby+whenever+clockwork+telugu
Ruby,Advanced,Explain Ruby's devise and authentication,Authentication,Devise,Devise, authentication, user management,Devise provides full-featured authentication: registration, login, password reset. Customizable with modules.,https://github.com/heartcombo/devise,https://youtube.com/results?search_query=ruby+devise,https://youtube.com/results?search_query=ruby+devise+hindi,https://youtube.com/results?search_query=ruby+devise+kannada,https://youtube.com/results?search_query=ruby+devise+tamil,https://youtube.com/results?search_query=ruby+devise+telugu
Ruby,Advanced,What is Ruby's cancancan and pundit for authorization?,Authorization,Access Control,CanCanCan, Pundit, authorization,CanCanCan provides role-based authorization. Pundit uses policy objects. Choose based on complexity needs.,https://github.com/CanCanCommunity/cancancan,https://youtube.com/results?search_query=ruby+cancancan+pundit,https://youtube.com/results?search_query=ruby+cancancan+pundit+hindi,https://youtube.com/results?search_query=ruby+cancancan+pundit+kannada,https://youtube.com/results?search_query=ruby+cancancan+pundit+tamil,https://youtube.com/results?search_query=ruby+cancancan+pundit+telugu
Ruby,Advanced,Explain Ruby's carrierwave and active storage,File Upload,Storage,CarrierWave, Active Storage, file uploads,CarrierWave is file upload gem. Active Storage is Rails built-in. Choose based on Rails version and needs.,https://github.com/carrierwaveuploader/carrierwave,https://youtube.com/results?search_query=ruby+carrierwave,https://youtube.com/results?search_query=ruby+carrierwave+hindi,https://youtube.com/results?search_query=ruby+carrierwave+kannada,https://youtube.com/results?search_query=ruby+carrierwave+tamil,https://youtube.com/results?search_query=ruby+carrierwave+telugu
Ruby,Advanced,What are Ruby's kaminari and will_paginate?,Pagination,Paginating,Kaminari, will_paginate, pagination,Kaminari and will_paginate provide pagination. Kaminari more feature-rich. Choose based on project requirements.,https://github.com/kaminari/kaminari,https://youtube.com/results?search_query=ruby+kaminari,https://youtube.com/results?search_query=ruby+kaminari+hindi,https://youtube.com/results?search_query=ruby+kaminari+kannada,https://youtube.com/results?search_query=ruby+kaminari+tamil,https://youtube.com/results?search_query=ruby+kaminari+telugu
Ruby,Advanced,Explain Ruby's elasticsearch-ruby and searchkick,Search,Elasticsearch,Elasticsearch-ruby, Searchkick, full-text search,elasticsearch-ruby is low-level client. Searchkick is high-level with ActiveRecord integration. Use for search features.,https://github.com/elastic/elasticsearch-ruby,https://youtube.com/results?search_query=ruby+elasticsearch,https://youtube.com/results?search_query=ruby+elasticsearch+hindi,https://youtube.com/results?search_query=ruby+elasticsearch+kannada,https://youtube.com/results?search_query=ruby+elasticsearch+tamil,https://youtube.com/results?search_query=ruby+elasticsearch+telugu
Ruby,Advanced,What is Ruby's graphql-ruby for GraphQL APIs?,API,GraphQL,GraphQL-ruby, GraphQL APIs, query language,graphql-ruby implements GraphQL server. Provides type system, resolvers, mutations. Use for flexible APIs.,https://graphql-ruby.org/,https://youtube.com/results?search_query=ruby+graphql,https://youtube.com/results?search_query=ruby+graphql+hindi,https://youtube.com/results?search_query=ruby+graphql+kannada,https://youtube.com/results?search_query=ruby+graphql+tamil,https://youtube.com/results?search_query=ruby+graphql+telugu
