skill,level,question_text,option_a,option_b,option_c,option_d,correct_answer,explanation,topic,mdn_link,youtube_english,youtube_hindi,youtube_kannada,youtube_tamil,youtube_telugu
Ruby,Advanced,What are Ruby's singleton methods on literals?,Metaprogramming,Singleton Methods,Literal singleton methods, immediate values,Symbols, integers, true, false, nil can have singleton methods but they affect all instances. Strings can have real singleton methods.,https://ruby-doc.org/core-3.1.2/doc/syntax/modules_and_classes_rdoc.html,https://youtube.com/results?search_query=ruby+literal+singleton,https://youtube.com/results?search_query=ruby+literal+singleton+hindi,https://youtube.com/results?search_query=ruby+literal+singleton+kannada,https://youtube.com/results?search_query=ruby+literal+singleton+tamil,https://youtube.com/results?search_query=ruby+literal+singleton+telugu
Ruby,Advanced,Explain Ruby's const_missing and const_set,Metaprogramming,Constants,const_missing, const_set, dynamic constants,const_missing called when constant not found. Can autoload or create constants dynamically. Use const_set to define.,https://ruby-doc.org/core-3.1.2/Module.html#method-i-const_missing,https://youtube.com/results?search_query=ruby+const_missing,https://youtube.com/results?search_query=ruby+const_missing+hindi,https://youtube.com/results?search_query=ruby+const_missing+kannada,https://youtube.com/results?search_query=ruby+const_missing+tamil,https://youtube.com/results?search_query=ruby+const_missing+telugu
Ruby,Advanced,What is Ruby's Benchmark module for performance testing?,Performance,Benchmarking,Benchmark, bmbm, benchmark-ips,Benchmark measures code execution time. bmbm for rehearse mode. benchmark-ips gem for iterations per second.,https://ruby-doc.org/stdlib-3.1.2/libdoc/benchmark/rdoc/Benchmark.html,https://youtube.com/results?search_query=ruby+benchmark,https://youtube.com/results?search_query=ruby+benchmark+hindi,https://youtube.com/results?search_query=ruby+benchmark+kannada,https://youtube.com/results?search_query=ruby+benchmark+tamil,https://youtube.com/results?search_query=ruby+benchmark+telugu
Ruby,Advanced,Explain Ruby's SecureRandom for cryptography,Security,Cryptography,SecureRandom, random bytes, UUID, tokens,SecureRandom provides cryptographically secure random numbers: random_bytes, hex, base64, uuid. Use for tokens, passwords.,https://ruby-doc.org/stdlib-3.1.2/libdoc/securerandom/rdoc/SecureRandom.html,https://youtube.com/results?search_query=ruby+securerandom,https://youtube.com/results?search_query=ruby+securerandom+hindi,https://youtube.com/results?search_query=ruby+securerandom+kannada,https://youtube.com/results?search_query=ruby+securerandom+tamil,https://youtube.com/results?search_query=ruby+securerandom+telugu
Ruby,Advanced,What are Ruby's Tempfile and StringIO for I/O?,File I/O,Temporary Files,Tempfile, StringIO, in-memory files,Tempfile creates temporary files auto-deleted. StringIO provides file interface to strings. Useful for testing.,https://ruby-doc.org/stdlib-3.1.2/libdoc/tempfile/rdoc/Tempfile.html,https://youtube.com/results?search_query=ruby+tempfile+stringio,https://youtube.com/results?search_query=ruby+tempfile+stringio+hindi,https://youtube.com/results?search_query=ruby+tempfile+stringio+kannada,https://youtube.com/results?search_query=ruby+tempfile+stringio+tamil,https://youtube.com/results?search_query=ruby+tempfile+stringio+telugu
Ruby,Advanced,Explain Ruby's Digest module for hashing,Security,Hashing,Digest, MD5, SHA1, SHA256, bcrypt,Digest provides cryptographic hashes: MD5, SHA1, SHA256. Use SHA256 for security. For passwords, use bcrypt gem.,https://ruby-doc.org/stdlib-3.1.2/libdoc/digest/rdoc/Digest.html,https://youtube.com/results?search_query=ruby+digest+module,https://youtube.com/results?search_query=ruby+digest+module+hindi,https://youtube.com/results?search_query=ruby+digest+module+kannada,https://youtube.com/results?search_query=ruby+digest+module+tamil,https://youtube.com/results?search_query=ruby+digest+module+telugu
Ruby,Advanced,What is Ruby's OpenSSL module for SSL/TLS?,Security,SSL/TLS,OpenSSL, SSL context, certificates, encryption,OpenSSL provides SSL/TLS, certificates, encryption. Use for secure sockets, HTTPS, certificate verification.,https://ruby-doc.org/stdlib-3.1.2/libdoc/openssl/rdoc/OpenSSL.html,https://youtube.com/results?search_query=ruby+openssl,https://youtube.com/results?search_query=ruby+openssl+hindi,https://youtube.com/results?search_query=ruby+openssl+kannada,https://youtube.com/results?search_query=ruby+openssl+tamil,https://youtube.com/results?search_query=ruby+openssl+telugu
Ruby,Advanced,Explain Ruby's Socket programming basics,Networking,Sockets,Socket, TCPSocket, UDPSocket, server-client,Socket provides low-level network programming. TCPSocket for TCP, UDPSocket for UDP. Use with IO.select for multiplexing.,https://ruby-doc.org/stdlib-3.1.2/libdoc/socket/rdoc/Socket.html,https://youtube.com/results?search_query=ruby+socket+programming,https://youtube.com/results?search_query=ruby+socket+programming+hindi,https://youtube.com/results?search_query=ruby+socket+programming+kannada,https://youtube.com/results?search_query=ruby+socket+programming+tamil,https://youtube.com/results?search_query=ruby+socket+programming+telugu
Ruby,Advanced,What are Ruby's IRB and Pry for REPL and debugging?,Development Tools,REPL,IRB, Pry, REPL, debugging, console,IRB is Ruby's built-in REPL. Pry is enhanced with syntax highlighting, debugging, source browsing. Use binding.pry for debugger.,https://ruby-doc.org/stdlib-3.1.2/libdoc/irb/rdoc/IRB.html,https://youtube.com/results?search_query=ruby+pry+irb,https://youtube.com/results?search_query=ruby+pry+irb+hindi,https://youtube.com/results?search_query=ruby+pry+irb+kannada,https://youtube.com/results?search_query=ruby+pry+irb+tamil,https://youtube.com/results?search_query=ruby+pry+irb+telugu
Ruby,Advanced,Explain Ruby's RDoc and Yard for documentation,Documentation,Doc Generation,RDoc, Yard, documentation generation,RDoc is built-in documentation generator. Yard is modern alternative with better features and @tag syntax.,https://ruby-doc.org/stdlib-3.1.2/libdoc/rdoc/rdoc/RDoc.html,https://youtube.com/results?search_query=ruby+rdoc+yard,https://youtube.com/results?search_query=ruby+rdoc+yard+hindi,https://youtube.com/results?search_query=ruby+rdoc+yard+kannada,https://youtube.com/results?search_query=ruby+rdoc+yard+tamil,https://youtube.com/results?search_query=ruby+rdoc+yard+telugu
Ruby,Advanced,What is Ruby's RubyVM module and MRI internals?,Language Internals,VM Internals,RubyVM, instruction sequences, bytecode,RubyVM provides access to MRI internals: instruction sequences, abstract syntax tree. MRI-specific, not in JRuby/TruffleRuby.,https://ruby-doc.org/core-3.1.2/RubyVM.html,https://youtube.com/results?search_query=rubyvm+mri,https://youtube.com/results?search_query=rubyvm+mri+hindi,https://youtube.com/results?search_query=rubyvm+mri+kannada,https://youtube.com/results?search_query=rubyvm+mri+tamil,https://youtube.com/results?search_query=rubyvm+mri+telugu
Ruby,Advanced,Explain Ruby's did_you_mean gem for error suggestions,Development Tools,Error Handling,DidYouMean, error suggestions, spell checking,did_you_mean suggests similar method/constant names on NameError. Included in Ruby 2.3+. Improves developer experience.,https://ruby-doc.org/stdlib-3.1.2/libdoc/did_you_mean/rdoc/DidYouMean.html,https://youtube.com/results?search_query=ruby+did_you_mean,https://youtube.com/results?search_query=ruby+did_you_mean+hindi,https://youtube.com/results?search_query=ruby+did_you_mean+kannada,https://youtube.com/results?search_query=ruby+did_you_mean+tamil,https://youtube.com/results?search_query=ruby+did_you_mean+telugu
Ruby,Advanced,What are Ruby's refinements with prepend and super?,Metaprogramming,Refinements,Refinements with super, prepend refinements,Refinements can call super to invoke original method. prepend works with refinements but complex. Use for layered modifications.,https://ruby-doc.org/core-3.1.2/doc/syntax/refinements_rdoc.html,https://youtube.com/results?search_query=ruby+refinements+super,https://youtube.com/results?search_query=ruby+refinements+super+hindi,https://youtube.com/results?search_query=ruby+refinements+super+kannada,https://youtube.com/results?search_query=ruby+refinements+super+tamil,https://youtube.com/results?search_query=ruby+refinements+super+telugu
Ruby,Advanced,Explain Ruby's Module#nesting and lexical scope,Language Fundamentals,Scope,Module.nesting, lexical scope, constant resolution,Module.nesting returns current lexical scope chain. Used for constant lookup. Differs from Module.nesting which is dynamic.,https://ruby-doc.org/core-3.1.2/Module.html#method-c-nesting,https://youtube.com/results?search_query=ruby+module+nesting,https://youtube.com/results?search_query=ruby+module+nesting+hindi,https://youtube.com/results?search_query=ruby+module+nesting+kannada,https://youtube.com/results?search_query=ruby+module+nesting+tamil,https://youtube.com/results?search_query=ruby+module+nesting+telugu
Ruby,Advanced,What is Ruby's TracePoint for profiling and debugging?,Debugging,Profiling,TracePoint, line profiling, call profiling,TracePoint can profile line executions, method calls. Use :line event for line profiling, :call for method profiling.,https://ruby-doc.org/core-3.1.2/TracePoint.html,https://youtube.com/results?search_query=ruby+tracepoint+profiling,https://youtube.com/results?search_query=ruby+tracepoint+profiling+hindi,https://youtube.com/results?search_query=ruby+tracepoint+profiling+kannada,https://youtube.com/results?search_query=ruby+tracepoint+profiling+tamil,https://youtube.com/results?search_query=ruby+tracepoint+profiling+telugu
Ruby,Advanced,Explain Ruby's Ractor messaging and shareable objects,Concurrency,Ractors,Ractor messaging, send, yield, take, shareable,Ractors communicate via send/yield and take. Only shareable objects (frozen, special classes) can be sent. Copying for others.,https://ruby-doc.org/core-3.1.2/Ractor.html,https://youtube.com/results?search_query=ruby+ractor+messaging,https://youtube.com/results?search_query=ruby+ractor+messaging+hindi,https://youtube.com/results?search_query=ruby+ractor+messaging+kannada,https://youtube.com/results?search_query=ruby+ractor+messaging+tamil,https://youtube.com/results?search_query=ruby+ractor+messaging+telugu
Ruby,Advanced,What are Ruby's endless ranges and beginless ranges?,Language Features,Ranges,Endless ranges, beginless ranges, 3-dot ranges,Endless: (1..). Beginless: (..10). 3-dot excludes end. Useful for slicing and infinite sequences.,https://ruby-doc.org/core-3.1.2/Range.html,https://youtube.com/results?search_query=ruby+endless+ranges,https://youtube.com/results?search_query=ruby+endless+ranges+hindi,https://youtube.com/results?search_query=ruby+endless+ranges+kannada,https://youtube.com/results?search_query=ruby+endless+ranges+tamil,https://youtube.com/results?search_query=ruby+endless+ranges+telugu
Ruby,Advanced,Explain Ruby's pattern matching with case/in,Language Features,Pattern Matching,Pattern matching, case/in, deconstruction, array/hash matching,Ruby 2.7+ supports pattern matching: case value; in pattern. Deconstructs arrays/hashes. Use for complex conditional logic.,https://ruby-doc.org/core-3.1.2/doc/syntax/pattern_matching_rdoc.html,https://youtube.com/results?search_query=ruby+pattern+matching,https://youtube.com/results?search_query=ruby+pattern+matching+hindi,https://youtube.com/results?search_query=ruby+pattern+matching+kannada,https://youtube.com/results?search_query=ruby+pattern+matching+tamil,https://youtube.com/results?search_query=ruby+pattern+matching+telugu
Ruby,Advanced,What is Ruby's numbered parameters and block parameters?,Language Features,Parameters,Numbered parameters, _1, _9, block parameters,_1, _2 etc are numbered block parameters in Ruby 2.7+. Use for concise blocks: array.map { _1 * 2 }.,https://ruby-doc.org/core-3.1.2/doc/syntax/literals_rdoc.html,https://youtube.com/results?search_query=ruby+numbered+parameters,https://youtube.com/results?search_query=ruby+numbered+parameters+hindi,https://youtube.com/results?search_query=ruby+numbered+parameters+kannada,https://youtube.com/results?search_query=ruby+numbered+parameters+tamil,https://youtube.com/results?search_query=ruby+numbered+parameters+telugu
Ruby,Advanced,Explain Ruby's method reference operator ::,Language Features,Method Reference,Method reference, ::, unary colon,Ruby 2.7+: method reference with :. :object.method returns callable object. Useful for passing methods as arguments.,https://ruby-doc.org/core-3.1.2/doc/syntax/calling_methods_rdoc.html,https://youtube.com/results?search_query=ruby+method+reference,https://youtube.com/results?search_query=ruby+method+reference+hindi,https://youtube.com/results?search_query=ruby+method+reference+kannada,https://youtube.com/results?search_query=ruby+method+reference+tamil,https://youtube.com/results?search_query=ruby+method+reference+telugu
Ruby,Advanced,What are Ruby's endless methods and one-liners?,Language Features,Method Syntax,Endless methods, def method = expression,Endless methods: def method = expression. One-line method definition returning expression. Clean for simple methods.,https://ruby-doc.org/core-3.1.2/doc/syntax/methods_rdoc.html,https://youtube.com/results?search_query=ruby+endless+methods,https://youtube.com/results?search_query=ruby+endless+methods+hindi,https://youtube.com/results?search_query=ruby+endless+methods+kannada,https://youtube.com/results?search_query=ruby+endless+methods+tamil,https://youtube.com/results?search_query=ruby+endless+methods+telugu
Ruby,Advanced,Explain Ruby's non-ASCII identifiers and encoding,Language Features,Internationalization,Non-ASCII identifiers, UTF-8 identifiers, encoding,Ruby supports UTF-8 identifiers: methods, variables, classes. Use # encoding: utf-8 comment. Be careful with Unicode normalization.,https://ruby-doc.org/core-3.1.2/doc/syntax/encoding_rdoc.html,https://youtube.com/results?search_query=ruby+unicode+identifiers,https://youtube.com/results?search_query=ruby+unicode+identifiers+hindi,https://youtube.com/results?search_query=ruby+unicode+identifiers+kannada,https://youtube.com/results?search_query=ruby+unicode+identifiers+tamil,https://youtube.com/results?search_query=ruby+unicode+identifiers+telugu
Ruby,Advanced,What is Ruby's flip-flop operator and its use?,Language Features,Operators,Flip-flop operator, .. in condition, range in condition,Flip-flop: true when left true until right true. Rarely used. Example: (1..10).select { |i| i == 3 .. i == 7 }.,https://ruby-doc.org/core-3.1.2/doc/syntax/control_expressions_rdoc.html,https://youtube.com/results?search_query=ruby+flip+flop+operator,https://youtube.com/results?search_query=ruby+flip+flop+operator+hindi,https://youtube.com/results?search_query=ruby+flip+flop+operator+kannada,https://youtube.com/results?search_query=ruby+flip+flop+operator+tamil,https://youtube.com/results?search_query=ruby+flip+flop+operator+telugu
Ruby,Advanced,Explain Ruby's retry, redo, and next in loops,Language Features,Flow Control,Retry, redo, next, break,Retry restarts entire iteration. Redo repeats current iteration. Next skips to next iteration. Break exits loop.,https://ruby-doc.org/core-3.1.2/doc/syntax/control_expressions_rdoc.html,https://youtube.com/results?search_query=ruby+retry+redo,https://youtube.com/results?search_query=ruby+retry+redo+hindi,https://youtube.com/results?search_query=ruby+retry+redo+kannada,https://youtube.com/results?search_query=ruby+retry+redo+tamil,https://youtube.com/results?search_query=ruby+retry+redo+telugu
Ruby,Advanced,What are Ruby's BEGIN and END blocks?,Language Features,Program Structure,BEGIN, END, program hooks,BEGIN runs before main program. END runs after program. Use for initialization/cleanup. Multiple blocks execute in definition order.,https://ruby-doc.org/core-3.1.2/doc/syntax/modules_and_classes_rdoc.html,https://youtube.com/results?search_query=ruby+begin+end+blocks,https://youtube.com/results?search_query=ruby+begin+end+blocks+hindi,https://youtube.com/results?search_query=ruby+begin+end+blocks+kannada,https://youtube.com/results?search_query=ruby+begin+end+blocks+tamil,https://youtube.com/results?search_query=ruby+begin+end+blocks+telugu
Ruby,Advanced,Explain Ruby's alias vs alias_method,Metaprogramming,Aliasing,Alias, alias_method, method aliasing,alias creates method alias at parse time. alias_method at runtime. Use alias_method for dynamic aliasing.,https://ruby-doc.org/core-3.1.2/Module.html#method-i-alias_method,https://youtube.com/results?search_query=ruby+alias+alias_method,https://youtube.com/results?search_query=ruby+alias+alias_method+hindi,https://youtube.com/results?search_query=ruby+alias+alias_method+kannada,https://youtube.com/results?search_query=ruby+alias+alias_method+tamil,https://youtube.com/results?search_query=ruby+alias+alias_method+telugu
Ruby,Advanced,What is Ruby's defined? operator and its return values?,Language Features,Operators,Defined?, nil, expression checking,defined? checks if expression defined. Returns nil if not, or description string. Use for safe method/constant checking.,https://ruby-doc.org/core-3.1.2/doc/syntax/control_expressions_rdoc.html,https://youtube.com/results?search_query=ruby+defined+operator,https://youtube.com/results?search_query=ruby+defined+operator+hindi,https://youtube.com/results?search_query=ruby+defined+operator+kannada,https://youtube.com/results?search_query=ruby+defined+operator+tamil,https://youtube.com/results?search_query=ruby+defined+operator+telugu
Ruby,Advanced,Explain Ruby's __FILE__ and __LINE__ constants,Language Features,Magic Constants,__FILE__, __LINE__, __dir__, source location,__FILE__ is current file path. __LINE__ is current line number. __dir__ is directory of __FILE__.,https://ruby-doc.org/core-3.1.2/doc/syntax/assignment_rdoc.html,https://youtube.com/results?search_query=ruby+file+line,https://youtube.com/results?search_query=ruby+file+line+hindi,https://youtube.com/results?search_query=ruby+file+line+kannada,https://youtube.com/results?search_query=ruby+file+line+tamil,https://youtube.com/results?search_query=ruby+file+line+telugu
Ruby,Advanced,What are Ruby's $SAFE levels and taint checking?,Security,Safe Levels,$SAFE, taint, trust, safe levels,$SAFE levels (0-4) restrict operations. Taint marks untrusted objects. Removed in Ruby 3. Use alternative security measures.,https://ruby-doc.org/core-3.1.2/doc/security_rdoc.html,https://youtube.com/results?search_query=ruby+safe+levels,https://youtube.com/results?search_query=ruby+safe+levels+hindi,https://youtube.com/results?search_query=ruby+safe+levels+kannada,https://youtube.com/results?search_query=ruby+safe+levels+tamil,https://youtube.com/results?search_query=ruby+safe+levels+telugu
Ruby,Advanced,Explain Ruby's ARGF for command-line file processing,File I/O,Command Line,ARGF, command-line files, stdin processing,ARGF reads from files specified in ARGV or stdin if no files. Treats multiple files as single stream. Use for filters.,https://ruby-doc.org/core-3.1.2/ARGF.html,https://youtube.com/results?search_query=ruby+argf,https://youtube.com/results?search_query=ruby+argf+hindi,https://youtube.com/results?search_query=ruby+argf+kannada,https://youtube.com/results?search_query=ruby+argf+tamil,https://youtube.com/results?search_query=ruby+argf+telugu
Ruby,Advanced,What is Ruby's DATA constant and __END__?,File I/O,Program Data,DATA, __END__, inline data,__END__ marks end of code. DATA is File object for data after __END__. Use for embedding data in script.,https://ruby-doc.org/core-3.1.2/doc/syntax/modules_and_classes_rdoc.html,https://youtube.com/results?search_query=ruby+data+constant,https://youtube.com/results?search_query=ruby+data+constant+hindi,https://youtube.com/results?search_query=ruby+data+constant+kannada,https://youtube.com/results?search_query=ruby+data+constant+tamil,https://youtube.com/results?search_query=ruby+data+constant+telugu
Ruby,Advanced,Explain Ruby's at_exit for program cleanup,Language Features,Cleanup,At_exit, exit handlers, cleanup hooks,at_exit registers blocks to run at program exit. Multiple handlers execute in reverse order. Use for resource cleanup.,https://ruby-doc.org/core-3.1.2/Kernel.html#method-i-at_exit,https://youtube.com/results?search_query=ruby+at_exit,https://youtube.com/results?search_query=ruby+at_exit+hindi,https://youtube.com/results?search_query=ruby+at_exit+kannada,https://youtube.com/results?search_query=ruby+at_exit+tamil,https://youtube.com/results?search_query=ruby+at_exit+telugu
Ruby,Advanced,What are Ruby's caller and caller_locations?,Debugging,Stack Trace,Caller, caller_locations, stack trace,Caller returns current call stack as strings. Caller_locations returns Thread::Backtrace::Location objects with more info.,https://ruby-doc.org/core-3.1.2/Kernel.html#method-i-caller,https://youtube.com/results?search_query=ruby+caller+locations,https://youtube.com/results?search_query=ruby+caller+locations+hindi,https://youtube.com/results?search_query=ruby+caller+locations+kannada,https://youtube.com/results?search_query=ruby+caller+locations+tamil,https://youtube.com/results?search_query=ruby+caller+locations+telugu
Ruby,Advanced,Explain Ruby's Rational and Complex numbers,Numerics,Advanced Math,Rational, Complex, numeric classes,Rational: fractions (1/3r). Complex: imaginary numbers (1+2i). Use for precise math and scientific computing.,https://ruby-doc.org/core-3.1.2/Rational.html,https://youtube.com/results?search_query=ruby+rational+complex,https://youtube.com/results?search_query=ruby+rational+complex+hindi,https://youtube.com/results?search_query=ruby+rational+complex+kannada,https://youtube.com/results?search_query=ruby+rational+complex+tamil,https://youtube.com/results?search_query=ruby+rational+complex+telugu
Ruby,Advanced,What is Ruby's Matrix class for linear algebra?,Numerics,Linear Algebra,Matrix, vectors, linear algebra,Matrix class provides matrix operations: multiplication, inversion, determinants. Use for scientific and ML computations.,https://ruby-doc.org/stdlib-3.1.2/libdoc/matrix/rdoc/Matrix.html,https://youtube.com/results?search_query=ruby+matrix+class,https://youtube.com/results?search_query=ruby+matrix+class+hindi,https://youtube.com/results?search_query=ruby+matrix+class+kannada,https://youtube.com/results?search_query=ruby+matrix+class+tamil,https://youtube.com/results?search_query=ruby+matrix+class+telugu
Ruby,Advanced,Explain Ruby's Prime class for number theory,Numerics,Number Theory,Prime, primes, number theory,Prime class provides prime number operations: checking, generation, factorization. Use for cryptography and algorithms.,https://ruby-doc.org/stdlib-3.1.2/libdoc/prime/rdoc/Prime.html,https://youtube.com/results?search_query=ruby+prime+class,https://youtube.com/results?search_query=ruby+prime+class+hindi,https://youtube.com/results?search_query=ruby+prime+class+kannada,https://youtube.com/results?search_query=ruby+prime+class+tamil,https://youtube.com/results?search_query=ruby+prime+class+telugu
Ruby,Advanced,What are Ruby's forwardable and delegate modules?,Metaprogramming,Delegation,Forwardable, DelegateClass, method delegation,Forwardable provides def_delegator for method forwarding. DelegateClass creates delegator class. Use for composition over inheritance.,https://ruby-doc.org/stdlib-3.1.2/libdoc/forwardable/rdoc/Forwardable.html,https://youtube.com/results?search_query=ruby+forwardable+delegate,https://youtube.com/results?search_query=ruby+forwardable+delegate+hindi,https://youtube.com/results?search_query=ruby+forwardable+delegate+kannada,https://youtube.com/results?search_query=ruby+forwardable+delegate+tamil,https://youtube.com/results?search_query=ruby+forwardable+delegate+telugu
Ruby,Advanced,Explain Ruby's singleton module for singleton pattern,Design Patterns,Singleton,Singleton module, singleton pattern,Singleton module mixes in singleton behavior. Use require 'singleton' and include Singleton. Provides instance method.,https://ruby-doc.org/stdlib-3.1.2/libdoc/singleton/rdoc/Singleton.html,https://youtube.com/results?search_query=ruby+singleton+module,https://youtube.com/results?search_query=ruby+singleton+module+hindi,https://youtube.com/results?search_query=ruby+singleton+module+kannada,https://youtube.com/results?search_query=ruby+singleton+module+tamil,https://youtube.com/results?search_query=ruby+singleton+module+telugu
Ruby,Advanced,What is Ruby's observer pattern implementation?,Design Patterns,Observer,Observable module, observer pattern,Observable module provides observer pattern. Use require 'observer' and include Observable. Notify observers on change.,https://ruby-doc.org/stdlib-3.1.2/libdoc/observer/rdoc/Observable.html,https://youtube.com/results?search_query=ruby+observer+pattern,https://youtube.com/results?search_query=ruby+observer+pattern+hindi,https://youtube.com/results?search_query=ruby+observer+pattern+kannada,https://youtube.com/results?search_query=ruby+observer+pattern+tamil,https://youtube.com/results?search_query=ruby+observer+pattern+telugu
Ruby,Advanced,Explain Ruby's timeout module for execution limits,Concurrency,Timeouts,Timeout, execution timeout, block timeout,Timeout module limits block execution time. Raises Timeout::Error. Use for preventing hanging operations.,https://ruby-doc.org/stdlib-3.1.2/libdoc/timeout/rdoc/Timeout.html,https://youtube.com/results?search_query=ruby+timeout+module,https://youtube.com/results?search_query=ruby+timeout+module+hindi,https://youtube.com/results?search_query=ruby+timeout+module+kannada,https://youtube.com/results?search_query=ruby+timeout+module+tamil,https://youtube.com/results?search_query=ruby+timeout+module+telugu
