skill,level,question_text,option_a,option_b,option_c,option_d,correct_answer,explanation,topic,mdn_link,youtube_english,youtube_hindi,youtube_kannada,youtube_tamil,youtube_telugu
Selenium,Advanced,How do you test browser save/restore session functionality?,Session Restore,Tabs Recovery,Crash Testing,Simulate browser crash/restart by quitting driver and starting new session with same profile. Test restored tabs, form data. Complex due to browser-specific session management.,https://www.selenium.dev/documentation/webdriver/browsers/,https://youtube.com/results?search_query=selenium+session+restore,https://youtube.com/results?search_query=selenium+session+restore+hindi,https://youtube.com/results?search_query=selenium+session+restore+kannada,https://youtube.com/results?search_query=selenium+session+restore+tamil,https://youtube.com/results?search_query=selenium+session+restore+telugu
Selenium,Advanced,How do you handle MIDI and Web Audio API testing?,Audio,MIDI,Web Audio,Mock audio devices using Chrome flags. Test UI interactions with audio elements. Actual audio output/input testing requires specialized hardware/software. Focus on functional not audio quality testing.,https://www.selenium.dev/documentation/webdriver/browsers/,https://youtube.com/results?search_query=selenium+web+audio+testing,https://youtube.com/results?search_query=selenium+audio+hindi,https://youtube.com/results?search_query=selenium+audio+kannada,https://youtube.com/results?search_query=selenium+audio+tamil,https://youtube.com/results?search_query=selenium+audio+telugu
Selenium,Advanced,How do you test browser theme/dark mode functionality?,Themes,Dark Mode,CSS,Switch theme via browser preferences or OS settings. Chrome: --force-dark-mode. Test CSS changes, contrast ratios. May need to trigger theme change via JavaScript for web app themes.,https://www.selenium.dev/documentation/webdriver/browsers/,https://youtube.com/results?search_query=selenium+dark+mode+testing,https://youtube.com/results?search_query=selenium+dark+mode+hindi,https://youtube.com/results?search_query=selenium+dark+mode+kannada,https://youtube.com/results?search_query=selenium+dark+mode+tamil,https://youtube.com/results?search_query=selenium+dark+mode+telugu
Selenium,Advanced,How do you handle browser font rendering and fallback testing?,Fonts,Rendering,Typography,Test with different system fonts, missing fonts. Use CSS to load specific fonts. Verify fallback fonts work. Visual testing tools for exact rendering. Difficult to automate font-specific issues.,https://www.selenium.dev/documentation/,https://youtube.com/results?search_query=selenium+font+testing,https://youtube.com/results?search_query=selenium+fonts+hindi,https://youtube.com/results?search_query=selenium+fonts+kannada,https://youtube.com/results?search_query=selenium+fonts+tamil,https://youtube.com/results?search_query=selenium+fonts+telugu
Selenium,Advanced,How do you test browser password manager integration?,Password Manager,Auto-fill,Security,Test auto-fill, save password prompts. Browser controls password manager; limited automation. Can test form autocomplete attributes. Actual password manager UI is browser-controlled.,https://www.selenium.dev/documentation/,https://youtube.com/results?search_query=selenium+password+manager+testing,https://youtube.com/results?search_query=selenium+password+manager+hindi,https://youtube.com/results?search_query=selenium+password+manager+kannada,https://youtube.com/results?search_query=selenium+password+manager+tamil,https://youtube.com/results?search_query=selenium+password+manager+telugu
Selenium,Advanced,How do you handle browser translation features in testing?,Translation,Internationalization,Built-in,Browser translation is a built-in feature. Test by changing browser language, triggering translation. Verify layout doesn't break. Content verification complex due to translation variability.,https://www.selenium.dev/documentation/,https://youtube.com/results?search_query=selenium+translation+testing,https://youtube.com/results?search_query=selenium+translation+hindi,https://youtube.com/results?search_query=selenium+translation+kannada,https://youtube.com/results?search_query=selenium+translation+tamil,https://youtube.com/results?search_query=selenium+translation+telugu
Selenium,Advanced,How do you test browser find-in-page functionality (Ctrl+F)?,Find in Page,Search,Browser Feature,Trigger browser find via keyboard shortcut (Keys.CONTROL + "f"). Test highlighting, navigation between matches. Browser controls UI; can verify search results via JavaScript.,https://www.selenium.dev/documentation/webdriver/actions_api/keyboard/,https://youtube.com/results?search_query=selenium+find+in+page,https://youtube.com/results?search_query=selenium+find+page+hindi,https://youtube.com/results?search_query=selenium+find+page+kannada,https://youtube.com/results?search_query=selenium+find+page+tamil,https://youtube.com/results?search_query=selenium+find+page+telugu
Selenium,Advanced,How do you handle browser print and print preview dialogs?,Print,Print Preview,System Dialogs,Cannot automate print dialog directly. Use JavaScript window.print() to trigger, but dialog is OS-level. Test print stylesheets with media queries. Alternative: PDF generation testing via backend.,https://www.selenium.dev/documentation/,https://youtube.com/results?search_query=selenium+print+dialog+testing,https://youtube.com/results?search_query=selenium+print+hindi,https://youtube.com/results?search_query=selenium+print+kannada,https://youtube.com/results?search_query=selenium+print+tamil,https://youtube.com/results?search_query=selenium+print+telugu
Selenium,Advanced,How do you test browser zoom with mouse wheel?,Mouse Wheel,Zoom,Precision,Use Actions class with scroll for mouse wheel zoom. Varies by browser: Ctrl+scroll. Test incremental zoom, reset functionality. Visual verification needed for actual zoom level.,https://www.selenium.dev/documentation/webdriver/actions_api/wheel/,https://youtube.com/results?search_query=selenium+mouse+wheel+zoom,https://youtube.com/results?search_query=selenium+mouse+zoom+hindi,https://youtube.com/results?search_query=selenium+mouse+zoom+kannada,https://youtube.com/results?search_query=selenium+mouse+zoom+tamil,https://youtube.com/results?search_query=selenium+mouse+zoom+telugu
Selenium,Advanced,How do you handle browser safe browsing warnings and malware alerts?,Safe Browsing,Security Warnings,Google,Trigger warnings by visiting known malware sites. Automate dismissal if possible. Usually requires browser flag to disable safe browsing for testing: --disable-features=SafeBrowsing.,https://www.selenium.dev/documentation/webdriver/browsers/,https://youtube.com/results?search_query=selenium+safe+browsing+testing,https://youtube.com/results?search_query=selenium+safe+browsing+hindi,https://youtube.com/results?search_query=selenium+safe+browsing+kannada,https://youtube.com/results?search_query=selenium+safe+browsing+tamil,https://youtube.com/results?search_query=selenium+safe+browsing+telugu
Selenium,Advanced,How do you test browser autocomplete form filling?,Autocomplete,Forms,UX,Test browser's built-in autocomplete for addresses, payment info. Set autocomplete attributes correctly. Hard to test actual browser autocomplete UI; focus on attribute validation and form submission.,https://www.selenium.dev/documentation/,https://youtube.com/results?search_query=selenium+autocomplete+testing,https://youtube.com/results?search_query=selenium+autocomplete+hindi,https://youtube.com/results?search_query=selenium+autocomplete+kannada,https://youtube.com/results?search_query=selenium+autocomplete+tamil,https://youtube.com/results?search_query=selenium+autocomplete+telugu
Selenium,Advanced,How do you handle browser spell check functionality?,Spell Check,Text Areas,Writing,Test in contenteditable areas or text areas with spellcheck attribute. Browser handles highlighting; can test by verifying misspelled words are marked (visual testing). Limited automation support.,https://www.selenium.dev/documentation/,https://youtube.com/results?search_query=selenium+spell+check+testing,https://youtube.com/results?search_query=selenium+spell+check+hindi,https://youtube.com/results?search_query=selenium+spell+check+kannada,https://youtube.com/results?search_query=selenium+spell+check+tamil,https://youtube.com/results?search_query=selenium+spell+check+telugu
Selenium,Advanced,How do you test browser read aloud/text-to-speech features?,Text to Speech,Accessibility,Speech,Trigger browser read aloud (varies by browser). Cannot verify audio output. Test UI controls for play/pause. Mostly manual testing for actual speech quality.,https://www.selenium.dev/documentation/,https://youtube.com/results?search_query=selenium+text+to+speech+testing,https://youtube.com/results?search_query=selenium+text+speech+hindi,https://youtube.com/results?search_query=selenium+text+speech+kannada,https://youtube.com/results?search_query=selenium+text+speech+tamil,https://youtube.com/results?search_query=selenium+text+speech+telugu
Selenium,Advanced,How do you handle browser picture-in-picture mode?,PiP,Video,Multitasking,Trigger PiP via JavaScript: videoElement.requestPictureInPicture(). Test resizing, positioning, interaction. Browser controls PiP window; limited automation of the PiP window itself.,https://www.selenium.dev/documentation/,https://youtube.com/results?search_query=selenium+picture+in+picture+testing,https://youtube.com/results?search_query=selenium+pip+hindi,https://youtube.com/results?search_query=selenium+pip+kannada,https://youtube.com/results?search_query=selenium+pip+tamil,https://youtube.com/results?search_query=selenium+pip+telugu
Selenium,Advanced,How do you test browser tab discarding (memory optimization)?,Tab Discarding,Performance,Memory,Trigger low memory state or use Chrome flags to force discarding. Test page restoration after discard. Browser behavior; difficult to reliably automate triggering.,https://www.selenium.dev/documentation/webdriver/browsers/,https://youtube.com/results?search_query=selenium+tab+discarding+testing,https://youtube.com/results?search_query=selenium+tab+discard+hindi,https://youtube.com/results?search_query=selenium+tab+discard+kannada,https://youtube.com/results?search_query=selenium+tab+discard+tamil,https://youtube.com/results?search_query=selenium+tab+discard+telugu
Selenium,Advanced,How do you handle browser shared worker and web worker testing?,Web Workers,Multithreading,Background,Test message passing between main thread and workers. Use JavaScript to post messages. Verify UI updates from worker messages. Workers run in background; can't directly interact.,https://www.selenium.dev/documentation/,https://youtube.com/results?search_query=selenium+web+workers+testing,https://youtube.com/results?search_query=selenium+web+workers+hindi,https://youtube.com/results?search_query=selenium+web+workers+kannada,https://youtube.com/results?search_query=selenium+web+workers+tamil,https://youtube.com/results?search_query=selenium+web+workers+telugu
Selenium,Advanced,How do you test browser clipboard integration (copy/paste)?,Clipboard,Copy Paste,System Integration,Use Actions class or keyboard shortcuts for copy/paste. Test with execCommand (deprecated) or Clipboard API. Browser permissions may restrict clipboard access. Cross-origin clipboard restricted.,https://www.selenium.dev/documentation/webdriver/actions_api/keyboard/,https://youtube.com/results?search_query=selenium+clipboard+testing,https://youtube.com/results?search_query=selenium+clipboard+hindi,https://youtube.com/results?search_query=selenium+clipboard+kannada,https://youtube.com/results?search_query=selenium+clipboard+tamil,https://youtube.com/results?search_query=selenium+clipboard+telugu
Selenium,Advanced,How do you handle browser media session API (media notifications)?,Media Session,Notifications,Audio Control,Test media metadata display in OS, playback controls. Use JavaScript to set media metadata. Browser/OS handles UI; limited automation of system media controls.,https://www.selenium.dev/documentation/,https://youtube.com/results?search_query=selenium+media+session+testing,https://youtube.com/results?search_query=selenium+media+session+hindi,https://youtube.com/results?search_query=selenium+media+session+kannada,https://youtube.com/results?search_query=selenium+media+session+tamil,https://youtube.com/results?search_query=selenium+media+session+telugu
Selenium,Advanced,How do you test browser payment request API?,Payment API,E-commerce,Checkout,Mock payment methods using test credentials. Test UI flow, validation. Real payment testing requires sandbox environments. Browser controls payment UI; limited automation.,https://www.selenium.dev/documentation/,https://youtube.com/results?search_query=selenium+payment+api+testing,https://youtube.com/results?search_query=selenium+payment+api+hindi,https://youtube.com/results?search_query=selenium+payment+api+kannada,https://youtube.com/results?search_query=selenium+payment+api+tamil,https://youtube.com/results?search_query=selenium+payment+api+telugu
Selenium,Advanced,How do you handle browser credential management API?,Credential Management,Passwords,Security,Test auto-sign-in, saving credentials. Browser controls UI. Can test via JavaScript CredentialsContainer API. Requires secure context (HTTPS).,https://www.selenium.dev/documentation/,https://youtube.com/results?search_query=selenium+credential+management,https://youtube.com/results?search_query=selenium+credentials+hindi,https://youtube.com/results?search_query=selenium+credentials+kannada,https://youtube.com/results?search_query=selenium+credentials+tamil,https://youtube.com/results?search_query=selenium+credentials+telugu
Selenium,Advanced,How do you test browser presentation API (second screen)?,Presentation API,Screens,Display,Test presentation request, controlling secondary display. Requires actual second screen or simulation. Limited automation support for multi-screen scenarios.,https://www.selenium.dev/documentation/,https://youtube.com/results?search_query=selenium+presentation+api+testing,https://youtube.com/results?search_query=selenium+presentation+hindi,https://youtube.com/results?search_query=selenium+presentation+kannada,https://youtube.com/results?search_query=selenium+presentation+tamil,https://youtube.com/results?search_query=selenium+presentation+telugu
Selenium,Advanced,How do you handle browser sensor APIs (ambient light, proximity, etc.)?,Sensor APIs,Hardware,Environment,Mock sensors using Chrome DevTools or browser flags. Test UI response to sensor data changes. Actual hardware sensors not available in automation.,https://www.selenium.dev/documentation/webdriver/browsers/,https://youtube.com/results?search_query=selenium+sensor+api+testing,https://youtube.com/results?search_query=selenium+sensor+hindi,https://youtube.com/results?search_query=selenium+sensor+kannada,https://youtube.com/results?search_query=selenium+sensor+tamil,https://youtube.com/results?search_query=selenium+sensor+telugu
Selenium,Advanced,How do you test browser gamepad API support?,Gamepad,Gaming,Controllers,Simulate gamepad connections via Chrome DevTools. Test button mapping, vibration support. Requires actual gamepad for full testing; automation limited to connection simulation.,https://www.selenium.dev/documentation/webdriver/browsers/,https://youtube.com/results?search_query=selenium+gamepad+api+testing,https://youtube.com/results?search_query=selenium+gamepad+hindi,https://youtube.com/results?search_query=selenium+gamepad+kannada,https://youtube.com/results?search_query=selenium+gamepad+tamil,https://youtube.com/results?search_query=selenium+gamepad+telugu
Selenium,Advanced,How do you handle browser virtual reality (WebXR) testing?,WebXR,VR,AR,Simulate XR devices via Chrome flags. Test basic API interactions. Actual VR/AR testing requires specialized hardware. Limited to functional not immersive testing.,https://www.selenium.dev/documentation/webdriver/browsers/,https://youtube.com/results?search_query=selenium+webxr+testing,https://youtube.com/results?search_query=selenium+webxr+hindi,https://youtube.com/results?search_query=selenium+webxr+kannada,https://youtube.com/results?search_query=selenium+webxr+tamil,https://youtube.com/results?search_query=selenium+webxr+telugu
Selenium,Advanced,How do you test browser color scheme detection (light/dark)?,Color Scheme,CSS Media,Preferences,Test prefers-color-scheme media query. Switch OS/browser theme, verify CSS changes. Use JavaScript to detect and override. Automate theme switching where possible.,https://www.selenium.dev/documentation/,https://youtube.com/results?search_query=selenium+color+scheme+testing,https://youtube.com/results?search_query=selenium+color+scheme+hindi,https://youtube.com/results?search_query=selenium+color+scheme+kannada,https://youtube.com/results?search_query=selenium+color+scheme+tamil,https://youtube.com/results?search_query=selenium+color+scheme+telugu
Selenium,Advanced,How do you handle browser reduced motion accessibility preference?,Reduced Motion,Accessibility,Animations,Test with prefers-reduced-motion media query. Set browser flag: --force-prefers-reduced-motion. Verify animations are disabled or alternative UI presented.,https://www.selenium.dev/documentation/webdriver/browsers/,https://youtube.com/results?search_query=selenium+reduced+motion+testing,https://youtube.com/results?search_query=selenium+reduced+motion+hindi,https://youtube.com/results?search_query=selenium+reduced+motion+kannada,https://youtube.com/results?search_query=selenium+reduced+motion+tamil,https://youtube.com/results?search_query=selenium+reduced+motion+telugu
Selenium,Advanced,How do you test browser high contrast mode?,High Contrast,Accessibility,Visual,Enable high contrast via OS settings or browser flags. Test UI readability, color overrides. Visual testing tools for verification. OS-dependent feature.,https://www.selenium.dev/documentation/,https://youtube.com/results?search_query=selenium+high+contrast+testing,https://youtube.com/results?search_query=selenium+high+contrast+hindi,https://youtube.com/results?search_query=selenium+high+contrast+kannada,https://youtube.com/results?search_query=selenium+high+contrast+tamil,https://youtube.com/results?search_query=selenium+high+contrast+telugu
Selenium,Advanced,How do you handle browser cursor size and style testing?,Cursor,Pointer,Accessibility,Test CSS cursor properties. Change cursor via JavaScript. Browser/OS controls actual cursor rendering. Limited to verifying CSS properties, not visual rendering.,https://www.selenium.dev/documentation/,https://youtube.com/results?search_query=selenium+cursor+testing,https://youtube.com/results?search_query=selenium+cursor+hindi,https://youtube.com/results?search_query=selenium+cursor+kannada,https://youtube.com/results?search_query=selenium+cursor+tamil,https://youtube.com/results?search_query=selenium+cursor+telugu
Selenium,Advanced,How do you test browser form validation and constraint API?,Form Validation,HTML5,Constraints,Test HTML5 validation attributes: required, pattern, min/max. Use JavaScript checkValidity(), reportValidity(). Test custom error messages, UI feedback for invalid fields.,https://www.selenium.dev/documentation/,https://youtube.com/results?search_query=selenium+form+validation+testing,https://youtube.com/results?search_query=selenium+form+validation+hindi,https://youtube.com/results?search_query=selenium+form+validation+kannada,https://youtube.com/results?search_query=selenium+form+validation+tamil,https://youtube.com/results?search_query=selenium+form+validation+telugu
Selenium,Advanced,How do you handle browser viewport units (vh, vw, vmin, vmax) testing?,Viewport Units,Responsive,CSS,Test with different viewport sizes using driver.manage().window().setSize(). Verify element sizing relative to viewport. Complex calculations may need JavaScript verification.,https://www.selenium.dev/documentation/webdriver/browsers/windows/,https://youtube.com/results?search_query=selenium+viewport+units+testing,https://youtube.com/results?search_query=selenium+viewport+hindi,https://youtube.com/results?search_query=selenium+viewport+kannada,https://youtube.com/results?search_query=selenium+viewport+tamil,https://youtube.com/results?search_query=selenium+viewport+telugu
Selenium,Advanced,How do you test browser CSS grid and flexbox layouts?,CSS Grid,Flexbox,Layout,Test responsive behavior with different viewports. Verify alignment, wrapping, ordering. Visual testing for exact layout. JavaScript to inspect computed styles.,https://www.selenium.dev/documentation/,https://youtube.com/results?search_query=selenium+css+grid+testing,https://youtube.com/results?search_query=selenium+css+grid+hindi,https://youtube.com/results?search_query=selenium+css+grid+kannada,https://youtube.com/results?search_query=selenium+css+grid+tamil,https://youtube.com/results?search_query=selenium+css+grid+telugu
Selenium,Advanced,How do you handle browser CSS custom properties (variables) testing?,CSS Variables,Custom Properties,Theming,Test variable values via JavaScript: getComputedStyle().getPropertyValue(). Change variables dynamically, verify UI updates. Theme switching often uses CSS variables.,https://www.selenium.dev/documentation/,https://youtube.com/results?search_query=selenium+css+variables+testing,https://youtube.com/results?search_query=selenium+css+variables+hindi,https://youtube.com/results?search_query=selenium+css+variables+kannada,https://youtube.com/results?search_query=selenium+css+variables+tamil,https://youtube.com/results?search_query=selenium+css+variables+telugu
Selenium,Advanced,How do you test browser CSS container queries?,Container Queries,Responsive,CSS,New CSS feature. Test element styles based on container size. Requires JavaScript polyfill for older browsers. Test with resizing containers, verifying style changes.,https://www.selenium.dev/documentation/,https://youtube.com/results?search_query=selenium+container+queries+testing,https://youtube.com/results?search_query=selenium+container+queries+hindi,https://youtube.com/results?search_query=selenium+container+queries+kannada,https://youtube.com/results?search_query=selenium+container+queries+tamil,https://youtube.com/results?search_query=selenium+container+queries+telugu
Selenium,Advanced,How do you handle browser CSS aspect-ratio property testing?,Aspect Ratio,Responsive,Media,Test element maintains ratio during resize. Use JavaScript to verify dimensions match ratio. Visual testing for exact adherence. Test with different content scenarios.,https://www.selenium.dev/documentation/,https://youtube.com/results?search_query=selenium+aspect+ratio+testing,https://youtube.com/results?search_query=selenium+aspect+ratio+hindi,https://youtube.com/results?search_query=selenium+aspect+ratio+kannada,https://youtube.com/results?search_query=selenium+aspect+ratio+tamil,https://youtube.com/results?search_query=selenium+aspect+ratio+telugu
Selenium,Advanced,How do you test browser CSS scroll snap functionality?,Scroll Snap,UX,Navigation,Test snapping behavior during scroll. Use JavaScript to trigger scroll, verify snap positions. Actions class for precise scrolling. Test keyboard and mouse wheel scrolling.,https://www.selenium.dev/documentation/webdriver/actions_api/wheel/,https://youtube.com/results?search_query=selenium+scroll+snap+testing,https://youtube.com/results?search_query=selenium+scroll+snap+hindi,https://youtube.com/results?search_query=selenium+scroll+snap+kannada,https://youtube.com/results?search_query=selenium+scroll+snap+tamil,https://youtube.com/results?search_query=selenium+scroll+snap+telugu
Selenium,Advanced,How do you handle browser CSS blend modes and filters testing?,Blend Modes,Filters,Graphics,Test filter applications: blur, grayscale, etc. Visual testing for exact rendering. JavaScript to verify filter properties. Cross-browser differences common.,https://www.selenium.dev/documentation/,https://youtube.com/results?search_query=selenium+css+filters+testing,https://youtube.com/results?search_query=selenium+css+filters+hindi,https://youtube.com/results?search_query=selenium+css+filters+kannada,https://youtube.com/results?search_query=selenium+css+filters+tamil,https://youtube.com/results?search_query=selenium+css+filters+telugu
Selenium,Advanced,How do you test browser CSS backdrop-filter property?,Backdrop Filter,Glass Effect,Visual,Test blur effect behind elements. Visual verification needed. JavaScript to check property value. Performance testing for heavy use of backdrop-filter.,https://www.selenium.dev/documentation/,https://youtube.com/results?search_query=selenium+backdrop+filter+testing,https://youtube.com/results?search_query=selenium+backdrop+filter+hindi,https://youtube.com/results?search_query=selenium+backdrop+filter+kannada,https://youtube.com/results?search_query=selenium+backdrop+filter+tamil,https://youtube.com/results?search_query=selenium+backdrop+filter+telugu
Selenium,Advanced,How do you handle browser CSS logical properties (start/end) testing?,Logical Properties,RTL,Bidirectional,Test with different text directions (LTR, RTL). Verify positioning, margins, padding adapt. Switch direction via HTML dir attribute or CSS direction property.,https://www.selenium.dev/documentation/,https://youtube.com/results?search_query=selenium+logical+properties+testing,https://youtube.com/results?search_query=selenium+logical+properties+hindi,https://youtube.com/results?search_query=selenium+logical+properties+kannada,https://youtube.com/results?search_query=selenium+logical+properties+tamil,https://youtube.com/results?search_query=selenium+logical+properties+telugu
