skill,level,question_text,option_a,option_b,option_c,option_d,correct_answer,explanation,topic,mdn_link,youtube_english,youtube_hindi,youtube_kannada,youtube_tamil,youtube_telugu

Selenium,Advanced,How does Selenium Grid handle parallel test execution across different browsers and OS combinations?,Infrastructure,Grid,Parallel Execution,Selenium Grid uses a hub-node architecture where the hub distributes tests to nodes configured with different browser/OS combinations. It manages session requests, load balancing, and allows simultaneous test execution reducing overall test time.,https://www.selenium.dev/documentation/grid/,https://youtube.com/results?search_query=selenium+grid+parallel+execution,https://youtube.com/results?search_query=selenium+grid+parallel+execution+hindi,https://youtube.com/results?search_query=selenium+grid+parallel+execution+kannada,https://youtube.com/results?search_query=selenium+grid+parallel+execution+tamil,https://youtube.com/results?search_query=selenium+grid+parallel+execution+telugu
Selenium,Advanced,What are Page Object Model (POM) and Page Factory design patterns, and how do they differ?,Design Patterns,Page Objects,Maintainability,POM is a design pattern creating separate class files for each page with locators and methods. Page Factory is Selenium's implementation of POM using @FindBy annotations and PageFactory.initElements() for lazy initialization of WebElements.,https://www.selenium.dev/documentation/test_practices/encouraged/page_object_models/,https://youtube.com/results?search_query=selenium+page+object+model+page+factory,https://youtube.com/results?search_query=selenium+page+object+model+hindi,https://youtube.com/results?search_query=selenium+page+object+model+kannada,https://youtube.com/results?search_query=selenium+page+object+model+tamil,https://youtube.com/results?search_query=selenium+page+object+model+telugu
Selenium,Advanced,How do you handle dynamic web elements in Selenium WebDriver?,Locators,Dynamic Elements,Waits,Use explicit waits with ExpectedConditions, relative XPath/CSS selectors (contains, starts-with, ends-with), or find elements by multiple attributes. Avoid using absolute XPaths and implement retry mechanisms for flaky elements.,https://www.selenium.dev/documentation/webdriver/elements/finders/,https://youtube.com/results?search_query=selenium+handle+dynamic+elements,https://youtube.com/results?search_query=selenium+dynamic+elements+hindi,https://youtube.com/results?search_query=selenium+dynamic+elements+kannada,https://youtube.com/results?search_query=selenium+dynamic+elements+tamil,https://youtube.com/results?search_query=selenium+dynamic+elements+telugu
Selenium,Advanced,What is the difference between implicit, explicit, and fluent waits in Selenium?,Waits,Synchronization,Timeouts,Implicit wait sets a global timeout for element searches. Explicit wait waits for specific conditions with polling. Fluent wait is a type of explicit wait with configurable polling frequency and ignorable exceptions.,https://www.selenium.dev/documentation/webdriver/waits/,https://youtube.com/results?search_query=selenium+waits+difference,https://youtube.com/results?search_query=selenium+waits+hindi,https://youtube.com/results?search_query=selenium+waits+kannada,https://youtube.com/results?search_query=selenium+waits+tamil,https://youtube.com/results?search_query=selenium+waits+telugu
Selenium,Advanced,How do you handle multiple windows and tabs in Selenium?,Window Management,Handles,Switching,Use getWindowHandles() to get all window handles, then switch between them using switchTo().window(handle). Store parent window handle before opening new windows and switch back when needed.,https://www.selenium.dev/documentation/webdriver/interactions/windows/,https://youtube.com/results?search_query=selenium+multiple+windows+tabs,https://youtube.com/results?search_query=selenium+multiple+windows+hindi,https://youtube.com/results?search_query=selenium+multiple+windows+kannada,https://youtube.com/results?search_query=selenium+multiple+windows+tamil,https://youtube.com/results?search_query=selenium+multiple+windows+telugu
Selenium,Advanced,How do you execute JavaScript code in Selenium WebDriver?,JavaScript Executor,Script Execution,Interactions,Use JavascriptExecutor interface: ((JavascriptExecutor)driver).executeScript("script", args). Useful for clicking hidden elements, scrolling, getting page properties, or performing actions when WebDriver fails.,https://www.selenium.dev/documentation/webdriver/elements/interactions/,https://youtube.com/results?search_query=selenium+javascript+executor,https://youtube.com/results?search_query=selenium+javascript+executor+hindi,https://youtube.com/results?search_query=selenium+javascript+executor+kannada,https://youtube.com/results?search_query=selenium+javascript+executor+tamil,https://youtube.com/results?search_query=selenium+javascript+executor+telugu
Selenium,Advanced,What are different ways to handle iframes in Selenium?,Frames,Iframes,Switching,Switch to iframe using driver.switchTo().frame() with index, name/id, or WebElement. Switch back to default content using driver.switchTo().defaultContent() or parent frame with driver.switchTo().parentFrame().,https://www.selenium.dev/documentation/webdriver/interactions/frames/,https://youtube.com/results?search_query=selenium+handle+iframes,https://youtube.com/results?search_query=selenium+iframes+hindi,https://youtube.com/results?search_query=selenium+iframes+kannada,https://youtube.com/results?search_query=selenium+iframes+tamil,https://youtube.com/results?search_query=selenium+iframes+telugu
Selenium,Advanced,How do you handle dropdowns that are not select tags?,Dropdowns,Custom Components,JavaScript,Use regular click actions or JavaScript for custom dropdowns. For React/Angular dropdowns, may need to trigger events or use Actions class. Some require clicking the dropdown then clicking the option.,https://www.selenium.dev/documentation/webdriver/elements/select_lists/,https://youtube.com/results?search_query=selenium+custom+dropdowns,https://youtube.com/results?search_query=selenium+dropdowns+hindi,https://youtube.com/results?search_query=selenium+dropdowns+kannada,https://youtube.com/results?search_query=selenium+dropdowns+tamil,https://youtube.com/results?search_query=selenium+dropdowns+telugu
Selenium,Advanced,What are the different types of exceptions in Selenium and how do you handle them?,Exceptions,Error Handling,Debugging,Common exceptions: NoSuchElementException, StaleElementReferenceException, TimeoutException, ElementNotInteractableException. Handle using try-catch, explicit waits, retry mechanisms, and proper synchronization.,https://www.selenium.dev/documentation/webdriver/troubleshooting/errors/,https://youtube.com/results?search_query=selenium+exceptions+handling,https://youtube.com/results?search_query=selenium+exceptions+hindi,https://youtube.com/results?search_query=selenium+exceptions+kannada,https://youtube.com/results?search_query=selenium+exceptions+tamil,https://youtube.com/results?search_query=selenium+exceptions+telugu
Selenium,Advanced,How do you perform drag and drop operations in Selenium?,Actions Class,Mouse Actions,Interactions,Use Actions class: new Actions(driver).dragAndDrop(source, target).perform(). For complex drag-drop, use clickAndHold(), moveToElement(), release() sequence. Some implementations may require JavaScript.,https://www.selenium.dev/documentation/webdriver/actions_api/mouse/,https://youtube.com/results?search_query=selenium+drag+and+drop,https://youtube.com/results?search_query=selenium+drag+drop+hindi,https://youtube.com/results?search_query=selenium+drag+drop+kannada,https://youtube.com/results?search_query=selenium+drag+drop+tamil,https://youtube.com/results?search_query=selenium+drag+drop+telugu
Selenium,Advanced,How do you handle file uploads in Selenium?,File Upload,Send Keys,System Dialogs,Use sendKeys() with the absolute file path to the input element of type="file". For non-input elements, may need AutoIT, Robot class, or Sikuli. Modern apps may use JavaScript or drag-drop.,https://www.selenium.dev/documentation/webdriver/elements/file_upload/,https://youtube.com/results?search_query=selenium+file+upload,https://youtube.com/results?search_query=selenium+file+upload+hindi,https://youtube.com/results?search_query=selenium+file+upload+kannada,https://youtube.com/results?search_query=selenium+file+upload+tamil,https://youtube.com/results?search_query=selenium+file+upload+telugu
Selenium,Advanced,How do you capture screenshots and videos in Selenium tests?,Reporting,Screenshots,Evidence,Use TakesScreenshot interface: ((TakesScreenshot)driver).getScreenshotAs(OutputType.FILE). For videos, use third-party tools like Allure, ExtentReports, or integrate with CI/CD tools. Selenium 4 has native support for relative screenshots.,https://www.selenium.dev/documentation/webdriver/capabilities/shared/,https://youtube.com/results?search_query=selenium+screenshots+videos,https://youtube.com/results?search_query=selenium+screenshots+hindi,https://youtube.com/results?search_query=selenium+screenshots+kannada,https://youtube.com/results?search_query=selenium+screenshots+tamil,https://youtube.com/results?search_query=selenium+screenshots+telugu
Selenium,Advanced,What are Data Driven and Keyword Driven frameworks in Selenium?,Frameworks,Test Design,Patterns,Data Driven: Test data separated from scripts (Excel, CSV, DB). Keyword Driven: Keywords represent actions stored separately. Hybrid combines both. Uses Apache POI, TestNG DataProvider, or external data sources.,https://www.selenium.dev/documentation/test_practices/,https://youtube.com/results?search_query=selenium+data+driven+keyword+driven,https://youtube.com/results?search_query=selenium+data+driven+hindi,https://youtube.com/results?search_query=selenium+data+driven+kannada,https://youtube.com/results?search_query=selenium+data+driven+tamil,https://youtube.com/results?search_query=selenium+data+driven+telugu
Selenium,Advanced,How do you handle browser cookies in Selenium?,Cookies,Session Management,Storage,Use driver.manage().getCookies(), addCookie(), deleteCookie(), deleteAllCookies(). Useful for authentication, session testing, or bypassing login screens by adding authenticated cookies.,https://www.selenium.dev/documentation/webdriver/interactions/cookies/,https://youtube.com/results?search_query=selenium+handle+cookies,https://youtube.com/results?search_query=selenium+cookies+hindi,https://youtube.com/results?search_query=selenium+cookies+kannada,https://youtube.com/results?search_query=selenium+cookies+tamil,https://youtube.com/results?search_query=selenium+cookies+telugu
Selenium,Advanced,What is the difference between findElement and findElements methods?,Locators,Elements,Collections,findElement() returns first matching WebElement or throws exception. findElements() returns List of all matching WebElements (empty list if none found). Use findElements() to check element existence without exception.,https://www.selenium.dev/documentation/webdriver/elements/finders/,https://youtube.com/results?search_query=selenium+findelement+findelements,https://youtube.com/results?search_query=selenium+findelement+hindi,https://youtube.com/results?search_query=selenium+findelement+kannada,https://youtube.com/results?search_query=selenium+findelement+tamil,https://youtube.com/results?search_query=selenium+findelement+telugu
Selenium,Advanced,How do you handle AJAX calls and dynamic content loading in Selenium?,AJAX,Asynchronous,Waits,Use explicit waits for elements to appear/change after AJAX calls. Wait for specific conditions like element visibility, staleness, or custom conditions using ExpectedConditions. Avoid Thread.sleep() for AJAX waits.,https://www.selenium.dev/documentation/webdriver/waits/,https://youtube.com/results?search_query=selenium+ajax+handling,https://youtube.com/results?search_query=selenium+ajax+hindi,https://youtube.com/results?search_query=selenium+ajax+kannada,https://youtube.com/results?search_query=selenium+ajax+tamil,https://youtube.com/results?search_query=selenium+ajax+telugu
Selenium,Advanced,What are relative locators in Selenium 4 and how do they work?,Locators,Selenium 4,Relative Positioning,Relative locators (Friendly Locators) find elements relative to others: above(), below(), toLeftOf(), toRightOf(), near(). Uses JavaScript getBoundingClientRect() to calculate positions. Useful when few attributes are available.,https://www.selenium.dev/documentation/webdriver/elements/locators/,https://youtube.com/results?search_query=selenium+relative+locators,https://youtube.com/results?search_query=selenium+relative+locators+hindi,https://youtube.com/results?search_query=selenium+relative+locators+kannada,https://youtube.com/results?search_query=selenium+relative+locators+tamil,https://youtube.com/results?search_query=selenium+relative+locators+telugu
Selenium,Advanced,How do you perform database testing with Selenium?,Database,Integration,Validation,Use JDBC to connect to databases and execute queries. Combine UI tests with DB validation: perform action in UI, verify data in DB. Useful for testing CRUD operations, data integrity, and backend validations.,https://docs.oracle.com/javase/tutorial/jdbc/,https://youtube.com/results?search_query=selenium+database+testing,https://youtube.com/results?search_query=selenium+database+hindi,https://youtube.com/results?search_query=selenium+database+kannada,https://youtube.com/results?search_query=selenium+database+tamil,https://youtube.com/results?search_query=selenium+database+telugu
Selenium,Advanced,What are headless browsers and when to use them?,Headless,Execution,Browsers,Headless browsers run without GUI (Chrome Headless, Firefox Headless). Faster execution, suitable for CI/CD, server environments. Use for regression tests, smoke tests. Not for visual validation or complex user interactions.,https://www.selenium.dev/documentation/webdriver/browsers/,https://youtube.com/results?search_query=selenium+headless+browsers,https://youtube.com/results?search_query=selenium+headless+hindi,https://youtube.com/results?search_query=selenium+headless+kannada,https://youtube.com/results?search_query=selenium+headless+tamil,https://youtube.com/results?search_query=selenium+headless+telugu
Selenium,Advanced,How do you handle SSL certificates and security warnings in Selenium?,Security,SSL,Certificates,For Chrome: use --ignore-certificate-errors. For Firefox: set acceptInsecureCerts capability. For self-signed certificates, may need to add exceptions or use browser profiles with certificates pre-installed.,https://www.selenium.dev/documentation/webdriver/capabilities/,https://youtube.com/results?search_query=selenium+ssl+certificates,https://youtube.com/results?search_query=selenium+ssl+hindi,https://youtube.com/results?search_query=selenium+ssl+kannada,https://youtube.com/results?search_query=selenium+ssl+tamil,https://youtube.com/results?search_query=selenium+ssl+telugu
Selenium,Advanced,How do you implement cross-browser testing with Selenium?,Cross Browser,Compatibility,Testing,Use WebDriverManager for driver management, parameterize browser types in tests, run tests on multiple browsers (Chrome, Firefox, Edge, Safari). Use Selenium Grid for parallel execution across browsers.,https://www.selenium.dev/documentation/grid/,https://youtube.com/results?search_query=selenium+cross+browser+testing,https://youtube.com/results?search_query=selenium+cross+browser+hindi,https://youtube.com/results?search_query=selenium+cross+browser+kannada,https://youtube.com/results?search_query=selenium+cross+browser+tamil,https://youtube.com/results?search_query=selenium+cross+browser+telugu
Selenium,Advanced,What are different ways to handle authentication popups in Selenium?,Authentication,Popups,Basic Auth,Pass credentials in URL: https://username:password@domain.com. Use AutoIT/Robot for OS-level dialogs. For basic auth, use WebDriverWait with Alert. Some apps use custom modal dialogs requiring regular WebDriver handling.,https://www.selenium.dev/documentation/webdriver/interactions/alerts/,https://youtube.com/results?search_query=selenium+authentication+popups,https://youtube.com/results?search_query=selenium+authentication+hindi,https://youtube.com/results?search_query=selenium+authentication+kannada,https://youtube.com/results?search_query=selenium+authentication+tamil,https://youtube.com/results?search_query=selenium+authentication+telugu
Selenium,Advanced,How do you handle WebDriver events and listeners?,Event Listeners,Logging,Monitoring,Implement WebDriverEventListener interface or use EventFiringWebDriver. Listen to events like beforeClick, afterFindBy, onException. Useful for logging, taking screenshots on failure, or custom reporting.,https://www.selenium.dev/documentation/webdriver/actions_api/events/,https://youtube.com/results?search_query=selenium+event+listeners,https://youtube.com/results?search_query=selenium+listeners+hindi,https://youtube.com/results?search_query=selenium+listeners+kannada,https://youtube.com/results?search_query=selenium+listeners+tamil,https://youtube.com/results?search_query=selenium+listeners+telugu
Selenium,Advanced,What is the difference between driver.close() and driver.quit()?,Browser Management,Teardown,Methods,driver.close() closes current window/tab. driver.quit() closes all windows/tabs and ends WebDriver session, releasing resources. Always use quit() in teardown to avoid memory leaks and orphaned processes.,https://www.selenium.dev/documentation/webdriver/browser/windows/,https://youtube.com/results?search_query=selenium+close+vs+quit,https://youtube.com/results?search_query=selenium+close+quit+hindi,https://youtube.com/results?search_query=selenium+close+quit+kannada,https://youtube.com/results?search_query=selenium+close+quit+tamil,https://youtube.com/results?search_query=selenium+close+quit+telugu
Selenium,Advanced,How do you handle date pickers and calendar widgets in Selenium?,Calendar,Date Picker,Widgets,Click date field to open picker, navigate using next/previous arrows, select day. For complex pickers, use JavaScript to set value directly. Some libraries (like React) may require triggering change events after setting value.,https://www.selenium.dev/documentation/webdriver/elements/interactions/,https://youtube.com/results?search_query=selenium+date+pickers,https://youtube.com/results?search_query=selenium+date+picker+hindi,https://youtube.com/results?search_query=selenium+date+picker+kannada,https://youtube.com/results?search_query=selenium+date+picker+tamil,https://youtube.com/results?search_query=selenium+date+picker+telugu
Selenium,Advanced,How do you handle mouse hover and right-click actions in Selenium?,Actions Class,Context Click,Hover,Use Actions class: hover - actions.moveToElement(element).perform(); right-click - actions.contextClick(element).perform(); double-click - actions.doubleClick(element).perform(). Chain multiple actions with build().perform().,https://www.selenium.dev/documentation/webdriver/actions_api/mouse/,https://youtube.com/results?search_query=selenium+mouse+hover+right+click,https://youtube.com/results?search_query=selenium+mouse+actions+hindi,https://youtube.com/results?search_query=selenium+mouse+actions+kannada,https://youtube.com/results?search_query=selenium+mouse+actions+tamil,https://youtube.com/results?search_query=selenium+mouse+actions+telugu
Selenium,Advanced,How do you handle file downloads in Selenium?,File Download,Preferences,Configuration,Set browser preferences to disable download dialogs and specify download directory. Chrome: use ChromeOptions with preferences. Firefox: set browser.download.dir. Cannot verify downloaded file content without external libraries.,https://www.selenium.dev/documentation/webdriver/browsers/,https://youtube.com/results?search_query=selenium+file+downloads,https://youtube.com/results?search_query=selenium+file+download+hindi,https://youtube.com/results?search_query=selenium+file+download+kannada,https://youtube.com/results?search_query=selenium+file+download+tamil,https://youtube.com/results?search_query=selenium+file+download+telugu
Selenium,Advanced,What are the different navigation methods in Selenium?,Navigation,Browser History,URLs,driver.navigate().to(url) - navigates to URL; back() - goes back; forward() - goes forward; refresh() - refreshes page. to() method works same as driver.get() but preserves history.,https://www.selenium.dev/documentation/webdriver/browser/navigation/,https://youtube.com/results?search_query=selenium+navigation+methods,https://youtube.com/results?search_query=selenium+navigation+hindi,https://youtube.com/results?search_query=selenium+navigation+kannada,https://youtube.com/results?search_query=selenium+navigation+tamil,https://youtube.com/results?search_query=selenium+navigation+telugu
Selenium,Advanced,How do you handle browser notifications and permissions in Selenium?,Notifications,Permissions,Browser Options,Use browser options to disable notifications: ChromeOptions with --disable-notifications. For other permissions, use preferences: Chrome - prefs.put("profile.default_content_setting_values.notifications", 2).,https://www.selenium.dev/documentation/webdriver/browsers/chrome/,https://youtube.com/results?search_query=selenium+browser+notifications,https://youtube.com/results?search_query=selenium+notifications+hindi,https://youtube.com/results?search_query=selenium+notifications+kannada,https://youtube.com/results?search_query=selenium+notifications+tamil,https://youtube.com/results?search_query=selenium+notifications+telugu
Selenium,Advanced,How do you handle WebTables in Selenium?,WebTables,Dynamic Tables,Data Extraction,Locate table, get rows with findElements(By.tagName("tr")), iterate through rows and cells. Use XPath axes for specific cell location. For dynamic tables, wait for rows to load and handle pagination.,https://www.selenium.dev/documentation/webdriver/elements/finders/,https://youtube.com/results?search_query=selenium+webtables+handling,https://youtube.com/results?search_query=selenium+webtables+hindi,https://youtube.com/results?search_query=selenium+webtables+kannada,https://youtube.com/results?search_query=selenium+webtables+tamil,https://youtube.com/results?search_query=selenium+webtables+telugu
Selenium,Advanced,What is StaleElementReferenceException and how do you resolve it?,Exceptions,Stale Elements,DOM Changes,Occurs when element is no longer attached to DOM (page refreshed, element removed/replaced). Resolve by re-finding element, using explicit wait for staleness, or implementing retry logic. Avoid storing WebElements for long periods.,https://www.selenium.dev/documentation/webdriver/troubleshooting/errors/stale_element_reference/,https://youtube.com/results?search_query=selenium+staleelementreferenceexception,https://youtube.com/results?search_query=selenium+stale+element+hindi,https://youtube.com/results?search_query=selenium+stale+element+kannada,https://youtube.com/results?search_query=selenium+stale+element+tamil,https://youtube.com/results?search_query=selenium+stale+element+telugu
Selenium,Advanced,How do you handle browser logs and console errors in Selenium?,Logging,Console Errors,Monitoring,Use driver.manage().logs().get(logType) where logType can be BROWSER, DRIVER, PERFORMANCE. Filter by Level (SEVERE, WARNING). Useful for catching JavaScript errors, network issues, or performance problems.,https://www.selenium.dev/documentation/webdriver/browser/logs/,https://youtube.com/results?search_query=selenium+browser+logs,https://youtube.com/results?search_query=selenium+browser+logs+hindi,https://youtube.com/results?search_query=selenium+browser+logs+kannada,https://youtube.com/results?search_query=selenium+browser+logs+tamil,https://youtube.com/results?search_query=selenium+browser+logs+telugu
Selenium,Advanced,How do you perform keyboard actions and key combinations in Selenium?,Keyboard Actions,Shortcuts,Keys Class,Use Actions class with sendKeys() or keyDown/keyUp for modifier keys (Ctrl, Shift, Alt). Use Keys enum for special keys. Example: actions.keyDown(Keys.CONTROL).sendKeys("c").keyUp(Keys.CONTROL).perform().,https://www.selenium.dev/documentation/webdriver/actions_api/keyboard/,https://youtube.com/results?search_query=selenium+keyboard+actions,https://youtube.com/results?search_query=selenium+keyboard+hindi,https://youtube.com/results?search_query=selenium+keyboard+kannada,https://youtube.com/results?search_query=selenium+keyboard+tamil,https://youtube.com/results?search_query=selenium+keyboard+telugu
Selenium,Advanced,What are different ways to scroll in Selenium?,Scrolling,JavaScript,Actions,Use JavaScript: ((JavascriptExecutor)driver).executeScript("window.scrollBy(0,500)"); Actions class: new Actions(driver).scrollToElement(element).perform(); Selenium 4: driver.findElement(locator).scrollIntoView().,https://www.selenium.dev/documentation/webdriver/actions_api/wheel/,https://youtube.com/results?search_query=selenium+scrolling+methods,https://youtube.com/results?search_query=selenium+scrolling+hindi,https://youtube.com/results?search_query=selenium+scrolling+kannada,https://youtube.com/results?search_query=selenium+scrolling+tamil,https://youtube.com/results?search_query=selenium+scrolling+telugu
