skill,level,question_text,option_a,option_b,option_c,option_d,correct_answer,explanation,topic,mdn_link,youtube_english,youtube_hindi,youtube_kannada,youtube_tamil,youtube_telugu
Selenium,Advanced,How do you handle browser differential serving testing?,Differential Serving,Modern Legacy,Performance,Test different bundles for modern vs legacy browsers. Feature detection, module/nomodule pattern. Verify correct bundle served. Fallback testing.,https://www.selenium.dev/documentation/,https://youtube.com/results?search_query=selenium+differential+serving+testing,https://youtube.com/results?search_query=selenium+differential+serving+hindi,https://youtube.com/results?search_query=selenium+differential+serving+kannada,https://youtube.com/results?search_query=selenium+differential+serving+tamil,https://youtube.com/results?search_query=selenium+differential+serving+telugu
Selenium,Advanced,How do you test browser privacy features (fingerprinting protection, tracking prevention)?,Privacy,Fingerprinting,Tracking,Test privacy settings impact on functionality. Verify tracking blocked. Browser-specific privacy features. Compliance testing with regulations.,https://www.selenium.dev/documentation/webdriver/browsers/,https://youtube.com/results?search_query=selenium+privacy+features+testing,https://youtube.com/results?search_query=selenium+privacy+hindi,https://youtube.com/results?search_query=selenium+privacy+kannada,https://youtube.com/results?search_query=selenium+privacy+tamil,https://youtube.com/results?search_query=selenium+privacy+telugu
Selenium,Advanced,How do you handle browser same-site cookie testing?,SameSite,Cookies,Security,Test cookie behavior with SameSite attribute (Strict, Lax, None). Cross-site request testing. Browser enforcement changes. Security testing for CSRF protection.,https://www.selenium.dev/documentation/webdriver/interactions/cookies/,https://youtube.com/results?search_query=selenium+samesite+cookie+testing,https://youtube.com/results?search_query=selenium+samesite+hindi,https://youtube.com/results?search_query=selenium+samesite+kannada,https://youtube.com/results?search_query=selenium+samesite+tamil,https://youtube.com/results?search_query=selenium+samesite+telugu
Selenium,Advanced,How do you test browser secure context restrictions?,Secure Context,HTTPS,Security,Test features requiring secure context (HTTPS). Mixed content warnings. Upgrade insecure requests. Development server vs production testing.,https://www.selenium.dev/documentation/,https://youtube.com/results?search_query=selenium+secure+context+testing,https://youtube.com/results?search_query=selenium+secure+context+hindi,https://youtube.com/results?search_query=selenium+secure+context+kannada,https://youtube.com/results?search_query=selenium+secure+context+tamil,https://youtube.com/results?search_query=selenium+secure+context+telugu
Selenium,Advanced,How do you handle browser content security policy (CSP) testing?,CSP,Security,Headers,Test CSP violations, reporting. Verify allowed sources for scripts, styles. Nonce/hash support. CSP level 2 vs 3 features.,https://www.selenium.dev/documentation/,https://youtube.com/results?search_query=selenium+csp+testing,https://youtube.com/results?search_query=selenium+csp+hindi,https://youtube.com/results?search_query=selenium+csp+kannada,https://youtube.com/results?search_query=selenium+csp+tamil,https://youtube.com/results?search_query=selenium+csp+telugu
Selenium,Advanced,How do you test browser cross-origin isolation?,Cross-Origin Isolation,Security,Performance,Test SharedArrayBuffer, performance.measureUserAgentSpecificMemory() availability. COOP, COEP headers. Verify isolation enables advanced features.,https://www.selenium.dev/documentation/,https://youtube.com/results?search_query=selenium+cross+origin+isolation+testing,https://youtube.com/results?search_query=selenium+cross+origin+hindi,https://youtube.com/results?search_query=selenium+cross+origin+kannada,https://youtube.com/results?search_query=selenium+cross+origin+tamil,https://youtube.com/results?search_query=selenium+cross+origin+telugu
Selenium,Advanced,How do you handle browser referrer policy testing?,Referrer Policy,Security,Privacy,Test referrer information sent with requests. Different policies: no-referrer, origin, strict-origin. Verify policy enforcement. Security implications.,https://www.selenium.dev/documentation/,https://youtube.com/results?search_query=selenium+referrer+policy+testing,https://youtube.com/results?search_query=selenium+referrer+hindi,https://youtube.com/results?search_query=selenium+referrer+kannada,https://youtube.com/results?search_query=selenium+referrer+tamil,https://youtube.com/results?search_query=selenium+referrer+telugu
Selenium,Advanced,How do you test browser feature policy (now permissions policy)?,Permissions Policy,Security,Features,Test API access restrictions: camera, microphone, geolocation. Verify policy enforcement. Deprecation of feature policy. New permissions policy syntax.,https://www.selenium.dev/documentation/,https://youtube.com/results?search_query=selenium+permissions+policy+testing,https://youtube.com/results?search_query=selenium+permissions+policy+hindi,https://youtube.com/results?search_query=selenium+permissions+policy+kannada,https://youtube.com/results?search_query=selenium+permissions+policy+tamil,https://youtube.com/results?search_query=selenium+permissions+policy+telugu
Selenium,Advanced,How do you handle browser mixed content testing?,Mixed Content,Security,HTTPS,Test automatic upgrading of HTTP resources. Blocked content warnings. Developer console warnings. Progressive enhancement vs strict enforcement.,https://www.selenium.dev/documentation/,https://youtube.com/results?search_query=selenium+mixed+content+testing,https://youtube.com/results?search_query=selenium+mixed+content+hindi,https://youtube.com/results?search_query=selenium+mixed+content+kannada,https://youtube.com/results?search_query=selenium+mixed+content+tamil,https://youtube.com/results?search_query=selenium+mixed+content+telugu
Selenium,Advanced,How do you test browser HSTS preload list?,HSTS,Security,HTTPS,Test automatic HTTPS redirects. Preload list inclusion verification. Subdomain coverage. Security headers testing.,https://www.selenium.dev/documentation/,https://youtube.com/results?search_query=selenium+hsts+testing,https://youtube.com/results?search_query=selenium+hsts+hindi,https://youtube.com/results?search_query=selenium+hsts+kannada,https://youtube.com/results?search_query=selenium+hsts+tamil,https://youtube.com/results?search_query=selenium+hsts+telugu
Selenium,Advanced,How do you handle browser expect-CT header testing?,Expect-CT,Security,Certificates,Test certificate transparency enforcement. Reporting of violations. Header configuration testing. Phasing out of expect-CT.,https://www.selenium.dev/documentation/,https://youtube.com/results?search_query=selenium+expect+ct+testing,https://youtube.com/results?search_query=selenium+expect+ct+hindi,https://youtube.com/results?search_query=selenium+expect+ct+kannada,https://youtube.com/results?search_query=selenium+expect+ct+tamil,https://youtube.com/results?search_query=selenium+expect+ct+telugu
Selenium,Advanced,How do you test browser clear site data functionality?,Clear Site Data,Storage,Privacy,Test clearing via Clear-Site-Data header. Verify all storage types cleared: cache, cookies, storage, executionContexts. Browser implementation differences.,https://www.selenium.dev/documentation/webdriver/interactions/,https://youtube.com/results?search_query=selenium+clear+site+data+testing,https://youtube.com/results?search_query=selenium+clear+site+hindi,https://youtube.com/results?search_query=selenium+clear+site+kannada,https://youtube.com/results?search_query=selenium+clear+site+tamil,https://youtube.com/results?search_query=selenium+clear+site+telugu
Selenium,Advanced,How do you handle browser reporting API for CSP, deprecation, etc.?,Reporting API,Monitoring,Security,Test report delivery to endpoints. Various report types: CSP, deprecation, intervention, crash. Verify JSON format. Endpoint reliability testing.,https://www.selenium.dev/documentation/,https://youtube.com/results?search_query=selenium+reporting+api+testing,https://youtube.com/results?search_query=selenium+reporting+api+hindi,https://youtube.com/results?search_query=selenium+reporting+api+kannada,https://youtube.com/results?search_query=selenium+reporting+api+tamil,https://youtube.com/results?search_query=selenium+reporting+api+telugu
Selenium,Advanced,How do you test browser web authentication API (WebAuthn)?,WebAuthn,Authentication,Security,Test biometric/passwordless authentication. Mock authenticators via DevTools. Registration and assertion flows. Cross-platform authenticator testing.,https://www.selenium.dev/documentation/,https://youtube.com/results?search_query=selenium+webauthn+testing,https://youtube.com/results?search_query=selenium+webauthn+hindi,https://youtube.com/results?search_query=selenium+webauthn+kannada,https://youtube.com/results?search_query=selenium+webauthn+tamil,https://youtube.com/results?search_query=selenium+webauthn+telugu
Selenium,Advanced,How do you handle browser credentialless iframes testing?,Credentialless Iframes,Security,Isolation,Test iframes without access to cookies, storage. Cross-origin isolation benefits. Performance vs security trade-offs. Browser support differences.,https://www.selenium.dev/documentation/webdriver/interactions/frames/,https://youtube.com/results?search_query=selenium+credentialless+iframes+testing,https://youtube.com/results?search_query=selenium+credentialless+hindi,https://youtube.com/results?search_query=selenium+credentialless+kannada,https://youtube.com/results?search_query=selenium+credentialless+tamil,https://youtube.com/results?search_query=selenium+credentialless+telugu
Selenium,Advanced,How do you test browser storage partitioning?,Storage Partitioning,Privacy,Security,Test third-party storage isolation. Cookie partitioning. Prevention of cross-site tracking. Impact on functionality requiring shared storage.,https://www.selenium.dev/documentation/webdriver/interactions/cookies/,https://youtube.com/results?search_query=selenium+storage+partitioning+testing,https://youtube.com/results?search_query=selenium+storage+partitioning+hindi,https://youtube.com/results?search_query=selenium+storage+partitioning+kannada,https://youtube.com/results?search_query=selenium+storage+partitioning+tamil,https://youtube.com/results?search_query=selenium+storage+partitioning+telugu
Selenium,Advanced,How do you handle browser user activation testing (transient activation)?,User Activation,UX,Security,Test APIs requiring user gesture: fullscreen, clipboard, etc. Verify activation expires appropriately. Programmatic vs user-initiated actions.,https://www.selenium.dev/documentation/,https://youtube.com/results?search_query=selenium+user+activation+testing,https://youtube.com/results?search_query=selenium+user+activation+hindi,https://youtube.com/results?search_query=selenium+user+activation+kannada,https://youtube.com/results?search_query=selenium+user+activation+tamil,https://youtube.com/results?search_query=selenium+user+activation+telugu
Selenium,Advanced,How do you test browser idle detection API?,Idle Detection,Power,Privacy,Test user idle state detection. Mock states via DevTools. Privacy considerations. Power-saving implications. Limited browser support.,https://www.selenium.dev/documentation/,https://youtube.com/results?search_query=selenium+idle+detection+testing,https://youtube.com/results?search_query=selenium+idle+detection+hindi,https://youtube.com/results?search_query=selenium+idle+detection+kannada,https://youtube.com/results?search_query=selenium+idle+detection+tamil,https://youtube.com/results?search_query=selenium+idle+detection+telugu
Selenium,Advanced,How do you handle browser screen wake lock API testing?,Wake Lock,Power,Media,Test preventing screen sleep. Video playback scenarios. Battery impact testing. Releasing lock appropriately. Browser support differences.,https://www.selenium.dev/documentation/,https://youtube.com/results?search_query=selenium+wake+lock+testing,https://youtube.com/results?search_query=selenium+wake+lock+hindi,https://youtube.com/results?search_query=selenium+wake+lock+kannada,https://youtube.com/results?search_query=selenium+wake+lock+tamil,https://youtube.com/results?search_query=selenium+wake+lock+telugu
Selenium,Advanced,How do you test browser clipboard sanitization?,Clipboard Sanitization,Security,HTML,Test pasting HTML, sanitization of dangerous content. Clipboard API vs execCommand. Browser security measures. Rich text paste testing.,https://www.selenium.dev/documentation/webdriver/actions_api/keyboard/,https://youtube.com/results?search_query=selenium+clipboard+sanitization+testing,https://youtube.com/results?search_query=selenium+clipboard+sanitization+hindi,https://youtube.com/results?search_query=selenium+clipboard+sanitization+kannada,https://youtube.com/results?search_query=selenium+clipboard+sanitization+tamil,https://youtube.com/results?search_query=selenium+clipboard+sanitization+telugu
Selenium,Advanced,How do you handle browser download attribution testing?,Download Attribution,Security,UX,Test download initiation tracking. Safe browsing checks. User confirmation dialogs. Malware scanning integration. Browser security features.,https://www.selenium.dev/documentation/webdriver/browsers/,https://youtube.com/results?search_query=selenium+download+attribution+testing,https://youtube.com/results?search_query=selenium+download+attribution+hindi,https://youtube.com/results?search_query=selenium+download+attribution+kannada,https://youtube.com/results?search_query=selenium+download+attribution+tamil,https://youtube.com/results?search_query=selenium+download+attribution+telugu
Selenium,Advanced,How do you test browser virtual keyboard API?,Virtual Keyboard,Mobile,Accessibility,Test virtual keyboard visibility detection. Layout viewport resizing. Input mode hints. Mobile browser testing. Limited automation support.,https://www.selenium.dev/documentation/,https://youtube.com/results?search_query=selenium+virtual+keyboard+testing,https://youtube.com/results?search_query=selenium+virtual+keyboard+hindi,https://youtube.com/results?search_query=selenium+virtual+keyboard+kannada,https://youtube.com/results?search_query=selenium+virtual+keyboard+tamil,https://youtube.com/results?search_query=selenium+virtual+keyboard+telugu
Selenium,Advanced,How do you handle browser content indexing API?,Content Indexing,PWA,Offline,Test adding/removing content for offline search. Background synchronization. Service worker integration. Search functionality testing.,https://www.selenium.dev/documentation/,https://youtube.com/results?search_query=selenium+content+indexing+testing,https://youtube.com/results?search_query=selenium+content+indexing+hindi,https://youtube.com/results?search_query=selenium+content+indexing+kannada,https://youtube.com/results?search_query=selenium+content+indexing+tamil,https://youtube.com/results?search_query=selenium+content+indexing+telugu
Selenium,Advanced,How do you test browser periodic background sync?,Periodic Sync,PWA,Background,Test data sync at regular intervals. Service worker registration. Network condition handling. User permission requirements. Limited automation support.,https://www.selenium.dev/documentation/,https://youtube.com/results?search_query=selenium+periodic+sync+testing,https://youtube.com/results?search_query=selenium+periodic+sync+hindi,https://youtube.com/results?search_query=selenium+periodic+sync+kannada,https://youtube.com/results?search_query=selenium+periodic+sync+tamil,https://youtube.com/results?search_query=selenium+periodic+sync+telugu
Selenium,Advanced,How do you handle browser web share API testing?,Web Share,Native Sharing,Social,Test sharing content to native apps. Share target registration. File sharing. Platform-specific differences. User gesture requirements.,https://www.selenium.dev/documentation/,https://youtube.com/results?search_query=selenium+web+share+testing,https://youtube.com/results?search_query=selenium+web+share+hindi,https://youtube.com/results?search_query=selenium+web+share+kannada,https://youtube.com/results?search_query=selenium+web+share+tamil,https://youtube.com/results?search_query=selenium+web+share+telugu
Selenium,Advanced,How do you test browser web share target API?,Web Share Target,PWA,Integration,Test receiving shared content from other apps. Service worker handling. Data parsing. App registration as share target. Platform integration.,https://www.selenium.dev/documentation/,https://youtube.com/results?search_query=selenium+web+share+target+testing,https://youtube.com/results?search_query=selenium+share+target+hindi,https://youtube.com/results?search_query=selenium+share+target+kannada,https://youtube.com/results?search_query=selenium+share+target+tamil,https://youtube.com/results?search_query=selenium+share+target+telugu
Selenium,Advanced,How do you handle browser contact picker API testing?,Contact Picker,Native Integration,Privacy,Test selecting contacts from device. Mock contacts via DevTools. Privacy permissions. Data format handling. Limited browser support.,https://www.selenium.dev/documentation/,https://youtube.com/results?search_query=selenium+contact+picker+testing,https://youtube.com/results?search_query=selenium+contact+picker+hindi,https://youtube.com/results?search_query=selenium+contact+picker+kannada,https://youtube.com/results?search_query=selenium+contact+picker+tamil,https://youtube.com/results?search_query=selenium+contact+picker+telugu
Selenium,Advanced,How do you test browser file system access API?,File System Access,Native Integration,Security,Test reading/writing files with user permission. Directory handles. File picker integration. Security restrictions. Progressive enhancement.,https://www.selenium.dev/documentation/,https://youtube.com/results?search_query=selenium+file+system+access+api+testing,https://youtube.com/results?search_query=selenium+file+system+access+hindi,https://youtube.com/results?search_query=selenium+file+system+access+kannada,https://youtube.com/results?search_query=selenium+file+system+access+tamil,https://youtube.com/results?search_query=selenium+file+system+access+telugu
Selenium,Advanced,How do you handle browser window placement API testing?,Window Placement,Multi-Screen,Productivity,Test multi-screen window management. Screen details API. Permission requirements. Limited automation for actual multi-screen setups. Mock screens via DevTools.,https://www.selenium.dev/documentation/,https://youtube.com/results?search_query=selenium+window+placement+testing,https://youtube.com/results?search_query=selenium+window+placement+hindi,https://youtube.com/results?search_query=selenium+window+placement+kannada,https://youtube.com/results?search_query=selenium+window+placement+tamil,https://youtube.com/results?search_query=selenium+window+placement+telugu
Selenium,Advanced,How do you test browser web NFC API?,Web NFC,Hardware,IoT,Test NFC tag reading/writing. Mock NFC via DevTools. Security permissions. Physical hardware dependency. Limited browser support.,https://www.selenium.dev/documentation/,https://youtube.com/results?search_query=selenium+web+nfc+testing,https://youtube.com/results?search_query=selenium+web+nfc+hindi,https://youtube.com/results?search_query=selenium+web+nfc+kannada,https://youtube.com/results?search_query=selenium+web+nfc+tamil,https://youtube.com/results?search_query=selenium+web+nfc+telugu
Selenium,Advanced,How do you handle browser web USB API testing?,Web USB,Hardware,Devices,Test USB device communication. Mock devices via DevTools. Security permissions. Physical hardware dependency. Limited use cases.,https://www.selenium.dev/documentation/,https://youtube.com/results?search_query=selenium+web+usb+testing,https://youtube.com/results?search_query=selenium+web+usb+hindi,https://youtube.com/results?search_query=selenium+web+usb+kannada,https://youtube.com/results?search_query=selenium+web+usb+tamil,https://youtube.com/results?search_query=selenium+web+usb+telugu
Selenium,Advanced,How do you test browser web Bluetooth API?,Web Bluetooth,Hardware,Wireless,Test Bluetooth device communication. Mock devices via DevTools. Security permissions. Physical hardware dependency. Platform support differences.,https://www.selenium.dev/documentation/,https://youtube.com/results?search_query=selenium+web+bluetooth+testing,https://youtube.com/results?search_query=selenium+web+bluetooth+hindi,https://youtube.com/results?search_query=selenium+web+bluetooth+kannada,https://youtube.com/results?search_query=selenium+web+bluetooth+tamil,https://youtube.com/results?search_query=selenium+web+bluetooth+telugu
Selenium,Advanced,How do you handle browser web serial API testing?,Web Serial,Hardware,Communication,Test serial port communication. Mock ports via DevTools. Security permissions. Physical hardware dependency. Niche use cases.,https://www.selenium.dev/documentation/,https://youtube.com/results?search_query=selenium+web+serial+testing,https://youtube.com/results?search_query=selenium+web+serial+hindi,https://youtube.com/results?search_query=selenium+web+serial+kannada,https://youtube.com/results?search_query=selenium+web+serial+tamil,https://youtube.com/results?search_query=selenium+web+serial+telugu
Selenium,Advanced,How do you test browser web MIDI API?,Web MIDI,Audio,Hardware,Test MIDI device communication. Mock devices via DevTools. Music applications. Low-latency requirements. Niche but important for specific apps.,https://www.selenium.dev/documentation/,https://youtube.com/results?search_query=selenium+web+midi+testing,https://youtube.com/results?search_query=selenium+web+midi+hindi,https://youtube.com/results?search_query=selenium+web+midi+kannada,https://youtube.com/results?search_query=selenium+web+midi+tamil,https://youtube.com/results?search_query=selenium+web+midi+telugu
Selenium,Advanced,How do you handle browser gamepad haptic feedback testing?,Gamepad Haptics,Gaming,Hardware,Test vibration, force feedback. Mock gamepad via DevTools. Immersive gaming experiences. Limited automation for actual haptic feedback.,https://www.selenium.dev/documentation/,https://youtube.com/results?search_query=selenium+gamepad+haptics+testing,https://youtube.com/results?search_query=selenium+gamepad+haptics+hindi,https://youtube.com/results?search_query=selenium+gamepad+haptics+kannada,https://youtube.com/results?search_query=selenium+gamepad+haptics+tamil,https://youtube.com/results?search_query=selenium+gamepad+haptics+telugu
Selenium,Advanced,How do you test browser presentation remote control?,Presentation Remote,Multi-Screen,Control,Test controlling presentation from another device. WebSocket communication. State synchronization. Limited automation scenarios.,https://www.selenium.dev/documentation/,https://youtube.com/results?search_query=selenium+presentation+remote+testing,https://youtube.com/results?search_query=selenium+presentation+remote+hindi,https://youtube.com/results?search_query=selenium+presentation+remote+kannada,https://youtube.com/results?search_query=selenium+presentation+remote+tamil,https://youtube.com/results?search_query=selenium+presentation+remote+telugu
Selenium,Advanced,How do you handle browser web codecs API testing?,Web Codecs,Media,Performance,Test low-level media encoding/decoding. Performance benchmarking. Hardware acceleration. Browser support differences. Complex media applications.,https://www.selenium.dev/documentation/,https://youtube.com/results?search_query=selenium+web+codecs+testing,https://youtube.com/results?search_query=selenium+web+codecs+hindi,https://youtube.com/results?search_query=selenium+web+codecs+kannada,https://youtube.com/results?search_query=selenium+web+codecs+tamil,https://youtube.com/results?search_query=selenium+web+codecs+telugu
Selenium,Advanced,How do you test browser web transport API?,Web Transport,Networking,Performance,Test modern transport protocol. Comparison with WebSocket, HTTP/3. Performance benchmarks. Reliability testing. Emerging technology.,https://www.selenium.dev/documentation/,https://youtube.com/results?search_query=selenium+web+transport+testing,https://youtube.com/results?search_query=selenium+web+transport+hindi,https://youtube.com/results?search_query=selenium+web+transport+kannada,https://youtube.com/results?search_query=selenium+web+transport+tamil,https://youtube.com/results?search_query=selenium+web+transport+telugu
Selenium,Advanced,How do you handle browser web assembly threads testing?,WebAssembly Threads,Parallelism,Performance,Test multi-threaded WebAssembly. SharedArrayBuffer requirement. Performance scaling. Browser support. Security considerations with shared memory.,https://www.selenium.dev/documentation/,https://youtube.com/results?search_query=selenium+webassembly+threads+testing,https://youtube.com/results?search_query=selenium+wasm+threads+hindi,https://youtube.com/results?search_query=selenium+wasm+threads+kannada,https://youtube.com/results?search_query=selenium+wasm+threads+tamil,https://youtube.com/results?search_query=selenium+wasm+threads+telugu
Selenium,Advanced,How do you test browser web assembly SIMD support?,WebAssembly SIMD,Performance,Vectorization,Test SIMD operations in WebAssembly. Performance benchmarks. Browser support differences. Use cases: image processing, physics simulations.,https://www.selenium.dev/documentation/,https://youtube.com/results?search_query=selenium+webassembly+simd+testing,https://youtube.com/results?search_query=selenium+wasm+simd+hindi,https://youtube.com/results?search_query=selenium+wasm+simd+kannada,https://youtube.com/results?search_query=selenium+wasm+simd+tamil,https://youtube.com/results?search_query=selenium+wasm+simd+telugu
