skill,level,question_text,option_a,option_b,option_c,option_d,correct_answer,explanation,topic,mdn_link,youtube_english,youtube_hindi,youtube_kannada,youtube_tamil,youtube_telugu
Selenium,Advanced,How do you handle shadow DOM elements in Selenium?,Shadow DOM,Web Components,Encapsulation,Use JavaScript to traverse shadow roots: element.shadowRoot.querySelector(). Or use Selenium 4+ getShadowRoot() method. For nested shadow DOM, chain multiple shadowRoot queries. Regular CSS/XPath won't work for shadow DOM.,https://www.selenium.dev/documentation/webdriver/shadow_dom/,https://youtube.com/results?search_query=selenium+shadow+dom,https://youtube.com/results?search_query=selenium+shadow+dom+hindi,https://youtube.com/results?search_query=selenium+shadow+dom+kannada,https://youtube.com/results?search_query=selenium+shadow+dom+tamil,https://youtube.com/results?search_query=selenium+shadow+dom+telugu
Selenium,Advanced,How do you handle geolocation testing in Selenium?,Geolocation,Browser Capabilities,Location Mocking,Use ChromeOptions with --use-fake-ui-for-media-stream and --use-fake-device-for-media-stream. Set location with ChromeDevTools Protocol or browser-specific capabilities. For actual location testing, use device emulation.,https://www.selenium.dev/documentation/webdriver/browsers/chrome/,https://youtube.com/results?search_query=selenium+geolocation+testing,https://youtube.com/results?search_query=selenium+geolocation+hindi,https://youtube.com/results?search_query=selenium+geolocation+kannada,https://youtube.com/results?search_query=selenium+geolocation+tamil,https://youtube.com/results?search_query=selenium+geolocation+telugu
Selenium,Advanced,How do you handle responsive design testing in Selenium?,Responsive Design,Mobile Testing,Viewport,Use driver.manage().window().setSize(new Dimension(width, height)) to test different screen sizes. Chrome DevTools Protocol for device emulation. Use TestNG parameters to run tests with multiple viewport sizes.,https://www.selenium.dev/documentation/webdriver/browsers/chrome/,https://youtube.com/results?search_query=selenium+responsive+design+testing,https://youtube.com/results?search_query=selenium+responsive+design+hindi,https://youtube.com/results?search_query=selenium+responsive+design+kannada,https://youtube.com/results?search_query=selenium+responsive+design+tamil,https://youtube.com/results?search_query=selenium+responsive+design+telugu
Selenium,Advanced,What is the difference between XPath and CSS selectors?,Locators,Comparison,Performance,XPath can traverse both directions (parent/child), supports text search, more powerful but slower. CSS is faster, simpler syntax, unidirectional (parent to child). CSS doesn't support text matching or traversing up.,https://www.selenium.dev/documentation/webdriver/elements/locators/,https://youtube.com/results?search_query=selenium+xpath+vs+css,https://youtube.com/results?search_query=selenium+xpath+css+hindi,https://youtube.com/results?search_query=selenium+xpath+css+kannada,https://youtube.com/results?search_query=selenium+xpath+css+tamil,https://youtube.com/results?search_query=selenium+xpath+css+telugu
Selenium,Advanced,How do you handle session management in Selenium tests?,Session Management,Cookies,Storage,Reuse authenticated sessions by saving cookies after login and adding them to new sessions. Use driver.manage().getCookies() and addCookie(). Helpful for tests that don't need to go through login each time.,https://www.selenium.dev/documentation/webdriver/interactions/cookies/,https://youtube.com/results?search_query=selenium+session+management,https://youtube.com/results?search_query=selenium+session+hindi,https://youtube.com/results?search_query=selenium+session+kannada,https://youtube.com/results?search_query=selenium+session+tamil,https://youtube.com/results?search_query=selenium+session+telugu
Selenium,Advanced,How do you handle performance testing with Selenium?,Performance,Navigation Timing,CDP,Use Navigation Timing API via JavaScript: executeScript("return window.performance.timing"). Calculate metrics like load time, DOM ready. Chrome DevTools Protocol for network throttling, performance metrics collection.,https://www.selenium.dev/documentation/webdriver/browsers/chrome/,https://youtube.com/results?search_query=selenium+performance+testing,https://youtube.com/results?search_query=selenium+performance+hindi,https://youtube.com/results?search_query=selenium+performance+kannada,https://youtube.com/results?search_query=selenium+performance+tamil,https://youtube.com/results?search_query=selenium+performance+telugu
Selenium,Advanced,How do you handle browser cache and local storage in Selenium?,Cache,Local Storage,Session Storage,Clear cache: driver.manage().deleteAllCookies() and execute JavaScript to clear localStorage/sessionStorage. For testing cache behavior, may need to configure browser to not clear cache on exit.,https://www.selenium.dev/documentation/webdriver/interactions/,https://youtube.com/results?search_query=selenium+browser+cache,https://youtube.com/results?search_query=selenium+cache+hindi,https://youtube.com/results?search_query=selenium+cache+kannada,https://youtube.com/results?search_query=selenium+cache+tamil,https://youtube.com/results?search_query=selenium+cache+telugu
Selenium,Advanced,How do you implement retry logic for flaky tests in Selenium?,Retry Mechanism,Flaky Tests,TestNG,Use TestNG IRetryAnalyzer interface or @Test(retryAnalyzer). Implement custom retry logic with try-catch and counters. For specific operations, implement retry for finding elements or clicking.,https://testng.org/doc/documentation-main.html,https://youtube.com/results?search_query=selenium+retry+logic,https://youtube.com/results?search_query=selenium+retry+hindi,https://youtube.com/results?search_query=selenium+retry+kannada,https://youtube.com/results?search_query=selenium+retry+tamil,https://youtube.com/results?search_query=selenium+retry+telugu
Selenium,Advanced,How do you handle browser proxy settings in Selenium?,Proxy,Network,Configuration,Use Proxy class with desired capabilities. Set HTTP, SSL, FTP proxies. Useful for testing with different locations, monitoring network traffic, or testing behind corporate proxies.,https://www.selenium.dev/documentation/webdriver/capabilities/,https://youtube.com/results?search_query=selenium+browser+proxy,https://youtube.com/results?search_query=selenium+proxy+hindi,https://youtube.com/results?search_query=selenium+proxy+kannada,https://youtube.com/results?search_query=selenium+proxy+tamil,https://youtube.com/results?search_query=selenium+proxy+telugu
Selenium,Advanced,How do you handle WebSocket connections in Selenium?,WebSocket,Real-time,Monitoring,Selenium cannot directly test WebSocket. Use JavaScript to monitor WebSocket messages or integrate with specialized WebSocket testing libraries. Can verify UI updates triggered by WebSocket messages.,https://www.selenium.dev/documentation/,https://youtube.com/results?search_query=selenium+websocket+testing,https://youtube.com/results?search_query=selenium+websocket+hindi,https://youtube.com/results?search_query=selenium+websocket+kannada,https://youtube.com/results?search_query=selenium+websocket+tamil,https://youtube.com/results?search_query=selenium+websocket+telugu
Selenium,Advanced,How do you handle CAPTCHA in automated tests?,CAPTCHA,Avoidance,Testing Strategies,Avoid testing CAPTCHA in automation. Use test environments with CAPTCHA disabled, or use test credentials that bypass CAPTCHA. For production testing, may need manual intervention or specialized CAPTCHA solving services.,https://www.selenium.dev/documentation/test_practices/donts/,https://youtube.com/results?search_query=selenium+captcha+handling,https://youtube.com/results?search_query=selenium+captcha+hindi,https://youtube.com/results?search_query=selenium+captcha+kannada,https://youtube.com/results?search_query=selenium+captcha+tamil,https://youtube.com/results?search_query=selenium+captcha+telugu
Selenium,Advanced,How do you test file download functionality?,File Download,Verification,External Tools,Set download directory, initiate download, then verify file exists using Java File class. Check file size, extension. Cannot verify content without external libraries like Apache Tika for content validation.,https://www.selenium.dev/documentation/webdriver/browsers/,https://youtube.com/results?search_query=selenium+test+file+download,https://youtube.com/results?search_query=selenium+file+download+hindi,https://youtube.com/results?search_query=selenium+file+download+kannada,https://youtube.com/results?search_query=selenium+file+download+tamil,https://youtube.com/results?search_query=selenium+file+download+telugu
Selenium,Advanced,What is the Page Object Model with Loadable Component pattern?,Design Patterns,Page Objects,Loadable Component,Combines POM with LoadableComponent abstract class that provides load() and isLoaded() methods. Ensures page is loaded before interactions, reducing flakiness. Useful for applications with complex loading sequences.,https://www.selenium.dev/documentation/test_practices/encouraged/page_object_models/,https://youtube.com/results?search_query=selenium+loadable+component,https://youtube.com/results?search_query=selenium+loadable+hindi,https://youtube.com/results?search_query=selenium+loadable+kannada,https://youtube.com/results?search_query=selenium+loadable+tamil,https://youtube.com/results?search_query=selenium+loadable+telugu
Selenium,Advanced,How do you handle browser zoom level in Selenium?,Zoom,Viewport,Accessibility,Use JavaScript to check/set zoom: executeScript("document.body.style.zoom='150%'"). Or send keyboard shortcuts (Ctrl+plus). Not all browsers support programmatic zoom control. Test accessibility features.,https://www.selenium.dev/documentation/webdriver/actions_api/keyboard/,https://youtube.com/results?search_query=selenium+browser+zoom,https://youtube.com/results?search_query=selenium+zoom+hindi,https://youtube.com/results?search_query=selenium+zoom+kannada,https://youtube.com/results?search_query=selenium+zoom+tamil,https://youtube.com/results?search_query=selenium+zoom+telugu
Selenium,Advanced,How do you handle browser language localization testing?,Localization,Language,Internationalization,Set browser language via options: ChromeOptions with --lang=es. Test UI text, date formats, number formats. May need to verify right-to-left languages. Use parameterized tests for multiple languages.,https://www.selenium.dev/documentation/webdriver/browsers/chrome/,https://youtube.com/results?search_query=selenium+localization+testing,https://youtube.com/results?search_query=selenium+localization+hindi,https://youtube.com/results?search_query=selenium+localization+kannada,https://youtube.com/results?search_query=selenium+localization+tamil,https://youtube.com/results?search_query=selenium+localization+telugu
Selenium,Advanced,How do you handle touch actions for mobile browser testing?,Touch Actions,Mobile,Emulation,Use TouchActions class (deprecated in Selenium 4) or W3C Actions API with pointer input sources. For mobile browsers, may need Appium for native touch actions. Chrome DevTools for mobile emulation.,https://www.selenium.dev/documentation/webdriver/actions_api/,https://youtube.com/results?search_query=selenium+touch+actions,https://youtube.com/results?search_query=selenium+touch+hindi,https://youtube.com/results?search_query=selenium+touch+kannada,https://youtube.com/results?search_query=selenium+touch+tamil,https://youtube.com/results?search_query=selenium+touch+telugu
Selenium,Advanced,How do you handle SVG elements in Selenium?,SVG,Vector Graphics,XPath,SVG elements are part of DOM but use different namespace. Use XPath with local-name() or CSS with element type. Some interactions may require JavaScript. SVG elements don't support all regular WebElement methods.,https://www.selenium.dev/documentation/webdriver/elements/finders/,https://youtube.com/results?search_query=selenium+svg+elements,https://youtube.com/results?search_query=selenium+svg+hindi,https://youtube.com/results?search_query=selenium+svg+kannada,https://youtube.com/results?search_query=selenium+svg+tamil,https://youtube.com/results?search_query=selenium+svg+telugu
Selenium,Advanced,How do you handle WebGL and Canvas elements in Selenium?,Canvas,WebGL,Graphics,Canvas elements are opaque to Selenium. Cannot interact with individual shapes. Use JavaScript to call canvas methods or simulate clicks at coordinates. For complex testing, may need visual testing tools or specialized libraries.,https://www.selenium.dev/documentation/webdriver/elements/,https://youtube.com/results?search_query=selenium+canvas+elements,https://youtube.com/results?search_query=selenium+canvas+hindi,https://youtube.com/results?search_query=selenium+canvas+kannada,https://youtube.com/results?search_query=selenium+canvas+tamil,https://youtube.com/results?search_query=selenium+canvas+telugu
Selenium,Advanced,How do you implement custom expected conditions in Selenium?,Expected Conditions,Custom Waits,Waiting Strategies,Implement ExpectedCondition interface with apply() method. Create custom conditions for complex waits: element has specific text, element count changes, custom JavaScript condition returns true.,https://www.selenium.dev/documentation/webdriver/waits/,https://youtube.com/results?search_query=selenium+custom+expected+conditions,https://youtube.com/results?search_query=selenium+custom+waits+hindi,https://youtube.com/results?search_query=selenium+custom+waits+kannada,https://youtube.com/results?search_query=selenium+custom+waits+tamil,https://youtube.com/results?search_query=selenium+custom+waits+telugu
Selenium,Advanced,How do you handle WebRTC testing in Selenium?,WebRTC,Media Streams,DevTools,Use Chrome DevTools Protocol to mock media streams: --use-fake-device-for-media-stream, --use-fake-ui-for-media-stream. Can test basic WebRTC functionality but limited for complex scenarios like actual peer connections.,https://www.selenium.dev/documentation/webdriver/browsers/chrome/,https://youtube.com/results?search_query=selenium+webrtc+testing,https://youtube.com/results?search_query=selenium+webrtc+hindi,https://youtube.com/results?search_query=selenium+webrtc+kannada,https://youtube.com/results?search_query=selenium+webrtc+tamil,https://youtube.com/results?search_query=selenium+webrtc+telugu
Selenium,Advanced,How do you handle Service Workers in Selenium?,Service Workers,PWA,Offline,Service workers run in background. Test by verifying offline functionality, push notifications. Use Chrome DevTools to inspect service worker status. Difficult to test directly with Selenium alone.,https://www.selenium.dev/documentation/,https://youtube.com/results?search_query=selenium+service+workers,https://youtube.com/results?search_query=selenium+service+worker+hindi,https://youtube.com/results?search_query=selenium+service+worker+kannada,https://youtube.com/results?search_query=selenium+service+worker+tamil,https://youtube.com/results?search_query=selenium+service+worker+telugu
Selenium,Advanced,How do you handle browser extensions/add-ons in Selenium?,Extensions,Add-ons,Chrome,Load unpacked extensions using ChromeOptions: addExtensions(new File("path")). For testing extension functionality, may need to switch to extension popup or background page contexts.,https://www.selenium.dev/documentation/webdriver/browsers/chrome/,https://youtube.com/results?search_query=selenium+browser+extensions,https://youtube.com/results?search_query=selenium+extensions+hindi,https://youtube.com/results?search_query=selenium+extensions+kannada,https://youtube.com/results?search_query=selenium+extensions+tamil,https://youtube.com/results?search_query=selenium+extensions+telugu
Selenium,Advanced,How do you handle browser fingerprinting and detection in tests?,Fingerprinting,Detection,Avoidance,Some sites detect automation. Use ChromeOptions to exclude automation switches: excludeSwitches("enable-automation"). Use undetected-chromedriver or modify browser properties. May need to mock navigator.webdriver property.,https://www.selenium.dev/documentation/webdriver/browsers/chrome/,https://youtube.com/results?search_query=selenium+browser+fingerprinting,https://youtube.com/results?search_query=selenium+fingerprinting+hindi,https://youtube.com/results?search_query=selenium+fingerprinting+kannada,https://youtube.com/results?search_query=selenium+fingerprinting+tamil,https://youtube.com/results?search_query=selenium+fingerprinting+telugu
Selenium,Advanced,How do you test accessibility (a11y) with Selenium?,Accessibility,WCAG,ARIA,Use JavaScript libraries like axe-core integrated with Selenium to run accessibility audits. Check ARIA attributes, keyboard navigation, screen reader compatibility. Can't fully test screen reader experience.,https://www.deque.com/axe/,https://youtube.com/results?search_query=selenium+accessibility+testing,https://youtube.com/results?search_query=selenium+accessibility+hindi,https://youtube.com/results?search_query=selenium+accessibility+kannada,https://youtube.com/results?search_query=selenium+accessibility+tamil,https://youtube.com/results?search_query=selenium+accessibility+telugu
Selenium,Advanced,How do you handle browser memory leaks in long-running tests?,Memory Leaks,Performance,Optimization,Use driver.quit() not close(), avoid static WebDriver instances, clear collections holding WebElements, use try-with-resources. Monitor memory with JVM flags. Split long tests into smaller ones.,https://www.selenium.dev/documentation/webdriver/troubleshooting/,https://youtube.com/results?search_query=selenium+memory+leaks,https://youtube.com/results?search_query=selenium+memory+hindi,https://youtube.com/results?search_query=selenium+memory+kannada,https://youtube.com/results?search_query=selenium+memory+tamil,https://youtube.com/results?search_query=selenium+memory+telugu
Selenium,Advanced,How do you implement parallel test execution in TestNG with Selenium?,Parallel Execution,TestNG,Threading,Use TestNG XML with parallel="tests/classes/methods" and thread-count. Make tests thread-safe: use ThreadLocal for WebDriver, avoid shared state. Use synchronized blocks for shared resources.,https://testng.org/doc/documentation-main.html,https://youtube.com/results?search_query=selenium+testng+parallel,https://youtube.com/results?search_query=selenium+parallel+hindi,https://youtube.com/results?search_query=selenium+parallel+kannada,https://youtube.com/results?search_query=selenium+parallel+tamil,https://youtube.com/results?search_query=selenium+parallel+telugu
Selenium,Advanced,How do you handle dynamic IDs and class names in locators?,Dynamic Locators,Stable Selectors,Attributes,Use partial attribute matches: contains(), starts-with(), ends-with() in XPath; *=, ^=, $= in CSS. Find by other stable attributes: name, data-* attributes, text content, or relative positioning.,https://www.selenium.dev/documentation/webdriver/elements/locators/,https://youtube.com/results?search_query=selenium+dynamic+locators,https://youtube.com/results?search_query=selenium+dynamic+ids+hindi,https://youtube.com/results?search_query=selenium+dynamic+ids+kannada,https://youtube.com/results?search_query=selenium+dynamic+ids+tamil,https://youtube.com/results?search_query=selenium+dynamic+ids+telugu
Selenium,Advanced,How do you test drag-and-drop between different browser windows?,Cross Window,Drag Drop,Complex Interactions,Selenium doesn't support cross-window drag-drop natively. Alternative: simulate with JavaScript events, or use Robot class for OS-level simulation. Complex scenario often avoided in automation.,https://www.selenium.dev/documentation/webdriver/actions_api/mouse/,https://youtube.com/results?search_query=selenium+cross+window+drag+drop,https://youtube.com/results?search_query=selenium+cross+window+hindi,https://youtube.com/results?search_query=selenium+cross+window+kannada,https://youtube.com/results?search_query=selenium+cross+window+tamil,https://youtube.com/results?search_query=selenium+cross+window+telugu
Selenium,Advanced,How do you handle browser push notifications in tests?,Push Notifications,Permission,Testing,Grant permission via browser options, then test notification display. Chrome DevTools Protocol to simulate push notifications. Actual push from server requires backend integration testing.,https://www.selenium.dev/documentation/webdriver/browsers/chrome/,https://youtube.com/results?search_query=selenium+push+notifications,https://youtube.com/results?search_query=selenium+notifications+hindi,https://youtube.com/results?search_query=selenium+notifications+kannada,https://youtube.com/results?search_query=selenium+notifications+tamil,https://youtube.com/results?search_query=selenium+notifications+telugu
Selenium,Advanced,How do you handle file system access from browser (File System Access API)?,File System API,Modern APIs,Testing,New browser API for file system access. Test by granting permissions, reading/writing files. May require origin trials or enabling experimental features. Limited automation support currently.,https://www.selenium.dev/documentation/,https://youtube.com/results?search_query=selenium+file+system+api,https://youtube.com/results?search_query=selenium+file+api+hindi,https://youtube.com/results?search_query=selenium+file+api+kannada,https://youtube.com/results?search_query=selenium+file+api+tamil,https://youtube.com/results?search_query=selenium+file+api+telugu
Selenium,Advanced,How do you test voice recognition/speech input in Selenium?,Speech Input,Voice,Audio,Use Chrome DevTools to emulate voice input or mock speech recognition. For actual testing, may need specialized tools. Most practical to test the text input that results from speech recognition.,https://www.selenium.dev/documentation/webdriver/browsers/chrome/,https://youtube.com/results?search_query=selenium+speech+input,https://youtube.com/results?search_query=selenium+speech+hindi,https://youtube.com/results?search_query=selenium+speech+kannada,https://youtube.com/results?search_query=selenium+speech+tamil,https://youtube.com/results?search_query=selenium+speech+telugu
Selenium,Advanced,How do you handle IndexedDB and client-side storage testing?,IndexedDB,Storage,Client-side,Use JavaScript to interact with IndexedDB: open databases, add/read data. Verify UI reflects stored data. Clear storage between tests for isolation. Complex to test due to asynchronous nature.,https://www.selenium.dev/documentation/webdriver/interactions/,https://youtube.com/results?search_query=selenium+indexeddb+testing,https://youtube.com/results?search_query=selenium+indexeddb+hindi,https://youtube.com/results?search_query=selenium+indexeddb+kannada,https://youtube.com/results?search_query=selenium+indexeddb+tamil,https://youtube.com/results?search_query=selenium+indexeddb+telugu
Selenium,Advanced,How do you implement visual regression testing with Selenium?,Visual Testing,Regression,Screenshots,Use libraries like Applitools, Percy, or Ashot. Capture screenshots, compare with baselines using image diff algorithms. Handle dynamic content with ignore regions. Integrate with CI/CD pipelines.,https://www.selenium.dev/documentation/,https://youtube.com/results?search_query=selenium+visual+regression+testing,https://youtube.com/results?search_query=selenium+visual+hindi,https://youtube.com/results?search_query=selenium+visual+kannada,https://youtube.com/results?search_query=selenium+visual+tamil,https://youtube.com/results?search_query=selenium+visual+telugu
Selenium,Advanced,How do you handle WebAssembly (WASM) applications in Selenium?,WebAssembly,WASM,Performance,WebAssembly modules run in browser like JavaScript. Test the JavaScript interface to WASM modules, not WASM directly. Performance testing possible via timing API. Debugging requires browser DevTools.,https://www.selenium.dev/documentation/,https://youtube.com/results?search_query=selenium+webassembly+testing,https://youtube.com/results?search_query=selenium+wasm+hindi,https://youtube.com/results?search_query=selenium+wasm+kannada,https://youtube.com/results?search_query=selenium+wasm+tamil,https://youtube.com/results?search_query=selenium+wasm+telugu
Selenium,Advanced,How do you test WebSocket reconnection logic?,WebSocket,Reconnection,Network,Simulate network disconnection using browser DevTools or proxy. Test UI behavior during disconnect/reconnect. Verify messages aren't lost. Requires integration with network manipulation tools.,https://www.selenium.dev/documentation/,https://youtube.com/results?search_query=selenium+websocket+reconnection,https://youtube.com/results?search_query=selenium+reconnection+hindi,https://youtube.com/results?search_query=selenium+reconnection+kannada,https://youtube.com/results?search_query=selenium+reconnection+tamil,https://youtube.com/results?search_query=selenium+reconnection+telugu
Selenium,Advanced,How do you handle browser back/forward cache (bfcache)?,BFCache,Navigation Cache,Performance,Test page restoration after navigation. Use page show/hide events. May need to disable for testing: ChromeOptions with --disable-back-forward-cache. Verify form data persistence.,https://www.selenium.dev/documentation/webdriver/browsers/,https://youtube.com/results?search_query=selenium+bfcache+testing,https://youtube.com/results?search_query=selenium+bfcache+hindi,https://youtube.com/results?search_query=selenium+bfcache+kannada,https://youtube.com/results?search_query=selenium+bfcache+tamil,https://youtube.com/results?search_query=selenium+bfcache+telugu
