skill,level,question_text,option_a,option_b,option_c,option_d,correct_answer,explanation,topic,mdn_link,youtube_english,youtube_hindi,youtube_kannada,youtube_tamil,youtube_telugu

Topic,Complexity,Question,Category,Tags,Keywords,Answer,Reference,General Video Resource,Video Hindi,Video Kannada,Video Tamil,Video Telugu
Unreal Engine,Basic,What is Unreal Engine?,Introduction,Game Engine,Epic Games,Unreal Engine is a powerful, open-source game engine developed by Epic Games, used for creating high-quality games, simulations, and interactive experiences across multiple platforms.,https://www.unrealengine.com/,https://youtube.com/results?search_query=what+is+unreal+engine,https://youtube.com/results?search_query=what+is+unreal+engine+hindi,https://youtube.com/results?search_query=what+is+unreal+engine+kannada,https://youtube.com/results?search_query=what+is+unreal+engine+tamil,https://youtube.com/results?search_query=what+is+unreal+engine+telugu
Unreal Engine,Basic,What programming language does Unreal Engine primarily use?,Scripting,C++,Blueprints,Unreal Engine primarily uses C++ for programming, along with Blueprints (a visual scripting system) for rapid prototyping and gameplay logic.,https://docs.unrealengine.com/5.3/en-US/scripting-and-automating-in-unreal-engine/,https://youtube.com/results?search_query=unreal+engine+programming+language,https://youtube.com/results?search_query=unreal+engine+programming+language+hindi,https://youtube.com/results?search_query=unreal+engine+programming+language+kannada,https://youtube.com/results?search_query=unreal+engine+programming+language+tamil,https://youtube.com/results?search_query=unreal+engine+programming+language+telugu
Unreal Engine,Basic,What are Blueprints?,Scripting,Blueprints,Visual Scripting,Blueprints are Unreal Engine's visual scripting system that allows developers to create gameplay logic, interactions, and systems without writing traditional code, using a node-based interface.,https://docs.unrealengine.com/5.3/en-US/blueprint-visual-scripting-in-unreal-engine/,https://youtube.com/results?search_query=unreal+engine+blueprints,https://youtube.com/results?search_query=unreal+engine+blueprints+hindi,https://youtube.com/results?search_query=unreal+engine+blueprints+kannada,https://youtube.com/results?search_query=unreal+engine+blueprints+tamil,https://youtube.com/results?search_query=unreal+engine+blueprints+telugu
Unreal Engine,Basic,What is an Actor in Unreal Engine?,Core Concepts,Actor,Object,An Actor is any object that can be placed in a level, such as a camera, static mesh, or player start. All Actors support 3D transformations (translation, rotation, scale) and can be spawned/destroyed at runtime.,https://docs.unrealengine.com/5.3/en-US/actors-in-unreal-engine/,https://youtube.com/results?search_query=unreal+engine+actor,https://youtube.com/results?search_query=unreal+engine+actor+hindi,https://youtube.com/results?search_query=unreal+engine+actor+kannada,https://youtube.com/results?search_query=unreal+engine+actor+tamil,https://youtube.com/results?search_query=unreal+engine+actor+telugu
Unreal Engine,Basic,What is a Component in Unreal Engine?,Core Concepts,Component,Modularity,A Component is a piece of functionality that can be added to an Actor. Components are modular and reusable—for example, a Spot Light Component or a Movement Component.,https://docs.unrealengine.com/5.3/en-US/components-in-unreal-engine/,https://youtube.com/results?search_query=unreal+engine+component,https://youtube.com/results?search_query=unreal+engine+component+hindi,https://youtube.com/results?search_query=unreal+engine+component+kannada,https://youtube.com/results?search_query=unreal+engine+component+tamil,https://youtube.com/results?search_query=unreal+engine+component+telugu
Unreal Engine,Basic,What is a Level?,Core Concepts,Level,Map,A Level (or Map) is a gameplay area that contains Actors, geometry, and gameplay elements. A game typically consists of multiple Levels.,https://docs.unrealengine.com/5.3/en-US/levels-in-unreal-engine/,https://youtube.com/results?search_query=unreal+engine+level,https://youtube.com/results?search_query=unreal+engine+level+hindi,https://youtube.com/results?search_query=unreal+engine+level+kannada,https://youtube.com/results?search_query=unreal+engine+level+tamil,https://youtube.com/results?search_query=unreal+engine+level+telugu
Unreal Engine,Basic,What is the Viewport?,Interface,Viewport,Editor,The Viewport is the main 3D editing window where you can view and manipulate your Level. It provides tools for moving, rotating, and scaling Actors.,https://docs.unrealengine.com/5.3/en-US/viewport-in-unreal-engine/,https://youtube.com/results?search_query=unreal+engine+viewport,https://youtube.com/results?search_query=unreal+engine+viewport+hindi,https://youtube.com/results?search_query=unreal+engine+viewport+kannada,https://youtube.com/results?search_query=unreal+engine+viewport+tamil,https://youtube.com/results?search_query=unreal+engine+viewport+telugu
Unreal Engine,Basic,What is the World Outliner?,Interface,World Outliner,Hierarchy,The World Outliner is a panel that lists all Actors in the current Level. It helps you select, search, and organize Actors hierarchically.,https://docs.unrealengine.com/5.3/en-US/world-outliner-in-unreal-engine/,https://youtube.com/results?search_query=unreal+engine+world+outliner,https://youtube.com/results?search_query=unreal+engine+world+outliner+hindi,https://youtube.com/results?search_query=unreal+engine+world+outliner+kannada,https://youtube.com/results?search_query=unreal+engine+world+outliner+tamil,https://youtube.com/results?search_query=unreal+engine+world+outliner+telugu
Unreal Engine,Basic,What is the Content Browser?,Interface,Content Browser,Assets,The Content Browser is where you manage all your project's assets (meshes, textures, materials, Blueprints, etc.). It mirrors your project's file structure on disk.,https://docs.unrealengine.com/5.3/en-US/content-browser-in-unreal-engine/,https://youtube.com/results?search_query=unreal+engine+content+browser,https://youtube.com/results?search_query=unreal+engine+content+browser+hindi,https://youtube.com/results?search_query=unreal+engine+content+browser+kannada,https://youtube.com/results?search_query=unreal+engine+content+browser+tamil,https://youtube.com/results?search_query=unreal+engine+content+browser+telugu
Unreal Engine,Basic,What is the Details Panel?,Interface,Details Panel,Properties,The Details Panel shows properties of the selected Actor or asset. Here you can edit settings like transformation, materials, physics, and custom variables.,https://docs.unrealengine.com/5.3/en-US/details-panel-in-unreal-engine/,https://youtube.com/results?search_query=unreal+engine+details+panel,https://youtube.com/results?search_query=unreal+engine+details+panel+hindi,https://youtube.com/results?search_query=unreal+engine+details+panel+kannada,https://youtube.com/results?search_query=unreal+engine+details+panel+tamil,https://youtube.com/results?search_query=unreal+engine+details+panel+telugu
Unreal Engine,Basic,How do you create a new Blueprint?,Blueprints,Create Blueprint,Right-click in the Content Browser → Blueprint Class → choose a parent class (e.g., Actor, Pawn, Character). Give it a name and double-click to open the Blueprint Editor.,https://docs.unrealengine.com/5.3/en-US/creating-blueprints-in-unreal-engine/,https://youtube.com/results?search_query=create+blueprint+unreal+engine,https://youtube.com/results?search_query=create+blueprint+unreal+engine+hindi,https://youtube.com/results?search_query=create+blueprint+unreal+engine+kannada,https://youtube.com/results?search_query=create+blueprint+unreal+engine+tamil,https://youtube.com/results?search_query=create+blueprint+unreal+engine+telugu
Unreal Engine,Basic,What are the main tabs in the Blueprint Editor?,Blueprints,Blueprint Editor,Tabs,The Blueprint Editor has several tabs: Event Graph (for logic), Construction Script (runs when placed/edited), Components (list of components), My Blueprint (variables, functions), and Viewport (preview).,https://docs.unrealengine.com/5.3/en-US/blueprint-editor-in-unreal-engine/,https://youtube.com/results?search_query=blueprint+editor+tabs,https://youtube.com/results?search_query=blueprint+editor+tabs+hindi,https://youtube.com/results?search_query=blueprint+editor+tabs+kannada,https://youtube.com/results?search_query=blueprint+editor+tabs+tamil,https://youtube.com/results?search_query=blueprint+editor+tabs+telugu
Unreal Engine,Basic,What is the Event Graph in Blueprints?,Blueprints,Event Graph,Nodes,The Event Graph is where you create gameplay logic by connecting nodes (events, functions, variables) together. Events (like Event BeginPlay) trigger the execution of connected nodes.,https://docs.unrealengine.com/5.3/en-US/event-graph-in-unreal-engine/,https://youtube.com/results?search_query=event+graph+blueprints,https://youtube.com/results?search_query=event+graph+blueprints+hindi,https://youtube.com/results?search_query=event+graph+blueprints+kannada,https://youtube.com/results?search_query=event+graph+blueprints+tamil,https://youtube.com/results?search_query=event+graph+blueprints+telugu
Unreal Engine,Basic,What is Event BeginPlay?,Blueprints,Event BeginPlay,Start,Event BeginPlay is a Blueprint event that triggers once when the Actor is spawned or when gameplay begins in the Level. It's commonly used for initialization.,https://docs.unrealengine.com/5.3/en-US/event-beginplay-in-unreal-engine/,https://youtube.com/results?search_query=event+beginplay+unreal,https://youtube.com/results?search_query=event+beginplay+unreal+hindi,https://youtube.com/results?search_query=event+beginplay+unreal+kannada,https://youtube.com/results?search_query=event+beginplay+unreal+tamil,https://youtube.com/results?search_query=event+beginplay+unreal+telugu
Unreal Engine,Basic,What is Event Tick?,Blueprints,Event Tick,Update,Event Tick is a Blueprint event that triggers every frame. Use it for logic that needs continuous updates (like movement). Be mindful of performance.,https://docs.unrealengine.com/5.3/en-US/event-tick-in-unreal-engine/,https://youtube.com/results?search_query=event+tick+unreal,https://youtube.com/results?search_query=event+tick+unreal+hindi,https://youtube.com/results?search_query=event+tick+unreal+kannada,https://youtube.com/results?search_query=event+tick+unreal+tamil,https://youtube.com/results?search_query=event+tick+unreal+telugu
Unreal Engine,Basic,How do you create a variable in Blueprints?,Blueprints,Variable,Create,In the My Blueprint tab, click the "+ Variable" button. Set its name, type (e.g., Boolean, Integer, Float), and optionally default value. You can make it public (editable) or private.,https://docs.unrealengine.com/5.3/en-US/variables-in-blueprints-unreal-engine/,https://youtube.com/results?search_query=create+variable+blueprints,https://youtube.com/results?search_query=create+variable+blueprints+hindi,https://youtube.com/results?search_query=create+variable+blueprints+kannada,https://youtube.com/results?search_query=create+variable+blueprints+tamil,https://youtube.com/results?search_query=create+variable+blueprints+telugu
Unreal Engine,Basic,What is a Static Mesh?,Assets,Static Mesh,Geometry,A Static Mesh is a piece of geometry that consists of a set of polygons that cannot be animated vertex-wise (but can be moved/rotated as a whole). Used for walls, floors, props.,https://docs.unrealengine.com/5.3/en-US/static-meshes-in-unreal-engine/,https://youtube.com/results?search_query=unreal+engine+static+mesh,https://youtube.com/results?search_query=unreal+engine+static+mesh+hindi,https://youtube.com/results?search_query=unreal+engine+static+mesh+kannada,https://youtube.com/results?search_query=unreal+engine+static+mesh+tamil,https://youtube.com/results?search_query=unreal+engine+static+mesh+telugu
Unreal Engine,Basic,What is a Skeletal Mesh?,Assets,Skeletal Mesh,Animation,A Skeletal Mesh is a mesh that is bound to a skeleton (bone hierarchy) and can be deformed for animation. Used for characters, creatures, and other articulated objects.,https://docs.unrealengine.com/5.3/en-US/skeletal-meshes-in-unreal-engine/,https://youtube.com/results?search_query=unreal+engine+skeletal+mesh,https://youtube.com/results?search_query=unreal+engine+skeletal+mesh+hindi,https://youtube.com/results?search_query=unreal+engine+skeletal+mesh+kannada,https://youtube.com/results?search_query=unreal+engine+skeletal+mesh+tamil,https://youtube.com/results?search_query=unreal+engine+skeletal+mesh+telugu
Unreal Engine,Basic,What is a Material?,Assets,Material,Shader,A Material defines the surface properties of a mesh—how it reacts to light, its color, roughness, metallicness, etc. It is created using a node-based Material Editor.,https://docs.unrealengine.com/5.3/en-US/materials-in-unreal-engine/,https://youtube.com/results?search_query=unreal+engine+material,https://youtube.com/results?search_query=unreal+engine+material+hindi,https://youtube.com/results?search_query=unreal+engine+material+kannada,https://youtube.com/results?search_query=unreal+engine+material+tamil,https://youtube.com/results?search_query=unreal+engine+material+telugu
Unreal Engine,Basic,What is a Texture?,Assets,Texture,Image,A Texture is a 2D image applied to a 3D surface to give it color, detail, bump, or other surface attributes. Textures are often used as inputs to Materials.,https://docs.unrealengine.com/5.3/en-US/textures-in-unreal-engine/,https://youtube.com/results?search_query=unreal+engine+texture,https://youtube.com/results?search_query=unreal+engine+texture+hindi,https://youtube.com/results?search_query=unreal+engine+texture+kannada,https://youtube.com/results?search_query=unreal+engine+texture+tamil,https://youtube.com/results?search_query=unreal+engine+texture+telugu
Unreal Engine,Basic,How do you apply a Material to a Static Mesh?,Assets,Material,Apply,Select the Static Mesh in the Viewport or World Outliner. In the Details Panel, find the Materials section. Click the dropdown and select a Material asset.,https://docs.unrealengine.com/5.3/en-US/applying-materials-in-unreal-engine/,https://youtube.com/results?search_query=apply+material+unreal,https://youtube.com/results?search_query=apply+material+unreal+hindi,https://youtube.com/results?search_query=apply+material+unreal+kannada,https://youtube.com/results?search_query=apply+material+unreal+tamil,https://youtube.com/results?search_query=apply+material+unreal+telugu
Unreal Engine,Basic,What is a Pawn?,Gameplay,Pawn,Controller,A Pawn is an Actor that can be "possessed" (controlled) by a Player Controller or AI Controller. It represents the physical presence of a player or AI in the world.,https://docs.unrealengine.com/5.3/en-US/pawns-in-unreal-engine/,https://youtube.com/results?search_query=unreal+engine+pawn,https://youtube.com/results?search_query=unreal+engine+pawn+hindi,https://youtube.com/results?search_query=unreal+engine+pawn+kannada,https://youtube.com/results?search_query=unreal+engine+pawn+tamil,https://youtube.com/results?search_query=unreal+engine+pawn+telugu
Unreal Engine,Basic,What is a Character?,Gameplay,Character,Movement,A Character is a specialized Pawn that includes a Capsule Component for collision, a Character Movement Component for walking/flying/swimming, and a Skeletal Mesh.,https://docs.unrealengine.com/5.3/en-US/characters-in-unreal-engine/,https://youtube.com/results?search_query=unreal+engine+character,https://youtube.com/results?search_query=unreal+engine+character+hindi,https://youtube.com/results?search_query=unreal+engine+character+kannada,https://youtube.com/results?search_query=unreal+engine+character+tamil,https://youtube.com/results?search_query=unreal+engine+character+telugu
Unreal Engine,Basic,What is a Player Controller?,Gameplay,Player Controller,Input,A Player Controller manages player input and camera. Each player has a Player Controller, which can possess a Pawn to control it.,https://docs.unrealengine.com/5.3/en-US/player-controllers-in-unreal-engine/,https://youtube.com/results?search_query=unreal+engine+player+controller,https://youtube.com/results?search_query=unreal+engine+player+controller+hindi,https://youtube.com/results?search_query=unreal+engine+player+controller+kannada,https://youtube.com/results?search_query=unreal+engine+player+controller+tamil,https://youtube.com/results?search_query=unreal+engine+player+controller+telugu
Unreal Engine,Basic,What is the Game Mode?,Gameplay,Game Mode,Rules,The Game Mode defines the game's rules, such as default Pawn class, Player Controller class, scoring, and win conditions. There is one Game Mode per Level.,https://docs.unrealengine.com/5.3/en-US/game-modes-in-unreal-engine/,https://youtube.com/results?search_query=unreal+engine+game+mode,https://youtube.com/results?search_query=unreal+engine+game+mode+hindi,https://youtube.com/results?search_query=unreal+engine+game+mode+kannada,https://youtube.com/results?search_query=unreal+engine+game+mode+tamil,https://youtube.com/results?search_query=unreal+engine+game+mode+telugu
Unreal Engine,Basic,How do you set the Game Mode for a Level?,Gameplay,Game Mode,Set,Go to Settings → World Settings. Under Game Mode, set "GameMode Override" to your desired Game Mode Blueprint.,https://docs.unrealengine.com/5.3/en-US/setting-game-mode-in-unreal-engine/,https://youtube.com/results?search_query=set+game+mode+unreal,https://youtube.com/results?search_query=set+game+mode+unreal+hindi,https://youtube.com/results?search_query=set+game+mode+unreal+kannada,https://youtube.com/results?search_query=set+game+mode+unreal+tamil,https://youtube.com/results?search_query=set+game+mode+unreal+telugu
Unreal Engine,Basic,What is a Collision in Unreal Engine?,Physics,Collision,Hit,Collision refers to the detection and response when two objects (with collision geometry) touch or overlap. Unreal uses collision channels and responses to control interactions.,https://docs.unrealengine.com/5.3/en-US/collision-in-unreal-engine/,https://youtube.com/results?search_query=unreal+engine+collision,https://youtube.com/results?search_query=unreal+engine+collision+hindi,https://youtube.com/results?search_query=unreal+engine+collision+kannada,https://youtube.com/results?search_query=unreal+engine+collision+tamil,https://youtube.com/results?search_query=unreal+engine+collision+telugu
Unreal Engine,Basic,What are Collision Presets?,Physics,Collision Presets,Settings,Collision Presets are predefined sets of collision responses (Block, Overlap, Ignore) for various collision channels (WorldStatic, Pawn, PhysicsBody, etc.). They simplify collision setup.,https://docs.unrealengine.com/5.3/en-US/collision-presets-in-unreal-engine/,https://youtube.com/results?search_query=collision+presets+unreal,https://youtube.com/results?search_query=collision+presets+unreal+hindi,https://youtube.com/results?search_query=collision+presets+unreal+kannada,https://youtube.com/results?search_query=collision+presets+unreal+tamil,https://youtube.com/results?search_query=collision+presets+unreal+telugu
Unreal Engine,Basic,What is the difference between Block and Overlap collision?,Physics,Block,Overlap,Block prevents objects from passing through each other (physical collision). Overlap allows objects to pass through but triggers overlap events (OnBeginOverlap, OnEndOverlap).,https://docs.unrealengine.com/5.3/en-US/collision-response-in-unreal-engine/,https://youtube.com/results?search_query=block+vs+overlap+collision,https://youtube.com/results?search_query=block+vs+overlap+collision+hindi,https://youtube.com/results?search_query=block+vs+overlap+collision+kannada,https://youtube.com/results?search_query=block+vs+overlap+collision+tamil,https://youtube.com/results?search_query=block+vs+overlap+collision+telugu
Unreal Engine,Basic,How do you add a collision to a Static Mesh?,Physics,Collision,Static Mesh,In the Static Mesh Editor, you can add collision via menu: Collision → Add Box/Sphere/Capsule Simplified Collision, or use Auto Convex Collision for complex shapes.,https://docs.unrealengine.com/5.3/en-US/adding-collision-to-static-meshes-in-unreal-engine/,https://youtube.com/results?search_query=add+collision+static+mesh,https://youtube.com/results?search_query=add+collision+static+mesh+hindi,https://youtube.com/results?search_query=add+collision+static+mesh+kannada,https://youtube.com/results?search_query=add+collision+static+mesh+tamil,https://youtube.com/results?search_query=add+collision+static+mesh+telugu
Unreal Engine,Basic,What is the OnBeginOverlap event?,Physics,OnBeginOverlap,Trigger,OnBeginOverlap is a Blueprint event that triggers when an Actor's collision component begins overlapping with another component (if collision is set to Overlap).,https://docs.unrealengine.com/5.3/en-US/onbeginoverlap-in-unreal-engine/,https://youtube.com/results?search_query=onbeginoverlap+unreal,https://youtube.com/results?search_query=onbeginoverlap+unreal+hindi,https://youtube.com/results?search_query=onbeginoverlap+unreal+kannada,https://youtube.com/results?search_query=onbeginoverlap+unreal+tamil,https://youtube.com/results?search_query=onbeginoverlap+unreal+telugu
Unreal Engine,Basic,What is the OnHit event (for Block collisions)?,Physics,OnHit,Impact,OnHit (or Event Hit) triggers when a physics object (with simulation enabled) collides with another object with Block response. It provides impact data like normal and impulse.,https://docs.unrealengine.com/5.3/en-US/onhit-in-unreal-engine/,https://youtube.com/results?search_query=onhit+event+unreal,https://youtube.com/results?search_query=onhit+event+unreal+hindi,https://youtube.com/results?search_query=onhit+event+unreal+kannada,https://youtube.com/results?search_query=onhit+event+unreal+tamil,https://youtube.com/results?search_query=onhit+event+unreal+telugu
Unreal Engine,Basic,What is a Trigger Volume?,Physics,Trigger Volume,Area,A Trigger Volume is a Box/Sphere/Capsule-shaped invisible volume that can generate overlap events. It's often used to detect when a player enters an area.,https://docs.unrealengine.com/5.3/en-US/trigger-volumes-in-unreal-engine/,https://youtube.com/results?search_query=trigger+volume+unreal,https://youtube.com/results?search_query=trigger+volume+unreal+hindi,https://youtube.com/results?search_query=trigger+volume+unreal+kannada,https://youtube.com/results?search_query=trigger+volume+unreal+tamil,https://youtube.com/results?search_query=trigger+volume+unreal+telugu
Unreal Engine,Basic,How do you create a Trigger Volume?,Physics,Trigger Volume,Create,In the Place Actors panel, under Volumes, drag "Trigger Box" or "Trigger Sphere" into the Level. Adjust its size in the Details Panel.,https://docs.unrealengine.com/5.3/en-US/creating-trigger-volumes-in-unreal-engine/,https://youtube.com/results?search_query=create+trigger+volume,https://youtube.com/results?search_query=create+trigger+volume+hindi,https://youtube.com/results?search_query=create+trigger+volume+kannada,https://youtube.com/results?search_query=create+trigger+volume+tamil,https://youtube.com/results?search_query=create+trigger+volume+telugu
Unreal Engine,Basic,What is a Light Actor?,Lighting,Light Actor,Illumination,A Light Actor is an Actor that emits light into the scene. Types include Directional Light, Point Light, Spot Light, and Rect Light.,https://docs.unrealengine.com/5.3/en-US/lights-in-unreal-engine/,https://youtube.com/results?search_query=light+actor+unreal,https://youtube.com/results?search_query=light+actor+unreal+hindi,https://youtube.com/results?search_query=light+actor+unreal+kannada,https://youtube.com/results?search_query=light+actor+unreal+tamil,https://youtube.com/results?search_query=light+actor+unreal+telugu
Unreal Engine,Basic,What is a Directional Light?,Lighting,Directional Light,Sun,A Directional Light simulates light coming from an infinitely far source (like the sun). It casts parallel shadows and affects the entire Level.,https://docs.unrealengine.com/5.3/en-US/directional-lights-in-unreal-engine/,https://youtube.com/results?search_query=directional+light+unreal,https://youtube.com/results?search_query=directional+light+unreal+hindi,https://youtube.com/results?search_query=directional+light+unreal+kannada,https://youtube.com/results?search_query=directional+light+unreal+tamil,https://youtube.com/results?search_query=directional+light+unreal+telugu
Unreal Engine,Basic,What is a Point Light?,Lighting,Point Light,Bulb,A Point Light emits light equally in all directions from a single point (like a light bulb).,https://docs.unrealengine.com/5.3/en-US/point-lights-in-unreal-engine/,https://youtube.com/results?search_query=point+light+unreal,https://youtube.com/results?search_query=point+light+unreal+hindi,https://youtube.com/results?search_query=point+light+unreal+kannada,https://youtube.com/results?search_query=point+light+unreal+tamil,https://youtube.com/results?search_query=point+light+unreal+telugu
Unreal Engine,Basic,What is a Spot Light?,Lighting,Spot Light,Cone,A Spot Light emits light in a cone shape, like a flashlight or stage spotlight.,https://docs.unrealengine.com/5.3/en-US/spot-lights-in-unreal-engine/,https://youtube.com/results?search_query=spot+light+unreal,https://youtube.com/results?search_query=spot+light+unreal+hindi,https://youtube.com/results?search_query=spot+light+unreal+kannada,https://youtube.com/results?search_query=spot+light+unreal+tamil,https://youtube.com/results?search_query=spot+light+unreal+telugu
