skill,level,question_text,option_a,option_b,option_c,option_d,correct_answer,explanation,topic,mdn_link,youtube_english,youtube_hindi,youtube_kannada,youtube_tamil,youtube_telugu
Unreal Engine,Basic,What is the purpose of Build Lighting?,Lighting,Build Lighting,Bake,Build Lighting calculates static lighting and shadows and bakes them into lightmaps. It's necessary for static lights to appear correctly. Press "Build" (lightning bolt icon) or use Build → Build Lighting Only.,https://docs.unrealengine.com/5.3/en-US/building-lighting-in-unreal-engine/,https://youtube.com/results?search_query=build+lighting+unreal,https://youtube.com/results?search_query=build+lighting+unreal+hindi,https://youtube.com/results?search_query=build+lighting+unreal+kannada,https://youtube.com/results?search_query=build+lighting+unreal+tamil,https://youtube.com/results?search_query=build+lighting+unreal+telugu
Unreal Engine,Basic,What is a Camera Actor?,Camera,Camera Actor,View,A Camera Actor is an Actor that defines a view into the world. You can place multiple cameras and switch between them.,https://docs.unrealengine.com/5.3/en-US/cameras-in-unreal-engine/,https://youtube.com/results?search_query=camera+actor+unreal,https://youtube.com/results?search_query=camera+actor+unreal+hindi,https://youtube.com/results?search_query=camera+actor+unreal+kannada,https://youtube.com/results?search_query=camera+actor+unreal+tamil,https://youtube.com/results?search_query=camera+actor+unreal+telugu
Unreal Engine,Basic,How do you set the active view to a Camera Actor?,Camera,Set View,Camera,Select the Camera Actor, then press Ctrl+Shift+P, or right-click in the Viewport and choose "Active Camera View". To revert, press Ctrl+Shift+P again.,https://docs.unrealengine.com/5.3/en-US/setting-active-camera-in-unreal-engine/,https://youtube.com/results?search_query=set+active+camera+unreal,https://youtube.com/results?search_query=set+active+camera+unreal+hindi,https://youtube.com/results?search_query=set+active+camera+unreal+kannada,https://youtube.com/results?search_query=set+active+camera+unreal+tamil,https://youtube.com/results?search_query=set+active+camera+unreal+telugu
Unreal Engine,Basic,What is a Timeline in Blueprints?,Blueprints,Timeline,Animation,A Timeline is a Blueprint node that allows you to animate values (floats, vectors, colors) over time using keyframes. Useful for simple animations like doors opening.,https://docs.unrealengine.com/5.3/en-US/timelines-in-blueprints-unreal-engine/,https://youtube.com/results?search_query=timeline+blueprints,https://youtube.com/results?search_query=timeline+blueprints+hindi,https://youtube.com/results?search_query=timeline+blueprints+kannada,https://youtube.com/results?search_query=timeline+blueprints+tamil,https://youtube.com/results?search_query=timeline+blueprints+telugu
Unreal Engine,Basic,How do you create a Timeline in Blueprints?,Blueprints,Timeline,Create,Right-click in the Event Graph → Add Timeline. Double-click the Timeline node to open its editor, where you add tracks and keyframes.,https://docs.unrealengine.com/5.3/en-US/creating-timelines-in-blueprints-unreal-engine/,https://youtube.com/results?search_query=create+timeline+blueprints,https://youtube.com/results?search_query=create+timeline+blueprints+hindi,https://youtube.com/results?search_query=create+timeline+blueprints+kannada,https://youtube.com/results?search_query=create+timeline+blueprints+tamil,https://youtube.com/results?search_query=create+timeline+blueprints+telugu
Unreal Engine,Basic,What is the Play button in the Editor?,Interface,Play,Test,The Play button (▶) starts a play-in-editor (PIE) session, allowing you to test your game directly in the Editor. You can also use Simulate (for AI testing) or VR Preview.,https://docs.unrealengine.com/5.3/en-US/testing-in-unreal-engine/,https://youtube.com/results?search_query=play+button+unreal,https://youtube.com/results?search_query=play+button+unreal+hindi,https://youtube.com/results?search_query=play+button+unreal+kannada,https://youtube.com/results?search_query=play+button+unreal+tamil,https://youtube.com/results?search_query=play+button+unreal+telugu
Unreal Engine,Basic,What is the difference between Play and Simulate?,Interface,Play,Simulate,Play uses a Player Controller and simulates player input. Simulate does not use a Player Controller—the character is controlled as if by AI (useful for testing AI behavior).,https://docs.unrealengine.com/5.3/en-US/play-and-simulate-in-unreal-engine/,https://youtube.com/results?search_query=play+vs+simulate+unreal,https://youtube.com/results?search_query=play+vs+simulate+unreal+hindi,https://youtube.com/results?search_query=play+vs+simulate+unreal+kannada,https://youtube.com/results?search_query=play+vs+simulate+unreal+tamil,https://youtube.com/results?search_query=play+vs+simulate+unreal+telugu
Unreal Engine,Basic,How do you save your Level?,Interface,Save,Level,File → Save Current (Ctrl+S), or click the Save icon in the toolbar. You can also use File → Save All to save everything.,https://docs.unrealengine.com/5.3/en-US/saving-in-unreal-engine/,https://youtube.com/results?search_query=save+level+unreal,https://youtube.com/results?search_query=save+level+unreal+hindi,https://youtube.com/results?search_query=save+level+unreal+kannada,https://youtube.com/results?search_query=save+level+unreal+tamil,https://youtube.com/results?search_query=save+level+unreal+telugu
Unreal Engine,Basic,What is the purpose of the Folders in Content Browser?,Content Management,Folders,Organize,Folders help organize your assets. Right-click in Content Browser → New Folder. Good practice to create folders like Meshes, Materials, Blueprints, Textures.,https://docs.unrealengine.com/5.3/en-US/organizing-content-in-unreal-engine/,https://youtube.com/results?search_query=folders+content+browser,https://youtube.com/results?search_query=folders+content+browser+hindi,https://youtube.com/results?search_query=folders+content+browser+kannada,https://youtube.com/results?search_query=folders+content+browser+tamil,https://youtube.com/results?search_query=folders+content+browser+telugu
Unreal Engine,Basic,How do you import assets into Unreal Engine?,Assets,Import,Content Browser,In Content Browser, click Import, or drag and drop files from Windows Explorer. Supported formats include FBX, OBJ (meshes), PNG, JPEG (textures), WAV (audio).,https://docs.unrealengine.com/5.3/en-US/importing-content-into-unreal-engine/,https://youtube.com/results?search_query=import+assets+unreal,https://youtube.com/results?search_query=import+assets+unreal+hindi,https://youtube.com/results?search_query=import+assets+unreal+kannada,https://youtube.com/results?search_query=import+assets+unreal+tamil,https://youtube.com/results?search_query=import+assets+unreal+telugu
Unreal Engine,Basic,What is a Blueprint Function?,Blueprints,Function,Reusable,A Blueprint Function is a reusable block of nodes that can be called from other parts of the same Blueprint. It can have inputs, outputs, and local variables.,https://docs.unrealengine.com/5.3/en-US/functions-in-blueprints-unreal-engine/,https://youtube.com/results?search_query=blueprint+function,https://youtube.com/results?search_query=blueprint+function+hindi,https://youtube.com/results?search_query=blueprint+function+kannada,https://youtube.com/results?search_query=blueprint+function+tamil,https://youtube.com/results?search_query=blueprint+function+telugu
Unreal Engine,Basic,How do you create a Blueprint Function?,Blueprints,Function,Create,In the My Blueprint tab, click "+ Function". Give it a name and double-click to open its graph. Add inputs/outputs via the Details Panel.,https://docs.unrealengine.com/5.3/en-US/creating-functions-in-blueprints-unreal-engine/,https://youtube.com/results?search_query=create+blueprint+function,https://youtube.com/results?search_query=create+blueprint+function+hindi,https://youtube.com/results?search_query=create+blueprint+function+kannada,https://youtube.com/results?search_query=create+blueprint+function+tamil,https://youtube.com/results?search_query=create+blueprint+function+telugu
Unreal Engine,Basic,What is a Blueprint Macro?,Blueprints,Macro,Node Group,A Blueprint Macro is a container for a group of nodes that can be reused within a single Blueprint. Unlike Functions, Macros are expanded inline (copy-pasted) and cannot have return values.,https://docs.unrealengine.com/5.3/en-US/macros-in-blueprints-unreal-engine/,https://youtube.com/results?search_query=blueprint+macro,https://youtube.com/results?search_query=blueprint+macro+hindi,https://youtube.com/results?search_query=blueprint+macro+kannada,https://youtube.com/results?search_query=blueprint+macro+tamil,https://youtube.com/results?search_query=blueprint+macro+telugu
Unreal Engine,Basic,When should you use a Function vs a Macro?,Blueprints,Function,Macro,Use a Function when you need reusable logic with return values, or that will be called from multiple Blueprints. Use a Macro for simple node groups used only within one Blueprint, especially if you want to avoid function call overhead.,https://docs.unrealengine.com/5.3/en-US/functions-vs-macros-in-blueprints-unreal-engine/,https://youtube.com/results?search_query=function+vs+macro+blueprint,https://youtube.com/results?search_query=function+vs+macro+blueprint+hindi,https://youtube.com/results?search_query=function+vs+macro+blueprint+kannada,https://youtube.com/results?search_query=function+vs+macro+blueprint+tamil,https://youtube.com/results?search_query=function+vs+macro+blueprint+telugu
Unreal Engine,Basic,What is the Construction Script in Blueprints?,Blueprints,Construction Script,Initialize,The Construction Script runs when the Blueprint is placed in the Level or when its properties are changed in the Editor. It's used for visual updates (like procedural meshes).,https://docs.unrealengine.com/5.3/en-US/construction-script-in-blueprints-unreal-engine/,https://youtube.com/results?search_query=construction+script+blueprint,https://youtube.com/results?search_query=construction+script+blueprint+hindi,https://youtube.com/results?search_query=construction+script+blueprint+kannada,https://youtube.com/results?search_query=construction+script+blueprint+tamil,https://youtube.com/results?search_query=construction+script+blueprint+telugu
Unreal Engine,Basic,Why would you use the Construction Script instead of Event BeginPlay?,Blueprints,Construction Script,Editor,Use Construction Script for logic that should update in the Editor (like adjusting a building's height visually). Use Event BeginPlay for runtime-only logic (like spawning enemies).,https://docs.unrealengine.com/5.3/en-US/when-to-use-construction-script-in-blueprints-unreal-engine/,https://youtube.com/results?search_query=construction+script+vs+beginplay,https://youtube.com/results?search_query=construction+script+vs+beginplay+hindi,https://youtube.com/results?search_query=construction+script+vs+beginplay+kannada,https://youtube.com/results?search_query=construction+script+vs+beginplay+tamil,https://youtube.com/results?search_query=construction+script+vs+beginplay+telugu
Unreal Engine,Basic,How do you move an Actor using Blueprints?,Blueprints,Movement,Set Actor Location,Use the "Set Actor Location" node (or "Add Actor World Offset") in the Event Graph. Typically you'd call this every tick or on an event.,https://docs.unrealengine.com/5.3/en-US/moving-actors-in-blueprints-unreal-engine/,https://youtube.com/results?search_query=move+actor+blueprint,https://youtube.com/results?search_query=move+actor+blueprint+hindi,https://youtube.com/results?search_query=move+actor+blueprint+kannada,https://youtube.com/results?search_query=move+actor+blueprint+tamil,https://youtube.com/results?search_query=move+actor+blueprint+telugu
Unreal Engine,Basic,How do you rotate an Actor using Blueprints?,Blueprints,Rotation,Set Actor Rotation,Use the "Set Actor Rotation" node (or "Add Actor World Rotation"). Provide a Rotator (pitch, yaw, roll) or a Quaternion.,https://docs.unrealengine.com/5.3/en-US/rotating-actors-in-blueprints-unreal-engine/,https://youtube.com/results?search_query=rotate+actor+blueprint,https://youtube.com/results?search_query=rotate+actor+blueprint+hindi,https://youtube.com/results?search_query=rotate+actor+blueprint+kannada,https://youtube.com/results?search_query=rotate+actor+blueprint+tamil,https://youtube.com/results?search_query=rotate+actor+blueprint+telugu
Unreal Engine,Basic,What is a Rotator in Unreal Engine?,Data Types,Rotator,Rotation,A Rotator is a struct that represents a rotation with three float components: Pitch (rotation around X-axis), Yaw (rotation around Z-axis), and Roll (rotation around Y-axis).,https://docs.unrealengine.com/5.3/en-US/rotators-in-unreal-engine/,https://youtube.com/results?search_query=rotator+unreal,https://youtube.com/results?search_query=rotator+unreal+hindi,https://youtube.com/results?search_query=rotator+unreal+kannada,https://youtube.com/results?search_query=rotator+unreal+tamil,https://youtube.com/results?search_query=rotator+unreal+telugu
Unreal Engine,Basic,What is a Vector in Unreal Engine?,Data Types,Vector,Position,A Vector is a struct with X, Y, Z float components. Used for positions, directions, scales, and colors (as LinearColor). Common types: FVector (3D), FVector2D (2D).,https://docs.unrealengine.com/5.3/en-US/vectors-in-unreal-engine/,https://youtube.com/results?search_query=vector+unreal,https://youtube.com/results?search_query=vector+unreal+hindi,https://youtube.com/results?search_query=vector+unreal+kannada,https://youtube.com/results?search_query=vector+unreal+tamil,https://youtube.com/results?search_query=vector+unreal+telugu
Unreal Engine,Basic,What is Delta Time?,Gameplay,Delta Time,Framerate,Delta Time (often obtained via "Get World Delta Seconds") is the time in seconds since the last frame. Multiplying movement by Delta Time makes it framerate-independent.,https://docs.unrealengine.com/5.3/en-US/delta-time-in-unreal-engine/,https://youtube.com/results?search_query=delta+time+unreal,https://youtube.com/results?search_query=delta+time+unreal+hindi,https://youtube.com/results?search_query=delta+time+unreal+kannada,https://youtube.com/results?search_query=delta+time+unreal+tamil,https://youtube.com/results?search_query=delta+time+unreal+telugu
Unreal Engine,Basic,Why is Delta Time important for movement?,Gameplay,Delta Time,Framerate,Using Delta Time ensures that movement speed remains consistent regardless of framerate. Without it, faster computers would have faster gameplay.,https://docs.unrealengine.com/5.3/en-US/why-use-delta-time-in-unreal-engine/,https://youtube.com/results?search_query=why+delta+time+important,https://youtube.com/results?search_query=why+delta+time+important+hindi,https://youtube.com/results?search_query=why+delta+time+important+kannada,https://youtube.com/results?search_query=why+delta+time+important+tamil,https://youtube.com/results?search_query=why+delta+time+important+telugu
Unreal Engine,Basic,How do you get player input in Blueprints?,Input,Input,Blueprint,Use Input Events (like "InputAxis MoveForward" or "Action Mappings") by enabling them in Project Settings → Input. Then, in the Blueprint Event Graph, right-click and search for the input event.,https://docs.unrealengine.com/5.3/en-US/input-in-blueprints-unreal-engine/,https://youtube.com/results?search_query=player+input+blueprint,https://youtube.com/results?search_query=player+input+blueprint+hindi,https://youtube.com/results?search_query=player+input+blueprint+kannada,https://youtube.com/results?search_query=player+input+blueprint+tamil,https://youtube.com/results?search_query=player+input+blueprint+telugu
Unreal Engine,Basic,How do you set up Input Actions in Unreal Engine?,Input,Input Actions,Settings,Go to Edit → Project Settings → Input. Under Bindings, add Action Mappings (for discrete actions like Jump) and Axis Mappings (for continuous input like movement).,https://docs.unrealengine.com/5.3/en-US/input-settings-in-unreal-engine/,https://youtube.com/results?search_query=input+actions+unreal,https://youtube.com/results?search_query=input+actions+unreal+hindi,https://youtube.com/results?search_query=input+actions+unreal+kannada,https://youtube.com/results?search_query=input+actions+unreal+tamil,https://youtube.com/results?search_query=input+actions+unreal+telugu
Unreal Engine,Basic,What is an Action Mapping?,Input,Action Mapping,Button,An Action Mapping is for discrete inputs like button presses (e.g., Jump, Fire). It returns a boolean (pressed/released) and can have multiple keys bound.,https://docs.unrealengine.com/5.3/en-US/action-mappings-in-unreal-engine/,https://youtube.com/results?search_query=action+mapping+unreal,https://youtube.com/results?search_query=action+mapping+unreal+hindi,https://youtube.com/results?search_query=action+mapping+unreal+kannada,https://youtube.com/results?search_query=action+mapping+unreal+tamil,https://youtube.com/results?search_query=action+mapping+unreal+telugu
Unreal Engine,Basic,What is an Axis Mapping?,Input,Axis Mapping,Continuous,An Axis Mapping is for continuous inputs like joystick or mouse movement. It returns a float value (e.g., -1 to 1) representing the intensity of input.,https://docs.unrealengine.com/5.3/en-US/axis-mappings-in-unreal-engine/,https://youtube.com/results?search_query=axis+mapping+unreal,https://youtube.com/results?search_query=axis+mapping+unreal+hindi,https://youtube.com/results?search_query=axis+mapping+unreal+kannada,https://youtube.com/results?search_query=axis+mapping+unreal+tamil,https://youtube.com/results?search_query=axis+mapping+unreal+telugu
Unreal Engine,Basic,How do you spawn an Actor at runtime?,Blueprints,Spawn Actor,Create,Use the "Spawn Actor from Class" node. Provide a class (Blueprint), transform (location/rotation), and optionally a spawn parameters struct.,https://docs.unrealengine.com/5.3/en-US/spawning-actors-in-blueprints-unreal-engine/,https://youtube.com/results?search_query=spawn+actor+blueprint,https://youtube.com/results?search_query=spawn+actor+blueprint+hindi,https://youtube.com/results?search_query=spawn+actor+blueprint+kannada,https://youtube.com/results?search_query=spawn+actor+blueprint+tamil,https://youtube.com/results?search_query=spawn+actor+blueprint+telugu
Unreal Engine,Basic,How do you destroy an Actor at runtime?,Blueprints,Destroy Actor,Remove,Use the "Destroy Actor" node on the Actor you want to destroy. It will be removed from the Level.,https://docs.unrealengine.com/5.3/en-US/destroying-actors-in-blueprints-unreal-engine/,https://youtube.com/results?search_query=destroy+actor+blueprint,https://youtube.com/results?search_query=destroy+actor+blueprint+hindi,https://youtube.com/results?search_query=destroy+actor+blueprint+kannada,https://youtube.com/results?search_query=destroy+actor+blueprint+tamil,https://youtube.com/results?search_query=destroy+actor+blueprint+telugu
Unreal Engine,Basic,What is the purpose of the "Get Actor Location" node?,Blueprints,Get Actor Location,Position,"Get Actor Location" returns the world-space position (as a Vector) of the Actor. Useful for calculations like distance.,https://docs.unrealengine.com/5.3/en-US/get-actor-location-in-blueprints-unreal-engine/,https://youtube.com/results?search_query=get+actor+location,https://youtube.com/results?search_query=get+actor+location+hindi,https://youtube.com/results?search_query=get+actor+location+kannada,https://youtube.com/results?search_query=get+actor+location+tamil,https://youtube.com/results?search_query=get+actor+location+telugu
Unreal Engine,Basic,What is the purpose of the "Get Player Controller" node?,Blueprints,Get Player Controller,Reference,"Get Player Controller" returns a reference to the Player Controller. Useful for accessing player input, camera, or UI.,https://docs.unrealengine.com/5.3/en-US/get-player-controller-in-blueprints-unreal-engine/,https://youtube.com/results?search_query=get+player+controller,https://youtube.com/results?search_query=get+player+controller+hindi,https://youtube.com/results?search_query=get+player+controller+kannada,https://youtube.com/results?search_query=get+player+controller+tamil,https://youtube.com/results?search_query=get+player+controller+telugu
Unreal Engine,Basic,What is the purpose of the "Get Controlled Pawn" node?,Blueprints,Get Controlled Pawn,Character,"Get Controlled Pawn" returns the Pawn currently possessed by the Player Controller. Useful in the Player Controller's Blueprint.,https://docs.unrealengine.com/5.3/en-US/get-controlled-pawn-in-blueprints-unreal-engine/,https://youtube.com/results?search_query=get+controlled+pawn,https://youtube.com/results?search_query=get+controlled+pawn+hindi,https://youtube.com/results?search_query=get+controlled+pawn+kannada,https://youtube.com/results?search_query=get+controlled+pawn+tamil,https://youtube.com/results?search_query=get+controlled+pawn+telugu
Unreal Engine,Basic,What is a Widget Blueprint?,UI,Widget Blueprint,Interface,A Widget Blueprint is a Blueprint for creating UI elements (HUD, menus, buttons, text). It uses a visual designer and event graph for UI logic.,https://docs.unrealengine.com/5.3/en-US/widget-blueprints-in-unreal-engine/,https://youtube.com/results?search_query=widget+blueprint,https://youtube.com/results?search_query=widget+blueprint+hindi,https://youtube.com/results?search_query=widget+blueprint+kannada,https://youtube.com/results?search_query=widget+blueprint+tamil,https://youtube.com/results?search_query=widget+blueprint+telugu
Unreal Engine,Basic,How do you create a Widget Blueprint?,UI,Widget Blueprint,Create,In Content Browser, right-click → User Interface → Widget Blueprint. Name it and double-click to open the Widget Designer.,https://docs.unrealengine.com/5.3/en-US/creating-widget-blueprints-in-unreal-engine/,https://youtube.com/results?search_query=create+widget+blueprint,https://youtube.com/results?search_query=create+widget+blueprint+hindi,https://youtube.com/results?search_query=create+widget+blueprint+kannada,https://youtube.com/results?search_query=create+widget+blueprint+tamil,https://youtube.com/results?search_query=create+widget+blueprint+telugu
Unreal Engine,Basic,How do you display a Widget on screen?,UI,Widget,Display,In a Blueprint, use "Create Widget" to create an instance, then "Add to Viewport" (or "Add to Player Screen") to show it. Usually done in the Player Controller or HUD.,https://docs.unrealengine.com/5.3/en-US/displaying-widgets-in-unreal-engine/,https://youtube.com/results?search_query=display+widget+unreal,https://youtube.com/results?search_query=display+widget+unreal+hindi,https://youtube.com/results?search_query=display+widget+unreal+kannada,https://youtube.com/results?search_query=display+widget+unreal+tamil,https://youtube.com/results?search_query=display+widget+unreal+telugu
Unreal Engine,Basic,What is the purpose of the "Bind" feature for Widget variables?,UI,Bind,Dynamic,Binding a widget variable (like Text Block's Text) to a function allows the UI to update automatically when the underlying data changes, without manual updates every frame.,https://docs.unrealengine.com/5.3/en-US/binding-in-widget-blueprints-unreal-engine/,https://youtube.com/results?search_query=bind+widget+unreal,https://youtube.com/results?search_query=bind+widget+unreal+hindi,https://youtube.com/results?search_query=bind+widget+unreal+kannada,https://youtube.com/results?search_query=bind+widget+unreal+tamil,https://youtube.com/results?search_query=bind+widget+unreal+telugu
Unreal Engine,Basic,How do you play a sound in Blueprints?,Audio,Play Sound,Blueprint,Use the "Play Sound at Location" node (for 3D sounds) or "Play Sound 2D" (for UI/music). Provide a Sound Wave asset.,https://docs.unrealengine.com/5.3/en-US/playing-sounds-in-blueprints-unreal-engine/,https://youtube.com/results?search_query=play+sound+blueprint,https://youtube.com/results?search_query=play+sound+blueprint+hindi,https://youtube.com/results?search_query=play+sound+blueprint+kannada,https://youtube.com/results?search_query=play+sound+blueprint+tamil,https://youtube.com/results?search_query=play+sound+blueprint+telugu
Unreal Engine,Basic,What is a Sound Cue?,Audio,Sound Cue,Graph,A Sound Cue is a Blueprint-like asset for creating complex audio behaviors by connecting nodes (like attenuations, modulators, branches).,https://docs.unrealengine.com/5.3/en-US/sound-cues-in-unreal-engine/,https://youtube.com/results?search_query=sound+cue+unreal,https://youtube.com/results?search_query=sound+cue+unreal+hindi,https://youtube.com/results?search_query=sound+cue+unreal+kannada,https://youtube.com/results?search_query=sound+cue+unreal+tamil,https://youtube.com/results?search_query=sound+cue+unreal+telugu
Unreal Engine,Basic,What is a Particle System (Niagara)?,Effects,Particle System,Niagara,Niagara is Unreal's advanced particle effects system (replacing Cascade). It allows creation of complex visual effects like fire, smoke, magic, etc.,https://docs.unrealengine.com/5.3/en-US/niagara-in-unreal-engine/,https://youtube.com/results?search_query=niagara+particle+system,https://youtube.com/results?search_query=niagara+particle+system+hindi,https://youtube.com/results?search_query=niagara+particle+system+kannada,https://youtube.com/results?search_query=niagara+particle+system+tamil,https://youtube.com/results?search_query=niagara+particle+system+telugu
